gbif_id	identifier	license	publisher	institution_code	collection_code	dataset_name	basis_of_record	occurrence_id	catalog_number	recorded_by	individual_count	occurrence_status	event_date	year	month	day	country_code	state_province	county	locality	decimal_latitude	decimal_longitude	accepted_name_usage_id	scientific_name	kingdom	phylum	class	order	family	genus	specific_epithet	taxon_rank	vernacular_name	taxonomic_status	dataset_key	publishing_country	last_interpreted	has_coordinate	has_geospatial_issues	taxon_key	accepted_taxon_key	kingdom_key	phylum_key	class_key	order_key	family_key	genus_key	species_key	species	generic_name	accepted_scientific_name	verbatim_scientific_name	protocol	last_parsed	last_crawled	repatriated	level0gid	level0name	level1gid	level1name	level2gid	level2name	date_transform	selected_observer
257584371	OBS62633547	CC0_1_0	Cornell Lab of Ornithology	CLO	EBIRD	EOD - eBird Observation Dataset	HUMAN_OBSERVATION	URN:catalog:CLO:EBIRD:OBS62633547	OBS62633547	obsr136347	2	PRESENT	12/16/72 0:00	1972	12	16	US	California	Santa Barbara	Devereux Slough	34.4136	-119.876	2478605	Sphyrapicus varius (Linnaeus, 1766)	Animalia	Chordata	Aves	Piciformes	Picidae	Sphyrapicus	varius	SPECIES	Yellow-bellied Sapsucker	ACCEPTED	4fa7b334-ce0d-4e88-aaae-2e0c138d049e	US	12/16/20 12:00	TRUE	FALSE	2478605	2478605	1	44	212	724	9333	2478596	2478605	Sphyrapicus varius	Sphyrapicus	Sphyrapicus varius (Linnaeus, 1766)	Sphyrapicus varius	DWC_ARCHIVE	12/16/20 12:00	6/30/20 8:20	FALSE	USA	United States	USA.5_1	California	USA.5.42_1	Santa Barbara	1972-12-16	FALSE
210472664	OBS62633467	CC0_1_0	Cornell Lab of Ornithology	CLO	EBIRD	EOD - eBird Observation Dataset	HUMAN_OBSERVATION	URN:catalog:CLO:EBIRD:OBS62633467	OBS62633467	obsr136347	1	PRESENT	12/15/73 0:00	1973	12	15	US	California	Santa Barbara	Devereux Slough	34.4136	-119.876	2497240	Athene cunicularia (Molina, 1782)	Animalia	Chordata	Aves	Strigiformes	Strigidae	Athene	cunicularia	SPECIES	Burrowing Owl	ACCEPTED	4fa7b334-ce0d-4e88-aaae-2e0c138d049e	US	12/16/20 12:01	TRUE	FALSE	2497240	2497240	1	44	212	1450	9348	2497239	2497240	Athene cunicularia	Athene	Athene cunicularia (Molina, 1782)	Athene cunicularia	DWC_ARCHIVE	12/16/20 12:01	6/30/20 8:20	FALSE	USA	United States	USA.5_1	California	USA.5.42_1	Santa Barbara	1973-12-15	FALSE
183002720	OBS53224578	CC0_1_0	Cornell Lab of Ornithology	CLO	EBIRD	EOD - eBird Observation Dataset	HUMAN_OBSERVATION	URN:catalog:CLO:EBIRD:OBS53224578	OBS53224578	obsr107968	1	PRESENT	10/18/76 0:00	1976	10	18	US	California	Santa Barbara	Devereux Slough	34.4136	-119.876	2491728	Pooecetes gramineus (J.F.Gmelin, 1789)	Animalia	Chordata	Aves	Passeriformes	Emberizidae	Pooecetes	gramineus	SPECIES	Vesper Sparrow	ACCEPTED	4fa7b334-ce0d-4e88-aaae-2e0c138d049e	US	12/16/20 12:01	TRUE	FALSE	2491728	2491728	1	44	212	729	9608	2491727	2491728	Pooecetes gramineus	Pooecetes	Pooecetes gramineus (J.F.Gmelin, 1789)	Pooecetes gramineus	DWC_ARCHIVE	12/16/20 12:01	6/30/20 8:20	FALSE	USA	United States	USA.5_1	California	USA.5.42_1	Santa Barbara	1976-10-18	FALSE
263614919	OBS62633235	CC0_1_0	Cornell Lab of Ornithology	CLO	EBIRD	EOD - eBird Observation Dataset	HUMAN_OBSERVATION	URN:catalog:CLO:EBIRD:OBS62633235	OBS62633235	obsr136347	1	PRESENT	1/1/77 0:00	1977	1	1	US	California	Santa Barbara	Devereux Slough	34.4136	-119.876	5228200	Gallinula galeata (Lichtenstein, 1818)	Animalia	Chordata	Aves	Gruiformes	Rallidae	Gallinula	galeata	SPECIES	Common Gallinule	SYNONYM	4fa7b334-ce0d-4e88-aaae-2e0c138d049e	US	12/16/20 12:01	TRUE	FALSE	7340222	5228200	1	44	212	1493	9342	7918617	5228199	Gallinula chloropus	Gallinula	Gallinula chloropus galeata (Lichtenstein, 1818)	Gallinula galeata	DWC_ARCHIVE	12/16/20 12:01	6/30/20 8:20	FALSE	USA	United States	USA.5_1	California	USA.5.42_1	Santa Barbara	1977-1-1	FALSE
833157660	OBS160326778	CC0_1_0	Cornell Lab of Ornithology	CLO	EBIRD	EOD - eBird Observation Dataset	HUMAN_OBSERVATION	URN:catalog:CLO:EBIRD:OBS160326778	OBS160326778	obsr107968	1	PRESENT	10/2/77 0:00	1977	10	2	US	California	Santa Barbara	Devereux Slough	34.4136	-119.876	2490327	Passerina cyanea (Linnaeus, 1766)	Animalia	Chordata	Aves	Passeriformes	Cardinalidae	Passerina	cyanea	SPECIES	Indigo Bunting	ACCEPTED	4fa7b334-ce0d-4e88-aaae-2e0c138d049e	US	12/16/20 12:13	TRUE	FALSE	2490327	2490327	1	44	212	729	9285	2490326	2490327	Passerina cyanea	Passerina	Passerina cyanea (Linnaeus, 1766)	Passerina cyanea	DWC_ARCHIVE	12/16/20 12:13	6/30/20 8:20	FALSE	USA	United States	USA.5_1	California	USA.5.42_1	Santa Barbara	1977-10-2	FALSE
824689548	OBS160326777	CC0_1_0	Cornell Lab of Ornithology	CLO	EBIRD	EOD - eBird Observation Dataset	HUMAN_OBSERVATION	URN:catalog:CLO:EBIRD:OBS160326777	OBS160326777	obsr107968	1	PRESENT	10/2/77 0:00	1977	10	2	US	California	Santa Barbara	Devereux Slough	34.4136	-119.876	2495869	Columbina passerina (Linnaeus, 1758)	Animalia	Chordata	Aves	Columbiformes	Columbidae	Columbina	passerina	SPECIES	Common Ground Dove	ACCEPTED	4fa7b334-ce0d-4e88-aaae-2e0c138d049e	US	12/16/20 12:03	TRUE	FALSE	2495869	2495869	1	44	212	1446	5233	2495852	2495869	Columbina passerina	Columbina	Columbina passerina (Linnaeus, 1758)	Columbina passerina	DWC_ARCHIVE	12/16/20 12:03	6/30/20 8:20	FALSE	USA	United States	USA.5_1	California	USA.5.42_1	Santa Barbara	1977-10-2	FALSE
180622463	OBS57396694	CC0_1_0	Cornell Lab of Ornithology	CLO	EBIRD	EOD - eBird Observation Dataset	HUMAN_OBSERVATION	URN:catalog:CLO:EBIRD:OBS57396694	OBS57396694	obsr107968	1	PRESENT	12/31/77 0:00	1977	12	31	US	California	Santa Barbara	Devereux Slough	34.4136	-119.876	2490926	Ixoreus naevius (Gmelin, 1789)	Animalia	Chordata	Aves	Passeriformes	Turdidae	Ixoreus	naevius	SPECIES	Varied Thrush	ACCEPTED	4fa7b334-ce0d-4e88-aaae-2e0c138d049e	US	12/16/20 11:52	TRUE	FALSE	2490926	2490926	1	44	212	729	5290	2490925	2490926	Ixoreus naevius	Ixoreus	Ixoreus naevius (Gmelin, 1789)	Ixoreus naevius	DWC_ARCHIVE	12/16/20 11:52	6/30/20 8:20	FALSE	USA	United States	USA.5_1	California	USA.5.42_1	Santa Barbara	1977-12-31	FALSE
946239284	OBS189825759	CC0_1_0	Cornell Lab of Ornithology	CLO	EBIRD	EOD - eBird Observation Dataset	HUMAN_OBSERVATION	URN:catalog:CLO:EBIRD:OBS189825759	OBS189825759	obsr21348	1	PRESENT	4/16/77 0:00	1977	4	16	US	California	Santa Barbara	Devereux Slough	34.4136	-119.876	2481143	Hydrocoloeus minutus (Pallas, 1776)	Animalia	Chordata	Aves	Charadriiformes	Laridae	Larus	minutus	SPECIES	Little Gull	SYNONYM	4fa7b334-ce0d-4e88-aaae-2e0c138d049e	US	12/16/20 11:52	TRUE	FALSE	6065841	2481143	1	44	212	7192402	9316	2481126	2481143	Larus minutus	Hydrocoloeus	Larus minutus Pallas, 1776	Hydrocoloeus minutus	DWC_ARCHIVE	12/16/20 11:52	6/30/20 8:20	FALSE	USA	United States	USA.5_1	California	USA.5.42_1	Santa Barbara	1977-4-16	FALSE
277412118	OBS78288333	CC0_1_0	Cornell Lab of Ornithology	CLO	EBIRD	EOD - eBird Observation Dataset	HUMAN_OBSERVATION	URN:catalog:CLO:EBIRD:OBS78288333	OBS78288333	obsr200150	1	PRESENT	4/18/77 0:00	1977	4	18	US	California	Santa Barbara	Devereux Slough	34.4136	-119.876	2481143	Hydrocoloeus minutus (Pallas, 1776)	Animalia	Chordata	Aves	Charadriiformes	Laridae	Larus	minutus	SPECIES	Little Gull	SYNONYM	4fa7b334-ce0d-4e88-aaae-2e0c138d049e	US	12/16/20 12:02	TRUE	FALSE	6065841	2481143	1	44	212	7192402	9316	2481126	2481143	Larus minutus	Hydrocoloeus	Larus minutus Pallas, 1776	Hydrocoloeus minutus	DWC_ARCHIVE	12/16/20 12:02	6/30/20 8:20	FALSE	USA	United States	USA.5_1	California	USA.5.42_1	Santa Barbara	1977-4-18	FALSE
277997346	OBS79653459	CC0_1_0	Cornell Lab of Ornithology	CLO	EBIRD	EOD - eBird Observation Dataset	HUMAN_OBSERVATION	URN:catalog:CLO:EBIRD:OBS79653459	OBS79653459	obsr107968	1	PRESENT	4/18/77 0:00	1977	4	18	US	California	Santa Barbara	Devereux Slough	34.4136	-119.876	2481143	Hydrocoloeus minutus (Pallas, 1776)	Animalia	Chordata	Aves	Charadriiformes	Laridae	Larus	minutus	SPECIES	Little Gull	SYNONYM	4fa7b334-ce0d-4e88-aaae-2e0c138d049e	US	12/16/20 12:02	TRUE	FALSE	6065841	2481143	1	44	212	7192402	9316	2481126	2481143	Larus minutus	Hydrocoloeus	Larus minutus Pallas, 1776	Hydrocoloeus minutus	DWC_ARCHIVE	12/16/20 12:02	6/30/20 8:20	FALSE	USA	United States	USA.5_1	California	USA.5.42_1	Santa Barbara	1977-4-18	FALSE
1412239398	OBS89711769	CC0_1_0	Cornell Lab of Ornithology	CLO	EBIRD	EOD - eBird Observation Dataset	HUMAN_OBSERVATION	URN:catalog:CLO:EBIRD:OBS89711769	OBS89711769	obsr202001	1	PRESENT	9/12/77 0:00	1977	9	12	US	California	Santa Barbara	Devereux Slough	34.4136	-119.876	2480803	Platalea ajaja Linnaeus, 1758	Animalia	Chordata	Aves	Pelecaniformes	Threskiornithidae	Platalea	ajaja	SPECIES	Roseate Spoonbill	ACCEPTED	4fa7b334-ce0d-4e88-aaae-2e0c138d049e	US	12/16/20 12:12	TRUE	FALSE	2480803	2480803	1	44	212	7190953	5288	2480798	2480803	Platalea ajaja	Platalea	Platalea ajaja Linnaeus, 1758	Platalea ajaja	DWC_ARCHIVE	12/16/20 12:12	6/30/20 8:20	FALSE	USA	United States	USA.5_1	California	USA.5.42_1	Santa Barbara	1977-9-12	FALSE
2185156013	OBS656873892	CC0_1_0	Cornell Lab of Ornithology	CLO	EBIRD	EOD - eBird Observation Dataset	HUMAN_OBSERVATION	URN:catalog:CLO:EBIRD:OBS656873892	OBS656873892	obsr21348	1	PRESENT	9/18/77 0:00	1977	9	18	US	California	Santa Barbara	Devereux Slough	34.4136	-119.876	2480803	Platalea ajaja Linnaeus, 1758	Animalia	Chordata	Aves	Pelecaniformes	Threskiornithidae	Platalea	ajaja	SPECIES	Roseate Spoonbill	ACCEPTED	4fa7b334-ce0d-4e88-aaae-2e0c138d049e	US	12/16/20 11:58	TRUE	FALSE	2480803	2480803	1	44	212	7190953	5288	2480798	2480803	Platalea ajaja	Platalea	Platalea ajaja Linnaeus, 1758	Platalea ajaja	DWC_ARCHIVE	12/16/20 11:58	6/30/20 8:20	FALSE	USA	United States	USA.5_1	California	USA.5.42_1	Santa Barbara	1977-9-18	FALSE
963622903	OBS208950663	CC0_1_0	Cornell Lab of Ornithology	CLO	EBIRD	EOD - eBird Observation Dataset	HUMAN_OBSERVATION	URN:catalog:CLO:EBIRD:OBS208950663	OBS208950663	obsr107968	1	PRESENT	9/19/77 0:00	1977	9	19	US	California	Santa Barbara	Devereux Slough	34.4136	-119.876	2480803	Platalea ajaja Linnaeus, 1758	Animalia	Chordata	Aves	Pelecaniformes	Threskiornithidae	Platalea	ajaja	SPECIES	Roseate Spoonbill	ACCEPTED	4fa7b334-ce0d-4e88-aaae-2e0c138d049e	US	12/16/20 12:02	TRUE	FALSE	2480803	2480803	1	44	212	7190953	5288	2480798	2480803	Platalea ajaja	Platalea	Platalea ajaja Linnaeus, 1758	Platalea ajaja	DWC_ARCHIVE	12/16/20 12:02	6/30/20 8:20	FALSE	USA	United States	USA.5_1	California	USA.5.42_1	Santa Barbara	1977-9-19	FALSE
595172738	OBS99641805	CC0_1_0	Cornell Lab of Ornithology	CLO	EBIRD	EOD - eBird Observation Dataset	HUMAN_OBSERVATION	URN:catalog:CLO:EBIRD:OBS99641805	OBS99641805	obsr26637	1	PRESENT	9/24/77 0:00	1977	9	24	US	California	Santa Barbara	Devereux Slough	34.4136	-119.876	2480803	Platalea ajaja Linnaeus, 1758	Animalia	Chordata	Aves	Pelecaniformes	Threskiornithidae	Platalea	ajaja	SPECIES	Roseate Spoonbill	ACCEPTED	4fa7b334-ce0d-4e88-aaae-2e0c138d049e	US	12/16/20 11:51	TRUE	FALSE	2480803	2480803	1	44	212	7190953	5288	2480798	2480803	Platalea ajaja	Platalea	Platalea ajaja Linnaeus, 1758	Platalea ajaja	DWC_ARCHIVE	12/16/20 11:51	6/30/20 8:20	FALSE	USA	United States	USA.5_1	California	USA.5.42_1	Santa Barbara	1977-9-24	FALSE
276491915	OBS78288335	CC0_1_0	Cornell Lab of Ornithology	CLO	EBIRD	EOD - eBird Observation Dataset	HUMAN_OBSERVATION	URN:catalog:CLO:EBIRD:OBS78288335	OBS78288335	obsr200150	1	PRESENT	10/10/78 0:00	1978	10	10	US	California	Santa Barbara	Devereux Slough	34.4136	-119.876	9687165	Motacilla alba Linnaeus, 1758	Animalia	Chordata	Aves	Passeriformes	Motacillidae	Motacilla	alba	SPECIES	White Wagtail	ACCEPTED	4fa7b334-ce0d-4e88-aaae-2e0c138d049e	US	12/16/20 12:02	TRUE	FALSE	9687165	9687165	1	44	212	729	5257	2490295	9687165	Motacilla alba	Motacilla	Motacilla alba Linnaeus, 1758	Motacilla alba	DWC_ARCHIVE	12/16/20 12:02	6/30/20 8:20	FALSE	USA	United States	USA.5_1	California	USA.5.42_1	Santa Barbara	1978-10-10	FALSE
1181822095	OBS265359320	CC0_1_0	Cornell Lab of Ornithology	CLO	EBIRD	EOD - eBird Observation Dataset	HUMAN_OBSERVATION	URN:catalog:CLO:EBIRD:OBS265359320	OBS265359320	obsr21348	1	PRESENT	10/10/78 0:00	1978	10	10	US	California	Santa Barbara	Devereux Slough	34.4136	-119.876	9687165	Motacilla alba Linnaeus, 1758	Animalia	Chordata	Aves	Passeriformes	Motacillidae	Motacilla	alba	SPECIES	White Wagtail	ACCEPTED	4fa7b334-ce0d-4e88-aaae-2e0c138d049e	US	12/16/20 12:03	TRUE	FALSE	9687165	9687165	1	44	212	729	5257	2490295	9687165	Motacilla alba	Motacilla	Motacilla alba Linnaeus, 1758	Motacilla alba	DWC_ARCHIVE	12/16/20 12:03	6/30/20 8:20	FALSE	USA	United States	USA.5_1	California	USA.5.42_1	Santa Barbara	1978-10-10	FALSE
2199940611	OBS645835935	CC0_1_0	Cornell Lab of Ornithology	CLO	EBIRD	EOD - eBird Observation Dataset	HUMAN_OBSERVATION	URN:catalog:CLO:EBIRD:OBS645835935	OBS645835935	obsr1130189	1	PRESENT	10/11/78 0:00	1978	10	11	US	California	Santa Barbara	Devereux Slough	34.4136	-119.876	9687165	Motacilla alba Linnaeus, 1758	Animalia	Chordata	Aves	Passeriformes	Motacillidae	Motacilla	alba	SPECIES	White Wagtail	ACCEPTED	4fa7b334-ce0d-4e88-aaae-2e0c138d049e	US	12/16/20 12:06	TRUE	FALSE	9687165	9687165	1	44	212	729	5257	2490295	9687165	Motacilla alba	Motacilla	Motacilla alba Linnaeus, 1758	Motacilla alba	DWC_ARCHIVE	12/16/20 12:06	6/30/20 8:20	FALSE	USA	United States	USA.5_1	California	USA.5.42_1	Santa Barbara	1978-10-11	FALSE
1786453490	OBS473469343	CC0_1_0	Cornell Lab of Ornithology	CLO	EBIRD	EOD - eBird Observation Dataset	HUMAN_OBSERVATION	URN:catalog:CLO:EBIRD:OBS473469343	OBS473469343	obsr116124	1	PRESENT	10/11/78 0:00	1978	10	11	US	California	Santa Barbara	Devereux Slough	34.4136	-119.876	9687165	Motacilla alba Linnaeus, 1758	Animalia	Chordata	Aves	Passeriformes	Motacillidae	Motacilla	alba	SPECIES	White Wagtail	ACCEPTED	4fa7b334-ce0d-4e88-aaae-2e0c138d049e	US	12/16/20 12:05	TRUE	FALSE	9687165	9687165	1	44	212	729	5257	2490295	9687165	Motacilla alba	Motacilla	Motacilla alba Linnaeus, 1758	Motacilla alba	DWC_ARCHIVE	12/16/20 12:05	6/30/20 8:20	FALSE	USA	United States	USA.5_1	California	USA.5.42_1	Santa Barbara	1978-10-11	FALSE
277399188	OBS81591401	CC0_1_0	Cornell Lab of Ornithology	CLO	EBIRD	EOD - eBird Observation Dataset	HUMAN_OBSERVATION	URN:catalog:CLO:EBIRD:OBS81591401	OBS81591401	obsr102836	1	PRESENT	10/8/78 0:00	1978	10	8	US	California	Santa Barbara	Devereux Slough	34.4136	-119.876	2483494	Myiodynastes luteiventris P.L.Sclater, 1859	Animalia	Chordata	Aves	Passeriformes	Tyrannidae	Myiodynastes	luteiventris	SPECIES	Sulphur-bellied Flycatcher	ACCEPTED	4fa7b334-ce0d-4e88-aaae-2e0c138d049e	US	12/16/20 11:51	TRUE	FALSE	2483494	2483494	1	44	212	729	5291	2483488	2483494	Myiodynastes luteiventris	Myiodynastes	Myiodynastes luteiventris P.L.Sclater, 1859	Myiodynastes luteiventris	DWC_ARCHIVE	12/16/20 11:51	6/30/20 8:20	FALSE	USA	United States	USA.5_1	California	USA.5.42_1	Santa Barbara	1978-10-8	FALSE
181591137	OBS57956672	CC0_1_0	Cornell Lab of Ornithology	CLO	EBIRD	EOD - eBird Observation Dataset	HUMAN_OBSERVATION	URN:catalog:CLO:EBIRD:OBS57956672	OBS57956672	obsr107968	1	PRESENT	10/9/78 0:00	1978	10	9	US	California	Santa Barbara	Devereux Slough	34.4136	-119.876	9687165	Motacilla alba Linnaeus, 1758	Animalia	Chordata	Aves	Passeriformes	Motacillidae	Motacilla	alba	SPECIES	White Wagtail	ACCEPTED	4fa7b334-ce0d-4e88-aaae-2e0c138d049e	US	12/16/20 11:51	TRUE	FALSE	9687165	9687165	1	44	212	729	5257	2490295	9687165	Motacilla alba	Motacilla	Motacilla alba Linnaeus, 1758	Motacilla alba	DWC_ARCHIVE	12/16/20 11:51	6/30/20 8:20	FALSE	USA	United States	USA.5_1	California	USA.5.42_1	Santa Barbara	1978-10-9	FALSE
181647030	OBS57956670	CC0_1_0	Cornell Lab of Ornithology	CLO	EBIRD	EOD - eBird Observation Dataset	HUMAN_OBSERVATION	URN:catalog:CLO:EBIRD:OBS57956670	OBS57956670	obsr107968	1	PRESENT	10/9/78 0:00	1978	10	9	US	California	Santa Barbara	Devereux Slough	34.4136	-119.876	2483494	Myiodynastes luteiventris P.L.Sclater, 1859	Animalia	Chordata	Aves	Passeriformes	Tyrannidae	Myiodynastes	luteiventris	SPECIES	Sulphur-bellied Flycatcher	ACCEPTED	4fa7b334-ce0d-4e88-aaae-2e0c138d049e	US	12/16/20 11:50	TRUE	FALSE	2483494	2483494	1	44	212	729	5291	2483488	2483494	Myiodynastes luteiventris	Myiodynastes	Myiodynastes luteiventris P.L.Sclater, 1859	Myiodynastes luteiventris	DWC_ARCHIVE	12/16/20 11:50	6/30/20 8:20	FALSE	USA	United States	USA.5_1	California	USA.5.42_1	Santa Barbara	1978-10-9	FALSE
257109023	OBS58551466	CC0_1_0	Cornell Lab of Ornithology	CLO	EBIRD	EOD - eBird Observation Dataset	HUMAN_OBSERVATION	URN:catalog:CLO:EBIRD:OBS58551466	OBS58551466	obsr107968	1	PRESENT	6/9/79 0:00	1979	6	9	US	California	Santa Barbara	Devereux Slough	34.4136	-119.876	2480894	Egretta caerulea (Linnaeus, 1758)	Animalia	Chordata	Aves	Pelecaniformes	Ardeidae	Egretta	caerulea	SPECIES	Little Blue Heron	ACCEPTED	4fa7b334-ce0d-4e88-aaae-2e0c138d049e	US	12/16/20 11:52	TRUE	FALSE	2480894	2480894	1	44	212	7190953	3685	2480872	2480894	Egretta caerulea	Egretta	Egretta caerulea (Linnaeus, 1758)	Egretta caerulea	DWC_ARCHIVE	12/16/20 11:52	6/30/20 8:20	FALSE	USA	United States	USA.5_1	California	USA.5.42_1	Santa Barbara	1979-6-9	FALSE
2107979731	OBS552912068	CC0_1_0	Cornell Lab of Ornithology	CLO	EBIRD	EOD - eBird Observation Dataset	HUMAN_OBSERVATION	URN:catalog:CLO:EBIRD:OBS552912068	OBS552912068	obsr208237	1	PRESENT	11/20/81 0:00	1981	11	20	US	California	Santa Barbara	Devereux Slough	34.4136	-119.876	2498402	Dendrocygna bicolor (Vieillot, 1816)	Animalia	Chordata	Aves	Anseriformes	Anatidae	Dendrocygna	bicolor	SPECIES	Fulvous Whistling-Duck	ACCEPTED	4fa7b334-ce0d-4e88-aaae-2e0c138d049e	US	12/16/20 11:55	TRUE	FALSE	2498402	2498402	1	44	212	1108	2986	2498392	2498402	Dendrocygna bicolor	Dendrocygna	Dendrocygna bicolor (Vieillot, 1816)	Dendrocygna bicolor	DWC_ARCHIVE	12/16/20 11:55	6/30/20 8:20	FALSE	USA	United States	USA.5_1	California	USA.5.42_1	Santa Barbara	1981-11-20	FALSE
587402843	OBS97600463	CC0_1_0	Cornell Lab of Ornithology	CLO	EBIRD	EOD - eBird Observation Dataset	HUMAN_OBSERVATION	URN:catalog:CLO:EBIRD:OBS97600463	OBS97600463	obsr21348	1	PRESENT	4/19/81 0:00	1981	4	19	US	California	Santa Barbara	Devereux Slough	34.4136	-119.876	2482800	Empidonax hammondii (Xantus de Vesey, 1858)	Animalia	Chordata	Aves	Passeriformes	Tyrannidae	Empidonax	hammondii	SPECIES	Hammond's Flycatcher	ACCEPTED	4fa7b334-ce0d-4e88-aaae-2e0c138d049e	US	12/16/20 12:00	TRUE	FALSE	2482800	2482800	1	44	212	729	5291	2482766	2482800	Empidonax hammondii	Empidonax	Empidonax hammondii (Xantus de Vesey, 1858)	Empidonax hammondii	DWC_ARCHIVE	12/16/20 12:00	6/30/20 8:20	FALSE	USA	United States	USA.5_1	California	USA.5.42_1	Santa Barbara	1981-4-19	FALSE
257679461	OBS62633099	CC0_1_0	Cornell Lab of Ornithology	CLO	EBIRD	EOD - eBird Observation Dataset	HUMAN_OBSERVATION	URN:catalog:CLO:EBIRD:OBS62633099	OBS62633099	obsr136347	1	PRESENT	1/2/83 0:00	1983	1	2	US	California	Santa Barbara	Devereux Slough	34.4136	-119.876	7415507	Leiothlypis peregrina (A.Wilson, 1811)	Animalia	Chordata	Aves	Passeriformes	Parulidae	Leiothlypis	peregrina	SPECIES	Tennessee Warbler	ACCEPTED	4fa7b334-ce0d-4e88-aaae-2e0c138d049e	US	12/16/20 11:51	TRUE	FALSE	7415507	7415507	1	44	212	729	5263	7467942	7415507	Leiothlypis peregrina	Leiothlypis	Leiothlypis peregrina (A.Wilson, 1811)	Leiothlypis peregrina	DWC_ARCHIVE	12/16/20 11:51	6/30/20 8:20	FALSE	USA	United States	USA.5_1	California	USA.5.42_1	Santa Barbara	1983-1-2	FALSE
271245761	OBS62632930	CC0_1_0	Cornell Lab of Ornithology	CLO	EBIRD	EOD - eBird Observation Dataset	HUMAN_OBSERVATION	URN:catalog:CLO:EBIRD:OBS62632930	OBS62632930	obsr136347	1	PRESENT	12/31/83 0:00	1983	12	31	US	California	Santa Barbara	Devereux Slough	34.4136	-119.876	2489985	Setophaga ruticilla (Linnaeus, 1758)	Animalia	Chordata	Aves	Passeriformes	Parulidae	Setophaga	ruticilla	SPECIES	American Redstart	ACCEPTED	4fa7b334-ce0d-4e88-aaae-2e0c138d049e	US	12/16/20 12:01	TRUE	FALSE	2489985	2489985	1	44	212	729	5263	2489984	2489985	Setophaga ruticilla	Setophaga	Setophaga ruticilla (Linnaeus, 1758)	Setophaga ruticilla	DWC_ARCHIVE	12/16/20 12:01	6/30/20 8:20	FALSE	USA	United States	USA.5_1	California	USA.5.42_1	Santa Barbara	1983-12-31	FALSE
263624318	OBS62632943	CC0_1_0	Cornell Lab of Ornithology	CLO	EBIRD	EOD - eBird Observation Dataset	HUMAN_OBSERVATION	URN:catalog:CLO:EBIRD:OBS62632943	OBS62632943	obsr136347	1	PRESENT	12/31/83 0:00	1983	12	31	US	California	Santa Barbara	Devereux Slough	34.4136	-119.876	5231139	Zonotrichia querula (Nuttall, 1840)	Animalia	Chordata	Aves	Passeriformes	Emberizidae	Zonotrichia	querula	SPECIES	Harris's Sparrow	ACCEPTED	4fa7b334-ce0d-4e88-aaae-2e0c138d049e	US	12/16/20 12:01	TRUE	FALSE	5231139	5231139	1	44	212	729	9608	6173226	5231139	Zonotrichia querula	Zonotrichia	Zonotrichia querula (Nuttall, 1840)	Zonotrichia querula	DWC_ARCHIVE	12/16/20 12:01	6/30/20 8:20	FALSE	USA	United States	USA.5_1	California	USA.5.42_1	Santa Barbara	1983-12-31	FALSE
273326279	OBS62635277	CC0_1_0	Cornell Lab of Ornithology	CLO	EBIRD	EOD - eBird Observation Dataset	HUMAN_OBSERVATION	URN:catalog:CLO:EBIRD:OBS62635277	OBS62635277	obsr136347	3	PRESENT	12/29/84 0:00	1984	12	29	US	California	Santa Barbara	Devereux Slough	34.4136	-119.876	5229935	Icterus spurius (Linnaeus, 1766)	Animalia	Chordata	Aves	Passeriformes	Icteridae	Icterus	spurius	SPECIES	Orchard Oriole	ACCEPTED	4fa7b334-ce0d-4e88-aaae-2e0c138d049e	US	12/16/20 11:51	TRUE	FALSE	5229935	5229935	1	44	212	729	6176	2484282	5229935	Icterus spurius	Icterus	Icterus spurius (Linnaeus, 1766)	Icterus spurius	DWC_ARCHIVE	12/16/20 11:51	6/30/20 8:20	FALSE	USA	United States	USA.5_1	California	USA.5.42_1	Santa Barbara	1984-12-29	FALSE
259967785	OBS62635157	CC0_1_0	Cornell Lab of Ornithology	CLO	EBIRD	EOD - eBird Observation Dataset	HUMAN_OBSERVATION	URN:catalog:CLO:EBIRD:OBS62635157	OBS62635157	obsr136347	2	PRESENT	12/29/84 0:00	1984	12	29	US	California	Santa Barbara	Devereux Slough	34.4136	-119.876	6178410	Melanitta deglandi (Bonaparte, 1850)	Animalia	Chordata	Aves	Anseriformes	Anatidae	Melanitta	deglandi	SPECIES	White-winged Scoter	SYNONYM	4fa7b334-ce0d-4e88-aaae-2e0c138d049e	US	12/16/20 12:12	TRUE	FALSE	2498243	6178410	1	44	212	1108	2986	2498237	2498238	Melanitta fusca	Melanitta	Melanitta fusca deglandi (Bonaparte, 1850)	Melanitta deglandi	DWC_ARCHIVE	12/16/20 12:12	6/30/20 8:20	FALSE	USA	United States	USA.5_1	California	USA.5.42_1	Santa Barbara	1984-12-29	FALSE
256385064	OBS62635293	CC0_1_0	Cornell Lab of Ornithology	CLO	EBIRD	EOD - eBird Observation Dataset	HUMAN_OBSERVATION	URN:catalog:CLO:EBIRD:OBS62635293	OBS62635293	obsr136347	12	PRESENT	12/29/84 0:00	1984	12	29	US	California	Santa Barbara	Devereux Slough	34.4136	-119.876	2490935	Sialia currucoides (Bechstein, 1798)	Animalia	Chordata	Aves	Passeriformes	Turdidae	Sialia	currucoides	SPECIES	Mountain Bluebird	ACCEPTED	4fa7b334-ce0d-4e88-aaae-2e0c138d049e	US	12/16/20 11:51	TRUE	FALSE	2490935	2490935	1	44	212	729	5290	2490934	2490935	Sialia currucoides	Sialia	Sialia currucoides (Bechstein, 1798)	Sialia currucoides	DWC_ARCHIVE	12/16/20 11:51	6/30/20 8:20	FALSE	USA	United States	USA.5_1	California	USA.5.42_1	Santa Barbara	1984-12-29	FALSE
273402449	OBS69898733	CC0_1_0	Cornell Lab of Ornithology	CLO	EBIRD	EOD - eBird Observation Dataset	HUMAN_OBSERVATION	URN:catalog:CLO:EBIRD:OBS69898733	OBS69898733	obsr107968	1	PRESENT	2/18/84 0:00	1984	2	18	US	California	Santa Barbara	Devereux Slough	34.4136	-119.876	5229935	Icterus spurius (Linnaeus, 1766)	Animalia	Chordata	Aves	Passeriformes	Icteridae	Icterus	spurius	SPECIES	Orchard Oriole	ACCEPTED	4fa7b334-ce0d-4e88-aaae-2e0c138d049e	US	12/16/20 11:51	TRUE	FALSE	5229935	5229935	1	44	212	729	6176	2484282	5229935	Icterus spurius	Icterus	Icterus spurius (Linnaeus, 1766)	Icterus spurius	DWC_ARCHIVE	12/16/20 11:51	6/30/20 8:20	FALSE	USA	United States	USA.5_1	California	USA.5.42_1	Santa Barbara	1984-2-18	FALSE
277143948	OBS69914392	CC0_1_0	Cornell Lab of Ornithology	CLO	EBIRD	EOD - eBird Observation Dataset	HUMAN_OBSERVATION	URN:catalog:CLO:EBIRD:OBS69914392	OBS69914392	obsr56093	1	PRESENT	2/18/84 0:00	1984	2	18	US	California	Santa Barbara	Devereux Slough	34.4136	-119.876	5229935	Icterus spurius (Linnaeus, 1766)	Animalia	Chordata	Aves	Passeriformes	Icteridae	Icterus	spurius	SPECIES	Orchard Oriole	ACCEPTED	4fa7b334-ce0d-4e88-aaae-2e0c138d049e	US	12/16/20 11:59	TRUE	FALSE	5229935	5229935	1	44	212	729	6176	2484282	5229935	Icterus spurius	Icterus	Icterus spurius (Linnaeus, 1766)	Icterus spurius	DWC_ARCHIVE	12/16/20 11:59	6/30/20 8:20	FALSE	USA	United States	USA.5_1	California	USA.5.42_1	Santa Barbara	1984-2-18	FALSE
271216614	OBS69898735	CC0_1_0	Cornell Lab of Ornithology	CLO	EBIRD	EOD - eBird Observation Dataset	HUMAN_OBSERVATION	URN:catalog:CLO:EBIRD:OBS69898735	OBS69898735	obsr107968	1	PRESENT	2/18/84 0:00	1984	2	18	US	California	Santa Barbara	Devereux Slough	34.4136	-119.876	7341822	Setophaga palmarum (J.F.Gmelin, 1789)	Animalia	Chordata	Aves	Passeriformes	Parulidae	Setophaga	palmarum	SPECIES	Palm Warbler	ACCEPTED	4fa7b334-ce0d-4e88-aaae-2e0c138d049e	US	12/16/20 11:51	TRUE	FALSE	7341822	7341822	1	44	212	729	5263	2489984	7341822	Setophaga palmarum	Setophaga	Setophaga palmarum (J.F.Gmelin, 1789)	Setophaga palmarum	DWC_ARCHIVE	12/16/20 11:51	6/30/20 8:20	FALSE	USA	United States	USA.5_1	California	USA.5.42_1	Santa Barbara	1984-2-18	FALSE
256929833	OBS88305718	CC0_1_0	Cornell Lab of Ornithology	CLO	EBIRD	EOD - eBird Observation Dataset	HUMAN_OBSERVATION	URN:catalog:CLO:EBIRD:OBS88305718	OBS88305718	obsr21348	1	PRESENT	2/18/84 0:00	1984	2	18	US	California	Santa Barbara	Devereux Slough	34.4136	-119.876	7341822	Setophaga palmarum (J.F.Gmelin, 1789)	Animalia	Chordata	Aves	Passeriformes	Parulidae	Setophaga	palmarum	SPECIES	Palm Warbler	ACCEPTED	4fa7b334-ce0d-4e88-aaae-2e0c138d049e	US	12/16/20 12:01	TRUE	FALSE	7341822	7341822	1	44	212	729	5263	2489984	7341822	Setophaga palmarum	Setophaga	Setophaga palmarum (J.F.Gmelin, 1789)	Setophaga palmarum	DWC_ARCHIVE	12/16/20 12:01	6/30/20 8:20	FALSE	USA	United States	USA.5_1	California	USA.5.42_1	Santa Barbara	1984-2-18	FALSE
271227293	OBS69914394	CC0_1_0	Cornell Lab of Ornithology	CLO	EBIRD	EOD - eBird Observation Dataset	HUMAN_OBSERVATION	URN:catalog:CLO:EBIRD:OBS69914394	OBS69914394	obsr56093	1	PRESENT	2/18/84 0:00	1984	2	18	US	California	Santa Barbara	Devereux Slough	34.4136	-119.876	7341822	Setophaga palmarum (J.F.Gmelin, 1789)	Animalia	Chordata	Aves	Passeriformes	Parulidae	Setophaga	palmarum	SPECIES	Palm Warbler	ACCEPTED	4fa7b334-ce0d-4e88-aaae-2e0c138d049e	US	12/16/20 11:59	TRUE	FALSE	7341822	7341822	1	44	212	729	5263	2489984	7341822	Setophaga palmarum	Setophaga	Setophaga palmarum (J.F.Gmelin, 1789)	Setophaga palmarum	DWC_ARCHIVE	12/16/20 11:59	6/30/20 8:20	FALSE	USA	United States	USA.5_1	California	USA.5.42_1	Santa Barbara	1984-2-18	FALSE
256584066	OBS88305703	CC0_1_0	Cornell Lab of Ornithology	CLO	EBIRD	EOD - eBird Observation Dataset	HUMAN_OBSERVATION	URN:catalog:CLO:EBIRD:OBS88305703	OBS88305703	obsr21348	1	PRESENT	2/18/84 0:00	1984	2	18	US	California	Santa Barbara	Devereux Slough	34.4136	-119.876	2489985	Setophaga ruticilla (Linnaeus, 1758)	Animalia	Chordata	Aves	Passeriformes	Parulidae	Setophaga	ruticilla	SPECIES	American Redstart	ACCEPTED	4fa7b334-ce0d-4e88-aaae-2e0c138d049e	US	12/16/20 12:01	TRUE	FALSE	2489985	2489985	1	44	212	729	5263	2489984	2489985	Setophaga ruticilla	Setophaga	Setophaga ruticilla (Linnaeus, 1758)	Setophaga ruticilla	DWC_ARCHIVE	12/16/20 12:01	6/30/20 8:20	FALSE	USA	United States	USA.5_1	California	USA.5.42_1	Santa Barbara	1984-2-18	FALSE
1770788467	OBS440104955	CC0_1_0	Cornell Lab of Ornithology	CLO	EBIRD_PNW	EOD - eBird Observation Dataset	HUMAN_OBSERVATION	URN:catalog:CLO:EBIRD_PNW:OBS440104955	OBS440104955	obsr537203	1	PRESENT	2/4/84 0:00	1984	2	4	US	California	Santa Barbara	Devereux Slough	34.4136	-119.876	7341822	Setophaga palmarum (J.F.Gmelin, 1789)	Animalia	Chordata	Aves	Passeriformes	Parulidae	Setophaga	palmarum	SPECIES	Palm Warbler	ACCEPTED	4fa7b334-ce0d-4e88-aaae-2e0c138d049e	US	12/16/20 12:04	TRUE	FALSE	7341822	7341822	1	44	212	729	5263	2489984	7341822	Setophaga palmarum	Setophaga	Setophaga palmarum (J.F.Gmelin, 1789)	Setophaga palmarum	DWC_ARCHIVE	12/16/20 12:04	6/30/20 8:20	FALSE	USA	United States	USA.5_1	California	USA.5.42_1	Santa Barbara	1984-2-4	FALSE
1770788414	OBS440104924	CC0_1_0	Cornell Lab of Ornithology	CLO	EBIRD_PNW	EOD - eBird Observation Dataset	HUMAN_OBSERVATION	URN:catalog:CLO:EBIRD_PNW:OBS440104924	OBS440104924	obsr537203	1	PRESENT	2/4/84 0:00	1984	2	4	US	California	Santa Barbara	Devereux Slough	34.4136	-119.876	5229935	Icterus spurius (Linnaeus, 1766)	Animalia	Chordata	Aves	Passeriformes	Icteridae	Icterus	spurius	SPECIES	Orchard Oriole	ACCEPTED	4fa7b334-ce0d-4e88-aaae-2e0c138d049e	US	12/16/20 11:54	TRUE	FALSE	5229935	5229935	1	44	212	729	6176	2484282	5229935	Icterus spurius	Icterus	Icterus spurius (Linnaeus, 1766)	Icterus spurius	DWC_ARCHIVE	12/16/20 11:54	6/30/20 8:20	FALSE	USA	United States	USA.5_1	California	USA.5.42_1	Santa Barbara	1984-2-4	FALSE
2143871020	OBS584238951	CC0_1_0	Cornell Lab of Ornithology	CLO	EBIRD	EOD - eBird Observation Dataset	HUMAN_OBSERVATION	URN:catalog:CLO:EBIRD:OBS584238951	OBS584238951	obsr196748	1	PRESENT	9/29/85 0:00	1985	9	29	US	California	Santa Barbara	Devereux Slough	34.4136	-119.876	2487430	Vireo olivaceus (Linnaeus, 1766)	Animalia	Chordata	Aves	Passeriformes	Vireonidae	Vireo	olivaceus	SPECIES	Red-eyed Vireo	ACCEPTED	4fa7b334-ce0d-4e88-aaae-2e0c138d049e	US	12/16/20 12:05	TRUE	FALSE	2487430	2487430	1	44	212	729	9358	2487406	2487430	Vireo olivaceus	Vireo	Vireo olivaceus (Linnaeus, 1766)	Vireo olivaceus	DWC_ARCHIVE	12/16/20 12:05	6/30/20 8:20	FALSE	USA	United States	USA.5_1	California	USA.5.42_1	Santa Barbara	1985-9-29	FALSE
2230343084	OBS700758873	CC0_1_0	Cornell Lab of Ornithology	CLO	EBIRD	EOD - eBird Observation Dataset	HUMAN_OBSERVATION	URN:catalog:CLO:EBIRD:OBS700758873	OBS700758873	obsr1029550	NA	PRESENT	10/7/87 0:00	1987	10	7	US	California	Santa Barbara	Devereux Slough	34.4136	-119.876	2497240	Athene cunicularia (Molina, 1782)	Animalia	Chordata	Aves	Strigiformes	Strigidae	Athene	cunicularia	SPECIES	Burrowing Owl	ACCEPTED	4fa7b334-ce0d-4e88-aaae-2e0c138d049e	US	12/16/20 12:07	TRUE	FALSE	2497240	2497240	1	44	212	1450	9348	2497239	2497240	Athene cunicularia	Athene	Athene cunicularia (Molina, 1782)	Athene cunicularia	DWC_ARCHIVE	12/16/20 12:07	6/30/20 8:20	FALSE	USA	United States	USA.5_1	California	USA.5.42_1	Santa Barbara	1987-10-7	FALSE
1767883806	OBS436906323	CC0_1_0	Cornell Lab of Ornithology	CLO	EBIRD	EOD - eBird Observation Dataset	HUMAN_OBSERVATION	URN:catalog:CLO:EBIRD:OBS436906323	OBS436906323	obsr111092	1	PRESENT	2/28/87 0:00	1987	2	28	US	California	Santa Barbara	Devereux Slough	34.4136	-119.876	2478597	Sphyrapicus ruber (Gmelin, 1788)	Animalia	Chordata	Aves	Piciformes	Picidae	Sphyrapicus	ruber	SPECIES	Red-breasted Sapsucker	ACCEPTED	4fa7b334-ce0d-4e88-aaae-2e0c138d049e	US	12/16/20 11:54	TRUE	FALSE	2478597	2478597	1	44	212	724	9333	2478596	2478597	Sphyrapicus ruber	Sphyrapicus	Sphyrapicus ruber (Gmelin, 1788)	Sphyrapicus ruber	DWC_ARCHIVE	12/16/20 11:54	6/30/20 8:20	FALSE	USA	United States	USA.5_1	California	USA.5.42_1	Santa Barbara	1987-2-28	TRUE
210471129	OBS62632674	CC0_1_0	Cornell Lab of Ornithology	CLO	EBIRD	EOD - eBird Observation Dataset	HUMAN_OBSERVATION	URN:catalog:CLO:EBIRD:OBS62632674	OBS62632674	obsr136347	1	PRESENT	12/31/88 0:00	1988	12	31	US	California	Santa Barbara	Devereux Slough	34.4136	-119.876	2497295	Asio flammeus (Pontoppidan, 1763)	Animalia	Chordata	Aves	Strigiformes	Strigidae	Asio	flammeus	SPECIES	Short-eared Owl	ACCEPTED	4fa7b334-ce0d-4e88-aaae-2e0c138d049e	US	12/16/20 11:52	TRUE	FALSE	2497295	2497295	1	44	212	1450	9348	8373955	2497295	Asio flammeus	Asio	Asio flammeus (Pontoppidan, 1763)	Asio flammeus	DWC_ARCHIVE	12/16/20 11:52	6/30/20 8:20	FALSE	USA	United States	USA.5_1	California	USA.5.42_1	Santa Barbara	1988-12-31	FALSE
1205539301	OBS316320463	CC0_1_0	Cornell Lab of Ornithology	CLO	EBIRD	EOD - eBird Observation Dataset	HUMAN_OBSERVATION	URN:catalog:CLO:EBIRD:OBS316320463	OBS316320463	obsr111092	1	PRESENT	10/3/89 0:00	1989	10	3	US	California	Santa Barbara	Devereux Slough	34.4136	-119.876	5229387	Calidris pugnax (Linnaeus, 1758)	Animalia	Chordata	Aves	Charadriiformes	Scolopacidae	Philomachus	pugnax	SPECIES	Ruff	SYNONYM	4fa7b334-ce0d-4e88-aaae-2e0c138d049e	US	12/16/20 12:04	TRUE	FALSE	8250742	5229387	1	44	212	7192402	5282	2481691	5229387	Philomachus pugnax	Calidris	Philomachus pugnax (Linnaeus, 1758)	Calidris pugnax	DWC_ARCHIVE	12/16/20 12:04	6/30/20 8:20	FALSE	USA	United States	USA.5_1	California	USA.5.42_1	Santa Barbara	1989-10-3	TRUE
1384690360	OBS339632752	CC0_1_0	Cornell Lab of Ornithology	CLO	EBIRD	EOD - eBird Observation Dataset	HUMAN_OBSERVATION	URN:catalog:CLO:EBIRD:OBS339632752	OBS339632752	obsr111092	1	PRESENT	11/28/89 0:00	1989	11	28	US	California	Santa Barbara	Devereux Slough	34.4136	-119.876	5229935	Icterus spurius (Linnaeus, 1766)	Animalia	Chordata	Aves	Passeriformes	Icteridae	Icterus	spurius	SPECIES	Orchard Oriole	ACCEPTED	4fa7b334-ce0d-4e88-aaae-2e0c138d049e	US	12/16/20 12:14	TRUE	FALSE	5229935	5229935	1	44	212	729	6176	2484282	5229935	Icterus spurius	Icterus	Icterus spurius (Linnaeus, 1766)	Icterus spurius	DWC_ARCHIVE	12/16/20 12:14	6/30/20 8:20	FALSE	USA	United States	USA.5_1	California	USA.5.42_1	Santa Barbara	1989-11-28	TRUE
1395089106	OBS351007045	CC0_1_0	Cornell Lab of Ornithology	CLO	EBIRD	EOD - eBird Observation Dataset	HUMAN_OBSERVATION	URN:catalog:CLO:EBIRD:OBS351007045	OBS351007045	obsr111092	1	PRESENT	10/3/90 0:00	1990	10	3	US	California	Santa Barbara	Coal Oil Point Reserve	34.4162	-119.877	2494973	Oreoscoptes montanus (J.K.Townsend, 1837)	Animalia	Chordata	Aves	Passeriformes	Mimidae	Oreoscoptes	montanus	SPECIES	Sage Thrasher	ACCEPTED	4fa7b334-ce0d-4e88-aaae-2e0c138d049e	US	12/16/20 12:14	TRUE	FALSE	2494973	2494973	1	44	212	729	9321	2494972	2494973	Oreoscoptes montanus	Oreoscoptes	Oreoscoptes montanus (J.K.Townsend, 1837)	Oreoscoptes montanus	DWC_ARCHIVE	12/16/20 12:14	6/30/20 8:20	FALSE	USA	United States	USA.5_1	California	USA.5.42_1	Santa Barbara	1990-10-3	TRUE
1772226787	OBS441667518	CC0_1_0	Cornell Lab of Ornithology	CLO	EBIRD	EOD - eBird Observation Dataset	HUMAN_OBSERVATION	URN:catalog:CLO:EBIRD:OBS441667518	OBS441667518	obsr57623	1	PRESENT	2/24/90 0:00	1990	2	24	US	California	Santa Barbara	Devereux Slough	34.4136	-119.876	6178410	Melanitta deglandi (Bonaparte, 1850)	Animalia	Chordata	Aves	Anseriformes	Anatidae	Melanitta	deglandi	SPECIES	White-winged Scoter	SYNONYM	4fa7b334-ce0d-4e88-aaae-2e0c138d049e	US	12/16/20 12:06	TRUE	FALSE	2498243	6178410	1	44	212	1108	2986	2498237	2498238	Melanitta fusca	Melanitta	Melanitta fusca deglandi (Bonaparte, 1850)	Melanitta deglandi	DWC_ARCHIVE	12/16/20 12:06	6/30/20 8:20	FALSE	USA	United States	USA.5_1	California	USA.5.42_1	Santa Barbara	1990-2-24	FALSE
1385880597	OBS340886798	CC0_1_0	Cornell Lab of Ornithology	CLO	EBIRD	EOD - eBird Observation Dataset	HUMAN_OBSERVATION	URN:catalog:CLO:EBIRD:OBS340886798	OBS340886798	obsr111092	1	PRESENT	2/24/90 0:00	1990	2	24	US	California	Santa Barbara	Devereux Slough	34.4136	-119.876	6178410	Melanitta deglandi (Bonaparte, 1850)	Animalia	Chordata	Aves	Anseriformes	Anatidae	Melanitta	deglandi	SPECIES	White-winged Scoter	SYNONYM	4fa7b334-ce0d-4e88-aaae-2e0c138d049e	US	12/16/20 12:03	TRUE	FALSE	2498243	6178410	1	44	212	1108	2986	2498237	2498238	Melanitta fusca	Melanitta	Melanitta fusca deglandi (Bonaparte, 1850)	Melanitta deglandi	DWC_ARCHIVE	12/16/20 12:03	6/30/20 8:20	FALSE	USA	United States	USA.5_1	California	USA.5.42_1	Santa Barbara	1990-2-24	TRUE
1777894838	OBS448186692	CC0_1_0	Cornell Lab of Ornithology	CLO	EBIRD	EOD - eBird Observation Dataset	HUMAN_OBSERVATION	URN:catalog:CLO:EBIRD:OBS448186692	OBS448186692	obsr57623	NA	PRESENT	2/25/90 0:00	1990	2	25	US	California	Santa Barbara	Devereux Slough	34.4136	-119.876	2484445	Agelaius tricolor (Audubon, 1837)	Animalia	Chordata	Aves	Passeriformes	Icteridae	Agelaius	tricolor	SPECIES	Tricolored Blackbird	ACCEPTED	4fa7b334-ce0d-4e88-aaae-2e0c138d049e	US	12/16/20 11:55	TRUE	FALSE	2484445	2484445	1	44	212	729	6176	2484444	2484445	Agelaius tricolor	Agelaius	Agelaius tricolor (Audubon, 1837)	Agelaius tricolor	DWC_ARCHIVE	12/16/20 11:55	6/30/20 8:20	FALSE	USA	United States	USA.5_1	California	USA.5.42_1	Santa Barbara	1990-2-25	FALSE
1385808437	OBS340923086	CC0_1_0	Cornell Lab of Ornithology	CLO	EBIRD	EOD - eBird Observation Dataset	HUMAN_OBSERVATION	URN:catalog:CLO:EBIRD:OBS340923086	OBS340923086	obsr111092	1	PRESENT	5/5/90 0:00	1990	5	5	US	California	Santa Barbara	Devereux Slough	34.4136	-119.876	9552291	Vireo cassinii Xantus de Vesey, 1858	Animalia	Chordata	Aves	Passeriformes	Vireonidae	Vireo	cassinii	SPECIES	Cassin's Vireo	ACCEPTED	4fa7b334-ce0d-4e88-aaae-2e0c138d049e	US	12/16/20 12:04	TRUE	FALSE	9552291	9552291	1	44	212	729	9358	2487406	9552291	Vireo cassinii	Vireo	Vireo cassinii Xantus de Vesey, 1858	Vireo cassinii	DWC_ARCHIVE	12/16/20 12:04	6/30/20 8:20	FALSE	USA	United States	USA.5_1	California	USA.5.42_1	Santa Barbara	1990-5-5	TRUE
279228583	OBS74846112	CC0_1_0	Cornell Lab of Ornithology	CLO	EBIRD	EOD - eBird Observation Dataset	HUMAN_OBSERVATION	URN:catalog:CLO:EBIRD:OBS74846112	OBS74846112	obsr125809	1	PRESENT	8/18/90 0:00	1990	8	18	US	California	Santa Barbara	Devereux Slough	34.4136	-119.876	5229387	Calidris pugnax (Linnaeus, 1758)	Animalia	Chordata	Aves	Charadriiformes	Scolopacidae	Philomachus	pugnax	SPECIES	Ruff	SYNONYM	4fa7b334-ce0d-4e88-aaae-2e0c138d049e	US	12/16/20 12:03	TRUE	FALSE	8250742	5229387	1	44	212	7192402	5282	2481691	5229387	Philomachus pugnax	Calidris	Philomachus pugnax (Linnaeus, 1758)	Calidris pugnax	DWC_ARCHIVE	12/16/20 12:03	6/30/20 8:20	FALSE	USA	United States	USA.5_1	California	USA.5.42_1	Santa Barbara	1990-8-18	FALSE
1399767781	OBS356371427	CC0_1_0	Cornell Lab of Ornithology	CLO	EBIRD	EOD - eBird Observation Dataset	HUMAN_OBSERVATION	URN:catalog:CLO:EBIRD:OBS356371427	OBS356371427	obsr486677	1	PRESENT	5/25/91 0:00	1991	5	25	US	California	Santa Barbara	Devereux Slough	34.4136	-119.876	7415507	Leiothlypis peregrina (A.Wilson, 1811)	Animalia	Chordata	Aves	Passeriformes	Parulidae	Leiothlypis	peregrina	SPECIES	Tennessee Warbler	ACCEPTED	4fa7b334-ce0d-4e88-aaae-2e0c138d049e	US	12/16/20 12:04	TRUE	FALSE	7415507	7415507	1	44	212	729	5263	7467942	7415507	Leiothlypis peregrina	Leiothlypis	Leiothlypis peregrina (A.Wilson, 1811)	Leiothlypis peregrina	DWC_ARCHIVE	12/16/20 12:04	6/30/20 8:20	FALSE	USA	United States	USA.5_1	California	USA.5.42_1	Santa Barbara	1991-5-25	FALSE
1200676946	OBS287035421	CC0_1_0	Cornell Lab of Ornithology	CLO	EBIRD	EOD - eBird Observation Dataset	HUMAN_OBSERVATION	URN:catalog:CLO:EBIRD:OBS287035421	OBS287035421	obsr111092	1	PRESENT	5/25/91 0:00	1991	5	25	US	California	Santa Barbara	Devereux Slough	34.4136	-119.876	7415507	Leiothlypis peregrina (A.Wilson, 1811)	Animalia	Chordata	Aves	Passeriformes	Parulidae	Leiothlypis	peregrina	SPECIES	Tennessee Warbler	ACCEPTED	4fa7b334-ce0d-4e88-aaae-2e0c138d049e	US	12/16/20 12:03	TRUE	FALSE	7415507	7415507	1	44	212	729	5263	7467942	7415507	Leiothlypis peregrina	Leiothlypis	Leiothlypis peregrina (A.Wilson, 1811)	Leiothlypis peregrina	DWC_ARCHIVE	12/16/20 12:03	6/30/20 8:20	FALSE	USA	United States	USA.5_1	California	USA.5.42_1	Santa Barbara	1991-5-25	TRUE
255934256	OBS58870613	CC0_1_0	Cornell Lab of Ornithology	CLO	EBIRD	EOD - eBird Observation Dataset	HUMAN_OBSERVATION	URN:catalog:CLO:EBIRD:OBS58870613	OBS58870613	obsr21101	1	PRESENT	8/25/91 0:00	1991	8	25	US	California	Santa Barbara	Devereux Slough	34.4136	-119.876	5229387	Calidris pugnax (Linnaeus, 1758)	Animalia	Chordata	Aves	Charadriiformes	Scolopacidae	Philomachus	pugnax	SPECIES	Ruff	SYNONYM	4fa7b334-ce0d-4e88-aaae-2e0c138d049e	US	12/16/20 11:50	TRUE	FALSE	8250742	5229387	1	44	212	7192402	5282	2481691	5229387	Philomachus pugnax	Calidris	Philomachus pugnax (Linnaeus, 1758)	Calidris pugnax	DWC_ARCHIVE	12/16/20 11:50	6/30/20 8:20	FALSE	USA	United States	USA.5_1	California	USA.5.42_1	Santa Barbara	1991-8-25	FALSE
1794499145	OBS546416903	CC0_1_0	Cornell Lab of Ornithology	CLO	EBIRD	EOD - eBird Observation Dataset	HUMAN_OBSERVATION	URN:catalog:CLO:EBIRD:OBS546416903	OBS546416903	obsr114768	1	PRESENT	8/28/91 0:00	1991	8	28	US	California	Santa Barbara	Devereux Slough	34.4136	-119.876	5229387	Calidris pugnax (Linnaeus, 1758)	Animalia	Chordata	Aves	Charadriiformes	Scolopacidae	Philomachus	pugnax	SPECIES	Ruff	SYNONYM	4fa7b334-ce0d-4e88-aaae-2e0c138d049e	US	12/16/20 12:07	TRUE	FALSE	8250742	5229387	1	44	212	7192402	5282	2481691	5229387	Philomachus pugnax	Calidris	Philomachus pugnax (Linnaeus, 1758)	Calidris pugnax	DWC_ARCHIVE	12/16/20 12:07	6/30/20 8:20	FALSE	USA	United States	USA.5_1	California	USA.5.42_1	Santa Barbara	1991-8-28	FALSE
837279787	OBS136937721	CC0_1_0	Cornell Lab of Ornithology	CLO	EBIRD_CAN	EOD - eBird Observation Dataset	HUMAN_OBSERVATION	URN:catalog:CLO:EBIRD_CAN:OBS136937721	OBS136937721	obsr163044	1	PRESENT	8/29/91 0:00	1991	8	29	US	California	Santa Barbara	Devereux Slough	34.4136	-119.876	5229387	Calidris pugnax (Linnaeus, 1758)	Animalia	Chordata	Aves	Charadriiformes	Scolopacidae	Philomachus	pugnax	SPECIES	Ruff	SYNONYM	4fa7b334-ce0d-4e88-aaae-2e0c138d049e	US	12/16/20 12:12	TRUE	FALSE	8250742	5229387	1	44	212	7192402	5282	2481691	5229387	Philomachus pugnax	Calidris	Philomachus pugnax (Linnaeus, 1758)	Calidris pugnax	DWC_ARCHIVE	12/16/20 12:12	6/30/20 8:20	FALSE	USA	United States	USA.5_1	California	USA.5.42_1	Santa Barbara	1991-8-29	FALSE
260057319	OBS62648199	CC0_1_0	Cornell Lab of Ornithology	CLO	EBIRD	EOD - eBird Observation Dataset	HUMAN_OBSERVATION	URN:catalog:CLO:EBIRD:OBS62648199	OBS62648199	obsr136347	1	PRESENT	12/30/95 0:00	1995	12	30	US	California	Santa Barbara	Devereux Slough	34.4136	-119.876	6178415	Melanitta americana (Swainson, 1832)	Animalia	Chordata	Aves	Anseriformes	Anatidae	Melanitta	americana	SPECIES	Black Scoter	SYNONYM	4fa7b334-ce0d-4e88-aaae-2e0c138d049e	US	12/16/20 11:50	TRUE	FALSE	2498250	6178415	1	44	212	1108	2986	2498237	2498247	Melanitta nigra	Melanitta	Melanitta nigra americana (Swainson, 1832)	Melanitta americana	DWC_ARCHIVE	12/16/20 11:50	6/30/20 8:20	FALSE	USA	United States	USA.5_1	California	USA.5.42_1	Santa Barbara	1995-12-30	FALSE
1182651943	OBS266366758	CC0_1_0	Cornell Lab of Ornithology	CLO	EBIRD	EOD - eBird Observation Dataset	HUMAN_OBSERVATION	URN:catalog:CLO:EBIRD:OBS266366758	OBS266366758	obsr111092	1	PRESENT	4/25/98 0:00	1998	4	25	US	California	Santa Barbara	Dune Pond at COPR	34.4137	-119.882	5228200	Gallinula galeata (Lichtenstein, 1818)	Animalia	Chordata	Aves	Gruiformes	Rallidae	Gallinula	galeata	SPECIES	Common Gallinule	SYNONYM	4fa7b334-ce0d-4e88-aaae-2e0c138d049e	US	12/16/20 11:52	TRUE	FALSE	7340222	5228200	1	44	212	1493	9342	7918617	5228199	Gallinula chloropus	Gallinula	Gallinula chloropus galeata (Lichtenstein, 1818)	Gallinula galeata	DWC_ARCHIVE	12/16/20 11:52	6/30/20 8:20	FALSE	USA	United States	USA.5_1	California	USA.5.42_1	Santa Barbara	1998-4-25	TRUE
1202938308	OBS295143839	CC0_1_0	Cornell Lab of Ornithology	CLO	EBIRD	EOD - eBird Observation Dataset	HUMAN_OBSERVATION	URN:catalog:CLO:EBIRD:OBS295143839	OBS295143839	obsr51183	1	PRESENT	1/18/99 0:00	1999	1	18	US	California	Santa Barbara	Devereux Slough	34.4136	-119.876	2478597	Sphyrapicus ruber (Gmelin, 1788)	Animalia	Chordata	Aves	Piciformes	Picidae	Sphyrapicus	ruber	SPECIES	Red-breasted Sapsucker	ACCEPTED	4fa7b334-ce0d-4e88-aaae-2e0c138d049e	US	12/16/20 12:02	TRUE	FALSE	2478597	2478597	1	44	212	724	9333	2478596	2478597	Sphyrapicus ruber	Sphyrapicus	Sphyrapicus ruber (Gmelin, 1788)	Sphyrapicus ruber	DWC_ARCHIVE	12/16/20 12:02	6/30/20 8:20	FALSE	USA	United States	USA.5_1	California	USA.5.42_1	Santa Barbara	1999-1-18	TRUE
263669082	OBS62632136	CC0_1_0	Cornell Lab of Ornithology	CLO	EBIRD	EOD - eBird Observation Dataset	HUMAN_OBSERVATION	URN:catalog:CLO:EBIRD:OBS62632136	OBS62632136	obsr136347	1	PRESENT	1/2/99 0:00	1999	1	2	US	California	Santa Barbara	Devereux Slough	34.4136	-119.876	5231140	Zonotrichia albicollis (J.F.Gmelin, 1789)	Animalia	Chordata	Aves	Passeriformes	Emberizidae	Zonotrichia	albicollis	SPECIES	White-throated Sparrow	ACCEPTED	4fa7b334-ce0d-4e88-aaae-2e0c138d049e	US	12/16/20 11:51	TRUE	FALSE	5231140	5231140	1	44	212	729	9608	6173226	5231140	Zonotrichia albicollis	Zonotrichia	Zonotrichia albicollis (J.F.Gmelin, 1789)	Zonotrichia albicollis	DWC_ARCHIVE	12/16/20 11:51	6/30/20 8:20	FALSE	USA	United States	USA.5_1	California	USA.5.42_1	Santa Barbara	1999-1-2	FALSE
959364607	OBS204340425	CC0_1_0	Cornell Lab of Ornithology	CLO	EBIRD	EOD - eBird Observation Dataset	HUMAN_OBSERVATION	URN:catalog:CLO:EBIRD:OBS204340425	OBS204340425	obsr28253	1	PRESENT	12/31/00 0:00	2000	12	31	US	California	Santa Barbara	Devereux Slough	34.4136	-119.876	6065824	Chroicocephalus ridibundus (Linnaeus, 1766)	Animalia	Chordata	Aves	Charadriiformes	Laridae	Chroicocephalus	ridibundus	SPECIES	Black-headed Gull	ACCEPTED	4fa7b334-ce0d-4e88-aaae-2e0c138d049e	US	12/16/20 11:52	TRUE	FALSE	6065824	6065824	1	44	212	7192402	9316	4848452	6065824	Chroicocephalus ridibundus	Chroicocephalus	Chroicocephalus ridibundus (Linnaeus, 1766)	Chroicocephalus ridibundus	DWC_ARCHIVE	12/16/20 11:52	6/30/20 8:20	FALSE	USA	United States	USA.5_1	California	USA.5.42_1	Santa Barbara	2000-12-31	FALSE
1203305105	OBS298169594	CC0_1_0	Cornell Lab of Ornithology	CLO	EBIRD	EOD - eBird Observation Dataset	HUMAN_OBSERVATION	URN:catalog:CLO:EBIRD:OBS298169594	OBS298169594	obsr51183	1	PRESENT	5/25/00 0:00	2000	5	25	US	California	Santa Barbara	Devereux Slough	34.4136	-119.876	5229687	Tyrannus forficatus (Gmelin, 1789)	Animalia	Chordata	Aves	Passeriformes	Tyrannidae	Tyrannus	forficatus	SPECIES	Scissor-tailed Flycatcher	ACCEPTED	4fa7b334-ce0d-4e88-aaae-2e0c138d049e	US	12/16/20 12:13	TRUE	FALSE	5229687	5229687	1	44	212	729	5291	2483336	5229687	Tyrannus forficatus	Tyrannus	Tyrannus forficatus (Gmelin, 1789)	Tyrannus forficatus	DWC_ARCHIVE	12/16/20 12:13	6/30/20 8:20	FALSE	USA	United States	USA.5_1	California	USA.5.42_1	Santa Barbara	2000-5-25	TRUE
575703504	OBS102410484	CC0_1_0	Cornell Lab of Ornithology	CLO	EBIRD	EOD - eBird Observation Dataset	HUMAN_OBSERVATION	URN:catalog:CLO:EBIRD:OBS102410484	OBS102410484	obsr194146	NA	PRESENT	1/3/03 0:00	2003	1	3	US	California	Santa Barbara	Devereux Slough	34.4136	-119.876	2484445	Agelaius tricolor (Audubon, 1837)	Animalia	Chordata	Aves	Passeriformes	Icteridae	Agelaius	tricolor	SPECIES	Tricolored Blackbird	ACCEPTED	4fa7b334-ce0d-4e88-aaae-2e0c138d049e	US	12/16/20 12:03	TRUE	FALSE	2484445	2484445	1	44	212	729	6176	2484444	2484445	Agelaius tricolor	Agelaius	Agelaius tricolor (Audubon, 1837)	Agelaius tricolor	DWC_ARCHIVE	12/16/20 12:03	6/30/20 8:20	FALSE	USA	United States	USA.5_1	California	USA.5.42_1	Santa Barbara	2003-1-3	FALSE
1185256299	OBS269174749	CC0_1_0	Cornell Lab of Ornithology	CLO	EBIRD	EOD - eBird Observation Dataset	HUMAN_OBSERVATION	URN:catalog:CLO:EBIRD:OBS269174749	OBS269174749	obsr221434	1	PRESENT	4/29/03 0:00	2003	4	29	US	California	Santa Barbara	Coal Oil Point--Devereux Beach and Sands Beach	34.4071	-119.878	2481192	Leucophaeus atricilla (Linnaeus, 1758)	Animalia	Chordata	Aves	Charadriiformes	Laridae	Larus	atricilla	SPECIES	Laughing Gull	SYNONYM	4fa7b334-ce0d-4e88-aaae-2e0c138d049e	US	12/16/20 12:04	TRUE	FALSE	6065844	2481192	1	44	212	7192402	9316	2481126	2481192	Larus atricilla	Leucophaeus	Larus atricilla Linnaeus, 1758	Leucophaeus atricilla	DWC_ARCHIVE	12/16/20 12:04	6/30/20 8:20	FALSE	USA	United States	USA.5_1	California	USA.5.42_1	Santa Barbara	2003-4-29	FALSE
825195269	OBS160811531	CC0_1_0	Cornell Lab of Ornithology	CLO	EBIRD	EOD - eBird Observation Dataset	HUMAN_OBSERVATION	URN:catalog:CLO:EBIRD:OBS160811531	OBS160811531	obsr27003	NA	PRESENT	12/11/04 0:00	2004	12	11	US	California	Santa Barbara	Devereux Slough	34.4136	-119.876	2498345	Cygnus buccinator Richardson, 1831	Animalia	Chordata	Aves	Anseriformes	Anatidae	Cygnus	buccinator	SPECIES	Trumpeter Swan	ACCEPTED	4fa7b334-ce0d-4e88-aaae-2e0c138d049e	US	12/16/20 11:52	TRUE	FALSE	2498345	2498345	1	44	212	1108	2986	2498334	2498345	Cygnus buccinator	Cygnus	Cygnus buccinator Richardson, 1831	Cygnus buccinator	DWC_ARCHIVE	12/16/20 11:52	6/30/20 8:20	FALSE	USA	United States	USA.5_1	California	USA.5.42_1	Santa Barbara	2004-12-11	FALSE
274292597	OBS62738781	CC0_1_0	Cornell Lab of Ornithology	CLO	EBIRD	EOD - eBird Observation Dataset	HUMAN_OBSERVATION	URN:catalog:CLO:EBIRD:OBS62738781	OBS62738781	obsr136347	1	PRESENT	12/4/04 0:00	2004	12	4	US	California	Santa Barbara	Devereux Slough	34.4136	-119.876	2498345	Cygnus buccinator Richardson, 1831	Animalia	Chordata	Aves	Anseriformes	Anatidae	Cygnus	buccinator	SPECIES	Trumpeter Swan	ACCEPTED	4fa7b334-ce0d-4e88-aaae-2e0c138d049e	US	12/16/20 12:02	TRUE	FALSE	2498345	2498345	1	44	212	1108	2986	2498334	2498345	Cygnus buccinator	Cygnus	Cygnus buccinator Richardson, 1831	Cygnus buccinator	DWC_ARCHIVE	12/16/20 12:02	6/30/20 8:20	FALSE	USA	United States	USA.5_1	California	USA.5.42_1	Santa Barbara	2004-12-4	FALSE
274367583	OBS62739362	CC0_1_0	Cornell Lab of Ornithology	CLO	EBIRD	EOD - eBird Observation Dataset	HUMAN_OBSERVATION	URN:catalog:CLO:EBIRD:OBS62739362	OBS62739362	obsr136347	1	PRESENT	12/8/04 0:00	2004	12	8	US	California	Santa Barbara	Devereux Slough	34.4136	-119.876	2498345	Cygnus buccinator Richardson, 1831	Animalia	Chordata	Aves	Anseriformes	Anatidae	Cygnus	buccinator	SPECIES	Trumpeter Swan	ACCEPTED	4fa7b334-ce0d-4e88-aaae-2e0c138d049e	US	12/16/20 12:02	TRUE	FALSE	2498345	2498345	1	44	212	1108	2986	2498334	2498345	Cygnus buccinator	Cygnus	Cygnus buccinator Richardson, 1831	Cygnus buccinator	DWC_ARCHIVE	12/16/20 12:02	6/30/20 8:20	FALSE	USA	United States	USA.5_1	California	USA.5.42_1	Santa Barbara	2004-12-8	FALSE
2142501984	OBS582517287	CC0_1_0	Cornell Lab of Ornithology	CLO	EBIRD	EOD - eBird Observation Dataset	HUMAN_OBSERVATION	URN:catalog:CLO:EBIRD:OBS582517287	OBS582517287	obsr208237	1	PRESENT	12/9/04 0:00	2004	12	9	US	California	Santa Barbara	Devereux Slough	34.4136	-119.876	2498345	Cygnus buccinator Richardson, 1831	Animalia	Chordata	Aves	Anseriformes	Anatidae	Cygnus	buccinator	SPECIES	Trumpeter Swan	ACCEPTED	4fa7b334-ce0d-4e88-aaae-2e0c138d049e	US	12/16/20 12:05	TRUE	FALSE	2498345	2498345	1	44	212	1108	2986	2498334	2498345	Cygnus buccinator	Cygnus	Cygnus buccinator Richardson, 1831	Cygnus buccinator	DWC_ARCHIVE	12/16/20 12:05	6/30/20 8:20	FALSE	USA	United States	USA.5_1	California	USA.5.42_1	Santa Barbara	2004-12-9	FALSE
271257249	OBS62739334	CC0_1_0	Cornell Lab of Ornithology	CLO	EBIRD	EOD - eBird Observation Dataset	HUMAN_OBSERVATION	URN:catalog:CLO:EBIRD:OBS62739334	OBS62739334	obsr136347	1	PRESENT	6/26/04 0:00	2004	6	26	US	California	Santa Barbara	Devereux Slough	34.4136	-119.876	2489985	Setophaga ruticilla (Linnaeus, 1758)	Animalia	Chordata	Aves	Passeriformes	Parulidae	Setophaga	ruticilla	SPECIES	American Redstart	ACCEPTED	4fa7b334-ce0d-4e88-aaae-2e0c138d049e	US	12/16/20 12:00	TRUE	FALSE	2489985	2489985	1	44	212	729	5263	2489984	2489985	Setophaga ruticilla	Setophaga	Setophaga ruticilla (Linnaeus, 1758)	Setophaga ruticilla	DWC_ARCHIVE	12/16/20 12:00	6/30/20 8:20	FALSE	USA	United States	USA.5_1	California	USA.5.42_1	Santa Barbara	2004-6-26	FALSE
133025027	OBS26453558	CC0_1_0	Cornell Lab of Ornithology	CLO	EBIRD	EOD - eBird Observation Dataset	HUMAN_OBSERVATION	URN:catalog:CLO:EBIRD:OBS26453558	OBS26453558	obsr57292	1	PRESENT	10/11/05 0:00	2005	10	11	US	California	Santa Barbara	Devereux Slough	34.4136	-119.876	7341822	Setophaga palmarum (J.F.Gmelin, 1789)	Animalia	Chordata	Aves	Passeriformes	Parulidae	Setophaga	palmarum	SPECIES	Palm Warbler	ACCEPTED	4fa7b334-ce0d-4e88-aaae-2e0c138d049e	US	12/16/20 11:50	TRUE	FALSE	7341822	7341822	1	44	212	729	5263	2489984	7341822	Setophaga palmarum	Setophaga	Setophaga palmarum (J.F.Gmelin, 1789)	Setophaga palmarum	DWC_ARCHIVE	12/16/20 11:50	6/30/20 8:20	FALSE	USA	United States	USA.5_1	California	USA.5.42_1	Santa Barbara	2005-10-11	FALSE
256813885	OBS62739521	CC0_1_0	Cornell Lab of Ornithology	CLO	EBIRD	EOD - eBird Observation Dataset	HUMAN_OBSERVATION	URN:catalog:CLO:EBIRD:OBS62739521	OBS62739521	obsr136347	1	PRESENT	11/3/05 0:00	2005	11	3	US	California	Santa Barbara	Devereux Slough	34.4136	-119.876	2480292	Charadrius montanus J.K.Townsend, 1837	Animalia	Chordata	Aves	Charadriiformes	Charadriidae	Charadrius	montanus	SPECIES	Mountain Plover	ACCEPTED	4fa7b334-ce0d-4e88-aaae-2e0c138d049e	US	12/16/20 11:51	TRUE	FALSE	2480292	2480292	1	44	212	7192402	2480210	2480277	2480292	Charadrius montanus	Charadrius	Charadrius montanus J.K.Townsend, 1837	Charadrius montanus	DWC_ARCHIVE	12/16/20 11:51	6/30/20 8:20	FALSE	USA	United States	USA.5_1	California	USA.5.42_1	Santa Barbara	2005-11-3	FALSE
256798677	OBS62738980	CC0_1_0	Cornell Lab of Ornithology	CLO	EBIRD	EOD - eBird Observation Dataset	HUMAN_OBSERVATION	URN:catalog:CLO:EBIRD:OBS62738980	OBS62738980	obsr136347	1	PRESENT	11/5/05 0:00	2005	11	5	US	California	Santa Barbara	Devereux Slough	34.4136	-119.876	2480292	Charadrius montanus J.K.Townsend, 1837	Animalia	Chordata	Aves	Charadriiformes	Charadriidae	Charadrius	montanus	SPECIES	Mountain Plover	ACCEPTED	4fa7b334-ce0d-4e88-aaae-2e0c138d049e	US	12/16/20 12:01	TRUE	FALSE	2480292	2480292	1	44	212	7192402	2480210	2480277	2480292	Charadrius montanus	Charadrius	Charadrius montanus J.K.Townsend, 1837	Charadrius montanus	DWC_ARCHIVE	12/16/20 12:01	6/30/20 8:20	FALSE	USA	United States	USA.5_1	California	USA.5.42_1	Santa Barbara	2005-11-5	FALSE
278316076	OBS62739547	CC0_1_0	Cornell Lab of Ornithology	CLO	EBIRD	EOD - eBird Observation Dataset	HUMAN_OBSERVATION	URN:catalog:CLO:EBIRD:OBS62739547	OBS62739547	obsr136347	1	PRESENT	5/18/05 0:00	2005	5	18	US	California	Santa Barbara	Devereux Slough	34.4136	-119.876	6093345	Setophaga americana (Linnaeus, 1758)	Animalia	Chordata	Aves	Passeriformes	Parulidae	Setophaga	americana	SPECIES	Northern Parula	ACCEPTED	4fa7b334-ce0d-4e88-aaae-2e0c138d049e	US	12/16/20 11:51	TRUE	FALSE	6093345	6093345	1	44	212	729	5263	2489984	6093345	Setophaga americana	Setophaga	Setophaga americana (Linnaeus, 1758)	Setophaga americana	DWC_ARCHIVE	12/16/20 11:51	6/30/20 8:20	FALSE	USA	United States	USA.5_1	California	USA.5.42_1	Santa Barbara	2005-5-18	FALSE
211162927	OBS62739546	CC0_1_0	Cornell Lab of Ornithology	CLO	EBIRD	EOD - eBird Observation Dataset	HUMAN_OBSERVATION	URN:catalog:CLO:EBIRD:OBS62739546	OBS62739546	obsr136347	1	PRESENT	5/5/05 0:00	2005	5	5	US	California	Santa Barbara	Devereux Slough	34.4136	-119.876	2490821	Catharus ustulatus (Nuttall, 1840)	Animalia	Chordata	Aves	Passeriformes	Turdidae	Catharus	ustulatus	SPECIES	Swainson's Thrush	ACCEPTED	4fa7b334-ce0d-4e88-aaae-2e0c138d049e	US	12/16/20 11:51	TRUE	FALSE	2490821	2490821	1	44	212	729	5290	2490799	2490821	Catharus ustulatus	Catharus	Catharus ustulatus (Nuttall, 1840)	Catharus ustulatus	DWC_ARCHIVE	12/16/20 11:51	6/30/20 8:20	FALSE	USA	United States	USA.5_1	California	USA.5.42_1	Santa Barbara	2005-5-5	FALSE
263713639	OBS62739082	CC0_1_0	Cornell Lab of Ornithology	CLO	EBIRD	EOD - eBird Observation Dataset	HUMAN_OBSERVATION	URN:catalog:CLO:EBIRD:OBS62739082	OBS62739082	obsr136347	1	PRESENT	10/25/06 0:00	2006	10	25	US	California	Santa Barbara	Devereux Slough	34.4136	-119.876	2496459	Geococcyx californianus (Lesson, 1829)	Animalia	Chordata	Aves	Cuculiformes	Cuculidae	Geococcyx	californianus	SPECIES	Greater Roadrunner	ACCEPTED	4fa7b334-ce0d-4e88-aaae-2e0c138d049e	US	12/16/20 11:51	TRUE	FALSE	2496459	2496459	1	44	212	1492	9309	2496458	2496459	Geococcyx californianus	Geococcyx	Geococcyx californianus (Lesson, 1829)	Geococcyx californianus	DWC_ARCHIVE	12/16/20 11:51	6/30/20 8:20	FALSE	USA	United States	USA.5_1	California	USA.5.42_1	Santa Barbara	2006-10-25	FALSE
275312633	OBS62740406	CC0_1_0	Cornell Lab of Ornithology	CLO	EBIRD	EOD - eBird Observation Dataset	HUMAN_OBSERVATION	URN:catalog:CLO:EBIRD:OBS62740406	OBS62740406	obsr136347	6	PRESENT	4/4/06 0:00	2006	4	4	US	California	Santa Barbara	Devereux Slough	34.4136	-119.876	2489129	Progne subis (Linnaeus, 1758)	Animalia	Chordata	Aves	Passeriformes	Hirundinidae	Progne	subis	SPECIES	Purple Martin	ACCEPTED	4fa7b334-ce0d-4e88-aaae-2e0c138d049e	US	12/16/20 11:51	TRUE	FALSE	2489129	2489129	1	44	212	729	5248	2489127	2489129	Progne subis	Progne	Progne subis (Linnaeus, 1758)	Progne subis	DWC_ARCHIVE	12/16/20 11:51	6/30/20 8:20	FALSE	USA	United States	USA.5_1	California	USA.5.42_1	Santa Barbara	2006-4-4	FALSE
829369035	OBS32382234	CC0_1_0	Cornell Lab of Ornithology	CLO	EBIRD	EOD - eBird Observation Dataset	HUMAN_OBSERVATION	URN:catalog:CLO:EBIRD:OBS32382234	OBS32382234	obsr38892	1	PRESENT	4/8/06 0:00	2006	4	8	US	California	Santa Barbara	Coal Oil Point--Devereux Beach and Sands Beach	34.4071	-119.878	2480273	Haematopus palliatus Temminck, 1820	Animalia	Chordata	Aves	Charadriiformes	Haematopodidae	Haematopus	palliatus	SPECIES	American Oystercatcher	ACCEPTED	4fa7b334-ce0d-4e88-aaae-2e0c138d049e	US	12/16/20 11:51	TRUE	FALSE	2480273	2480273	1	44	212	7192402	4287243	2480260	2480273	Haematopus palliatus	Haematopus	Haematopus palliatus Temminck, 1820	Haematopus palliatus	DWC_ARCHIVE	12/16/20 11:51	6/30/20 8:20	FALSE	USA	United States	USA.5_1	California	USA.5.42_1	Santa Barbara	2006-4-8	FALSE
278542082	OBS62739052	CC0_1_0	Cornell Lab of Ornithology	CLO	EBIRD	EOD - eBird Observation Dataset	HUMAN_OBSERVATION	URN:catalog:CLO:EBIRD:OBS62739052	OBS62739052	obsr136347	1	PRESENT	5/18/06 0:00	2006	5	18	US	California	Santa Barbara	Devereux Slough	34.4136	-119.876	6093345	Setophaga americana (Linnaeus, 1758)	Animalia	Chordata	Aves	Passeriformes	Parulidae	Setophaga	americana	SPECIES	Northern Parula	ACCEPTED	4fa7b334-ce0d-4e88-aaae-2e0c138d049e	US	12/16/20 12:02	TRUE	FALSE	6093345	6093345	1	44	212	729	5263	2489984	6093345	Setophaga americana	Setophaga	Setophaga americana (Linnaeus, 1758)	Setophaga americana	DWC_ARCHIVE	12/16/20 12:02	6/30/20 8:20	FALSE	USA	United States	USA.5_1	California	USA.5.42_1	Santa Barbara	2006-5-18	FALSE
278855712	OBS62739555	CC0_1_0	Cornell Lab of Ornithology	CLO	EBIRD	EOD - eBird Observation Dataset	HUMAN_OBSERVATION	URN:catalog:CLO:EBIRD:OBS62739555	OBS62739555	obsr136347	1	PRESENT	5/19/06 0:00	2006	5	19	US	California	Santa Barbara	Devereux Slough	34.4136	-119.876	6093345	Setophaga americana (Linnaeus, 1758)	Animalia	Chordata	Aves	Passeriformes	Parulidae	Setophaga	americana	SPECIES	Northern Parula	ACCEPTED	4fa7b334-ce0d-4e88-aaae-2e0c138d049e	US	12/16/20 12:00	TRUE	FALSE	6093345	6093345	1	44	212	729	5263	2489984	6093345	Setophaga americana	Setophaga	Setophaga americana (Linnaeus, 1758)	Setophaga americana	DWC_ARCHIVE	12/16/20 12:00	6/30/20 8:20	FALSE	USA	United States	USA.5_1	California	USA.5.42_1	Santa Barbara	2006-5-19	FALSE
255750914	OBS62740435	CC0_1_0	Cornell Lab of Ornithology	CLO	EBIRD	EOD - eBird Observation Dataset	HUMAN_OBSERVATION	URN:catalog:CLO:EBIRD:OBS62740435	OBS62740435	obsr136347	1	PRESENT	5/4/06 0:00	2006	5	4	US	California	Santa Barbara	Devereux Slough	34.4136	-119.876	7341822	Setophaga palmarum (J.F.Gmelin, 1789)	Animalia	Chordata	Aves	Passeriformes	Parulidae	Setophaga	palmarum	SPECIES	Palm Warbler	ACCEPTED	4fa7b334-ce0d-4e88-aaae-2e0c138d049e	US	12/16/20 11:52	TRUE	FALSE	7341822	7341822	1	44	212	729	5263	2489984	7341822	Setophaga palmarum	Setophaga	Setophaga palmarum (J.F.Gmelin, 1789)	Setophaga palmarum	DWC_ARCHIVE	12/16/20 11:52	6/30/20 8:20	FALSE	USA	United States	USA.5_1	California	USA.5.42_1	Santa Barbara	2006-5-4	FALSE
1406166649	OBS368624446	CC0_1_0	Cornell Lab of Ornithology	CLO	EBIRD	EOD - eBird Observation Dataset	HUMAN_OBSERVATION	URN:catalog:CLO:EBIRD:OBS368624446	OBS368624446	obsr302151	1	PRESENT	9/7/06 0:00	2006	9	7	US	California	Santa Barbara	Devereux Slough	34.4136	-119.876	2483647	Pyrocephalus rubinus (Boddaert, 1783)	Animalia	Chordata	Aves	Passeriformes	Tyrannidae	Pyrocephalus	rubinus	SPECIES	Vermilion Flycatcher	ACCEPTED	4fa7b334-ce0d-4e88-aaae-2e0c138d049e	US	12/16/20 12:04	TRUE	FALSE	2483647	2483647	1	44	212	729	5291	2483646	2483647	Pyrocephalus rubinus	Pyrocephalus	Pyrocephalus rubinus (Boddaert, 1783)	Pyrocephalus rubinus	DWC_ARCHIVE	12/16/20 12:04	6/30/20 8:20	FALSE	USA	United States	USA.5_1	California	USA.5.42_1	Santa Barbara	2006-9-7	TRUE
271613795	OBS62739754	CC0_1_0	Cornell Lab of Ornithology	CLO	EBIRD	EOD - eBird Observation Dataset	HUMAN_OBSERVATION	URN:catalog:CLO:EBIRD:OBS62739754	OBS62739754	obsr136347	1	PRESENT	10/23/07 0:00	2007	10	23	US	California	Santa Barbara	Devereux Slough	34.4136	-119.876	2491728	Pooecetes gramineus (J.F.Gmelin, 1789)	Animalia	Chordata	Aves	Passeriformes	Emberizidae	Pooecetes	gramineus	SPECIES	Vesper Sparrow	ACCEPTED	4fa7b334-ce0d-4e88-aaae-2e0c138d049e	US	12/16/20 11:51	TRUE	FALSE	2491728	2491728	1	44	212	729	9608	2491727	2491728	Pooecetes gramineus	Pooecetes	Pooecetes gramineus (J.F.Gmelin, 1789)	Pooecetes gramineus	DWC_ARCHIVE	12/16/20 11:51	6/30/20 8:20	FALSE	USA	United States	USA.5_1	California	USA.5.42_1	Santa Barbara	2007-10-23	FALSE
271611646	OBS62740167	CC0_1_0	Cornell Lab of Ornithology	CLO	EBIRD	EOD - eBird Observation Dataset	HUMAN_OBSERVATION	URN:catalog:CLO:EBIRD:OBS62740167	OBS62740167	obsr136347	1	PRESENT	4/22/07 0:00	2007	4	22	US	California	Santa Barbara	Devereux Slough	34.4136	-119.876	2489129	Progne subis (Linnaeus, 1758)	Animalia	Chordata	Aves	Passeriformes	Hirundinidae	Progne	subis	SPECIES	Purple Martin	ACCEPTED	4fa7b334-ce0d-4e88-aaae-2e0c138d049e	US	12/16/20 12:00	TRUE	FALSE	2489129	2489129	1	44	212	729	5248	2489127	2489129	Progne subis	Progne	Progne subis (Linnaeus, 1758)	Progne subis	DWC_ARCHIVE	12/16/20 12:00	6/30/20 8:20	FALSE	USA	United States	USA.5_1	California	USA.5.42_1	Santa Barbara	2007-4-22	FALSE
261057174	OBS62739669	CC0_1_0	Cornell Lab of Ornithology	CLO	EBIRD	EOD - eBird Observation Dataset	HUMAN_OBSERVATION	URN:catalog:CLO:EBIRD:OBS62739669	OBS62739669	obsr136347	2	PRESENT	5/1/07 0:00	2007	5	1	US	California	Santa Barbara	Devereux Slough	34.4136	-119.876	7597244	Selasphorus calliope	Animalia	Chordata	Aves	Apodiformes	Trochilidae	Selasphorus	calliope	SPECIES	Calliope Hummingbird	ACCEPTED	4fa7b334-ce0d-4e88-aaae-2e0c138d049e	US	12/16/20 12:00	TRUE	FALSE	7597244	7597244	1	44	212	1448	5289	2476843	7597244	Selasphorus calliope	Selasphorus	Selasphorus calliope	Selasphorus calliope	DWC_ARCHIVE	12/16/20 12:00	6/30/20 8:20	FALSE	USA	United States	USA.5_1	California	USA.5.42_1	Santa Barbara	2007-5-1	FALSE
139263732	OBS41339841	CC0_1_0	Cornell Lab of Ornithology	CLO	EBIRD	EOD - eBird Observation Dataset	HUMAN_OBSERVATION	URN:catalog:CLO:EBIRD:OBS41339841	OBS41339841	obsr106931	1	PRESENT	5/13/07 0:00	2007	5	13	US	California	Santa Barbara	Devereux Slough	34.4136	-119.876	7597244	Selasphorus calliope	Animalia	Chordata	Aves	Apodiformes	Trochilidae	Selasphorus	calliope	SPECIES	Calliope Hummingbird	ACCEPTED	4fa7b334-ce0d-4e88-aaae-2e0c138d049e	US	12/16/20 12:01	TRUE	FALSE	7597244	7597244	1	44	212	1448	5289	2476843	7597244	Selasphorus calliope	Selasphorus	Selasphorus calliope	Selasphorus calliope	DWC_ARCHIVE	12/16/20 12:01	6/30/20 8:20	FALSE	USA	United States	USA.5_1	California	USA.5.42_1	Santa Barbara	2007-5-13	FALSE
258730766	OBS62740176	CC0_1_0	Cornell Lab of Ornithology	CLO	EBIRD	EOD - eBird Observation Dataset	HUMAN_OBSERVATION	URN:catalog:CLO:EBIRD:OBS62740176	OBS62740176	obsr136347	1	PRESENT	5/14/07 0:00	2007	5	14	US	California	Santa Barbara	Devereux Slough	34.4136	-119.876	7597244	Selasphorus calliope	Animalia	Chordata	Aves	Apodiformes	Trochilidae	Selasphorus	calliope	SPECIES	Calliope Hummingbird	ACCEPTED	4fa7b334-ce0d-4e88-aaae-2e0c138d049e	US	12/16/20 12:01	TRUE	FALSE	7597244	7597244	1	44	212	1448	5289	2476843	7597244	Selasphorus calliope	Selasphorus	Selasphorus calliope	Selasphorus calliope	DWC_ARCHIVE	12/16/20 12:01	6/30/20 8:20	FALSE	USA	United States	USA.5_1	California	USA.5.42_1	Santa Barbara	2007-5-14	FALSE
1405748322	OBS367343604	CC0_1_0	Cornell Lab of Ornithology	CLO	EBIRD	EOD - eBird Observation Dataset	HUMAN_OBSERVATION	URN:catalog:CLO:EBIRD:OBS367343604	OBS367343604	obsr302151	1	PRESENT	8/17/07 0:00	2007	8	17	US	California	Santa Barbara	Devereux Slough	34.4136	-119.876	2481119	Chlidonias niger (Linnaeus, 1758)	Animalia	Chordata	Aves	Charadriiformes	Laridae	Chlidonias	niger	SPECIES	Black Tern	ACCEPTED	4fa7b334-ce0d-4e88-aaae-2e0c138d049e	US	12/16/20 12:04	TRUE	FALSE	2481119	2481119	1	44	212	7192402	9316	2481118	2481119	Chlidonias niger	Chlidonias	Chlidonias niger (Linnaeus, 1758)	Chlidonias niger	DWC_ARCHIVE	12/16/20 12:04	6/30/20 8:20	FALSE	USA	United States	USA.5_1	California	USA.5.42_1	Santa Barbara	2007-8-17	TRUE
1392876920	OBS348727793	CC0_1_0	Cornell Lab of Ornithology	CLO	EBIRD	EOD - eBird Observation Dataset	HUMAN_OBSERVATION	URN:catalog:CLO:EBIRD:OBS348727793	OBS348727793	obsr51183	1	PRESENT	8/17/07 0:00	2007	8	17	US	California	Santa Barbara	Devereux Slough	34.4136	-119.876	2481119	Chlidonias niger (Linnaeus, 1758)	Animalia	Chordata	Aves	Charadriiformes	Laridae	Chlidonias	niger	SPECIES	Black Tern	ACCEPTED	4fa7b334-ce0d-4e88-aaae-2e0c138d049e	US	12/16/20 12:03	TRUE	FALSE	2481119	2481119	1	44	212	7192402	9316	2481118	2481119	Chlidonias niger	Chlidonias	Chlidonias niger (Linnaeus, 1758)	Chlidonias niger	DWC_ARCHIVE	12/16/20 12:03	6/30/20 8:20	FALSE	USA	United States	USA.5_1	California	USA.5.42_1	Santa Barbara	2007-8-17	TRUE
256044368	OBS82647122	CC0_1_0	Cornell Lab of Ornithology	CLO	EBIRD	EOD - eBird Observation Dataset	HUMAN_OBSERVATION	URN:catalog:CLO:EBIRD:OBS82647122	OBS82647122	obsr57292	1	PRESENT	8/30/07 0:00	2007	8	30	US	California	Santa Barbara	Devereux Slough	34.4136	-119.876	2481119	Chlidonias niger (Linnaeus, 1758)	Animalia	Chordata	Aves	Charadriiformes	Laridae	Chlidonias	niger	SPECIES	Black Tern	ACCEPTED	4fa7b334-ce0d-4e88-aaae-2e0c138d049e	US	12/16/20 12:04	TRUE	FALSE	2481119	2481119	1	44	212	7192402	9316	2481118	2481119	Chlidonias niger	Chlidonias	Chlidonias niger (Linnaeus, 1758)	Chlidonias niger	DWC_ARCHIVE	12/16/20 12:04	6/30/20 8:20	FALSE	USA	United States	USA.5_1	California	USA.5.42_1	Santa Barbara	2007-8-30	FALSE
276141798	OBS82647129	CC0_1_0	Cornell Lab of Ornithology	CLO	EBIRD	EOD - eBird Observation Dataset	HUMAN_OBSERVATION	URN:catalog:CLO:EBIRD:OBS82647129	OBS82647129	obsr57292	3	PRESENT	8/30/07 0:00	2007	8	30	US	California	Santa Barbara	Devereux Slough	34.4136	-119.876	2489129	Progne subis (Linnaeus, 1758)	Animalia	Chordata	Aves	Passeriformes	Hirundinidae	Progne	subis	SPECIES	Purple Martin	ACCEPTED	4fa7b334-ce0d-4e88-aaae-2e0c138d049e	US	12/16/20 12:03	TRUE	FALSE	2489129	2489129	1	44	212	729	5248	2489127	2489129	Progne subis	Progne	Progne subis (Linnaeus, 1758)	Progne subis	DWC_ARCHIVE	12/16/20 12:03	6/30/20 8:20	FALSE	USA	United States	USA.5_1	California	USA.5.42_1	Santa Barbara	2007-8-30	FALSE
1405751176	OBS367351943	CC0_1_0	Cornell Lab of Ornithology	CLO	EBIRD	EOD - eBird Observation Dataset	HUMAN_OBSERVATION	URN:catalog:CLO:EBIRD:OBS367351943	OBS367351943	obsr302151	1	PRESENT	8/30/07 0:00	2007	8	30	US	California	Santa Barbara	Devereux Slough	34.4136	-119.876	2481119	Chlidonias niger (Linnaeus, 1758)	Animalia	Chordata	Aves	Charadriiformes	Laridae	Chlidonias	niger	SPECIES	Black Tern	ACCEPTED	4fa7b334-ce0d-4e88-aaae-2e0c138d049e	US	12/16/20 12:03	TRUE	FALSE	2481119	2481119	1	44	212	7192402	9316	2481118	2481119	Chlidonias niger	Chlidonias	Chlidonias niger (Linnaeus, 1758)	Chlidonias niger	DWC_ARCHIVE	12/16/20 12:03	6/30/20 8:20	FALSE	USA	United States	USA.5_1	California	USA.5.42_1	Santa Barbara	2007-8-30	TRUE
1405741492	OBS367352629	CC0_1_0	Cornell Lab of Ornithology	CLO	EBIRD	EOD - eBird Observation Dataset	HUMAN_OBSERVATION	URN:catalog:CLO:EBIRD:OBS367352629	OBS367352629	obsr302151	1	PRESENT	8/31/07 0:00	2007	8	31	US	California	Santa Barbara	Devereux Slough	34.4136	-119.876	2481119	Chlidonias niger (Linnaeus, 1758)	Animalia	Chordata	Aves	Charadriiformes	Laridae	Chlidonias	niger	SPECIES	Black Tern	ACCEPTED	4fa7b334-ce0d-4e88-aaae-2e0c138d049e	US	12/16/20 11:54	TRUE	FALSE	2481119	2481119	1	44	212	7192402	9316	2481118	2481119	Chlidonias niger	Chlidonias	Chlidonias niger (Linnaeus, 1758)	Chlidonias niger	DWC_ARCHIVE	12/16/20 11:54	6/30/20 8:20	FALSE	USA	United States	USA.5_1	California	USA.5.42_1	Santa Barbara	2007-8-31	TRUE
256426679	OBS62739160	CC0_1_0	Cornell Lab of Ornithology	CLO	EBIRD	EOD - eBird Observation Dataset	HUMAN_OBSERVATION	URN:catalog:CLO:EBIRD:OBS62739160	OBS62739160	obsr136347	1	PRESENT	8/4/07 0:00	2007	8	4	US	California	Santa Barbara	Devereux Slough	34.4136	-119.876	2487441	Vireo bellii Audubon, 1844	Animalia	Chordata	Aves	Passeriformes	Vireonidae	Vireo	bellii	SPECIES	Bell's Vireo	ACCEPTED	4fa7b334-ce0d-4e88-aaae-2e0c138d049e	US	12/16/20 12:02	TRUE	FALSE	2487441	2487441	1	44	212	729	9358	2487406	2487441	Vireo bellii	Vireo	Vireo bellii Audubon, 1844	Vireo bellii	DWC_ARCHIVE	12/16/20 12:02	6/30/20 8:20	FALSE	USA	United States	USA.5_1	California	USA.5.42_1	Santa Barbara	2007-8-4	FALSE
1405736287	OBS367334715	CC0_1_0	Cornell Lab of Ornithology	CLO	EBIRD	EOD - eBird Observation Dataset	HUMAN_OBSERVATION	URN:catalog:CLO:EBIRD:OBS367334715	OBS367334715	obsr302151	1	PRESENT	8/4/07 0:00	2007	8	4	US	California	Santa Barbara	Devereux Slough	34.4136	-119.876	2487441	Vireo bellii Audubon, 1844	Animalia	Chordata	Aves	Passeriformes	Vireonidae	Vireo	bellii	SPECIES	Bell's Vireo	ACCEPTED	4fa7b334-ce0d-4e88-aaae-2e0c138d049e	US	12/16/20 11:54	TRUE	FALSE	2487441	2487441	1	44	212	729	9358	2487406	2487441	Vireo bellii	Vireo	Vireo bellii Audubon, 1844	Vireo bellii	DWC_ARCHIVE	12/16/20 11:54	6/30/20 8:20	FALSE	USA	United States	USA.5_1	California	USA.5.42_1	Santa Barbara	2007-8-4	TRUE
256469749	OBS62739171	CC0_1_0	Cornell Lab of Ornithology	CLO	EBIRD	EOD - eBird Observation Dataset	HUMAN_OBSERVATION	URN:catalog:CLO:EBIRD:OBS62739171	OBS62739171	obsr136347	1	PRESENT	8/5/07 0:00	2007	8	5	US	California	Santa Barbara	Devereux Slough	34.4136	-119.876	2487441	Vireo bellii Audubon, 1844	Animalia	Chordata	Aves	Passeriformes	Vireonidae	Vireo	bellii	SPECIES	Bell's Vireo	ACCEPTED	4fa7b334-ce0d-4e88-aaae-2e0c138d049e	US	12/16/20 12:02	TRUE	FALSE	2487441	2487441	1	44	212	729	9358	2487406	2487441	Vireo bellii	Vireo	Vireo bellii Audubon, 1844	Vireo bellii	DWC_ARCHIVE	12/16/20 12:02	6/30/20 8:20	FALSE	USA	United States	USA.5_1	California	USA.5.42_1	Santa Barbara	2007-8-5	FALSE
2786796750	OBS796912201	CC0_1_0	Cornell Lab of Ornithology	CLO	EBIRD	EOD - eBird Observation Dataset	HUMAN_OBSERVATION	URN:catalog:CLO:EBIRD:OBS796912201	OBS796912201	obsr208237	1	PRESENT	8/5/07 0:00	2007	8	5	US	California	Santa Barbara	Devereux Slough	34.4136	-119.876	2487441	Vireo bellii Audubon, 1844	Animalia	Chordata	Aves	Passeriformes	Vireonidae	Vireo	bellii	SPECIES	Bell's Vireo	ACCEPTED	4fa7b334-ce0d-4e88-aaae-2e0c138d049e	US	12/16/20 12:10	TRUE	FALSE	2487441	2487441	1	44	212	729	9358	2487406	2487441	Vireo bellii	Vireo	Vireo bellii Audubon, 1844	Vireo bellii	DWC_ARCHIVE	12/16/20 12:10	6/30/20 8:20	FALSE	USA	United States	USA.5_1	California	USA.5.42_1	Santa Barbara	2007-8-5	FALSE
1204072884	OBS301594362	CC0_1_0	Cornell Lab of Ornithology	CLO	EBIRD	EOD - eBird Observation Dataset	HUMAN_OBSERVATION	URN:catalog:CLO:EBIRD:OBS301594362	OBS301594362	obsr51183	1	PRESENT	8/7/07 0:00	2007	8	7	US	California	Santa Barbara	Devereux Slough	34.4136	-119.876	7341770	Setophaga nigrescens (J.K.Townsend, 1837)	Animalia	Chordata	Aves	Passeriformes	Parulidae	Setophaga	nigrescens	SPECIES	Black-throated Gray Warbler	ACCEPTED	4fa7b334-ce0d-4e88-aaae-2e0c138d049e	US	12/16/20 11:53	TRUE	FALSE	7341770	7341770	1	44	212	729	5263	2489984	7341770	Setophaga nigrescens	Setophaga	Setophaga nigrescens (J.K.Townsend, 1837)	Setophaga nigrescens	DWC_ARCHIVE	12/16/20 11:53	6/30/20 8:20	FALSE	USA	United States	USA.5_1	California	USA.5.42_1	Santa Barbara	2007-8-7	TRUE
260586814	OBS62739266	CC0_1_0	Cornell Lab of Ornithology	CLO	EBIRD	EOD - eBird Observation Dataset	HUMAN_OBSERVATION	URN:catalog:CLO:EBIRD:OBS62739266	OBS62739266	obsr136347	1	PRESENT	9/19/07 0:00	2007	9	19	US	California	Santa Barbara	Devereux Slough	34.4136	-119.876	2482786	Empidonax traillii (Audubon, 1828)	Animalia	Chordata	Aves	Passeriformes	Tyrannidae	Empidonax	traillii	SPECIES	Willow Flycatcher	ACCEPTED	4fa7b334-ce0d-4e88-aaae-2e0c138d049e	US	12/16/20 12:01	TRUE	FALSE	2482786	2482786	1	44	212	729	5291	2482766	2482786	Empidonax traillii	Empidonax	Empidonax traillii (Audubon, 1828)	Empidonax traillii	DWC_ARCHIVE	12/16/20 12:01	6/30/20 8:20	FALSE	USA	United States	USA.5_1	California	USA.5.42_1	Santa Barbara	2007-9-19	FALSE
274684434	OBS62740299	CC0_1_0	Cornell Lab of Ornithology	CLO	EBIRD	EOD - eBird Observation Dataset	HUMAN_OBSERVATION	URN:catalog:CLO:EBIRD:OBS62740299	OBS62740299	obsr136347	3	PRESENT	9/2/07 0:00	2007	9	2	US	California	Santa Barbara	Devereux Slough	34.4136	-119.876	2489129	Progne subis (Linnaeus, 1758)	Animalia	Chordata	Aves	Passeriformes	Hirundinidae	Progne	subis	SPECIES	Purple Martin	ACCEPTED	4fa7b334-ce0d-4e88-aaae-2e0c138d049e	US	12/16/20 12:01	TRUE	FALSE	2489129	2489129	1	44	212	729	5248	2489127	2489129	Progne subis	Progne	Progne subis (Linnaeus, 1758)	Progne subis	DWC_ARCHIVE	12/16/20 12:01	6/30/20 8:20	FALSE	USA	United States	USA.5_1	California	USA.5.42_1	Santa Barbara	2007-9-2	FALSE
133415153	OBS43375328	CC0_1_0	Cornell Lab of Ornithology	CLO	EBIRD	EOD - eBird Observation Dataset	HUMAN_OBSERVATION	URN:catalog:CLO:EBIRD:OBS43375328	OBS43375328	obsr88587	NA	PRESENT	9/22/07 0:00	2007	9	22	US	California	Santa Barbara	Devereux Slough	34.4136	-119.876	2482786	Empidonax traillii (Audubon, 1828)	Animalia	Chordata	Aves	Passeriformes	Tyrannidae	Empidonax	traillii	SPECIES	Willow Flycatcher	ACCEPTED	4fa7b334-ce0d-4e88-aaae-2e0c138d049e	US	12/16/20 12:01	TRUE	FALSE	2482786	2482786	1	44	212	729	5291	2482766	2482786	Empidonax traillii	Empidonax	Empidonax traillii (Audubon, 1828)	Empidonax traillii	DWC_ARCHIVE	12/16/20 12:01	6/30/20 8:20	FALSE	USA	United States	USA.5_1	California	USA.5.42_1	Santa Barbara	2007-9-22	FALSE
599603970	OBS99010433	CC0_1_0	Cornell Lab of Ornithology	CLO	EBIRD	EOD - eBird Observation Dataset	HUMAN_OBSERVATION	URN:catalog:CLO:EBIRD:OBS99010433	OBS99010433	obsr57194	1	PRESENT	8/25/08 0:00	2008	8	25	US	California	Santa Barbara	Devereux Slough	34.4136	-119.876	9367409	Sterna hirundo Linnaeus, 1758	Animalia	Chordata	Aves	Charadriiformes	Laridae	Sterna	hirundo	SPECIES	Common Tern	ACCEPTED	4fa7b334-ce0d-4e88-aaae-2e0c138d049e	US	12/16/20 12:12	TRUE	FALSE	9367409	9367409	1	44	212	7192402	9316	2481227	9367409	Sterna hirundo	Sterna	Sterna hirundo Linnaeus, 1758	Sterna hirundo	DWC_ARCHIVE	12/16/20 12:12	6/30/20 8:20	FALSE	USA	United States	USA.5_1	California	USA.5.42_1	Santa Barbara	2008-8-25	FALSE
198980783	OBS58423887	CC0_1_0	Cornell Lab of Ornithology	CLO	EBIRD	EOD - eBird Observation Dataset	HUMAN_OBSERVATION	URN:catalog:CLO:EBIRD:OBS58423887	OBS58423887	obsr57292	1	PRESENT	8/31/08 0:00	2008	8	31	US	California	Santa Barbara	Devereux Slough	34.4136	-119.876	5229400	Calidris himantopus (Bonaparte, 1826)	Animalia	Chordata	Aves	Charadriiformes	Scolopacidae	Calidris	himantopus	SPECIES	Stilt Sandpiper	ACCEPTED	4fa7b334-ce0d-4e88-aaae-2e0c138d049e	US	12/16/20 12:02	TRUE	FALSE	5229400	5229400	1	44	212	7192402	5282	2481739	5229400	Calidris himantopus	Calidris	Calidris himantopus (Bonaparte, 1826)	Calidris himantopus	DWC_ARCHIVE	12/16/20 12:02	6/30/20 8:20	FALSE	USA	United States	USA.5_1	California	USA.5.42_1	Santa Barbara	2008-8-31	FALSE
948203501	OBS191864480	CC0_1_0	Cornell Lab of Ornithology	CLO	EBIRD	EOD - eBird Observation Dataset	HUMAN_OBSERVATION	URN:catalog:CLO:EBIRD:OBS191864480	OBS191864480	obsr51183	1	PRESENT	8/31/08 0:00	2008	8	31	US	California	Santa Barbara	Devereux Slough	34.4136	-119.876	5229400	Calidris himantopus (Bonaparte, 1826)	Animalia	Chordata	Aves	Charadriiformes	Scolopacidae	Calidris	himantopus	SPECIES	Stilt Sandpiper	ACCEPTED	4fa7b334-ce0d-4e88-aaae-2e0c138d049e	US	12/16/20 12:01	TRUE	FALSE	5229400	5229400	1	44	212	7192402	5282	2481739	5229400	Calidris himantopus	Calidris	Calidris himantopus (Bonaparte, 1826)	Calidris himantopus	DWC_ARCHIVE	12/16/20 12:01	6/30/20 8:20	FALSE	USA	United States	USA.5_1	California	USA.5.42_1	Santa Barbara	2008-8-31	TRUE
274915908	OBS62740027	CC0_1_0	Cornell Lab of Ornithology	CLO	EBIRD	EOD - eBird Observation Dataset	HUMAN_OBSERVATION	URN:catalog:CLO:EBIRD:OBS62740027	OBS62740027	obsr136347	1	PRESENT	9/9/08 0:00	2008	9	9	US	California	Santa Barbara	Devereux Slough	34.4136	-119.876	2489129	Progne subis (Linnaeus, 1758)	Animalia	Chordata	Aves	Passeriformes	Hirundinidae	Progne	subis	SPECIES	Purple Martin	ACCEPTED	4fa7b334-ce0d-4e88-aaae-2e0c138d049e	US	12/16/20 12:00	TRUE	FALSE	2489129	2489129	1	44	212	729	5248	2489127	2489129	Progne subis	Progne	Progne subis (Linnaeus, 1758)	Progne subis	DWC_ARCHIVE	12/16/20 12:00	6/30/20 8:20	FALSE	USA	United States	USA.5_1	California	USA.5.42_1	Santa Barbara	2008-9-9	FALSE
891096652	121304	CC_BY_NC_4_0	iNaturalist.org	iNaturalist	Observations	iNaturalist Research-grade Observations	HUMAN_OBSERVATION	http://www.inaturalist.org/observations/121304	121304	Lynn Watson, Santa Barbara	NA	PRESENT	5/3/09 9:22	2009	5	3	US	California	NA	NA	34.406836	-119.87851	2480272	Haematopus bachmani Audubon, 1838	Animalia	Chordata	Aves	Charadriiformes	Haematopodidae	Haematopus	bachmani	SPECIES	NA	ACCEPTED	50c9509d-22c7-4a22-a47d-8c48425ef4a7	US	2/21/21 4:31	TRUE	FALSE	2480272	2480272	1	44	212	7192402	4287243	2480260	2480272	Haematopus bachmani	Haematopus	Haematopus bachmani Audubon, 1838	Haematopus bachmani	DWC_ARCHIVE	2/21/21 4:31	2/21/21 2:33	FALSE	USA	United States	USA.5_1	California	USA.5.42_1	Santa Barbara	2009-5-3	FALSE
267062061	OBS69404960	CC0_1_0	Cornell Lab of Ornithology	CLO	EBIRD	EOD - eBird Observation Dataset	HUMAN_OBSERVATION	URN:catalog:CLO:EBIRD:OBS69404960	OBS69404960	obsr177191	2	PRESENT	5/3/09 0:00	2009	5	3	US	California	Santa Barbara	Devereux Slough	34.4136	-119.876	2480272	Haematopus bachmani Audubon, 1838	Animalia	Chordata	Aves	Charadriiformes	Haematopodidae	Haematopus	bachmani	SPECIES	Black Oystercatcher	ACCEPTED	4fa7b334-ce0d-4e88-aaae-2e0c138d049e	US	12/16/20 11:51	TRUE	FALSE	2480272	2480272	1	44	212	7192402	4287243	2480260	2480272	Haematopus bachmani	Haematopus	Haematopus bachmani Audubon, 1838	Haematopus bachmani	DWC_ARCHIVE	12/16/20 11:51	6/30/20 8:20	FALSE	USA	United States	USA.5_1	California	USA.5.42_1	Santa Barbara	2009-5-3	FALSE
257946090	OBS80978045	CC0_1_0	Cornell Lab of Ornithology	CLO	EBIRD	EOD - eBird Observation Dataset	HUMAN_OBSERVATION	URN:catalog:CLO:EBIRD:OBS80978045	OBS80978045	obsr136347	1	PRESENT	8/29/09 0:00	2009	8	29	US	California	Santa Barbara	Devereux Slough	34.4136	-119.876	5229400	Calidris himantopus (Bonaparte, 1826)	Animalia	Chordata	Aves	Charadriiformes	Scolopacidae	Calidris	himantopus	SPECIES	Stilt Sandpiper	ACCEPTED	4fa7b334-ce0d-4e88-aaae-2e0c138d049e	US	12/16/20 12:00	TRUE	FALSE	5229400	5229400	1	44	212	7192402	5282	2481739	5229400	Calidris himantopus	Calidris	Calidris himantopus (Bonaparte, 1826)	Calidris himantopus	DWC_ARCHIVE	12/16/20 12:00	6/30/20 8:20	FALSE	USA	United States	USA.5_1	California	USA.5.42_1	Santa Barbara	2009-8-29	FALSE
261025154	OBS80978057	CC0_1_0	Cornell Lab of Ornithology	CLO	EBIRD	EOD - eBird Observation Dataset	HUMAN_OBSERVATION	URN:catalog:CLO:EBIRD:OBS80978057	OBS80978057	obsr136347	1	PRESENT	8/30/09 0:00	2009	8	30	US	California	Santa Barbara	Devereux Slough	34.4136	-119.876	5229400	Calidris himantopus (Bonaparte, 1826)	Animalia	Chordata	Aves	Charadriiformes	Scolopacidae	Calidris	himantopus	SPECIES	Stilt Sandpiper	ACCEPTED	4fa7b334-ce0d-4e88-aaae-2e0c138d049e	US	12/16/20 12:01	TRUE	FALSE	5229400	5229400	1	44	212	7192402	5282	2481739	5229400	Calidris himantopus	Calidris	Calidris himantopus (Bonaparte, 1826)	Calidris himantopus	DWC_ARCHIVE	12/16/20 12:01	6/30/20 8:20	FALSE	USA	United States	USA.5_1	California	USA.5.42_1	Santa Barbara	2009-8-30	FALSE
1412035428	OBS74385785	CC0_1_0	Cornell Lab of Ornithology	CLO	EBIRD	EOD - eBird Observation Dataset	HUMAN_OBSERVATION	URN:catalog:CLO:EBIRD:OBS74385785	OBS74385785	obsr38892	1	PRESENT	8/30/09 0:00	2009	8	30	US	California	Santa Barbara	Santa Barbara/Devereaux Slough	34.4144	-119.876	5229400	Calidris himantopus (Bonaparte, 1826)	Animalia	Chordata	Aves	Charadriiformes	Scolopacidae	Calidris	himantopus	SPECIES	Stilt Sandpiper	ACCEPTED	4fa7b334-ce0d-4e88-aaae-2e0c138d049e	US	12/16/20 11:52	TRUE	FALSE	5229400	5229400	1	44	212	7192402	5282	2481739	5229400	Calidris himantopus	Calidris	Calidris himantopus (Bonaparte, 1826)	Calidris himantopus	DWC_ARCHIVE	12/16/20 11:52	6/30/20 8:20	FALSE	USA	United States	USA.5_1	California	USA.5.42_1	Santa Barbara	2009-8-30	FALSE
1409935942	OBS388766185	CC0_1_0	Cornell Lab of Ornithology	CLO	EBIRD	EOD - eBird Observation Dataset	HUMAN_OBSERVATION	URN:catalog:CLO:EBIRD:OBS388766185	OBS388766185	obsr741029	NA	PRESENT	2/16/10 0:00	2010	2	16	US	California	Santa Barbara	Coal Oil Point--Devereux Beach and Sands Beach	34.4071	-119.878	2496459	Geococcyx californianus (Lesson, 1829)	Animalia	Chordata	Aves	Cuculiformes	Cuculidae	Geococcyx	californianus	SPECIES	Greater Roadrunner	ACCEPTED	4fa7b334-ce0d-4e88-aaae-2e0c138d049e	US	12/16/20 12:03	TRUE	FALSE	2496459	2496459	1	44	212	1492	9309	2496458	2496459	Geococcyx californianus	Geococcyx	Geococcyx californianus (Lesson, 1829)	Geococcyx californianus	DWC_ARCHIVE	12/16/20 12:03	6/30/20 8:20	FALSE	USA	United States	USA.5_1	California	USA.5.42_1	Santa Barbara	2010-2-16	FALSE
584849043	OBS95791152	CC0_1_0	Cornell Lab of Ornithology	CLO	EBIRD	EOD - eBird Observation Dataset	HUMAN_OBSERVATION	URN:catalog:CLO:EBIRD:OBS95791152	OBS95791152	obsr169091	1	PRESENT	7/27/10 0:00	2010	7	27	US	California	Santa Barbara	Devereux Slough	34.4136	-119.876	2480888	Egretta rufescens (Gmelin, 1789)	Animalia	Chordata	Aves	Pelecaniformes	Ardeidae	Egretta	rufescens	SPECIES	Reddish Egret	ACCEPTED	4fa7b334-ce0d-4e88-aaae-2e0c138d049e	US	12/16/20 11:51	TRUE	FALSE	2480888	2480888	1	44	212	7190953	3685	2480872	2480888	Egretta rufescens	Egretta	Egretta rufescens (Gmelin, 1789)	Egretta rufescens	DWC_ARCHIVE	12/16/20 11:51	6/30/20 8:20	FALSE	USA	United States	USA.5_1	California	USA.5.42_1	Santa Barbara	2010-7-27	FALSE
1775558979	OBS445503408	CC0_1_0	Cornell Lab of Ornithology	CLO	EBIRD	EOD - eBird Observation Dataset	HUMAN_OBSERVATION	URN:catalog:CLO:EBIRD:OBS445503408	OBS445503408	obsr216793	1	PRESENT	10/14/11 0:00	2011	10	14	US	California	Santa Barbara	Devereux Slough	34.4136	-119.876	2480328	Pluvialis dominica (Statius Muller, 1776)	Animalia	Chordata	Aves	Charadriiformes	Charadriidae	Pluvialis	dominica	SPECIES	American Golden-Plover	ACCEPTED	4fa7b334-ce0d-4e88-aaae-2e0c138d049e	US	12/16/20 12:05	TRUE	FALSE	2480328	2480328	1	44	212	7192402	2480210	2480326	2480328	Pluvialis dominica	Pluvialis	Pluvialis dominica (Statius Muller, 1776)	Pluvialis dominica	DWC_ARCHIVE	12/16/20 12:05	6/30/20 8:20	FALSE	USA	United States	USA.5_1	California	USA.5.42_1	Santa Barbara	2011-10-14	FALSE
1405696304	OBS367502938	CC0_1_0	Cornell Lab of Ornithology	CLO	EBIRD	EOD - eBird Observation Dataset	HUMAN_OBSERVATION	URN:catalog:CLO:EBIRD:OBS367502938	OBS367502938	obsr302151	1	PRESENT	10/14/11 0:00	2011	10	14	US	California	Santa Barbara	Devereux Slough	34.4136	-119.876	2480328	Pluvialis dominica (Statius Muller, 1776)	Animalia	Chordata	Aves	Charadriiformes	Charadriidae	Pluvialis	dominica	SPECIES	American Golden-Plover	ACCEPTED	4fa7b334-ce0d-4e88-aaae-2e0c138d049e	US	12/16/20 11:53	TRUE	FALSE	2480328	2480328	1	44	212	7192402	2480210	2480326	2480328	Pluvialis dominica	Pluvialis	Pluvialis dominica (Statius Muller, 1776)	Pluvialis dominica	DWC_ARCHIVE	12/16/20 11:53	6/30/20 8:20	FALSE	USA	United States	USA.5_1	California	USA.5.42_1	Santa Barbara	2011-10-14	TRUE
1206613016	OBS328279702	CC0_1_0	Cornell Lab of Ornithology	CLO	EBIRD	EOD - eBird Observation Dataset	HUMAN_OBSERVATION	URN:catalog:CLO:EBIRD:OBS328279702	OBS328279702	obsr172576	1	PRESENT	10/15/11 0:00	2011	10	15	US	California	Santa Barbara	Devereux Slough	34.4136	-119.876	2480328	Pluvialis dominica (Statius Muller, 1776)	Animalia	Chordata	Aves	Charadriiformes	Charadriidae	Pluvialis	dominica	SPECIES	American Golden-Plover	ACCEPTED	4fa7b334-ce0d-4e88-aaae-2e0c138d049e	US	12/16/20 11:54	TRUE	FALSE	2480328	2480328	1	44	212	7192402	2480210	2480326	2480328	Pluvialis dominica	Pluvialis	Pluvialis dominica (Statius Muller, 1776)	Pluvialis dominica	DWC_ARCHIVE	12/16/20 11:54	6/30/20 8:20	FALSE	USA	United States	USA.5_1	California	USA.5.42_1	Santa Barbara	2011-10-15	FALSE
1185367904	OBS269189459	CC0_1_0	Cornell Lab of Ornithology	CLO	EBIRD	EOD - eBird Observation Dataset	HUMAN_OBSERVATION	URN:catalog:CLO:EBIRD:OBS269189459	OBS269189459	obsr221434	1	PRESENT	10/15/11 0:00	2011	10	15	US	California	Santa Barbara	Devereux Slough	34.4136	-119.876	2480328	Pluvialis dominica (Statius Muller, 1776)	Animalia	Chordata	Aves	Charadriiformes	Charadriidae	Pluvialis	dominica	SPECIES	American Golden-Plover	ACCEPTED	4fa7b334-ce0d-4e88-aaae-2e0c138d049e	US	12/16/20 11:52	TRUE	FALSE	2480328	2480328	1	44	212	7192402	2480210	2480326	2480328	Pluvialis dominica	Pluvialis	Pluvialis dominica (Statius Muller, 1776)	Pluvialis dominica	DWC_ARCHIVE	12/16/20 11:52	6/30/20 8:20	FALSE	USA	United States	USA.5_1	California	USA.5.42_1	Santa Barbara	2011-10-15	FALSE
597577998	OBS128291539	CC0_1_0	Cornell Lab of Ornithology	CLO	EBIRD	EOD - eBird Observation Dataset	HUMAN_OBSERVATION	URN:catalog:CLO:EBIRD:OBS128291539	OBS128291539	obsr51183	1	PRESENT	10/16/11 0:00	2011	10	16	US	California	Santa Barbara	Devereux Slough	34.4136	-119.876	2480328	Pluvialis dominica (Statius Muller, 1776)	Animalia	Chordata	Aves	Charadriiformes	Charadriidae	Pluvialis	dominica	SPECIES	American Golden-Plover	ACCEPTED	4fa7b334-ce0d-4e88-aaae-2e0c138d049e	US	12/16/20 11:52	TRUE	FALSE	2480328	2480328	1	44	212	7192402	2480210	2480326	2480328	Pluvialis dominica	Pluvialis	Pluvialis dominica (Statius Muller, 1776)	Pluvialis dominica	DWC_ARCHIVE	12/16/20 11:52	6/30/20 8:20	FALSE	USA	United States	USA.5_1	California	USA.5.42_1	Santa Barbara	2011-10-16	TRUE
596870853	OBS128392988	CC0_1_0	Cornell Lab of Ornithology	CLO	EBIRD	EOD - eBird Observation Dataset	HUMAN_OBSERVATION	URN:catalog:CLO:EBIRD:OBS128392988	OBS128392988	obsr169091	1	PRESENT	10/17/11 0:00	2011	10	17	US	California	Santa Barbara	Devereux Slough	34.4136	-119.876	2480328	Pluvialis dominica (Statius Muller, 1776)	Animalia	Chordata	Aves	Charadriiformes	Charadriidae	Pluvialis	dominica	SPECIES	American Golden-Plover	ACCEPTED	4fa7b334-ce0d-4e88-aaae-2e0c138d049e	US	12/16/20 11:51	TRUE	FALSE	2480328	2480328	1	44	212	7192402	2480210	2480326	2480328	Pluvialis dominica	Pluvialis	Pluvialis dominica (Statius Muller, 1776)	Pluvialis dominica	DWC_ARCHIVE	12/16/20 11:51	6/30/20 8:20	FALSE	USA	United States	USA.5_1	California	USA.5.42_1	Santa Barbara	2011-10-17	FALSE
598651824	OBS112266485	CC0_1_0	Cornell Lab of Ornithology	CLO	EBIRD	EOD - eBird Observation Dataset	HUMAN_OBSERVATION	URN:catalog:CLO:EBIRD:OBS112266485	OBS112266485	obsr193892	1	PRESENT	3/12/11 0:00	2011	3	12	US	California	Santa Barbara	Devereux Slough	34.4136	-119.876	2484591	Regulus satrapa Lichtenstein, 1823	Animalia	Chordata	Aves	Passeriformes	Regulidae	Regulus	satrapa	SPECIES	Golden-crowned Kinglet	ACCEPTED	4fa7b334-ce0d-4e88-aaae-2e0c138d049e	US	12/16/20 12:01	TRUE	FALSE	2484591	2484591	1	44	212	729	5279	2484589	2484591	Regulus satrapa	Regulus	Regulus satrapa Lichtenstein, 1823	Regulus satrapa	DWC_ARCHIVE	12/16/20 12:01	6/30/20 8:20	FALSE	USA	United States	USA.5_1	California	USA.5.42_1	Santa Barbara	2011-3-12	FALSE
598599440	OBS112326544	CC0_1_0	Cornell Lab of Ornithology	CLO	EBIRD	EOD - eBird Observation Dataset	HUMAN_OBSERVATION	URN:catalog:CLO:EBIRD:OBS112326544	OBS112326544	obsr123794	1	PRESENT	3/12/11 0:00	2011	3	12	US	California	Santa Barbara	Devereux Slough	34.4136	-119.876	2484591	Regulus satrapa Lichtenstein, 1823	Animalia	Chordata	Aves	Passeriformes	Regulidae	Regulus	satrapa	SPECIES	Golden-crowned Kinglet	ACCEPTED	4fa7b334-ce0d-4e88-aaae-2e0c138d049e	US	12/16/20 12:01	TRUE	FALSE	2484591	2484591	1	44	212	729	5279	2484589	2484591	Regulus satrapa	Regulus	Regulus satrapa Lichtenstein, 1823	Regulus satrapa	DWC_ARCHIVE	12/16/20 12:01	6/30/20 8:20	FALSE	USA	United States	USA.5_1	California	USA.5.42_1	Santa Barbara	2011-3-12	FALSE
598630090	OBS112328472	CC0_1_0	Cornell Lab of Ornithology	CLO	EBIRD	EOD - eBird Observation Dataset	HUMAN_OBSERVATION	URN:catalog:CLO:EBIRD:OBS112328472	OBS112328472	obsr203566	1	PRESENT	3/12/11 0:00	2011	3	12	US	California	Santa Barbara	Devereux Slough	34.4136	-119.876	2484591	Regulus satrapa Lichtenstein, 1823	Animalia	Chordata	Aves	Passeriformes	Regulidae	Regulus	satrapa	SPECIES	Golden-crowned Kinglet	ACCEPTED	4fa7b334-ce0d-4e88-aaae-2e0c138d049e	US	12/16/20 12:03	TRUE	FALSE	2484591	2484591	1	44	212	729	5279	2484589	2484591	Regulus satrapa	Regulus	Regulus satrapa Lichtenstein, 1823	Regulus satrapa	DWC_ARCHIVE	12/16/20 12:03	6/30/20 8:20	FALSE	USA	United States	USA.5_1	California	USA.5.42_1	Santa Barbara	2011-3-12	FALSE
598396058	OBS112283961	CC0_1_0	Cornell Lab of Ornithology	CLO	EBIRD	EOD - eBird Observation Dataset	HUMAN_OBSERVATION	URN:catalog:CLO:EBIRD:OBS112283961	OBS112283961	obsr55357	1	PRESENT	3/12/11 0:00	2011	3	12	US	California	Santa Barbara	Devereux Slough	34.4136	-119.876	2484591	Regulus satrapa Lichtenstein, 1823	Animalia	Chordata	Aves	Passeriformes	Regulidae	Regulus	satrapa	SPECIES	Golden-crowned Kinglet	ACCEPTED	4fa7b334-ce0d-4e88-aaae-2e0c138d049e	US	12/16/20 12:01	TRUE	FALSE	2484591	2484591	1	44	212	729	5279	2484589	2484591	Regulus satrapa	Regulus	Regulus satrapa Lichtenstein, 1823	Regulus satrapa	DWC_ARCHIVE	12/16/20 12:01	6/30/20 8:20	FALSE	USA	United States	USA.5_1	California	USA.5.42_1	Santa Barbara	2011-3-12	FALSE
598594913	OBS112302491	CC0_1_0	Cornell Lab of Ornithology	CLO	EBIRD	EOD - eBird Observation Dataset	HUMAN_OBSERVATION	URN:catalog:CLO:EBIRD:OBS112302491	OBS112302491	obsr199620	1	PRESENT	3/12/11 0:00	2011	3	12	US	California	Santa Barbara	Devereux Slough	34.4136	-119.876	2484591	Regulus satrapa Lichtenstein, 1823	Animalia	Chordata	Aves	Passeriformes	Regulidae	Regulus	satrapa	SPECIES	Golden-crowned Kinglet	ACCEPTED	4fa7b334-ce0d-4e88-aaae-2e0c138d049e	US	12/16/20 11:51	TRUE	FALSE	2484591	2484591	1	44	212	729	5279	2484589	2484591	Regulus satrapa	Regulus	Regulus satrapa Lichtenstein, 1823	Regulus satrapa	DWC_ARCHIVE	12/16/20 11:51	6/30/20 8:20	FALSE	USA	United States	USA.5_1	California	USA.5.42_1	Santa Barbara	2011-3-12	FALSE
598652130	OBS112275800	CC0_1_0	Cornell Lab of Ornithology	CLO	EBIRD	EOD - eBird Observation Dataset	HUMAN_OBSERVATION	URN:catalog:CLO:EBIRD:OBS112275800	OBS112275800	obsr59797	1	PRESENT	3/12/11 0:00	2011	3	12	US	California	Santa Barbara	Devereux Slough	34.4136	-119.876	2484591	Regulus satrapa Lichtenstein, 1823	Animalia	Chordata	Aves	Passeriformes	Regulidae	Regulus	satrapa	SPECIES	Golden-crowned Kinglet	ACCEPTED	4fa7b334-ce0d-4e88-aaae-2e0c138d049e	US	12/16/20 11:52	TRUE	FALSE	2484591	2484591	1	44	212	729	5279	2484589	2484591	Regulus satrapa	Regulus	Regulus satrapa Lichtenstein, 1823	Regulus satrapa	DWC_ARCHIVE	12/16/20 11:52	6/30/20 8:20	FALSE	USA	United States	USA.5_1	California	USA.5.42_1	Santa Barbara	2011-3-12	FALSE
598396059	OBS112292557	CC0_1_0	Cornell Lab of Ornithology	CLO	EBIRD	EOD - eBird Observation Dataset	HUMAN_OBSERVATION	URN:catalog:CLO:EBIRD:OBS112292557	OBS112292557	obsr203281	1	PRESENT	3/12/11 0:00	2011	3	12	US	California	Santa Barbara	Devereux Slough	34.4136	-119.876	2484591	Regulus satrapa Lichtenstein, 1823	Animalia	Chordata	Aves	Passeriformes	Regulidae	Regulus	satrapa	SPECIES	Golden-crowned Kinglet	ACCEPTED	4fa7b334-ce0d-4e88-aaae-2e0c138d049e	US	12/16/20 11:51	TRUE	FALSE	2484591	2484591	1	44	212	729	5279	2484589	2484591	Regulus satrapa	Regulus	Regulus satrapa Lichtenstein, 1823	Regulus satrapa	DWC_ARCHIVE	12/16/20 11:51	6/30/20 8:20	FALSE	USA	United States	USA.5_1	California	USA.5.42_1	Santa Barbara	2011-3-12	FALSE
598602962	OBS112293887	CC0_1_0	Cornell Lab of Ornithology	CLO	EBIRD	EOD - eBird Observation Dataset	HUMAN_OBSERVATION	URN:catalog:CLO:EBIRD:OBS112293887	OBS112293887	obsr125057	1	PRESENT	3/12/11 0:00	2011	3	12	US	California	Santa Barbara	Devereux Slough	34.4136	-119.876	2484591	Regulus satrapa Lichtenstein, 1823	Animalia	Chordata	Aves	Passeriformes	Regulidae	Regulus	satrapa	SPECIES	Golden-crowned Kinglet	ACCEPTED	4fa7b334-ce0d-4e88-aaae-2e0c138d049e	US	12/16/20 12:02	TRUE	FALSE	2484591	2484591	1	44	212	729	5279	2484589	2484591	Regulus satrapa	Regulus	Regulus satrapa Lichtenstein, 1823	Regulus satrapa	DWC_ARCHIVE	12/16/20 12:02	6/30/20 8:20	FALSE	USA	United States	USA.5_1	California	USA.5.42_1	Santa Barbara	2011-3-12	FALSE
598411439	OBS112358974	CC0_1_0	Cornell Lab of Ornithology	CLO	EBIRD	EOD - eBird Observation Dataset	HUMAN_OBSERVATION	URN:catalog:CLO:EBIRD:OBS112358974	OBS112358974	obsr163924	1	PRESENT	3/12/11 0:00	2011	3	12	US	California	Santa Barbara	Devereux Slough	34.4136	-119.876	2484591	Regulus satrapa Lichtenstein, 1823	Animalia	Chordata	Aves	Passeriformes	Regulidae	Regulus	satrapa	SPECIES	Golden-crowned Kinglet	ACCEPTED	4fa7b334-ce0d-4e88-aaae-2e0c138d049e	US	12/16/20 12:01	TRUE	FALSE	2484591	2484591	1	44	212	729	5279	2484589	2484591	Regulus satrapa	Regulus	Regulus satrapa Lichtenstein, 1823	Regulus satrapa	DWC_ARCHIVE	12/16/20 12:01	6/30/20 8:20	FALSE	USA	United States	USA.5_1	California	USA.5.42_1	Santa Barbara	2011-3-12	FALSE
598613982	OBS112267957	CC0_1_0	Cornell Lab of Ornithology	CLO	EBIRD	EOD - eBird Observation Dataset	HUMAN_OBSERVATION	URN:catalog:CLO:EBIRD:OBS112267957	OBS112267957	obsr138536	1	PRESENT	3/12/11 0:00	2011	3	12	US	California	Santa Barbara	Devereux Slough	34.4136	-119.876	2484591	Regulus satrapa Lichtenstein, 1823	Animalia	Chordata	Aves	Passeriformes	Regulidae	Regulus	satrapa	SPECIES	Golden-crowned Kinglet	ACCEPTED	4fa7b334-ce0d-4e88-aaae-2e0c138d049e	US	12/16/20 12:01	TRUE	FALSE	2484591	2484591	1	44	212	729	5279	2484589	2484591	Regulus satrapa	Regulus	Regulus satrapa Lichtenstein, 1823	Regulus satrapa	DWC_ARCHIVE	12/16/20 12:01	6/30/20 8:20	FALSE	USA	United States	USA.5_1	California	USA.5.42_1	Santa Barbara	2011-3-12	FALSE
590171094	OBS119348703	CC0_1_0	Cornell Lab of Ornithology	CLO	EBIRD	EOD - eBird Observation Dataset	HUMAN_OBSERVATION	URN:catalog:CLO:EBIRD:OBS119348703	OBS119348703	obsr268304	1	PRESENT	5/23/11 0:00	2011	5	23	US	California	Santa Barbara	Devereux Slough	34.4136	-119.876	2489989	Icteria virens (Linnaeus, 1758)	Animalia	Chordata	Aves	Passeriformes	Parulidae	Icteria	virens	SPECIES	Yellow-breasted Chat	ACCEPTED	4fa7b334-ce0d-4e88-aaae-2e0c138d049e	US	12/16/20 11:51	TRUE	FALSE	2489989	2489989	1	44	212	729	5263	2489988	2489989	Icteria virens	Icteria	Icteria virens (Linnaeus, 1758)	Icteria virens	DWC_ARCHIVE	12/16/20 11:51	6/30/20 8:20	FALSE	USA	United States	USA.5_1	California	USA.5.42_1	Santa Barbara	2011-5-23	FALSE
1412532890	OBS121273205	CC0_1_0	Cornell Lab of Ornithology	CLO	EBIRD	EOD - eBird Observation Dataset	HUMAN_OBSERVATION	URN:catalog:CLO:EBIRD:OBS121273205	OBS121273205	obsr202001	1	PRESENT	6/16/11 0:00	2011	6	16	US	California	Santa Barbara	Coal Oil Point--Devereux Beach and Sands Beach	34.4071	-119.878	2480273	Haematopus palliatus Temminck, 1820	Animalia	Chordata	Aves	Charadriiformes	Haematopodidae	Haematopus	palliatus	SPECIES	American Oystercatcher	ACCEPTED	4fa7b334-ce0d-4e88-aaae-2e0c138d049e	US	12/16/20 12:04	TRUE	FALSE	2480273	2480273	1	44	212	7192402	4287243	2480260	2480273	Haematopus palliatus	Haematopus	Haematopus palliatus Temminck, 1820	Haematopus palliatus	DWC_ARCHIVE	12/16/20 12:04	6/30/20 8:20	FALSE	USA	United States	USA.5_1	California	USA.5.42_1	Santa Barbara	2011-6-16	FALSE
605277456	OBS134324011	CC0_1_0	Cornell Lab of Ornithology	CLO	EBIRD	EOD - eBird Observation Dataset	HUMAN_OBSERVATION	URN:catalog:CLO:EBIRD:OBS134324011	OBS134324011	obsr165305	1	PRESENT	7/21/11 0:00	2011	7	21	US	California	Santa Barbara	Devereux Slough	34.4136	-119.876	2497921	Tyto alba (Scopoli, 1769)	Animalia	Chordata	Aves	Strigiformes	Tytonidae	Tyto	alba	SPECIES	Barn Owl	ACCEPTED	4fa7b334-ce0d-4e88-aaae-2e0c138d049e	US	12/16/20 12:03	TRUE	FALSE	2497921	2497921	1	44	212	1450	5292	2497905	2497921	Tyto alba	Tyto	Tyto alba (Scopoli, 1769)	Tyto alba	DWC_ARCHIVE	12/16/20 12:03	6/30/20 8:20	FALSE	USA	United States	USA.5_1	California	USA.5.42_1	Santa Barbara	2011-7-21	FALSE
605574059	OBS134323964	CC0_1_0	Cornell Lab of Ornithology	CLO	EBIRD	EOD - eBird Observation Dataset	HUMAN_OBSERVATION	URN:catalog:CLO:EBIRD:OBS134323964	OBS134323964	obsr106931	1	PRESENT	7/21/11 0:00	2011	7	21	US	California	Santa Barbara	Devereux Slough	34.4136	-119.876	2497921	Tyto alba (Scopoli, 1769)	Animalia	Chordata	Aves	Strigiformes	Tytonidae	Tyto	alba	SPECIES	Barn Owl	ACCEPTED	4fa7b334-ce0d-4e88-aaae-2e0c138d049e	US	12/16/20 11:52	TRUE	FALSE	2497921	2497921	1	44	212	1450	5292	2497905	2497921	Tyto alba	Tyto	Tyto alba (Scopoli, 1769)	Tyto alba	DWC_ARCHIVE	12/16/20 11:52	6/30/20 8:20	FALSE	USA	United States	USA.5_1	California	USA.5.42_1	Santa Barbara	2011-7-21	FALSE
602200431	OBS126223515	CC0_1_0	Cornell Lab of Ornithology	CLO	EBIRD	EOD - eBird Observation Dataset	HUMAN_OBSERVATION	URN:catalog:CLO:EBIRD:OBS126223515	OBS126223515	obsr38892	1	PRESENT	9/15/11 0:00	2011	9	15	US	California	Santa Barbara	Santa Barbara/Devereaux Slough	34.4144	-119.876	9367409	Sterna hirundo Linnaeus, 1758	Animalia	Chordata	Aves	Charadriiformes	Laridae	Sterna	hirundo	SPECIES	Common Tern	ACCEPTED	4fa7b334-ce0d-4e88-aaae-2e0c138d049e	US	12/16/20 12:02	TRUE	FALSE	9367409	9367409	1	44	212	7192402	9316	2481227	9367409	Sterna hirundo	Sterna	Sterna hirundo Linnaeus, 1758	Sterna hirundo	DWC_ARCHIVE	12/16/20 12:02	6/30/20 8:20	FALSE	USA	United States	USA.5_1	California	USA.5.42_1	Santa Barbara	2011-9-15	FALSE
839253098	OBS137509657	CC0_1_0	Cornell Lab of Ornithology	CLO	EBIRD	EOD - eBird Observation Dataset	HUMAN_OBSERVATION	URN:catalog:CLO:EBIRD:OBS137509657	OBS137509657	obsr231847	1	PRESENT	1/26/12 0:00	2012	1	26	US	California	Santa Barbara	Devereux Slough	34.4136	-119.876	2483647	Pyrocephalus rubinus (Boddaert, 1783)	Animalia	Chordata	Aves	Passeriformes	Tyrannidae	Pyrocephalus	rubinus	SPECIES	Vermilion Flycatcher	ACCEPTED	4fa7b334-ce0d-4e88-aaae-2e0c138d049e	US	12/16/20 12:02	TRUE	FALSE	2483647	2483647	1	44	212	729	5291	2483646	2483647	Pyrocephalus rubinus	Pyrocephalus	Pyrocephalus rubinus (Boddaert, 1783)	Pyrocephalus rubinus	DWC_ARCHIVE	12/16/20 12:02	6/30/20 8:20	FALSE	USA	United States	USA.5_1	California	USA.5.42_1	Santa Barbara	2012-1-26	FALSE
842216186	OBS138477376	CC0_1_0	Cornell Lab of Ornithology	CLO	EBIRD	EOD - eBird Observation Dataset	HUMAN_OBSERVATION	URN:catalog:CLO:EBIRD:OBS138477376	OBS138477376	obsr297711	NA	PRESENT	1/4/12 0:00	2012	1	4	US	California	Santa Barbara	Devereux Slough	34.4136	-119.876	2492109	Spizella passerina (Bechstein, 1798)	Animalia	Chordata	Aves	Passeriformes	Emberizidae	Spizella	passerina	SPECIES	Chipping Sparrow	ACCEPTED	4fa7b334-ce0d-4e88-aaae-2e0c138d049e	US	12/16/20 11:51	TRUE	FALSE	2492109	2492109	1	44	212	729	9608	2492093	2492109	Spizella passerina	Spizella	Spizella passerina (Bechstein, 1798)	Spizella passerina	DWC_ARCHIVE	12/16/20 11:51	6/30/20 8:20	FALSE	USA	United States	USA.5_1	California	USA.5.42_1	Santa Barbara	2012-1-4	FALSE
829989780	OBS173464784	CC0_1_0	Cornell Lab of Ornithology	CLO	EBIRD	EOD - eBird Observation Dataset	HUMAN_OBSERVATION	URN:catalog:CLO:EBIRD:OBS173464784	OBS173464784	obsr278473	2	PRESENT	12/22/12 0:00	2012	12	22	US	California	Santa Barbara	Devereux Slough	34.4136	-119.876	9629160	Loxia curvirostra Linnaeus, 1758	Animalia	Chordata	Aves	Passeriformes	Fringillidae	Loxia	curvirostra	SPECIES	Red Crossbill	ACCEPTED	4fa7b334-ce0d-4e88-aaae-2e0c138d049e	US	12/16/20 12:00	TRUE	FALSE	9629160	9629160	1	44	212	729	5242	2494150	9629160	Loxia curvirostra	Loxia	Loxia curvirostra Linnaeus, 1758	Loxia curvirostra	DWC_ARCHIVE	12/16/20 12:00	6/30/20 8:20	FALSE	USA	United States	USA.5_1	California	USA.5.42_1	Santa Barbara	2012-12-22	FALSE
830485935	OBS174012755	CC0_1_0	Cornell Lab of Ornithology	CLO	EBIRD	EOD - eBird Observation Dataset	HUMAN_OBSERVATION	URN:catalog:CLO:EBIRD:OBS174012755	OBS174012755	obsr137269	2	PRESENT	12/22/12 0:00	2012	12	22	US	California	Santa Barbara	Devereux Slough	34.4136	-119.876	9629160	Loxia curvirostra Linnaeus, 1758	Animalia	Chordata	Aves	Passeriformes	Fringillidae	Loxia	curvirostra	SPECIES	Red Crossbill	ACCEPTED	4fa7b334-ce0d-4e88-aaae-2e0c138d049e	US	12/16/20 11:51	TRUE	FALSE	9629160	9629160	1	44	212	729	5242	2494150	9629160	Loxia curvirostra	Loxia	Loxia curvirostra Linnaeus, 1758	Loxia curvirostra	DWC_ARCHIVE	12/16/20 11:51	6/30/20 8:20	FALSE	USA	United States	USA.5_1	California	USA.5.42_1	Santa Barbara	2012-12-22	FALSE
831334389	OBS138482909	CC0_1_0	Cornell Lab of Ornithology	CLO	EBIRD	EOD - eBird Observation Dataset	HUMAN_OBSERVATION	URN:catalog:CLO:EBIRD:OBS138482909	OBS138482909	obsr297711	NA	PRESENT	2/1/12 0:00	2012	2	1	US	California	Santa Barbara	Devereux Slough	34.4136	-119.876	2481156	Larus glaucoides B.Meyer, 1822	Animalia	Chordata	Aves	Charadriiformes	Laridae	Larus	glaucoides	SPECIES	Iceland Gull	ACCEPTED	4fa7b334-ce0d-4e88-aaae-2e0c138d049e	US	12/16/20 12:00	TRUE	FALSE	2481156	2481156	1	44	212	7192402	9316	2481126	2481156	Larus glaucoides	Larus	Larus glaucoides B.Meyer, 1822	Larus glaucoides	DWC_ARCHIVE	12/16/20 12:00	6/30/20 8:20	FALSE	USA	United States	USA.5_1	California	USA.5.42_1	Santa Barbara	2012-2-1	FALSE
1409928680	OBS388770174	CC0_1_0	Cornell Lab of Ornithology	CLO	EBIRD	EOD - eBird Observation Dataset	HUMAN_OBSERVATION	URN:catalog:CLO:EBIRD:OBS388770174	OBS388770174	obsr741029	NA	PRESENT	2/2/12 0:00	2012	2	2	US	California	Santa Barbara	Coal Oil Point--Devereux Beach and Sands Beach	34.4071	-119.878	5231140	Zonotrichia albicollis (J.F.Gmelin, 1789)	Animalia	Chordata	Aves	Passeriformes	Emberizidae	Zonotrichia	albicollis	SPECIES	White-throated Sparrow	ACCEPTED	4fa7b334-ce0d-4e88-aaae-2e0c138d049e	US	12/16/20 11:54	TRUE	FALSE	5231140	5231140	1	44	212	729	9608	6173226	5231140	Zonotrichia albicollis	Zonotrichia	Zonotrichia albicollis (J.F.Gmelin, 1789)	Zonotrichia albicollis	DWC_ARCHIVE	12/16/20 11:54	6/30/20 8:20	FALSE	USA	United States	USA.5_1	California	USA.5.42_1	Santa Barbara	2012-2-2	FALSE
830693749	OBS142121873	CC0_1_0	Cornell Lab of Ornithology	CLO	EBIRD	EOD - eBird Observation Dataset	HUMAN_OBSERVATION	URN:catalog:CLO:EBIRD:OBS142121873	OBS142121873	obsr302151	1	PRESENT	2/24/12 0:00	2012	2	24	US	California	Santa Barbara	Devereux Slough	34.4136	-119.876	2481156	Larus glaucoides B.Meyer, 1822	Animalia	Chordata	Aves	Charadriiformes	Laridae	Larus	glaucoides	SPECIES	Iceland Gull	ACCEPTED	4fa7b334-ce0d-4e88-aaae-2e0c138d049e	US	12/16/20 11:52	TRUE	FALSE	2481156	2481156	1	44	212	7192402	9316	2481126	2481156	Larus glaucoides	Larus	Larus glaucoides B.Meyer, 1822	Larus glaucoides	DWC_ARCHIVE	12/16/20 11:52	6/30/20 8:20	FALSE	USA	United States	USA.5_1	California	USA.5.42_1	Santa Barbara	2012-2-24	TRUE
823390414	OBS143309414	CC0_1_0	Cornell Lab of Ornithology	CLO	EBIRD	EOD - eBird Observation Dataset	HUMAN_OBSERVATION	URN:catalog:CLO:EBIRD:OBS143309414	OBS143309414	obsr302151	1	PRESENT	3/4/12 0:00	2012	3	4	US	California	Santa Barbara	Devereux Slough	34.4136	-119.876	2498326	Bucephala clangula (Linnaeus, 1758)	Animalia	Chordata	Aves	Anseriformes	Anatidae	Bucephala	clangula	SPECIES	Common Goldeneye	ACCEPTED	4fa7b334-ce0d-4e88-aaae-2e0c138d049e	US	12/16/20 12:01	TRUE	FALSE	2498326	2498326	1	44	212	1108	2986	2498324	2498326	Bucephala clangula	Bucephala	Bucephala clangula (Linnaeus, 1758)	Bucephala clangula	DWC_ARCHIVE	12/16/20 12:01	6/30/20 8:20	FALSE	USA	United States	USA.5_1	California	USA.5.42_1	Santa Barbara	2012-3-4	TRUE
824526798	OBS143555494	CC0_1_0	Cornell Lab of Ornithology	CLO	EBIRD	EOD - eBird Observation Dataset	HUMAN_OBSERVATION	URN:catalog:CLO:EBIRD:OBS143555494	OBS143555494	obsr302151	1	PRESENT	3/6/12 0:00	2012	3	6	US	California	Santa Barbara	Devereux Slough	34.4136	-119.876	2498326	Bucephala clangula (Linnaeus, 1758)	Animalia	Chordata	Aves	Anseriformes	Anatidae	Bucephala	clangula	SPECIES	Common Goldeneye	ACCEPTED	4fa7b334-ce0d-4e88-aaae-2e0c138d049e	US	12/16/20 12:02	TRUE	FALSE	2498326	2498326	1	44	212	1108	2986	2498324	2498326	Bucephala clangula	Bucephala	Bucephala clangula (Linnaeus, 1758)	Bucephala clangula	DWC_ARCHIVE	12/16/20 12:02	6/30/20 8:20	FALSE	USA	United States	USA.5_1	California	USA.5.42_1	Santa Barbara	2012-3-6	TRUE
832183832	OBS158573632	CC0_1_0	Cornell Lab of Ornithology	CLO	EBIRD	EOD - eBird Observation Dataset	HUMAN_OBSERVATION	URN:catalog:CLO:EBIRD:OBS158573632	OBS158573632	obsr195234	1	PRESENT	7/12/12 0:00	2012	7	12	US	California	Santa Barbara	Devereux Slough	34.4136	-119.876	2496459	Geococcyx californianus (Lesson, 1829)	Animalia	Chordata	Aves	Cuculiformes	Cuculidae	Geococcyx	californianus	SPECIES	Greater Roadrunner	ACCEPTED	4fa7b334-ce0d-4e88-aaae-2e0c138d049e	US	12/16/20 12:02	TRUE	FALSE	2496459	2496459	1	44	212	1492	9309	2496458	2496459	Geococcyx californianus	Geococcyx	Geococcyx californianus (Lesson, 1829)	Geococcyx californianus	DWC_ARCHIVE	12/16/20 12:02	6/30/20 8:20	FALSE	USA	United States	USA.5_1	California	USA.5.42_1	Santa Barbara	2012-7-12	FALSE
832491905	OBS161741279	CC0_1_0	Cornell Lab of Ornithology	CLO	EBIRD	EOD - eBird Observation Dataset	HUMAN_OBSERVATION	URN:catalog:CLO:EBIRD:OBS161741279	OBS161741279	obsr302151	NA	PRESENT	8/23/12 0:00	2012	8	23	US	California	Santa Barbara	Devereux Slough	34.4136	-119.876	2480272	Haematopus bachmani Audubon, 1838	Animalia	Chordata	Aves	Charadriiformes	Haematopodidae	Haematopus	bachmani	SPECIES	Black Oystercatcher	ACCEPTED	4fa7b334-ce0d-4e88-aaae-2e0c138d049e	US	12/16/20 11:51	TRUE	FALSE	2480272	2480272	1	44	212	7192402	4287243	2480260	2480272	Haematopus bachmani	Haematopus	Haematopus bachmani Audubon, 1838	Haematopus bachmani	DWC_ARCHIVE	12/16/20 11:51	6/30/20 8:20	FALSE	USA	United States	USA.5_1	California	USA.5.42_1	Santa Barbara	2012-8-23	TRUE
936468359	OBS177675919	CC0_1_0	Cornell Lab of Ornithology	CLO	EBIRD	EOD - eBird Observation Dataset	HUMAN_OBSERVATION	URN:catalog:CLO:EBIRD:OBS177675919	OBS177675919	obsr282891	3	PRESENT	1/21/13 0:00	2013	1	21	US	California	Santa Barbara	Devereux Slough	34.4136	-119.876	9629160	Loxia curvirostra Linnaeus, 1758	Animalia	Chordata	Aves	Passeriformes	Fringillidae	Loxia	curvirostra	SPECIES	Red Crossbill	ACCEPTED	4fa7b334-ce0d-4e88-aaae-2e0c138d049e	US	12/16/20 12:02	TRUE	FALSE	9629160	9629160	1	44	212	729	5242	2494150	9629160	Loxia curvirostra	Loxia	Loxia curvirostra Linnaeus, 1758	Loxia curvirostra	DWC_ARCHIVE	12/16/20 12:02	6/30/20 8:20	FALSE	USA	United States	USA.5_1	California	USA.5.42_1	Santa Barbara	2013-1-21	FALSE
936456890	OBS177674659	CC0_1_0	Cornell Lab of Ornithology	CLO	EBIRD	EOD - eBird Observation Dataset	HUMAN_OBSERVATION	URN:catalog:CLO:EBIRD:OBS177674659	OBS177674659	obsr243067	1	PRESENT	1/21/13 0:00	2013	1	21	US	California	Santa Barbara	Devereux Slough	34.4136	-119.876	2492235	Melospiza georgiana (Latham, 1790)	Animalia	Chordata	Aves	Passeriformes	Emberizidae	Melospiza	georgiana	SPECIES	Swamp Sparrow	ACCEPTED	4fa7b334-ce0d-4e88-aaae-2e0c138d049e	US	12/16/20 12:02	TRUE	FALSE	2492235	2492235	1	44	212	729	9608	2492191	2492235	Melospiza georgiana	Melospiza	Melospiza georgiana (Latham, 1790)	Melospiza georgiana	DWC_ARCHIVE	12/16/20 12:02	6/30/20 8:20	FALSE	USA	United States	USA.5_1	California	USA.5.42_1	Santa Barbara	2013-1-21	FALSE
936469552	OBS177662715	CC0_1_0	Cornell Lab of Ornithology	CLO	EBIRD	EOD - eBird Observation Dataset	HUMAN_OBSERVATION	URN:catalog:CLO:EBIRD:OBS177662715	OBS177662715	obsr282891	1	PRESENT	1/21/13 0:00	2013	1	21	US	California	Santa Barbara	Devereux Slough	34.4136	-119.876	2492235	Melospiza georgiana (Latham, 1790)	Animalia	Chordata	Aves	Passeriformes	Emberizidae	Melospiza	georgiana	SPECIES	Swamp Sparrow	ACCEPTED	4fa7b334-ce0d-4e88-aaae-2e0c138d049e	US	12/16/20 12:03	TRUE	FALSE	2492235	2492235	1	44	212	729	9608	2492191	2492235	Melospiza georgiana	Melospiza	Melospiza georgiana (Latham, 1790)	Melospiza georgiana	DWC_ARCHIVE	12/16/20 12:03	6/30/20 8:20	FALSE	USA	United States	USA.5_1	California	USA.5.42_1	Santa Barbara	2013-1-21	FALSE
1343443233	OBS177854769	CC0_1_0	Cornell Lab of Ornithology	CLO	EBIRD	EOD - eBird Observation Dataset	HUMAN_OBSERVATION	URN:catalog:CLO:EBIRD:OBS177854769	OBS177854769	obsr240555	1	PRESENT	1/22/13 0:00	2013	1	22	US	California	Santa Barbara	Coal Oil Point--Devereux Beach and Sands Beach	34.4071	-119.878	2481156	Larus glaucoides B.Meyer, 1822	Animalia	Chordata	Aves	Charadriiformes	Laridae	Larus	glaucoides	SPECIES	Iceland Gull	ACCEPTED	4fa7b334-ce0d-4e88-aaae-2e0c138d049e	US	12/16/20 12:03	TRUE	FALSE	2481156	2481156	1	44	212	7192402	9316	2481126	2481156	Larus glaucoides	Larus	Larus glaucoides B.Meyer, 1822	Larus glaucoides	DWC_ARCHIVE	12/16/20 12:03	6/30/20 8:20	FALSE	USA	United States	USA.5_1	California	USA.5.42_1	Santa Barbara	2013-1-22	FALSE
934737476	OBS175371967	CC0_1_0	Cornell Lab of Ornithology	CLO	EBIRD	EOD - eBird Observation Dataset	HUMAN_OBSERVATION	URN:catalog:CLO:EBIRD:OBS175371967	OBS175371967	obsr195234	1	PRESENT	1/5/13 0:00	2013	1	5	US	California	Santa Barbara	Devereux Slough	34.4136	-119.876	2492235	Melospiza georgiana (Latham, 1790)	Animalia	Chordata	Aves	Passeriformes	Emberizidae	Melospiza	georgiana	SPECIES	Swamp Sparrow	ACCEPTED	4fa7b334-ce0d-4e88-aaae-2e0c138d049e	US	12/16/20 12:03	TRUE	FALSE	2492235	2492235	1	44	212	729	9608	2492191	2492235	Melospiza georgiana	Melospiza	Melospiza georgiana (Latham, 1790)	Melospiza georgiana	DWC_ARCHIVE	12/16/20 12:03	6/30/20 8:20	FALSE	USA	United States	USA.5_1	California	USA.5.42_1	Santa Barbara	2013-1-5	FALSE
935024337	OBS175735742	CC0_1_0	Cornell Lab of Ornithology	CLO	EBIRD	EOD - eBird Observation Dataset	HUMAN_OBSERVATION	URN:catalog:CLO:EBIRD:OBS175735742	OBS175735742	obsr136347	1	PRESENT	1/5/13 0:00	2013	1	5	US	California	Santa Barbara	Devereux Slough	34.4136	-119.876	2497921	Tyto alba (Scopoli, 1769)	Animalia	Chordata	Aves	Strigiformes	Tytonidae	Tyto	alba	SPECIES	Barn Owl	ACCEPTED	4fa7b334-ce0d-4e88-aaae-2e0c138d049e	US	12/16/20 11:52	TRUE	FALSE	2497921	2497921	1	44	212	1450	5292	2497905	2497921	Tyto alba	Tyto	Tyto alba (Scopoli, 1769)	Tyto alba	DWC_ARCHIVE	12/16/20 11:52	6/30/20 8:20	FALSE	USA	United States	USA.5_1	California	USA.5.42_1	Santa Barbara	2013-1-5	FALSE
935024100	OBS175735302	CC0_1_0	Cornell Lab of Ornithology	CLO	EBIRD	EOD - eBird Observation Dataset	HUMAN_OBSERVATION	URN:catalog:CLO:EBIRD:OBS175735302	OBS175735302	obsr136347	1	PRESENT	1/5/13 0:00	2013	1	5	US	California	Santa Barbara	Devereux Slough	34.4136	-119.876	2492235	Melospiza georgiana (Latham, 1790)	Animalia	Chordata	Aves	Passeriformes	Emberizidae	Melospiza	georgiana	SPECIES	Swamp Sparrow	ACCEPTED	4fa7b334-ce0d-4e88-aaae-2e0c138d049e	US	12/16/20 12:13	TRUE	FALSE	2492235	2492235	1	44	212	729	9608	2492191	2492235	Melospiza georgiana	Melospiza	Melospiza georgiana (Latham, 1790)	Melospiza georgiana	DWC_ARCHIVE	12/16/20 12:13	6/30/20 8:20	FALSE	USA	United States	USA.5_1	California	USA.5.42_1	Santa Barbara	2013-1-5	FALSE
969810177	OBS215517356	CC0_1_0	Cornell Lab of Ornithology	CLO	EBIRD	EOD - eBird Observation Dataset	HUMAN_OBSERVATION	URN:catalog:CLO:EBIRD:OBS215517356	OBS215517356	obsr350207	1	PRESENT	10/27/13 0:00	2013	10	27	US	California	Santa Barbara	Devereux Slough	34.4136	-119.876	2484907	Sitta pygmaea Vigors, 1839	Animalia	Chordata	Aves	Passeriformes	Sittidae	Sitta	pygmaea	SPECIES	Pygmy Nuthatch	ACCEPTED	4fa7b334-ce0d-4e88-aaae-2e0c138d049e	US	12/16/20 11:52	TRUE	FALSE	2484907	2484907	1	44	212	729	5283	2484878	2484907	Sitta pygmaea	Sitta	Sitta pygmaea Vigors, 1839	Sitta pygmaea	DWC_ARCHIVE	12/16/20 11:52	6/30/20 8:20	FALSE	USA	United States	USA.5_1	California	USA.5.42_1	Santa Barbara	2013-10-27	FALSE
891764566	460146	CC_BY_NC_4_0	iNaturalist.org	iNaturalist	Observations	iNaturalist Research-grade Observations	HUMAN_OBSERVATION	http://www.inaturalist.org/observations/460146	460146	Lynn Watson, Santa Barbara	NA	PRESENT	11/16/13 16:16	2013	11	16	US	California	NA	NA	34.407994	-119.879283	9163261	Setophaga coronata auduboni (J.K.Townsend, 1837)	Animalia	Chordata	Aves	Passeriformes	Parulidae	Setophaga	coronata	SUBSPECIES	NA	SYNONYM	50c9509d-22c7-4a22-a47d-8c48425ef4a7	US	2/21/21 5:07	TRUE	FALSE	6542061	9163261	1	44	212	729	5263	2489984	7760978	Setophaga auduboni	Setophaga	Setophaga auduboni auduboni	Setophaga coronata auduboni	DWC_ARCHIVE	2/21/21 5:07	2/21/21 2:33	FALSE	USA	United States	USA.5_1	California	USA.5.42_1	Santa Barbara	2013-11-16	FALSE
971760195	OBS217892605	CC0_1_0	Cornell Lab of Ornithology	CLO	EBIRD	EOD - eBird Observation Dataset	HUMAN_OBSERVATION	URN:catalog:CLO:EBIRD:OBS217892605	OBS217892605	obsr51183	1	PRESENT	11/3/13 0:00	2013	11	3	US	California	Santa Barbara	Devereux Slough	34.4136	-119.876	7341822	Setophaga palmarum (J.F.Gmelin, 1789)	Animalia	Chordata	Aves	Passeriformes	Parulidae	Setophaga	palmarum	SPECIES	Palm Warbler	ACCEPTED	4fa7b334-ce0d-4e88-aaae-2e0c138d049e	US	12/16/20 12:03	TRUE	FALSE	7341822	7341822	1	44	212	729	5263	2489984	7341822	Setophaga palmarum	Setophaga	Setophaga palmarum (J.F.Gmelin, 1789)	Setophaga palmarum	DWC_ARCHIVE	12/16/20 12:03	6/30/20 8:20	FALSE	USA	United States	USA.5_1	California	USA.5.42_1	Santa Barbara	2013-11-3	TRUE
948146499	OBS191703010	CC0_1_0	Cornell Lab of Ornithology	CLO	EBIRD	EOD - eBird Observation Dataset	HUMAN_OBSERVATION	URN:catalog:CLO:EBIRD:OBS191703010	OBS191703010	obsr302151	2	PRESENT	4/20/13 0:00	2013	4	20	US	California	Santa Barbara	Devereux Slough	34.4136	-119.876	5846430	Leucophaeus pipixcan (Wagler, 1831)	Animalia	Chordata	Aves	Charadriiformes	Laridae	Leucophaeus	pipixcan	SPECIES	Franklin's Gull	ACCEPTED	4fa7b334-ce0d-4e88-aaae-2e0c138d049e	US	12/16/20 11:53	TRUE	FALSE	5846430	5846430	1	44	212	7192402	9316	4352369	5846430	Leucophaeus pipixcan	Leucophaeus	Leucophaeus pipixcan (Wagler, 1831)	Leucophaeus pipixcan	DWC_ARCHIVE	12/16/20 11:53	6/30/20 8:20	FALSE	USA	United States	USA.5_1	California	USA.5.42_1	Santa Barbara	2013-4-20	TRUE
1206734329	OBS328653055	CC0_1_0	Cornell Lab of Ornithology	CLO	EBIRD	EOD - eBird Observation Dataset	HUMAN_OBSERVATION	URN:catalog:CLO:EBIRD:OBS328653055	OBS328653055	obsr282891	1	PRESENT	4/27/13 0:00	2013	4	27	US	California	Santa Barbara	Devereux Slough	34.4136	-119.876	2480830	Bubulcus ibis (Linnaeus, 1758)	Animalia	Chordata	Aves	Pelecaniformes	Ardeidae	Bubulcus	ibis	SPECIES	Cattle Egret	ACCEPTED	4fa7b334-ce0d-4e88-aaae-2e0c138d049e	US	12/16/20 12:03	TRUE	FALSE	2480830	2480830	1	44	212	7190953	3685	2480829	2480830	Bubulcus ibis	Bubulcus	Bubulcus ibis (Linnaeus, 1758)	Bubulcus ibis	DWC_ARCHIVE	12/16/20 12:03	6/30/20 8:20	FALSE	USA	United States	USA.5_1	California	USA.5.42_1	Santa Barbara	2013-4-27	FALSE
949316280	OBS193007883	CC0_1_0	Cornell Lab of Ornithology	CLO	EBIRD	EOD - eBird Observation Dataset	HUMAN_OBSERVATION	URN:catalog:CLO:EBIRD:OBS193007883	OBS193007883	obsr172576	5	PRESENT	4/27/13 0:00	2013	4	27	US	California	Santa Barbara	Devereux Slough	34.4136	-119.876	2480830	Bubulcus ibis (Linnaeus, 1758)	Animalia	Chordata	Aves	Pelecaniformes	Ardeidae	Bubulcus	ibis	SPECIES	Cattle Egret	ACCEPTED	4fa7b334-ce0d-4e88-aaae-2e0c138d049e	US	12/16/20 11:52	TRUE	FALSE	2480830	2480830	1	44	212	7190953	3685	2480829	2480830	Bubulcus ibis	Bubulcus	Bubulcus ibis (Linnaeus, 1758)	Bubulcus ibis	DWC_ARCHIVE	12/16/20 11:52	6/30/20 8:20	FALSE	USA	United States	USA.5_1	California	USA.5.42_1	Santa Barbara	2013-4-27	FALSE
949236517	OBS193114326	CC0_1_0	Cornell Lab of Ornithology	CLO	EBIRD	EOD - eBird Observation Dataset	HUMAN_OBSERVATION	URN:catalog:CLO:EBIRD:OBS193114326	OBS193114326	obsr302151	5	PRESENT	4/27/13 0:00	2013	4	27	US	California	Santa Barbara	Devereux Slough	34.4136	-119.876	2480830	Bubulcus ibis (Linnaeus, 1758)	Animalia	Chordata	Aves	Pelecaniformes	Ardeidae	Bubulcus	ibis	SPECIES	Cattle Egret	ACCEPTED	4fa7b334-ce0d-4e88-aaae-2e0c138d049e	US	12/16/20 12:01	TRUE	FALSE	2480830	2480830	1	44	212	7190953	3685	2480829	2480830	Bubulcus ibis	Bubulcus	Bubulcus ibis (Linnaeus, 1758)	Bubulcus ibis	DWC_ARCHIVE	12/16/20 12:01	6/30/20 8:20	FALSE	USA	United States	USA.5_1	California	USA.5.42_1	Santa Barbara	2013-4-27	TRUE
951081649	OBS194862864	CC0_1_0	Cornell Lab of Ornithology	CLO	EBIRD	EOD - eBird Observation Dataset	HUMAN_OBSERVATION	URN:catalog:CLO:EBIRD:OBS194862864	OBS194862864	obsr302151	1	PRESENT	5/6/13 0:00	2013	5	6	US	California	Santa Barbara	Devereux Slough	34.4136	-119.876	6092644	Setophaga occidentalis (J.K.Townsend, 1837)	Animalia	Chordata	Aves	Passeriformes	Parulidae	Setophaga	occidentalis	SPECIES	Hermit Warbler	ACCEPTED	4fa7b334-ce0d-4e88-aaae-2e0c138d049e	US	12/16/20 11:52	TRUE	FALSE	6092644	6092644	1	44	212	729	5263	2489984	6092644	Setophaga occidentalis	Setophaga	Setophaga occidentalis (J.K.Townsend, 1837)	Setophaga occidentalis	DWC_ARCHIVE	12/16/20 11:52	6/30/20 8:20	FALSE	USA	United States	USA.5_1	California	USA.5.42_1	Santa Barbara	2013-5-6	TRUE
958068423	OBS202747014	CC0_1_0	Cornell Lab of Ornithology	CLO	EBIRD	EOD - eBird Observation Dataset	HUMAN_OBSERVATION	URN:catalog:CLO:EBIRD:OBS202747014	OBS202747014	obsr298922	2	PRESENT	6/27/13 0:00	2013	6	27	US	California	Santa Barbara	Devereux Slough	34.4136	-119.876	5231643	Spinus lawrencei (Cassin, 1850)	Animalia	Chordata	Aves	Passeriformes	Fringillidae	Spinus	lawrencei	SPECIES	Lawrence's Goldfinch	ACCEPTED	4fa7b334-ce0d-4e88-aaae-2e0c138d049e	US	12/16/20 12:01	TRUE	FALSE	5231643	5231643	1	44	212	729	5242	8051475	5231643	Spinus lawrencei	Spinus	Spinus lawrencei (Cassin, 1850)	Spinus lawrencei	DWC_ARCHIVE	12/16/20 12:01	6/30/20 8:20	FALSE	USA	United States	USA.5_1	California	USA.5.42_1	Santa Barbara	2013-6-27	FALSE
1150092870	OBS225549530	CC0_1_0	Cornell Lab of Ornithology	CLO	EBIRD	EOD - eBird Observation Dataset	HUMAN_OBSERVATION	URN:catalog:CLO:EBIRD:OBS225549530	OBS225549530	obsr96989	1	PRESENT	1/11/14 0:00	2014	1	11	US	California	Santa Barbara	Devereux Slough	34.4136	-119.876	6092644	Setophaga occidentalis (J.K.Townsend, 1837)	Animalia	Chordata	Aves	Passeriformes	Parulidae	Setophaga	occidentalis	SPECIES	Hermit Warbler	ACCEPTED	4fa7b334-ce0d-4e88-aaae-2e0c138d049e	US	12/16/20 11:52	TRUE	FALSE	6092644	6092644	1	44	212	729	5263	2489984	6092644	Setophaga occidentalis	Setophaga	Setophaga occidentalis (J.K.Townsend, 1837)	Setophaga occidentalis	DWC_ARCHIVE	12/16/20 11:52	6/30/20 8:20	FALSE	USA	United States	USA.5_1	California	USA.5.42_1	Santa Barbara	2014-1-11	FALSE
891034908	505475	CC_BY_NC_4_0	iNaturalist.org	iNaturalist	Observations	iNaturalist Research-grade Observations	HUMAN_OBSERVATION	http://www.inaturalist.org/observations/505475	505475	BJ Stacey	NA	PRESENT	1/18/14 15:23	2014	1	18	US	California	NA	NA	34.413668	-119.876529	2498125	Anas crecca carolinensis Gmelin, 1789	Animalia	Chordata	Aves	Anseriformes	Anatidae	Anas	crecca	SUBSPECIES	NA	SYNONYM	50c9509d-22c7-4a22-a47d-8c48425ef4a7	US	2/21/21 5:06	TRUE	FALSE	6178406	2498125	1	44	212	1108	2986	2498056	2498125	Anas carolinensis	Anas	Anas carolinensis Gmelin, 1789	Anas crecca carolinensis	DWC_ARCHIVE	2/21/21 5:06	2/21/21 2:33	FALSE	USA	United States	USA.5_1	California	USA.5.42_1	Santa Barbara	2014-1-18	FALSE
1149745435	OBS224720798	CC0_1_0	Cornell Lab of Ornithology	CLO	EBIRD	EOD - eBird Observation Dataset	HUMAN_OBSERVATION	URN:catalog:CLO:EBIRD:OBS224720798	OBS224720798	obsr136347	1	PRESENT	1/4/14 0:00	2014	1	4	US	California	Santa Barbara	Devereux Slough	34.4136	-119.876	6092644	Setophaga occidentalis (J.K.Townsend, 1837)	Animalia	Chordata	Aves	Passeriformes	Parulidae	Setophaga	occidentalis	SPECIES	Hermit Warbler	ACCEPTED	4fa7b334-ce0d-4e88-aaae-2e0c138d049e	US	12/16/20 11:52	TRUE	FALSE	6092644	6092644	1	44	212	729	5263	2489984	6092644	Setophaga occidentalis	Setophaga	Setophaga occidentalis (J.K.Townsend, 1837)	Setophaga occidentalis	DWC_ARCHIVE	12/16/20 11:52	6/30/20 8:20	FALSE	USA	United States	USA.5_1	California	USA.5.42_1	Santa Barbara	2014-1-4	FALSE
1149744743	OBS224720766	CC0_1_0	Cornell Lab of Ornithology	CLO	EBIRD	EOD - eBird Observation Dataset	HUMAN_OBSERVATION	URN:catalog:CLO:EBIRD:OBS224720766	OBS224720766	obsr136347	1	PRESENT	1/4/14 0:00	2014	1	4	US	California	Santa Barbara	Devereux Slough	34.4136	-119.876	2497921	Tyto alba (Scopoli, 1769)	Animalia	Chordata	Aves	Strigiformes	Tytonidae	Tyto	alba	SPECIES	Barn Owl	ACCEPTED	4fa7b334-ce0d-4e88-aaae-2e0c138d049e	US	12/16/20 12:01	TRUE	FALSE	2497921	2497921	1	44	212	1450	5292	2497905	2497921	Tyto alba	Tyto	Tyto alba (Scopoli, 1769)	Tyto alba	DWC_ARCHIVE	12/16/20 12:01	6/30/20 8:20	FALSE	USA	United States	USA.5_1	California	USA.5.42_1	Santa Barbara	2014-1-4	FALSE
1149860846	OBS225008405	CC0_1_0	Cornell Lab of Ornithology	CLO	EBIRD	EOD - eBird Observation Dataset	HUMAN_OBSERVATION	URN:catalog:CLO:EBIRD:OBS225008405	OBS225008405	obsr263383	1	PRESENT	1/7/14 0:00	2014	1	7	US	California	Santa Barbara	Devereux Slough	34.4136	-119.876	2480888	Egretta rufescens (Gmelin, 1789)	Animalia	Chordata	Aves	Pelecaniformes	Ardeidae	Egretta	rufescens	SPECIES	Reddish Egret	ACCEPTED	4fa7b334-ce0d-4e88-aaae-2e0c138d049e	US	12/16/20 12:02	TRUE	FALSE	2480888	2480888	1	44	212	7190953	3685	2480872	2480888	Egretta rufescens	Egretta	Egretta rufescens (Gmelin, 1789)	Egretta rufescens	DWC_ARCHIVE	12/16/20 12:02	6/30/20 8:20	FALSE	USA	United States	USA.5_1	California	USA.5.42_1	Santa Barbara	2014-1-7	FALSE
1194543445	OBS279486666	CC0_1_0	Cornell Lab of Ornithology	CLO	EBIRD	EOD - eBird Observation Dataset	HUMAN_OBSERVATION	URN:catalog:CLO:EBIRD:OBS279486666	OBS279486666	obsr302151	1	PRESENT	10/26/14 0:00	2014	10	26	US	California	Santa Barbara	Devereux Slough	34.4136	-119.876	6092644	Setophaga occidentalis (J.K.Townsend, 1837)	Animalia	Chordata	Aves	Passeriformes	Parulidae	Setophaga	occidentalis	SPECIES	Hermit Warbler	ACCEPTED	4fa7b334-ce0d-4e88-aaae-2e0c138d049e	US	12/16/20 12:04	TRUE	FALSE	6092644	6092644	1	44	212	729	5263	2489984	6092644	Setophaga occidentalis	Setophaga	Setophaga occidentalis (J.K.Townsend, 1837)	Setophaga occidentalis	DWC_ARCHIVE	12/16/20 12:04	6/30/20 8:20	FALSE	USA	United States	USA.5_1	California	USA.5.42_1	Santa Barbara	2014-10-26	TRUE
1344046400	OBS279479740	CC0_1_0	Cornell Lab of Ornithology	CLO	EBIRD	EOD - eBird Observation Dataset	HUMAN_OBSERVATION	URN:catalog:CLO:EBIRD:OBS279479740	OBS279479740	obsr309446	1	PRESENT	11/5/14 0:00	2014	11	5	US	California	Santa Barbara	Coal Oil Point--Devereux Beach and Sands Beach	34.4071	-119.878	2488485	Piranga rubra (Linnaeus, 1758)	Animalia	Chordata	Aves	Passeriformes	Cardinalidae	Piranga	rubra	SPECIES	Summer Tanager	ACCEPTED	4fa7b334-ce0d-4e88-aaae-2e0c138d049e	US	12/16/20 11:53	TRUE	FALSE	2488485	2488485	1	44	212	729	9285	2488483	2488485	Piranga rubra	Piranga	Piranga rubra (Linnaeus, 1758)	Piranga rubra	DWC_ARCHIVE	12/16/20 11:53	6/30/20 8:20	FALSE	USA	United States	USA.5_1	California	USA.5.42_1	Santa Barbara	2014-11-5	FALSE
1194607313	OBS279457739	CC0_1_0	Cornell Lab of Ornithology	CLO	EBIRD	EOD - eBird Observation Dataset	HUMAN_OBSERVATION	URN:catalog:CLO:EBIRD:OBS279457739	OBS279457739	obsr337176	1	PRESENT	11/5/14 0:00	2014	11	5	US	California	Santa Barbara	Devereux Slough	34.4136	-119.876	2488485	Piranga rubra (Linnaeus, 1758)	Animalia	Chordata	Aves	Passeriformes	Cardinalidae	Piranga	rubra	SPECIES	Summer Tanager	ACCEPTED	4fa7b334-ce0d-4e88-aaae-2e0c138d049e	US	12/16/20 12:13	TRUE	FALSE	2488485	2488485	1	44	212	729	9285	2488483	2488485	Piranga rubra	Piranga	Piranga rubra (Linnaeus, 1758)	Piranga rubra	DWC_ARCHIVE	12/16/20 12:13	6/30/20 8:20	FALSE	USA	United States	USA.5_1	California	USA.5.42_1	Santa Barbara	2014-11-5	FALSE
1194532393	OBS279488530	CC0_1_0	Cornell Lab of Ornithology	CLO	EBIRD	EOD - eBird Observation Dataset	HUMAN_OBSERVATION	URN:catalog:CLO:EBIRD:OBS279488530	OBS279488530	obsr152073	1	PRESENT	11/5/14 0:00	2014	11	5	US	California	Santa Barbara	Devereux Slough	34.4136	-119.876	2488485	Piranga rubra (Linnaeus, 1758)	Animalia	Chordata	Aves	Passeriformes	Cardinalidae	Piranga	rubra	SPECIES	Summer Tanager	ACCEPTED	4fa7b334-ce0d-4e88-aaae-2e0c138d049e	US	12/16/20 12:04	TRUE	FALSE	2488485	2488485	1	44	212	729	9285	2488483	2488485	Piranga rubra	Piranga	Piranga rubra (Linnaeus, 1758)	Piranga rubra	DWC_ARCHIVE	12/16/20 12:04	6/30/20 8:20	FALSE	USA	United States	USA.5_1	California	USA.5.42_1	Santa Barbara	2014-11-5	FALSE
1194541953	OBS279485478	CC0_1_0	Cornell Lab of Ornithology	CLO	EBIRD	EOD - eBird Observation Dataset	HUMAN_OBSERVATION	URN:catalog:CLO:EBIRD:OBS279485478	OBS279485478	obsr53608	1	PRESENT	11/5/14 0:00	2014	11	5	US	California	Santa Barbara	Devereux Slough	34.4136	-119.876	2488485	Piranga rubra (Linnaeus, 1758)	Animalia	Chordata	Aves	Passeriformes	Cardinalidae	Piranga	rubra	SPECIES	Summer Tanager	ACCEPTED	4fa7b334-ce0d-4e88-aaae-2e0c138d049e	US	12/16/20 12:02	TRUE	FALSE	2488485	2488485	1	44	212	729	9285	2488483	2488485	Piranga rubra	Piranga	Piranga rubra (Linnaeus, 1758)	Piranga rubra	DWC_ARCHIVE	12/16/20 12:02	6/30/20 8:20	FALSE	USA	United States	USA.5_1	California	USA.5.42_1	Santa Barbara	2014-11-5	FALSE
1197912806	OBS283515739	CC0_1_0	Cornell Lab of Ornithology	CLO	EBIRD	EOD - eBird Observation Dataset	HUMAN_OBSERVATION	URN:catalog:CLO:EBIRD:OBS283515739	OBS283515739	obsr206701	4	PRESENT	12/1/14 0:00	2014	12	1	US	California	Santa Barbara	Coal Oil Point--Devereux Beach and Sands Beach	34.4071	-119.878	6178410	Melanitta deglandi (Bonaparte, 1850)	Animalia	Chordata	Aves	Anseriformes	Anatidae	Melanitta	deglandi	SPECIES	White-winged Scoter	SYNONYM	4fa7b334-ce0d-4e88-aaae-2e0c138d049e	US	12/16/20 12:03	TRUE	FALSE	2498243	6178410	1	44	212	1108	2986	2498237	2498238	Melanitta fusca	Melanitta	Melanitta fusca deglandi (Bonaparte, 1850)	Melanitta deglandi	DWC_ARCHIVE	12/16/20 12:03	6/30/20 8:20	FALSE	USA	United States	USA.5_1	California	USA.5.42_1	Santa Barbara	2014-12-1	FALSE
1200563330	OBS286951219	CC0_1_0	Cornell Lab of Ornithology	CLO	EBIRD	EOD - eBird Observation Dataset	HUMAN_OBSERVATION	URN:catalog:CLO:EBIRD:OBS286951219	OBS286951219	obsr282891	1	PRESENT	12/25/14 0:00	2014	12	25	US	California	Santa Barbara	Coal Oil Point--Devereux Beach and Sands Beach	34.4071	-119.878	6178410	Melanitta deglandi (Bonaparte, 1850)	Animalia	Chordata	Aves	Anseriformes	Anatidae	Melanitta	deglandi	SPECIES	White-winged Scoter	SYNONYM	4fa7b334-ce0d-4e88-aaae-2e0c138d049e	US	12/16/20 11:52	TRUE	FALSE	2498243	6178410	1	44	212	1108	2986	2498237	2498238	Melanitta fusca	Melanitta	Melanitta fusca deglandi (Bonaparte, 1850)	Melanitta deglandi	DWC_ARCHIVE	12/16/20 11:52	6/30/20 8:20	FALSE	USA	United States	USA.5_1	California	USA.5.42_1	Santa Barbara	2014-12-25	FALSE
1200739280	OBS287193595	CC0_1_0	Cornell Lab of Ornithology	CLO	EBIRD	EOD - eBird Observation Dataset	HUMAN_OBSERVATION	URN:catalog:CLO:EBIRD:OBS287193595	OBS287193595	obsr97862	1	PRESENT	12/26/14 0:00	2014	12	26	US	California	Santa Barbara	Devereux Slough	34.4136	-119.876	2478597	Sphyrapicus ruber (Gmelin, 1788)	Animalia	Chordata	Aves	Piciformes	Picidae	Sphyrapicus	ruber	SPECIES	Red-breasted Sapsucker	ACCEPTED	4fa7b334-ce0d-4e88-aaae-2e0c138d049e	US	12/16/20 12:02	TRUE	FALSE	2478597	2478597	1	44	212	724	9333	2478596	2478597	Sphyrapicus ruber	Sphyrapicus	Sphyrapicus ruber (Gmelin, 1788)	Sphyrapicus ruber	DWC_ARCHIVE	12/16/20 12:02	6/30/20 8:20	FALSE	USA	United States	USA.5_1	California	USA.5.42_1	Santa Barbara	2014-12-26	FALSE
1155049574	OBS232407027	CC0_1_0	Cornell Lab of Ornithology	CLO	EBIRD	EOD - eBird Observation Dataset	HUMAN_OBSERVATION	URN:catalog:CLO:EBIRD:OBS232407027	OBS232407027	obsr243067	1	PRESENT	2/3/14 0:00	2014	2	3	US	California	Santa Barbara	Coal Oil Point--Devereux Beach and Sands Beach	34.4071	-119.878	2494973	Oreoscoptes montanus (J.K.Townsend, 1837)	Animalia	Chordata	Aves	Passeriformes	Mimidae	Oreoscoptes	montanus	SPECIES	Sage Thrasher	ACCEPTED	4fa7b334-ce0d-4e88-aaae-2e0c138d049e	US	12/16/20 11:53	TRUE	FALSE	2494973	2494973	1	44	212	729	9321	2494972	2494973	Oreoscoptes montanus	Oreoscoptes	Oreoscoptes montanus (J.K.Townsend, 1837)	Oreoscoptes montanus	DWC_ARCHIVE	12/16/20 11:53	6/30/20 8:20	FALSE	USA	United States	USA.5_1	California	USA.5.42_1	Santa Barbara	2014-2-3	FALSE
1155420782	OBS233361217	CC0_1_0	Cornell Lab of Ornithology	CLO	EBIRD	EOD - eBird Observation Dataset	HUMAN_OBSERVATION	URN:catalog:CLO:EBIRD:OBS233361217	OBS233361217	obsr38892	1	PRESENT	2/9/14 0:00	2014	2	9	US	California	Santa Barbara	Santa Barbara/Devereaux Slough	34.4144	-119.876	2498387	Aix sponsa (Linnaeus, 1758)	Animalia	Chordata	Aves	Anseriformes	Anatidae	Aix	sponsa	SPECIES	Wood Duck	ACCEPTED	4fa7b334-ce0d-4e88-aaae-2e0c138d049e	US	12/16/20 12:04	TRUE	FALSE	2498387	2498387	1	44	212	1108	2986	2498386	2498387	Aix sponsa	Aix	Aix sponsa (Linnaeus, 1758)	Aix sponsa	DWC_ARCHIVE	12/16/20 12:04	6/30/20 8:20	FALSE	USA	United States	USA.5_1	California	USA.5.42_1	Santa Barbara	2014-2-9	FALSE
1159640357	OBS239423854	CC0_1_0	Cornell Lab of Ornithology	CLO	EBIRD	EOD - eBird Observation Dataset	HUMAN_OBSERVATION	URN:catalog:CLO:EBIRD:OBS239423854	OBS239423854	obsr221434	1	PRESENT	3/12/14 0:00	2014	3	12	US	California	Santa Barbara	Devereux Slough	34.4136	-119.876	6092644	Setophaga occidentalis (J.K.Townsend, 1837)	Animalia	Chordata	Aves	Passeriformes	Parulidae	Setophaga	occidentalis	SPECIES	Hermit Warbler	ACCEPTED	4fa7b334-ce0d-4e88-aaae-2e0c138d049e	US	12/16/20 12:02	TRUE	FALSE	6092644	6092644	1	44	212	729	5263	2489984	6092644	Setophaga occidentalis	Setophaga	Setophaga occidentalis (J.K.Townsend, 1837)	Setophaga occidentalis	DWC_ARCHIVE	12/16/20 12:02	6/30/20 8:20	FALSE	USA	United States	USA.5_1	California	USA.5.42_1	Santa Barbara	2014-3-12	FALSE
2108784033	OBS571818355	CC0_1_0	Cornell Lab of Ornithology	CLO	EBIRD	EOD - eBird Observation Dataset	HUMAN_OBSERVATION	URN:catalog:CLO:EBIRD:OBS571818355	OBS571818355	obsr55781	1	PRESENT	4/12/14 0:00	2014	4	12	US	California	Santa Barbara	Devereux Slough	34.4136	-119.876	7341770	Setophaga nigrescens (J.K.Townsend, 1837)	Animalia	Chordata	Aves	Passeriformes	Parulidae	Setophaga	nigrescens	SPECIES	Black-throated Gray Warbler	ACCEPTED	4fa7b334-ce0d-4e88-aaae-2e0c138d049e	US	12/16/20 12:05	TRUE	FALSE	7341770	7341770	1	44	212	729	5263	2489984	7341770	Setophaga nigrescens	Setophaga	Setophaga nigrescens (J.K.Townsend, 1837)	Setophaga nigrescens	DWC_ARCHIVE	12/16/20 12:05	6/30/20 8:20	FALSE	USA	United States	USA.5_1	California	USA.5.42_1	Santa Barbara	2014-4-12	FALSE
1164195373	OBS245579316	CC0_1_0	Cornell Lab of Ornithology	CLO	EBIRD	EOD - eBird Observation Dataset	HUMAN_OBSERVATION	URN:catalog:CLO:EBIRD:OBS245579316	OBS245579316	obsr230614	1	PRESENT	4/13/14 0:00	2014	4	13	US	California	Santa Barbara	Devereux Slough	34.4136	-119.876	2480830	Bubulcus ibis (Linnaeus, 1758)	Animalia	Chordata	Aves	Pelecaniformes	Ardeidae	Bubulcus	ibis	SPECIES	Cattle Egret	ACCEPTED	4fa7b334-ce0d-4e88-aaae-2e0c138d049e	US	12/16/20 12:02	TRUE	FALSE	2480830	2480830	1	44	212	7190953	3685	2480829	2480830	Bubulcus ibis	Bubulcus	Bubulcus ibis (Linnaeus, 1758)	Bubulcus ibis	DWC_ARCHIVE	12/16/20 12:02	6/30/20 8:20	FALSE	USA	United States	USA.5_1	California	USA.5.42_1	Santa Barbara	2014-4-13	FALSE
1167404347	OBS249518502	CC0_1_0	Cornell Lab of Ornithology	CLO	EBIRD_CL	EOD - eBird Observation Dataset	HUMAN_OBSERVATION	URN:catalog:CLO:EBIRD_CL:OBS249518502	OBS249518502	obsr424571	1	PRESENT	4/18/14 0:00	2014	4	18	US	California	Santa Barbara	Devereux Slough	34.4136	-119.876	2477108	Aeronautes saxatalis (Woodhouse, 1853)	Animalia	Chordata	Aves	Apodiformes	Apodidae	Aeronautes	saxatalis	SPECIES	White-throated Swift	ACCEPTED	4fa7b334-ce0d-4e88-aaae-2e0c138d049e	US	12/16/20 11:52	TRUE	FALSE	2477108	2477108	1	44	212	1448	2993	2477107	2477108	Aeronautes saxatalis	Aeronautes	Aeronautes saxatalis (Woodhouse, 1853)	Aeronautes saxatalis	DWC_ARCHIVE	12/16/20 11:52	6/30/20 8:20	FALSE	USA	United States	USA.5_1	California	USA.5.42_1	Santa Barbara	2014-4-18	FALSE
1165266888	OBS246936584	CC0_1_0	Cornell Lab of Ornithology	CLO	EBIRD	EOD - eBird Observation Dataset	HUMAN_OBSERVATION	URN:catalog:CLO:EBIRD:OBS246936584	OBS246936584	obsr251355	1	PRESENT	4/20/14 0:00	2014	4	20	US	California	Santa Barbara	Devereux Slough	34.4136	-119.876	5789146	Geothlypis tolmiei (J.K.Townsend, 1839)	Animalia	Chordata	Aves	Passeriformes	Parulidae	Geothlypis	tolmiei	SPECIES	MacGillivray's Warbler	ACCEPTED	4fa7b334-ce0d-4e88-aaae-2e0c138d049e	US	12/16/20 12:03	TRUE	FALSE	5789146	5789146	1	44	212	729	5263	2489637	5789146	Geothlypis tolmiei	Geothlypis	Geothlypis tolmiei (J.K.Townsend, 1839)	Geothlypis tolmiei	DWC_ARCHIVE	12/16/20 12:03	6/30/20 8:20	FALSE	USA	United States	USA.5_1	California	USA.5.42_1	Santa Barbara	2014-4-20	FALSE
1344157809	OBS288247547	CC0_1_0	Cornell Lab of Ornithology	CLO	EBIRD	EOD - eBird Observation Dataset	HUMAN_OBSERVATION	URN:catalog:CLO:EBIRD:OBS288247547	OBS288247547	obsr53921	1	PRESENT	1/1/15 0:00	2015	1	1	US	California	Santa Barbara	Devereux Slough	34.4136	-119.876	2478597	Sphyrapicus ruber (Gmelin, 1788)	Animalia	Chordata	Aves	Piciformes	Picidae	Sphyrapicus	ruber	SPECIES	Red-breasted Sapsucker	ACCEPTED	4fa7b334-ce0d-4e88-aaae-2e0c138d049e	US	12/16/20 11:53	TRUE	FALSE	2478597	2478597	1	44	212	724	9333	2478596	2478597	Sphyrapicus ruber	Sphyrapicus	Sphyrapicus ruber (Gmelin, 1788)	Sphyrapicus ruber	DWC_ARCHIVE	12/16/20 11:53	6/30/20 8:20	FALSE	USA	United States	USA.5_1	California	USA.5.42_1	Santa Barbara	2015-1-1	FALSE
1344157800	OBS288247527	CC0_1_0	Cornell Lab of Ornithology	CLO	EBIRD	EOD - eBird Observation Dataset	HUMAN_OBSERVATION	URN:catalog:CLO:EBIRD:OBS288247527	OBS288247527	obsr53921	7	PRESENT	1/1/15 0:00	2015	1	1	US	California	Santa Barbara	Devereux Slough	34.4136	-119.876	5229390	Phalaropus fulicarius (Linnaeus, 1758)	Animalia	Chordata	Aves	Charadriiformes	Scolopacidae	Phalaropus	fulicarius	SPECIES	Red Phalarope	ACCEPTED	4fa7b334-ce0d-4e88-aaae-2e0c138d049e	US	12/16/20 11:54	TRUE	FALSE	5229390	5229390	1	44	212	7192402	5282	7237089	5229390	Phalaropus fulicarius	Phalaropus	Phalaropus fulicarius (Linnaeus, 1758)	Phalaropus fulicarius	DWC_ARCHIVE	12/16/20 11:54	6/30/20 8:20	FALSE	USA	United States	USA.5_1	California	USA.5.42_1	Santa Barbara	2015-1-1	FALSE
1344677960	OBS288989229	CC0_1_0	Cornell Lab of Ornithology	CLO	EBIRD	EOD - eBird Observation Dataset	HUMAN_OBSERVATION	URN:catalog:CLO:EBIRD:OBS288989229	OBS288989229	obsr282891	7	PRESENT	1/1/15 0:00	2015	1	1	US	California	Santa Barbara	Devereux Slough	34.4136	-119.876	5229390	Phalaropus fulicarius (Linnaeus, 1758)	Animalia	Chordata	Aves	Charadriiformes	Scolopacidae	Phalaropus	fulicarius	SPECIES	Red Phalarope	ACCEPTED	4fa7b334-ce0d-4e88-aaae-2e0c138d049e	US	12/16/20 12:04	TRUE	FALSE	5229390	5229390	1	44	212	7192402	5282	7237089	5229390	Phalaropus fulicarius	Phalaropus	Phalaropus fulicarius (Linnaeus, 1758)	Phalaropus fulicarius	DWC_ARCHIVE	12/16/20 12:04	6/30/20 8:20	FALSE	USA	United States	USA.5_1	California	USA.5.42_1	Santa Barbara	2015-1-1	FALSE
1344677970	OBS288989249	CC0_1_0	Cornell Lab of Ornithology	CLO	EBIRD	EOD - eBird Observation Dataset	HUMAN_OBSERVATION	URN:catalog:CLO:EBIRD:OBS288989249	OBS288989249	obsr282891	1	PRESENT	1/1/15 0:00	2015	1	1	US	California	Santa Barbara	Devereux Slough	34.4136	-119.876	2478597	Sphyrapicus ruber (Gmelin, 1788)	Animalia	Chordata	Aves	Piciformes	Picidae	Sphyrapicus	ruber	SPECIES	Red-breasted Sapsucker	ACCEPTED	4fa7b334-ce0d-4e88-aaae-2e0c138d049e	US	12/16/20 11:53	TRUE	FALSE	2478597	2478597	1	44	212	724	9333	2478596	2478597	Sphyrapicus ruber	Sphyrapicus	Sphyrapicus ruber (Gmelin, 1788)	Sphyrapicus ruber	DWC_ARCHIVE	12/16/20 11:53	6/30/20 8:20	FALSE	USA	United States	USA.5_1	California	USA.5.42_1	Santa Barbara	2015-1-1	FALSE
1344383830	OBS288460145	CC0_1_0	Cornell Lab of Ornithology	CLO	EBIRD	EOD - eBird Observation Dataset	HUMAN_OBSERVATION	URN:catalog:CLO:EBIRD:OBS288460145	OBS288460145	obsr548926	2	PRESENT	1/2/15 0:00	2015	1	2	US	California	Santa Barbara	Devereux Slough	34.4136	-119.876	2481156	Larus glaucoides B.Meyer, 1822	Animalia	Chordata	Aves	Charadriiformes	Laridae	Larus	glaucoides	SPECIES	Iceland Gull	ACCEPTED	4fa7b334-ce0d-4e88-aaae-2e0c138d049e	US	12/16/20 12:13	TRUE	FALSE	2481156	2481156	1	44	212	7192402	9316	2481126	2481156	Larus glaucoides	Larus	Larus glaucoides B.Meyer, 1822	Larus glaucoides	DWC_ARCHIVE	12/16/20 12:13	6/30/20 8:20	FALSE	USA	United States	USA.5_1	California	USA.5.42_1	Santa Barbara	2015-1-2	TRUE
1344793336	OBS289197315	CC0_1_0	Cornell Lab of Ornithology	CLO	EBIRD	EOD - eBird Observation Dataset	HUMAN_OBSERVATION	URN:catalog:CLO:EBIRD:OBS289197315	OBS289197315	obsr53921	1	PRESENT	1/3/15 0:00	2015	1	3	US	California	Santa Barbara	Devereux Slough	34.4136	-119.876	2484340	Icterus galbula (Linnaeus, 1758)	Animalia	Chordata	Aves	Passeriformes	Icteridae	Icterus	galbula	SPECIES	Baltimore Oriole	ACCEPTED	4fa7b334-ce0d-4e88-aaae-2e0c138d049e	US	12/16/20 12:03	TRUE	FALSE	2484340	2484340	1	44	212	729	6176	2484282	2484340	Icterus galbula	Icterus	Icterus galbula (Linnaeus, 1758)	Icterus galbula	DWC_ARCHIVE	12/16/20 12:03	6/30/20 8:20	FALSE	USA	United States	USA.5_1	California	USA.5.42_1	Santa Barbara	2015-1-3	FALSE
1344569141	OBS288755534	CC0_1_0	Cornell Lab of Ornithology	CLO	EBIRD	EOD - eBird Observation Dataset	HUMAN_OBSERVATION	URN:catalog:CLO:EBIRD:OBS288755534	OBS288755534	obsr282891	1	PRESENT	1/3/15 0:00	2015	1	3	US	California	Santa Barbara	Devereux Slough	34.4136	-119.876	2484340	Icterus galbula (Linnaeus, 1758)	Animalia	Chordata	Aves	Passeriformes	Icteridae	Icterus	galbula	SPECIES	Baltimore Oriole	ACCEPTED	4fa7b334-ce0d-4e88-aaae-2e0c138d049e	US	12/16/20 12:03	TRUE	FALSE	2484340	2484340	1	44	212	729	6176	2484282	2484340	Icterus galbula	Icterus	Icterus galbula (Linnaeus, 1758)	Icterus galbula	DWC_ARCHIVE	12/16/20 12:03	6/30/20 8:20	FALSE	USA	United States	USA.5_1	California	USA.5.42_1	Santa Barbara	2015-1-3	FALSE
1344726893	OBS289041030	CC0_1_0	Cornell Lab of Ornithology	CLO	EBIRD	EOD - eBird Observation Dataset	HUMAN_OBSERVATION	URN:catalog:CLO:EBIRD:OBS289041030	OBS289041030	obsr548926	1	PRESENT	1/3/15 0:00	2015	1	3	US	California	Santa Barbara	Devereux Slough	34.4136	-119.876	2484340	Icterus galbula (Linnaeus, 1758)	Animalia	Chordata	Aves	Passeriformes	Icteridae	Icterus	galbula	SPECIES	Baltimore Oriole	ACCEPTED	4fa7b334-ce0d-4e88-aaae-2e0c138d049e	US	12/16/20 11:52	TRUE	FALSE	2484340	2484340	1	44	212	729	6176	2484282	2484340	Icterus galbula	Icterus	Icterus galbula (Linnaeus, 1758)	Icterus galbula	DWC_ARCHIVE	12/16/20 11:52	6/30/20 8:20	FALSE	USA	United States	USA.5_1	California	USA.5.42_1	Santa Barbara	2015-1-3	TRUE
1344662348	OBS289106612	CC0_1_0	Cornell Lab of Ornithology	CLO	EBIRD	EOD - eBird Observation Dataset	HUMAN_OBSERVATION	URN:catalog:CLO:EBIRD:OBS289106612	OBS289106612	obsr166679	8	PRESENT	1/4/15 0:00	2015	1	4	US	California	Santa Barbara	Coal Oil Point--Devereux Beach and Sands Beach	34.4071	-119.878	5229390	Phalaropus fulicarius (Linnaeus, 1758)	Animalia	Chordata	Aves	Charadriiformes	Scolopacidae	Phalaropus	fulicarius	SPECIES	Red Phalarope	ACCEPTED	4fa7b334-ce0d-4e88-aaae-2e0c138d049e	US	12/16/20 11:53	TRUE	FALSE	5229390	5229390	1	44	212	7192402	5282	7237089	5229390	Phalaropus fulicarius	Phalaropus	Phalaropus fulicarius (Linnaeus, 1758)	Phalaropus fulicarius	DWC_ARCHIVE	12/16/20 11:53	6/30/20 8:20	FALSE	USA	United States	USA.5_1	California	USA.5.42_1	Santa Barbara	2015-1-4	FALSE
1344664063	OBS289122940	CC0_1_0	Cornell Lab of Ornithology	CLO	EBIRD	EOD - eBird Observation Dataset	HUMAN_OBSERVATION	URN:catalog:CLO:EBIRD:OBS289122940	OBS289122940	obsr171564	8	PRESENT	1/4/15 0:00	2015	1	4	US	California	Santa Barbara	Coal Oil Point--Devereux Beach and Sands Beach	34.4071	-119.878	5229390	Phalaropus fulicarius (Linnaeus, 1758)	Animalia	Chordata	Aves	Charadriiformes	Scolopacidae	Phalaropus	fulicarius	SPECIES	Red Phalarope	ACCEPTED	4fa7b334-ce0d-4e88-aaae-2e0c138d049e	US	12/16/20 11:53	TRUE	FALSE	5229390	5229390	1	44	212	7192402	5282	7237089	5229390	Phalaropus fulicarius	Phalaropus	Phalaropus fulicarius (Linnaeus, 1758)	Phalaropus fulicarius	DWC_ARCHIVE	12/16/20 11:53	6/30/20 8:20	FALSE	USA	United States	USA.5_1	California	USA.5.42_1	Santa Barbara	2015-1-4	FALSE
1344664041	OBS289122941	CC0_1_0	Cornell Lab of Ornithology	CLO	EBIRD	EOD - eBird Observation Dataset	HUMAN_OBSERVATION	URN:catalog:CLO:EBIRD:OBS289122941	OBS289122941	obsr171564	1	PRESENT	1/4/15 0:00	2015	1	4	US	California	Santa Barbara	Coal Oil Point--Devereux Beach and Sands Beach	34.4071	-119.878	2481324	Cerorhinca monocerata (Pallas, 1811)	Animalia	Chordata	Aves	Charadriiformes	Alcidae	Cerorhinca	monocerata	SPECIES	Rhinoceros Auklet	ACCEPTED	4fa7b334-ce0d-4e88-aaae-2e0c138d049e	US	12/16/20 11:53	TRUE	FALSE	2481324	2481324	1	44	212	7192402	2985	2481323	2481324	Cerorhinca monocerata	Cerorhinca	Cerorhinca monocerata (Pallas, 1811)	Cerorhinca monocerata	DWC_ARCHIVE	12/16/20 11:53	6/30/20 8:20	FALSE	USA	United States	USA.5_1	California	USA.5.42_1	Santa Barbara	2015-1-4	FALSE
1344662202	OBS289106613	CC0_1_0	Cornell Lab of Ornithology	CLO	EBIRD	EOD - eBird Observation Dataset	HUMAN_OBSERVATION	URN:catalog:CLO:EBIRD:OBS289106613	OBS289106613	obsr166679	1	PRESENT	1/4/15 0:00	2015	1	4	US	California	Santa Barbara	Coal Oil Point--Devereux Beach and Sands Beach	34.4071	-119.878	2481324	Cerorhinca monocerata (Pallas, 1811)	Animalia	Chordata	Aves	Charadriiformes	Alcidae	Cerorhinca	monocerata	SPECIES	Rhinoceros Auklet	ACCEPTED	4fa7b334-ce0d-4e88-aaae-2e0c138d049e	US	12/16/20 11:53	TRUE	FALSE	2481324	2481324	1	44	212	7192402	2985	2481323	2481324	Cerorhinca monocerata	Cerorhinca	Cerorhinca monocerata (Pallas, 1811)	Cerorhinca monocerata	DWC_ARCHIVE	12/16/20 11:53	6/30/20 8:20	FALSE	USA	United States	USA.5_1	California	USA.5.42_1	Santa Barbara	2015-1-4	FALSE
1344778504	OBS289328523	CC0_1_0	Cornell Lab of Ornithology	CLO	EBIRD	EOD - eBird Observation Dataset	HUMAN_OBSERVATION	URN:catalog:CLO:EBIRD:OBS289328523	OBS289328523	obsr273117	1	PRESENT	1/5/15 0:00	2015	1	5	US	California	Santa Barbara	Devereux Slough	34.4136	-119.876	2484340	Icterus galbula (Linnaeus, 1758)	Animalia	Chordata	Aves	Passeriformes	Icteridae	Icterus	galbula	SPECIES	Baltimore Oriole	ACCEPTED	4fa7b334-ce0d-4e88-aaae-2e0c138d049e	US	12/16/20 11:54	TRUE	FALSE	2484340	2484340	1	44	212	729	6176	2484282	2484340	Icterus galbula	Icterus	Icterus galbula (Linnaeus, 1758)	Icterus galbula	DWC_ARCHIVE	12/16/20 11:54	6/30/20 8:20	FALSE	USA	United States	USA.5_1	California	USA.5.42_1	Santa Barbara	2015-1-5	FALSE
1344990993	OBS289364149	CC0_1_0	Cornell Lab of Ornithology	CLO	EBIRD	EOD - eBird Observation Dataset	HUMAN_OBSERVATION	URN:catalog:CLO:EBIRD:OBS289364149	OBS289364149	obsr221434	1	PRESENT	1/5/15 0:00	2015	1	5	US	California	Santa Barbara	Devereux Slough	34.4136	-119.876	2484340	Icterus galbula (Linnaeus, 1758)	Animalia	Chordata	Aves	Passeriformes	Icteridae	Icterus	galbula	SPECIES	Baltimore Oriole	ACCEPTED	4fa7b334-ce0d-4e88-aaae-2e0c138d049e	US	12/16/20 12:03	TRUE	FALSE	2484340	2484340	1	44	212	729	6176	2484282	2484340	Icterus galbula	Icterus	Icterus galbula (Linnaeus, 1758)	Icterus galbula	DWC_ARCHIVE	12/16/20 12:03	6/30/20 8:20	FALSE	USA	United States	USA.5_1	California	USA.5.42_1	Santa Barbara	2015-1-5	FALSE
1393749841	OBS349602687	CC0_1_0	Cornell Lab of Ornithology	CLO	EBIRD	EOD - eBird Observation Dataset	HUMAN_OBSERVATION	URN:catalog:CLO:EBIRD:OBS349602687	OBS349602687	obsr324182	1	PRESENT	10/24/15 0:00	2015	10	24	US	California	Santa Barbara	Devereux Slough	34.4136	-119.876	2498387	Aix sponsa (Linnaeus, 1758)	Animalia	Chordata	Aves	Anseriformes	Anatidae	Aix	sponsa	SPECIES	Wood Duck	ACCEPTED	4fa7b334-ce0d-4e88-aaae-2e0c138d049e	US	12/16/20 12:03	TRUE	FALSE	2498387	2498387	1	44	212	1108	2986	2498386	2498387	Aix sponsa	Aix	Aix sponsa (Linnaeus, 1758)	Aix sponsa	DWC_ARCHIVE	12/16/20 12:03	6/30/20 8:20	FALSE	USA	United States	USA.5_1	California	USA.5.42_1	Santa Barbara	2015-10-24	FALSE
1397171660	OBS353309073	CC0_1_0	Cornell Lab of Ornithology	CLO	EBIRD	EOD - eBird Observation Dataset	HUMAN_OBSERVATION	URN:catalog:CLO:EBIRD:OBS353309073	OBS353309073	obsr420881	1	PRESENT	11/14/15 0:00	2015	11	14	US	California	Santa Barbara	Coal Oil Point--Devereux Beach and Sands Beach	34.4071	-119.878	5739277	Ardenna grisea (Gmelin, 1789)	Animalia	Chordata	Aves	Procellariiformes	Procellariidae	Puffinus	grisea	SPECIES	Sooty Shearwater	SYNONYM	4fa7b334-ce0d-4e88-aaae-2e0c138d049e	US	12/16/20 11:54	TRUE	FALSE	8249990	5739277	1	44	212	7192755	9339	5229335	5739277	Puffinus griseus	Ardenna	Puffinus griseus (Gmelin, 1789)	Ardenna grisea	DWC_ARCHIVE	12/16/20 11:54	6/30/20 8:20	FALSE	USA	United States	USA.5_1	California	USA.5.42_1	Santa Barbara	2015-11-14	TRUE
1932340917	17770690	CC_BY_NC_4_0	iNaturalist.org	iNaturalist	Observations	iNaturalist Research-grade Observations	HUMAN_OBSERVATION	https://www.inaturalist.org/observations/17770690	17770690	Tom Turner	NA	PRESENT	12/8/15 8:33	2015	12	8	US	California	NA	NA	34.41407	-119.876931	9537647	Mergus merganser Linnaeus, 1758	Animalia	Chordata	Aves	Anseriformes	Anatidae	Mergus	merganser	SPECIES	NA	ACCEPTED	50c9509d-22c7-4a22-a47d-8c48425ef4a7	US	2/21/21 5:10	TRUE	FALSE	9537647	9537647	1	44	212	1108	2986	2498368	9537647	Mergus merganser	Mergus	Mergus merganser Linnaeus, 1758	Mergus merganser	DWC_ARCHIVE	2/21/21 5:10	2/21/21 2:33	FALSE	USA	United States	USA.5_1	California	USA.5.42_1	Santa Barbara	2015-12-8	TRUE
1400988988	OBS357840314	CC0_1_0	Cornell Lab of Ornithology	CLO	EBIRD	EOD - eBird Observation Dataset	HUMAN_OBSERVATION	URN:catalog:CLO:EBIRD:OBS357840314	OBS357840314	obsr548926	1	PRESENT	12/8/15 0:00	2015	12	8	US	California	Santa Barbara	Devereux Slough	34.4136	-119.876	9537647	Mergus merganser Linnaeus, 1758	Animalia	Chordata	Aves	Anseriformes	Anatidae	Mergus	merganser	SPECIES	Common Merganser	ACCEPTED	4fa7b334-ce0d-4e88-aaae-2e0c138d049e	US	12/16/20 11:53	TRUE	FALSE	9537647	9537647	1	44	212	1108	2986	2498368	9537647	Mergus merganser	Mergus	Mergus merganser Linnaeus, 1758	Mergus merganser	DWC_ARCHIVE	12/16/20 11:53	6/30/20 8:20	FALSE	USA	United States	USA.5_1	California	USA.5.42_1	Santa Barbara	2015-12-8	TRUE
1401051949	OBS358213388	CC0_1_0	Cornell Lab of Ornithology	CLO	EBIRD	EOD - eBird Observation Dataset	HUMAN_OBSERVATION	URN:catalog:CLO:EBIRD:OBS358213388	OBS358213388	obsr625166	1	PRESENT	12/9/15 0:00	2015	12	9	US	California	Santa Barbara	Devereux Slough	34.4136	-119.876	9537647	Mergus merganser Linnaeus, 1758	Animalia	Chordata	Aves	Anseriformes	Anatidae	Mergus	merganser	SPECIES	Common Merganser	ACCEPTED	4fa7b334-ce0d-4e88-aaae-2e0c138d049e	US	12/16/20 12:04	TRUE	FALSE	9537647	9537647	1	44	212	1108	2986	2498368	9537647	Mergus merganser	Mergus	Mergus merganser Linnaeus, 1758	Mergus merganser	DWC_ARCHIVE	12/16/20 12:04	6/30/20 8:20	FALSE	USA	United States	USA.5_1	California	USA.5.42_1	Santa Barbara	2015-12-9	FALSE
1348290052	OBS294851783	CC0_1_0	Cornell Lab of Ornithology	CLO	EBIRD	EOD - eBird Observation Dataset	HUMAN_OBSERVATION	URN:catalog:CLO:EBIRD:OBS294851783	OBS294851783	obsr180058	1	PRESENT	2/2/15 0:00	2015	2	2	US	California	Santa Barbara	Coal Oil Point--Devereux Beach and Sands Beach	34.4071	-119.878	2481324	Cerorhinca monocerata (Pallas, 1811)	Animalia	Chordata	Aves	Charadriiformes	Alcidae	Cerorhinca	monocerata	SPECIES	Rhinoceros Auklet	ACCEPTED	4fa7b334-ce0d-4e88-aaae-2e0c138d049e	US	12/16/20 12:03	TRUE	FALSE	2481324	2481324	1	44	212	7192402	2985	2481323	2481324	Cerorhinca monocerata	Cerorhinca	Cerorhinca monocerata (Pallas, 1811)	Cerorhinca monocerata	DWC_ARCHIVE	12/16/20 12:03	6/30/20 8:20	FALSE	USA	United States	USA.5_1	California	USA.5.42_1	Santa Barbara	2015-2-2	FALSE
1351707679	OBS299061933	CC0_1_0	Cornell Lab of Ornithology	CLO	EBIRD	EOD - eBird Observation Dataset	HUMAN_OBSERVATION	URN:catalog:CLO:EBIRD:OBS299061933	OBS299061933	obsr306119	1	PRESENT	2/21/15 0:00	2015	2	21	US	California	Santa Barbara	Devereux Slough	34.4136	-119.876	5229390	Phalaropus fulicarius (Linnaeus, 1758)	Animalia	Chordata	Aves	Charadriiformes	Scolopacidae	Phalaropus	fulicarius	SPECIES	Red Phalarope	ACCEPTED	4fa7b334-ce0d-4e88-aaae-2e0c138d049e	US	12/16/20 11:52	TRUE	FALSE	5229390	5229390	1	44	212	7192402	5282	7237089	5229390	Phalaropus fulicarius	Phalaropus	Phalaropus fulicarius (Linnaeus, 1758)	Phalaropus fulicarius	DWC_ARCHIVE	12/16/20 11:52	6/30/20 8:20	FALSE	USA	United States	USA.5_1	California	USA.5.42_1	Santa Barbara	2015-2-21	FALSE
1351707695	OBS299061908	CC0_1_0	Cornell Lab of Ornithology	CLO	EBIRD	EOD - eBird Observation Dataset	HUMAN_OBSERVATION	URN:catalog:CLO:EBIRD:OBS299061908	OBS299061908	obsr306119	1	PRESENT	2/21/15 0:00	2015	2	21	US	California	Santa Barbara	Devereux Slough	34.4136	-119.876	7531611	Leiothlypis ruficapilla (A.Wilson, 1811)	Animalia	Chordata	Aves	Passeriformes	Parulidae	Leiothlypis	ruficapilla	SPECIES	Nashville Warbler	ACCEPTED	4fa7b334-ce0d-4e88-aaae-2e0c138d049e	US	12/16/20 12:03	TRUE	FALSE	7531611	7531611	1	44	212	729	5263	7467942	7531611	Leiothlypis ruficapilla	Leiothlypis	Leiothlypis ruficapilla (A.Wilson, 1811)	Leiothlypis ruficapilla	DWC_ARCHIVE	12/16/20 12:03	6/30/20 8:20	FALSE	USA	United States	USA.5_1	California	USA.5.42_1	Santa Barbara	2015-2-21	FALSE
1352043689	OBS299847083	CC0_1_0	Cornell Lab of Ornithology	CLO	EBIRD	EOD - eBird Observation Dataset	HUMAN_OBSERVATION	URN:catalog:CLO:EBIRD:OBS299847083	OBS299847083	obsr282891	1	PRESENT	2/27/15 0:00	2015	2	27	US	California	Santa Barbara	Devereux Slough	34.4136	-119.876	7531611	Leiothlypis ruficapilla (A.Wilson, 1811)	Animalia	Chordata	Aves	Passeriformes	Parulidae	Leiothlypis	ruficapilla	SPECIES	Nashville Warbler	ACCEPTED	4fa7b334-ce0d-4e88-aaae-2e0c138d049e	US	12/16/20 12:03	TRUE	FALSE	7531611	7531611	1	44	212	729	5263	7467942	7531611	Leiothlypis ruficapilla	Leiothlypis	Leiothlypis ruficapilla (A.Wilson, 1811)	Leiothlypis ruficapilla	DWC_ARCHIVE	12/16/20 12:03	6/30/20 8:20	FALSE	USA	United States	USA.5_1	California	USA.5.42_1	Santa Barbara	2015-2-27	FALSE
1352052968	OBS299836850	CC0_1_0	Cornell Lab of Ornithology	CLO	EBIRD	EOD - eBird Observation Dataset	HUMAN_OBSERVATION	URN:catalog:CLO:EBIRD:OBS299836850	OBS299836850	obsr548926	1	PRESENT	2/27/15 0:00	2015	2	27	US	California	Santa Barbara	Devereux Slough	34.4136	-119.876	7531611	Leiothlypis ruficapilla (A.Wilson, 1811)	Animalia	Chordata	Aves	Passeriformes	Parulidae	Leiothlypis	ruficapilla	SPECIES	Nashville Warbler	ACCEPTED	4fa7b334-ce0d-4e88-aaae-2e0c138d049e	US	12/16/20 11:52	TRUE	FALSE	7531611	7531611	1	44	212	729	5263	7467942	7531611	Leiothlypis ruficapilla	Leiothlypis	Leiothlypis ruficapilla (A.Wilson, 1811)	Leiothlypis ruficapilla	DWC_ARCHIVE	12/16/20 11:52	6/30/20 8:20	FALSE	USA	United States	USA.5_1	California	USA.5.42_1	Santa Barbara	2015-2-27	TRUE
1352330838	OBS300123117	CC0_1_0	Cornell Lab of Ornithology	CLO	EBIRD	EOD - eBird Observation Dataset	HUMAN_OBSERVATION	URN:catalog:CLO:EBIRD:OBS300123117	OBS300123117	obsr243067	2	PRESENT	2/28/15 0:00	2015	2	28	US	California	Santa Barbara	Devereux Slough	34.4136	-119.876	5231635	Spinus pinus (A.Wilson, 1810)	Animalia	Chordata	Aves	Passeriformes	Fringillidae	Spinus	pinus	SPECIES	Pine Siskin	ACCEPTED	4fa7b334-ce0d-4e88-aaae-2e0c138d049e	US	12/16/20 11:54	TRUE	FALSE	5231635	5231635	1	44	212	729	5242	8051475	5231635	Spinus pinus	Spinus	Spinus pinus (A.Wilson, 1810)	Spinus pinus	DWC_ARCHIVE	12/16/20 11:54	6/30/20 8:20	FALSE	USA	United States	USA.5_1	California	USA.5.42_1	Santa Barbara	2015-2-28	FALSE
1352727413	OBS300666745	CC0_1_0	Cornell Lab of Ornithology	CLO	EBIRD	EOD - eBird Observation Dataset	HUMAN_OBSERVATION	URN:catalog:CLO:EBIRD:OBS300666745	OBS300666745	obsr309446	2	PRESENT	2/28/15 0:00	2015	2	28	US	California	Santa Barbara	Devereux Slough	34.4136	-119.876	5231635	Spinus pinus (A.Wilson, 1810)	Animalia	Chordata	Aves	Passeriformes	Fringillidae	Spinus	pinus	SPECIES	Pine Siskin	ACCEPTED	4fa7b334-ce0d-4e88-aaae-2e0c138d049e	US	12/16/20 12:13	TRUE	FALSE	5231635	5231635	1	44	212	729	5242	8051475	5231635	Spinus pinus	Spinus	Spinus pinus (A.Wilson, 1810)	Spinus pinus	DWC_ARCHIVE	12/16/20 12:13	6/30/20 8:20	FALSE	USA	United States	USA.5_1	California	USA.5.42_1	Santa Barbara	2015-2-28	FALSE
1352630370	OBS300608570	CC0_1_0	Cornell Lab of Ornithology	CLO	EBIRD	EOD - eBird Observation Dataset	HUMAN_OBSERVATION	URN:catalog:CLO:EBIRD:OBS300608570	OBS300608570	obsr111092	2	PRESENT	2/28/15 0:00	2015	2	28	US	California	Santa Barbara	Devereux Slough	34.4136	-119.876	5231635	Spinus pinus (A.Wilson, 1810)	Animalia	Chordata	Aves	Passeriformes	Fringillidae	Spinus	pinus	SPECIES	Pine Siskin	ACCEPTED	4fa7b334-ce0d-4e88-aaae-2e0c138d049e	US	12/16/20 12:03	TRUE	FALSE	5231635	5231635	1	44	212	729	5242	8051475	5231635	Spinus pinus	Spinus	Spinus pinus (A.Wilson, 1810)	Spinus pinus	DWC_ARCHIVE	12/16/20 12:03	6/30/20 8:20	FALSE	USA	United States	USA.5_1	California	USA.5.42_1	Santa Barbara	2015-2-28	TRUE
2673009822	OBS730574764	CC0_1_0	Cornell Lab of Ornithology	CLO	EBIRD	EOD - eBird Observation Dataset	HUMAN_OBSERVATION	URN:catalog:CLO:EBIRD:OBS730574764	OBS730574764	obsr620833	NA	PRESENT	4/15/15 0:00	2015	4	15	US	California	Santa Barbara	Devereux Slough	34.4136	-119.876	5231483	Salpinctes obsoletus (Say, 1822)	Animalia	Chordata	Aves	Passeriformes	Troglodytidae	Salpinctes	obsoletus	SPECIES	Rock Wren	ACCEPTED	4fa7b334-ce0d-4e88-aaae-2e0c138d049e	US	12/16/20 11:57	TRUE	FALSE	5231483	5231483	1	44	212	729	9355	2493947	5231483	Salpinctes obsoletus	Salpinctes	Salpinctes obsoletus (Say, 1822)	Salpinctes obsoletus	DWC_ARCHIVE	12/16/20 11:57	6/30/20 8:20	FALSE	USA	United States	USA.5_1	California	USA.5.42_1	Santa Barbara	2015-4-15	FALSE
1361428476	OBS311877938	CC0_1_0	Cornell Lab of Ornithology	CLO	EBIRD	EOD - eBird Observation Dataset	HUMAN_OBSERVATION	URN:catalog:CLO:EBIRD:OBS311877938	OBS311877938	obsr337176	1	PRESENT	4/21/15 0:00	2015	4	21	US	California	Santa Barbara	Devereux Slough	34.4136	-119.876	2474953	Antigone canadensis (Linnaeus, 1758)	Animalia	Chordata	Aves	Gruiformes	Gruidae	Grus	canadensis	SPECIES	Sandhill Crane	SYNONYM	4fa7b334-ce0d-4e88-aaae-2e0c138d049e	US	12/16/20 12:03	TRUE	FALSE	9036008	2474953	1	44	212	1493	9313	2474940	2474953	Grus canadensis	Antigone	Grus canadensis (Linnaeus, 1758)	Antigone canadensis	DWC_ARCHIVE	12/16/20 12:03	6/30/20 8:20	FALSE	USA	United States	USA.5_1	California	USA.5.42_1	Santa Barbara	2015-4-21	FALSE
1361548075	OBS312074115	CC0_1_0	Cornell Lab of Ornithology	CLO	EBIRD	EOD - eBird Observation Dataset	HUMAN_OBSERVATION	URN:catalog:CLO:EBIRD:OBS312074115	OBS312074115	obsr282891	1	PRESENT	4/21/15 0:00	2015	4	21	US	California	Santa Barbara	Devereux Slough	34.4136	-119.876	2474953	Antigone canadensis (Linnaeus, 1758)	Animalia	Chordata	Aves	Gruiformes	Gruidae	Grus	canadensis	SPECIES	Sandhill Crane	SYNONYM	4fa7b334-ce0d-4e88-aaae-2e0c138d049e	US	12/16/20 12:01	TRUE	FALSE	9036008	2474953	1	44	212	1493	9313	2474940	2474953	Grus canadensis	Antigone	Grus canadensis (Linnaeus, 1758)	Antigone canadensis	DWC_ARCHIVE	12/16/20 12:01	6/30/20 8:20	FALSE	USA	United States	USA.5_1	California	USA.5.42_1	Santa Barbara	2015-4-21	FALSE
1361414075	OBS311841720	CC0_1_0	Cornell Lab of Ornithology	CLO	EBIRD	EOD - eBird Observation Dataset	HUMAN_OBSERVATION	URN:catalog:CLO:EBIRD:OBS311841720	OBS311841720	obsr543588	1	PRESENT	4/21/15 0:00	2015	4	21	US	California	Santa Barbara	Devereux Slough	34.4136	-119.876	2474953	Antigone canadensis (Linnaeus, 1758)	Animalia	Chordata	Aves	Gruiformes	Gruidae	Grus	canadensis	SPECIES	Sandhill Crane	SYNONYM	4fa7b334-ce0d-4e88-aaae-2e0c138d049e	US	12/16/20 11:53	TRUE	FALSE	9036008	2474953	1	44	212	1493	9313	2474940	2474953	Grus canadensis	Antigone	Grus canadensis (Linnaeus, 1758)	Antigone canadensis	DWC_ARCHIVE	12/16/20 11:53	6/30/20 8:20	FALSE	USA	United States	USA.5_1	California	USA.5.42_1	Santa Barbara	2015-4-21	FALSE
1361410752	OBS311826916	CC0_1_0	Cornell Lab of Ornithology	CLO	EBIRD	EOD - eBird Observation Dataset	HUMAN_OBSERVATION	URN:catalog:CLO:EBIRD:OBS311826916	OBS311826916	obsr302151	1	PRESENT	4/21/15 0:00	2015	4	21	US	California	Santa Barbara	Devereux Slough	34.4136	-119.876	2474953	Antigone canadensis (Linnaeus, 1758)	Animalia	Chordata	Aves	Gruiformes	Gruidae	Grus	canadensis	SPECIES	Sandhill Crane	SYNONYM	4fa7b334-ce0d-4e88-aaae-2e0c138d049e	US	12/16/20 12:03	TRUE	FALSE	9036008	2474953	1	44	212	1493	9313	2474940	2474953	Grus canadensis	Antigone	Grus canadensis (Linnaeus, 1758)	Antigone canadensis	DWC_ARCHIVE	12/16/20 12:03	6/30/20 8:20	FALSE	USA	United States	USA.5_1	California	USA.5.42_1	Santa Barbara	2015-4-21	TRUE
1361345601	OBS311818904	CC0_1_0	Cornell Lab of Ornithology	CLO	EBIRD	EOD - eBird Observation Dataset	HUMAN_OBSERVATION	URN:catalog:CLO:EBIRD:OBS311818904	OBS311818904	obsr548926	1	PRESENT	4/21/15 0:00	2015	4	21	US	California	Santa Barbara	Devereux Slough	34.4136	-119.876	2474953	Antigone canadensis (Linnaeus, 1758)	Animalia	Chordata	Aves	Gruiformes	Gruidae	Grus	canadensis	SPECIES	Sandhill Crane	SYNONYM	4fa7b334-ce0d-4e88-aaae-2e0c138d049e	US	12/16/20 12:04	TRUE	FALSE	9036008	2474953	1	44	212	1493	9313	2474940	2474953	Grus canadensis	Antigone	Grus canadensis (Linnaeus, 1758)	Antigone canadensis	DWC_ARCHIVE	12/16/20 12:04	6/30/20 8:20	FALSE	USA	United States	USA.5_1	California	USA.5.42_1	Santa Barbara	2015-4-21	TRUE
1364502552	OBS315406441	CC0_1_0	Cornell Lab of Ornithology	CLO	EBIRD	EOD - eBird Observation Dataset	HUMAN_OBSERVATION	URN:catalog:CLO:EBIRD:OBS315406441	OBS315406441	obsr251355	1	PRESENT	5/3/15 0:00	2015	5	3	US	California	Santa Barbara	Devereux Slough	34.4136	-119.876	7597244	Selasphorus calliope	Animalia	Chordata	Aves	Apodiformes	Trochilidae	Selasphorus	calliope	SPECIES	Calliope Hummingbird	ACCEPTED	4fa7b334-ce0d-4e88-aaae-2e0c138d049e	US	12/16/20 12:15	TRUE	FALSE	7597244	7597244	1	44	212	1448	5289	2476843	7597244	Selasphorus calliope	Selasphorus	Selasphorus calliope	Selasphorus calliope	DWC_ARCHIVE	12/16/20 12:15	6/30/20 8:20	FALSE	USA	United States	USA.5_1	California	USA.5.42_1	Santa Barbara	2015-5-3	FALSE
1364628293	OBS315548332	CC0_1_0	Cornell Lab of Ornithology	CLO	EBIRD	EOD - eBird Observation Dataset	HUMAN_OBSERVATION	URN:catalog:CLO:EBIRD:OBS315548332	OBS315548332	obsr548926	2	PRESENT	5/3/15 0:00	2015	5	3	US	California	Santa Barbara	Devereux Slough	34.4136	-119.876	7597244	Selasphorus calliope	Animalia	Chordata	Aves	Apodiformes	Trochilidae	Selasphorus	calliope	SPECIES	Calliope Hummingbird	ACCEPTED	4fa7b334-ce0d-4e88-aaae-2e0c138d049e	US	12/16/20 12:02	TRUE	FALSE	7597244	7597244	1	44	212	1448	5289	2476843	7597244	Selasphorus calliope	Selasphorus	Selasphorus calliope	Selasphorus calliope	DWC_ARCHIVE	12/16/20 12:02	6/30/20 8:20	FALSE	USA	United States	USA.5_1	California	USA.5.42_1	Santa Barbara	2015-5-3	TRUE
1372825728	OBS325427601	CC0_1_0	Cornell Lab of Ornithology	CLO	EBIRD	EOD - eBird Observation Dataset	HUMAN_OBSERVATION	URN:catalog:CLO:EBIRD:OBS325427601	OBS325427601	obsr184473	1	PRESENT	6/6/15 0:00	2015	6	6	US	California	Santa Barbara	Devereux Slough	34.4136	-119.876	2481764	Calidris pusilla (Linnaeus, 1766)	Animalia	Chordata	Aves	Charadriiformes	Scolopacidae	Calidris	pusilla	SPECIES	Semipalmated Sandpiper	ACCEPTED	4fa7b334-ce0d-4e88-aaae-2e0c138d049e	US	12/16/20 12:04	TRUE	FALSE	2481764	2481764	1	44	212	7192402	5282	2481739	2481764	Calidris pusilla	Calidris	Calidris pusilla (Linnaeus, 1766)	Calidris pusilla	DWC_ARCHIVE	12/16/20 12:04	6/30/20 8:20	FALSE	USA	United States	USA.5_1	California	USA.5.42_1	Santa Barbara	2015-6-6	FALSE
1378203460	OBS332410544	CC0_1_0	Cornell Lab of Ornithology	CLO	EBIRD	EOD - eBird Observation Dataset	HUMAN_OBSERVATION	URN:catalog:CLO:EBIRD:OBS332410544	OBS332410544	obsr272147	1	PRESENT	7/19/15 0:00	2015	7	19	US	California	Santa Barbara	Devereux Slough	34.4136	-119.876	5228513	Archilochus alexandri (Bourcier & Mulsant, 1846)	Animalia	Chordata	Aves	Apodiformes	Trochilidae	Archilochus	alexandri	SPECIES	Black-chinned Hummingbird	ACCEPTED	4fa7b334-ce0d-4e88-aaae-2e0c138d049e	US	12/16/20 12:04	TRUE	FALSE	5228513	5228513	1	44	212	1448	5289	2476402	5228513	Archilochus alexandri	Archilochus	Archilochus alexandri (Bourcier & Mulsant, 1846)	Archilochus alexandri	DWC_ARCHIVE	12/16/20 12:04	6/30/20 8:20	FALSE	USA	United States	USA.5_1	California	USA.5.42_1	Santa Barbara	2015-7-19	FALSE
1376632888	OBS330160082	CC0_1_0	Cornell Lab of Ornithology	CLO	EBIRD	EOD - eBird Observation Dataset	HUMAN_OBSERVATION	URN:catalog:CLO:EBIRD:OBS330160082	OBS330160082	obsr51183	1	PRESENT	7/4/15 0:00	2015	7	4	US	California	Santa Barbara	Devereux Slough	34.4136	-119.876	5228513	Archilochus alexandri (Bourcier & Mulsant, 1846)	Animalia	Chordata	Aves	Apodiformes	Trochilidae	Archilochus	alexandri	SPECIES	Black-chinned Hummingbird	ACCEPTED	4fa7b334-ce0d-4e88-aaae-2e0c138d049e	US	12/16/20 11:53	TRUE	FALSE	5228513	5228513	1	44	212	1448	5289	2476402	5228513	Archilochus alexandri	Archilochus	Archilochus alexandri (Bourcier & Mulsant, 1846)	Archilochus alexandri	DWC_ARCHIVE	12/16/20 11:53	6/30/20 8:20	FALSE	USA	United States	USA.5_1	California	USA.5.42_1	Santa Barbara	2015-7-4	TRUE
1377163494	OBS331018457	CC0_1_0	Cornell Lab of Ornithology	CLO	EBIRD	EOD - eBird Observation Dataset	HUMAN_OBSERVATION	URN:catalog:CLO:EBIRD:OBS331018457	OBS331018457	obsr298922	7	PRESENT	7/9/15 0:00	2015	7	9	US	California	Santa Barbara	Devereux Slough	34.4136	-119.876	5739277	Ardenna grisea (Gmelin, 1789)	Animalia	Chordata	Aves	Procellariiformes	Procellariidae	Puffinus	grisea	SPECIES	Sooty Shearwater	SYNONYM	4fa7b334-ce0d-4e88-aaae-2e0c138d049e	US	12/16/20 12:05	TRUE	FALSE	8249990	5739277	1	44	212	7192755	9339	5229335	5739277	Puffinus griseus	Ardenna	Puffinus griseus (Gmelin, 1789)	Ardenna grisea	DWC_ARCHIVE	12/16/20 12:05	6/30/20 8:20	FALSE	USA	United States	USA.5_1	California	USA.5.42_1	Santa Barbara	2015-7-9	FALSE
1710931989	OBS366783389	CC0_1_0	Cornell Lab of Ornithology	CLO	EBIRD	EOD - eBird Observation Dataset	HUMAN_OBSERVATION	URN:catalog:CLO:EBIRD:OBS366783389	OBS366783389	obsr420881	1	PRESENT	1/17/16 0:00	2016	1	17	US	California	Santa Barbara	Coal Oil Point--Devereux Beach and Sands Beach	34.4071	-119.878	5739277	Ardenna grisea (Gmelin, 1789)	Animalia	Chordata	Aves	Procellariiformes	Procellariidae	Puffinus	grisea	SPECIES	Sooty Shearwater	SYNONYM	4fa7b334-ce0d-4e88-aaae-2e0c138d049e	US	12/16/20 11:53	TRUE	FALSE	8249990	5739277	1	44	212	7192755	9339	5229335	5739277	Puffinus griseus	Ardenna	Puffinus griseus (Gmelin, 1789)	Ardenna grisea	DWC_ARCHIVE	12/16/20 11:53	6/30/20 8:20	FALSE	USA	United States	USA.5_1	California	USA.5.42_1	Santa Barbara	2016-1-17	TRUE
1708331805	OBS363077274	CC0_1_0	Cornell Lab of Ornithology	CLO	EBIRD	EOD - eBird Observation Dataset	HUMAN_OBSERVATION	URN:catalog:CLO:EBIRD:OBS363077274	OBS363077274	obsr53921	1	PRESENT	1/2/16 0:00	2016	1	2	US	California	Santa Barbara	Devereux Slough	34.4136	-119.876	2491872	Passerella iliaca (Merrem, 1786)	Animalia	Chordata	Aves	Passeriformes	Emberizidae	Passerella	iliaca	SPECIES	Fox Sparrow	ACCEPTED	4fa7b334-ce0d-4e88-aaae-2e0c138d049e	US	12/16/20 11:54	TRUE	FALSE	2491872	2491872	1	44	212	729	9608	2491871	2491872	Passerella iliaca	Passerella	Passerella iliaca (Merrem, 1786)	Passerella iliaca	DWC_ARCHIVE	12/16/20 11:54	6/30/20 8:20	FALSE	USA	United States	USA.5_1	California	USA.5.42_1	Santa Barbara	2016-1-2	FALSE
1708283848	OBS363004442	CC0_1_0	Cornell Lab of Ornithology	CLO	EBIRD	EOD - eBird Observation Dataset	HUMAN_OBSERVATION	URN:catalog:CLO:EBIRD:OBS363004442	OBS363004442	obsr53921	1	PRESENT	1/2/16 0:00	2016	1	2	US	California	Santa Barbara	Coal Oil Point--Devereux Beach and Sands Beach	34.4071	-119.878	2481324	Cerorhinca monocerata (Pallas, 1811)	Animalia	Chordata	Aves	Charadriiformes	Alcidae	Cerorhinca	monocerata	SPECIES	Rhinoceros Auklet	ACCEPTED	4fa7b334-ce0d-4e88-aaae-2e0c138d049e	US	12/16/20 12:03	TRUE	FALSE	2481324	2481324	1	44	212	7192402	2985	2481323	2481324	Cerorhinca monocerata	Cerorhinca	Cerorhinca monocerata (Pallas, 1811)	Cerorhinca monocerata	DWC_ARCHIVE	12/16/20 12:03	6/30/20 8:20	FALSE	USA	United States	USA.5_1	California	USA.5.42_1	Santa Barbara	2016-1-2	FALSE
1709410901	OBS364725176	CC0_1_0	Cornell Lab of Ornithology	CLO	EBIRD	EOD - eBird Observation Dataset	HUMAN_OBSERVATION	URN:catalog:CLO:EBIRD:OBS364725176	OBS364725176	obsr429742	1	PRESENT	1/2/16 0:00	2016	1	2	US	California	Santa Barbara	Coal Oil Point Reserve	34.4095	-119.881	2492109	Spizella passerina (Bechstein, 1798)	Animalia	Chordata	Aves	Passeriformes	Emberizidae	Spizella	passerina	SPECIES	Chipping Sparrow	ACCEPTED	4fa7b334-ce0d-4e88-aaae-2e0c138d049e	US	12/16/20 12:04	TRUE	FALSE	2492109	2492109	1	44	212	729	9608	2492093	2492109	Spizella passerina	Spizella	Spizella passerina (Bechstein, 1798)	Spizella passerina	DWC_ARCHIVE	12/16/20 12:04	6/30/20 8:20	FALSE	NA	NA	NA	NA	NA	NA	2016-1-2	FALSE
1708182209	OBS362859512	CC0_1_0	Cornell Lab of Ornithology	CLO	EBIRD	EOD - eBird Observation Dataset	HUMAN_OBSERVATION	URN:catalog:CLO:EBIRD:OBS362859512	OBS362859512	obsr548926	1	PRESENT	1/2/16 0:00	2016	1	2	US	California	Santa Barbara	Devereux Slough	34.4136	-119.876	2491872	Passerella iliaca (Merrem, 1786)	Animalia	Chordata	Aves	Passeriformes	Emberizidae	Passerella	iliaca	SPECIES	Fox Sparrow	ACCEPTED	4fa7b334-ce0d-4e88-aaae-2e0c138d049e	US	12/16/20 12:03	TRUE	FALSE	2491872	2491872	1	44	212	729	9608	2491871	2491872	Passerella iliaca	Passerella	Passerella iliaca (Merrem, 1786)	Passerella iliaca	DWC_ARCHIVE	12/16/20 12:03	6/30/20 8:20	FALSE	USA	United States	USA.5_1	California	USA.5.42_1	Santa Barbara	2016-1-2	TRUE
1713297540	OBS370635195	CC0_1_0	Cornell Lab of Ornithology	CLO	EBIRD	EOD - eBird Observation Dataset	HUMAN_OBSERVATION	URN:catalog:CLO:EBIRD:OBS370635195	OBS370635195	obsr689353	1	PRESENT	1/25/16 0:00	2016	1	25	US	California	Santa Barbara	Devereux Slough	34.4136	-119.876	2481000	Falco mexicanus Schlegel, 1850	Animalia	Chordata	Aves	Falconiformes	Falconidae	Falco	mexicanus	SPECIES	Prairie Falcon	ACCEPTED	4fa7b334-ce0d-4e88-aaae-2e0c138d049e	US	12/16/20 11:53	TRUE	FALSE	2481000	2481000	1	44	212	7191407	5240	2480996	2481000	Falco mexicanus	Falco	Falco mexicanus Schlegel, 1850	Falco mexicanus	DWC_ARCHIVE	12/16/20 11:53	6/30/20 8:20	FALSE	USA	United States	USA.5_1	California	USA.5.42_1	Santa Barbara	2016-1-25	FALSE
1712092309	OBS368710261	CC0_1_0	Cornell Lab of Ornithology	CLO	EBIRD	EOD - eBird Observation Dataset	HUMAN_OBSERVATION	URN:catalog:CLO:EBIRD:OBS368710261	OBS368710261	obsr111092	1	PRESENT	1/25/16 0:00	2016	1	25	US	California	Santa Barbara	Devereux Slough	34.4136	-119.876	2481000	Falco mexicanus Schlegel, 1850	Animalia	Chordata	Aves	Falconiformes	Falconidae	Falco	mexicanus	SPECIES	Prairie Falcon	ACCEPTED	4fa7b334-ce0d-4e88-aaae-2e0c138d049e	US	12/16/20 12:05	TRUE	FALSE	2481000	2481000	1	44	212	7191407	5240	2480996	2481000	Falco mexicanus	Falco	Falco mexicanus Schlegel, 1850	Falco mexicanus	DWC_ARCHIVE	12/16/20 12:05	6/30/20 8:20	FALSE	USA	United States	USA.5_1	California	USA.5.42_1	Santa Barbara	2016-1-25	TRUE
1712716521	OBS369853270	CC0_1_0	Cornell Lab of Ornithology	CLO	EBIRD	EOD - eBird Observation Dataset	HUMAN_OBSERVATION	URN:catalog:CLO:EBIRD:OBS369853270	OBS369853270	obsr335700	2	PRESENT	1/30/16 0:00	2016	1	30	US	California	Santa Barbara	Devereux Slough	34.4136	-119.876	2498326	Bucephala clangula (Linnaeus, 1758)	Animalia	Chordata	Aves	Anseriformes	Anatidae	Bucephala	clangula	SPECIES	Common Goldeneye	ACCEPTED	4fa7b334-ce0d-4e88-aaae-2e0c138d049e	US	12/16/20 11:54	TRUE	FALSE	2498326	2498326	1	44	212	1108	2986	2498324	2498326	Bucephala clangula	Bucephala	Bucephala clangula (Linnaeus, 1758)	Bucephala clangula	DWC_ARCHIVE	12/16/20 11:54	6/30/20 8:20	FALSE	USA	United States	USA.5_1	California	USA.5.42_1	Santa Barbara	2016-1-30	FALSE
1766055807	OBS434910688	CC0_1_0	Cornell Lab of Ornithology	CLO	EBIRD	EOD - eBird Observation Dataset	HUMAN_OBSERVATION	URN:catalog:CLO:EBIRD:OBS434910688	OBS434910688	obsr687919	1	PRESENT	10/8/16 0:00	2016	10	8	US	California	Santa Barbara	Coal Oil Point--Devereux Beach and Sands Beach	34.4071	-119.878	5231643	Spinus lawrencei (Cassin, 1850)	Animalia	Chordata	Aves	Passeriformes	Fringillidae	Spinus	lawrencei	SPECIES	Lawrence's Goldfinch	ACCEPTED	4fa7b334-ce0d-4e88-aaae-2e0c138d049e	US	12/16/20 11:54	TRUE	FALSE	5231643	5231643	1	44	212	729	5242	8051475	5231643	Spinus lawrencei	Spinus	Spinus lawrencei (Cassin, 1850)	Spinus lawrencei	DWC_ARCHIVE	12/16/20 11:54	6/30/20 8:20	FALSE	USA	United States	USA.5_1	California	USA.5.42_1	Santa Barbara	2016-10-8	FALSE
1775683342	OBS445334733	CC0_1_0	Cornell Lab of Ornithology	CLO	EBIRD	EOD - eBird Observation Dataset	HUMAN_OBSERVATION	URN:catalog:CLO:EBIRD:OBS445334733	OBS445334733	obsr230614	1	PRESENT	11/25/16 0:00	2016	11	25	US	California	Santa Barbara	Devereux Slough	34.4136	-119.876	2498160	Anser rossii Cassin, 1861	Animalia	Chordata	Aves	Anseriformes	Anatidae	Chen	rossii	SPECIES	Ross's Goose	SYNONYM	4fa7b334-ce0d-4e88-aaae-2e0c138d049e	US	12/16/20 11:55	TRUE	FALSE	2498161	2498160	1	44	212	1108	2986	2498159	2498160	Chen rossii	Anser	Chen rossii (Cassin, 1861)	Anser rossii	DWC_ARCHIVE	12/16/20 11:55	6/30/20 8:20	FALSE	USA	United States	USA.5_1	California	USA.5.42_1	Santa Barbara	2016-11-25	FALSE
1776282601	OBS446192015	CC0_1_0	Cornell Lab of Ornithology	CLO	EBIRD	EOD - eBird Observation Dataset	HUMAN_OBSERVATION	URN:catalog:CLO:EBIRD:OBS446192015	OBS446192015	obsr403183	1	PRESENT	11/29/16 0:00	2016	11	29	US	California	Santa Barbara	West Campus UCSB	34.4132	-119.88	2488485	Piranga rubra (Linnaeus, 1758)	Animalia	Chordata	Aves	Passeriformes	Cardinalidae	Piranga	rubra	SPECIES	Summer Tanager	ACCEPTED	4fa7b334-ce0d-4e88-aaae-2e0c138d049e	US	12/16/20 11:55	TRUE	FALSE	2488485	2488485	1	44	212	729	9285	2488483	2488485	Piranga rubra	Piranga	Piranga rubra (Linnaeus, 1758)	Piranga rubra	DWC_ARCHIVE	12/16/20 11:55	6/30/20 8:20	FALSE	USA	United States	USA.5_1	California	USA.5.42_1	Santa Barbara	2016-11-29	FALSE
1778400944	OBS448776427	CC0_1_0	Cornell Lab of Ornithology	CLO	EBIRD	EOD - eBird Observation Dataset	HUMAN_OBSERVATION	URN:catalog:CLO:EBIRD:OBS448776427	OBS448776427	obsr548926	2	PRESENT	12/12/16 0:00	2016	12	12	US	California	Santa Barbara	Devereux Slough	34.4136	-119.876	2498160	Anser rossii Cassin, 1861	Animalia	Chordata	Aves	Anseriformes	Anatidae	Chen	rossii	SPECIES	Ross's Goose	SYNONYM	4fa7b334-ce0d-4e88-aaae-2e0c138d049e	US	12/16/20 12:05	TRUE	FALSE	2498161	2498160	1	44	212	1108	2986	2498159	2498160	Chen rossii	Anser	Chen rossii (Cassin, 1861)	Anser rossii	DWC_ARCHIVE	12/16/20 12:05	6/30/20 8:20	FALSE	USA	United States	USA.5_1	California	USA.5.42_1	Santa Barbara	2016-12-12	TRUE
1780516908	OBS450957218	CC0_1_0	Cornell Lab of Ornithology	CLO	EBIRD	EOD - eBird Observation Dataset	HUMAN_OBSERVATION	URN:catalog:CLO:EBIRD:OBS450957218	OBS450957218	obsr302151	2	PRESENT	12/23/16 0:00	2016	12	23	US	California	Santa Barbara	Devereux Slough	34.4136	-119.876	2498160	Anser rossii Cassin, 1861	Animalia	Chordata	Aves	Anseriformes	Anatidae	Chen	rossii	SPECIES	Ross's Goose	SYNONYM	4fa7b334-ce0d-4e88-aaae-2e0c138d049e	US	12/16/20 12:15	TRUE	FALSE	2498161	2498160	1	44	212	1108	2986	2498159	2498160	Chen rossii	Anser	Chen rossii (Cassin, 1861)	Anser rossii	DWC_ARCHIVE	12/16/20 12:15	6/30/20 8:20	FALSE	USA	United States	USA.5_1	California	USA.5.42_1	Santa Barbara	2016-12-23	TRUE
1782204152	OBS452904914	CC0_1_0	Cornell Lab of Ornithology	CLO	EBIRD	EOD - eBird Observation Dataset	HUMAN_OBSERVATION	URN:catalog:CLO:EBIRD:OBS452904914	OBS452904914	obsr287371	3	PRESENT	12/28/16 0:00	2016	12	28	US	California	Santa Barbara	Devereux Slough	34.4136	-119.876	2498160	Anser rossii Cassin, 1861	Animalia	Chordata	Aves	Anseriformes	Anatidae	Chen	rossii	SPECIES	Ross's Goose	SYNONYM	4fa7b334-ce0d-4e88-aaae-2e0c138d049e	US	12/16/20 11:56	TRUE	FALSE	2498161	2498160	1	44	212	1108	2986	2498159	2498160	Chen rossii	Anser	Chen rossii (Cassin, 1861)	Anser rossii	DWC_ARCHIVE	12/16/20 11:56	6/30/20 8:20	FALSE	USA	United States	USA.5_1	California	USA.5.42_1	Santa Barbara	2016-12-28	FALSE
1781421616	OBS452196456	CC0_1_0	Cornell Lab of Ornithology	CLO	EBIRD	EOD - eBird Observation Dataset	HUMAN_OBSERVATION	URN:catalog:CLO:EBIRD:OBS452196456	OBS452196456	obsr276156	3	PRESENT	12/28/16 0:00	2016	12	28	US	California	Santa Barbara	Devereux Slough	34.4136	-119.876	2498160	Anser rossii Cassin, 1861	Animalia	Chordata	Aves	Anseriformes	Anatidae	Chen	rossii	SPECIES	Ross's Goose	SYNONYM	4fa7b334-ce0d-4e88-aaae-2e0c138d049e	US	12/16/20 11:55	TRUE	FALSE	2498161	2498160	1	44	212	1108	2986	2498159	2498160	Chen rossii	Anser	Chen rossii (Cassin, 1861)	Anser rossii	DWC_ARCHIVE	12/16/20 11:55	6/30/20 8:20	FALSE	USA	United States	USA.5_1	California	USA.5.42_1	Santa Barbara	2016-12-28	FALSE
1782153678	OBS452878348	CC0_1_0	Cornell Lab of Ornithology	CLO	EBIRD	EOD - eBird Observation Dataset	HUMAN_OBSERVATION	URN:catalog:CLO:EBIRD:OBS452878348	OBS452878348	obsr447864	1	PRESENT	12/31/16 0:00	2016	12	31	US	California	Santa Barbara	Devereux Slough	34.4136	-119.876	2481156	Larus glaucoides B.Meyer, 1822	Animalia	Chordata	Aves	Charadriiformes	Laridae	Larus	glaucoides	SPECIES	Iceland Gull	ACCEPTED	4fa7b334-ce0d-4e88-aaae-2e0c138d049e	US	12/16/20 11:54	TRUE	FALSE	2481156	2481156	1	44	212	7192402	9316	2481126	2481156	Larus glaucoides	Larus	Larus glaucoides B.Meyer, 1822	Larus glaucoides	DWC_ARCHIVE	12/16/20 11:54	6/30/20 8:20	FALSE	USA	United States	USA.5_1	California	USA.5.42_1	Santa Barbara	2016-12-31	FALSE
1716081081	OBS374215578	CC0_1_0	Cornell Lab of Ornithology	CLO	EBIRD	EOD - eBird Observation Dataset	HUMAN_OBSERVATION	URN:catalog:CLO:EBIRD:OBS374215578	OBS374215578	obsr417931	2	PRESENT	2/15/16 0:00	2016	2	15	US	California	Santa Barbara	Coal Oil Point--Devereux Beach and Sands Beach	34.4071	-119.878	2481324	Cerorhinca monocerata (Pallas, 1811)	Animalia	Chordata	Aves	Charadriiformes	Alcidae	Cerorhinca	monocerata	SPECIES	Rhinoceros Auklet	ACCEPTED	4fa7b334-ce0d-4e88-aaae-2e0c138d049e	US	12/16/20 11:54	TRUE	FALSE	2481324	2481324	1	44	212	7192402	2985	2481323	2481324	Cerorhinca monocerata	Cerorhinca	Cerorhinca monocerata (Pallas, 1811)	Cerorhinca monocerata	DWC_ARCHIVE	12/16/20 11:54	6/30/20 8:20	FALSE	USA	United States	USA.5_1	California	USA.5.42_1	Santa Barbara	2016-2-15	FALSE
1715818684	OBS374209319	CC0_1_0	Cornell Lab of Ornithology	CLO	EBIRD	EOD - eBird Observation Dataset	HUMAN_OBSERVATION	URN:catalog:CLO:EBIRD:OBS374209319	OBS374209319	obsr420881	2	PRESENT	2/15/16 0:00	2016	2	15	US	California	Santa Barbara	Coal Oil Point--Devereux Beach and Sands Beach	34.4071	-119.878	2481324	Cerorhinca monocerata (Pallas, 1811)	Animalia	Chordata	Aves	Charadriiformes	Alcidae	Cerorhinca	monocerata	SPECIES	Rhinoceros Auklet	ACCEPTED	4fa7b334-ce0d-4e88-aaae-2e0c138d049e	US	12/16/20 12:02	TRUE	FALSE	2481324	2481324	1	44	212	7192402	2985	2481323	2481324	Cerorhinca monocerata	Cerorhinca	Cerorhinca monocerata (Pallas, 1811)	Cerorhinca monocerata	DWC_ARCHIVE	12/16/20 12:02	6/30/20 8:20	FALSE	USA	United States	USA.5_1	California	USA.5.42_1	Santa Barbara	2016-2-15	TRUE
1717422396	OBS376138925	CC0_1_0	Cornell Lab of Ornithology	CLO	EBIRD	EOD - eBird Observation Dataset	HUMAN_OBSERVATION	URN:catalog:CLO:EBIRD:OBS376138925	OBS376138925	obsr420881	1	PRESENT	2/21/16 0:00	2016	2	21	US	California	Santa Barbara	Coal Oil Point--Devereux Beach and Sands Beach	34.4071	-119.878	2481609	Stercorarius pomarinus (Temminck, 1815)	Animalia	Chordata	Aves	Charadriiformes	Stercorariidae	Stercorarius	pomarinus	SPECIES	Pomarine Jaeger	ACCEPTED	4fa7b334-ce0d-4e88-aaae-2e0c138d049e	US	12/16/20 11:53	TRUE	FALSE	2481609	2481609	1	44	212	7192402	9347	2481608	2481609	Stercorarius pomarinus	Stercorarius	Stercorarius pomarinus (Temminck, 1815)	Stercorarius pomarinus	DWC_ARCHIVE	12/16/20 11:53	6/30/20 8:20	FALSE	USA	United States	USA.5_1	California	USA.5.42_1	Santa Barbara	2016-2-21	TRUE
1724168723	OBS386725097	CC0_1_0	Cornell Lab of Ornithology	CLO	EBIRD	EOD - eBird Observation Dataset	HUMAN_OBSERVATION	URN:catalog:CLO:EBIRD:OBS386725097	OBS386725097	obsr172576	1	PRESENT	3/27/16 0:00	2016	3	27	US	California	Santa Barbara	Coal Oil Point--Devereux Beach and Sands Beach	34.4071	-119.878	2481342	Uria aalge (Pontoppidan, 1763)	Animalia	Chordata	Aves	Charadriiformes	Alcidae	Uria	aalge	SPECIES	Common Murre	ACCEPTED	4fa7b334-ce0d-4e88-aaae-2e0c138d049e	US	12/16/20 11:54	TRUE	FALSE	2481342	2481342	1	44	212	7192402	2985	2481338	2481342	Uria aalge	Uria	Uria aalge (Pontoppidan, 1763)	Uria aalge	DWC_ARCHIVE	12/16/20 11:54	6/30/20 8:20	FALSE	USA	United States	USA.5_1	California	USA.5.42_1	Santa Barbara	2016-3-27	FALSE
1719874885	OBS379617372	CC0_1_0	Cornell Lab of Ornithology	CLO	EBIRD	EOD - eBird Observation Dataset	HUMAN_OBSERVATION	URN:catalog:CLO:EBIRD:OBS379617372	OBS379617372	obsr306119	1	PRESENT	3/6/16 0:00	2016	3	6	US	California	Santa Barbara	Devereux Slough	34.4136	-119.876	7531611	Leiothlypis ruficapilla (A.Wilson, 1811)	Animalia	Chordata	Aves	Passeriformes	Parulidae	Leiothlypis	ruficapilla	SPECIES	Nashville Warbler	ACCEPTED	4fa7b334-ce0d-4e88-aaae-2e0c138d049e	US	12/16/20 11:53	TRUE	FALSE	7531611	7531611	1	44	212	729	5263	7467942	7531611	Leiothlypis ruficapilla	Leiothlypis	Leiothlypis ruficapilla (A.Wilson, 1811)	Leiothlypis ruficapilla	DWC_ARCHIVE	12/16/20 11:53	6/30/20 8:20	FALSE	USA	United States	USA.5_1	California	USA.5.42_1	Santa Barbara	2016-3-6	FALSE
1720171173	OBS379867899	CC0_1_0	Cornell Lab of Ornithology	CLO	EBIRD	EOD - eBird Observation Dataset	HUMAN_OBSERVATION	URN:catalog:CLO:EBIRD:OBS379867899	OBS379867899	obsr420881	5	PRESENT	3/8/16 0:00	2016	3	8	US	California	Santa Barbara	Devereux Slough	34.4136	-119.876	5231635	Spinus pinus (A.Wilson, 1810)	Animalia	Chordata	Aves	Passeriformes	Fringillidae	Spinus	pinus	SPECIES	Pine Siskin	ACCEPTED	4fa7b334-ce0d-4e88-aaae-2e0c138d049e	US	12/16/20 12:04	TRUE	FALSE	5231635	5231635	1	44	212	729	5242	8051475	5231635	Spinus pinus	Spinus	Spinus pinus (A.Wilson, 1810)	Spinus pinus	DWC_ARCHIVE	12/16/20 12:04	6/30/20 8:20	FALSE	USA	United States	USA.5_1	California	USA.5.42_1	Santa Barbara	2016-3-8	TRUE
1727063566	OBS390609822	CC0_1_0	Cornell Lab of Ornithology	CLO	EBIRD	EOD - eBird Observation Dataset	HUMAN_OBSERVATION	URN:catalog:CLO:EBIRD:OBS390609822	OBS390609822	obsr420881	1	PRESENT	4/12/16 0:00	2016	4	12	US	California	Santa Barbara	Devereux Slough	34.4136	-119.876	7531611	Leiothlypis ruficapilla (A.Wilson, 1811)	Animalia	Chordata	Aves	Passeriformes	Parulidae	Leiothlypis	ruficapilla	SPECIES	Nashville Warbler	ACCEPTED	4fa7b334-ce0d-4e88-aaae-2e0c138d049e	US	12/16/20 11:55	TRUE	FALSE	7531611	7531611	1	44	212	729	5263	7467942	7531611	Leiothlypis ruficapilla	Leiothlypis	Leiothlypis ruficapilla (A.Wilson, 1811)	Leiothlypis ruficapilla	DWC_ARCHIVE	12/16/20 11:55	6/30/20 8:20	FALSE	USA	United States	USA.5_1	California	USA.5.42_1	Santa Barbara	2016-4-12	TRUE
1728174235	OBS391815116	CC0_1_0	Cornell Lab of Ornithology	CLO	EBIRD	EOD - eBird Observation Dataset	HUMAN_OBSERVATION	URN:catalog:CLO:EBIRD:OBS391815116	OBS391815116	obsr51183	5	PRESENT	4/16/16 0:00	2016	4	16	US	California	Santa Barbara	Devereux Slough	34.4136	-119.876	5231635	Spinus pinus (A.Wilson, 1810)	Animalia	Chordata	Aves	Passeriformes	Fringillidae	Spinus	pinus	SPECIES	Pine Siskin	ACCEPTED	4fa7b334-ce0d-4e88-aaae-2e0c138d049e	US	12/16/20 11:54	TRUE	FALSE	5231635	5231635	1	44	212	729	5242	8051475	5231635	Spinus pinus	Spinus	Spinus pinus (A.Wilson, 1810)	Spinus pinus	DWC_ARCHIVE	12/16/20 11:54	6/30/20 8:20	FALSE	USA	United States	USA.5_1	California	USA.5.42_1	Santa Barbara	2016-4-16	TRUE
1728682967	OBS392580082	CC0_1_0	Cornell Lab of Ornithology	CLO	EBIRD	EOD - eBird Observation Dataset	HUMAN_OBSERVATION	URN:catalog:CLO:EBIRD:OBS392580082	OBS392580082	obsr337176	1	PRESENT	4/18/16 0:00	2016	4	18	US	California	Santa Barbara	Devereux Slough	34.4136	-119.876	5846430	Leucophaeus pipixcan (Wagler, 1831)	Animalia	Chordata	Aves	Charadriiformes	Laridae	Leucophaeus	pipixcan	SPECIES	Franklin's Gull	ACCEPTED	4fa7b334-ce0d-4e88-aaae-2e0c138d049e	US	12/16/20 12:04	TRUE	FALSE	5846430	5846430	1	44	212	7192402	9316	4352369	5846430	Leucophaeus pipixcan	Leucophaeus	Leucophaeus pipixcan (Wagler, 1831)	Leucophaeus pipixcan	DWC_ARCHIVE	12/16/20 12:04	6/30/20 8:20	FALSE	USA	United States	USA.5_1	California	USA.5.42_1	Santa Barbara	2016-4-18	FALSE
1729110648	OBS392987531	CC0_1_0	Cornell Lab of Ornithology	CLO	EBIRD	EOD - eBird Observation Dataset	HUMAN_OBSERVATION	URN:catalog:CLO:EBIRD:OBS392987531	OBS392987531	obsr420881	1	PRESENT	4/19/16 0:00	2016	4	19	US	California	Santa Barbara	Devereux Slough	34.4136	-119.876	2484879	Sitta canadensis Linnaeus, 1766	Animalia	Chordata	Aves	Passeriformes	Sittidae	Sitta	canadensis	SPECIES	Red-breasted Nuthatch	ACCEPTED	4fa7b334-ce0d-4e88-aaae-2e0c138d049e	US	12/16/20 12:14	TRUE	FALSE	2484879	2484879	1	44	212	729	5283	2484878	2484879	Sitta canadensis	Sitta	Sitta canadensis Linnaeus, 1766	Sitta canadensis	DWC_ARCHIVE	12/16/20 12:14	6/30/20 8:20	FALSE	USA	United States	USA.5_1	California	USA.5.42_1	Santa Barbara	2016-4-19	TRUE
1731680985	OBS395859078	CC0_1_0	Cornell Lab of Ornithology	CLO	EBIRD	EOD - eBird Observation Dataset	HUMAN_OBSERVATION	URN:catalog:CLO:EBIRD:OBS395859078	OBS395859078	obsr548926	14	PRESENT	4/27/16 0:00	2016	4	27	US	California	Santa Barbara	Devereux Slough	34.4136	-119.876	2480830	Bubulcus ibis (Linnaeus, 1758)	Animalia	Chordata	Aves	Pelecaniformes	Ardeidae	Bubulcus	ibis	SPECIES	Cattle Egret	ACCEPTED	4fa7b334-ce0d-4e88-aaae-2e0c138d049e	US	12/16/20 11:54	TRUE	FALSE	2480830	2480830	1	44	212	7190953	3685	2480829	2480830	Bubulcus ibis	Bubulcus	Bubulcus ibis (Linnaeus, 1758)	Bubulcus ibis	DWC_ARCHIVE	12/16/20 11:54	6/30/20 8:20	FALSE	USA	United States	USA.5_1	California	USA.5.42_1	Santa Barbara	2016-4-27	TRUE
1731429359	OBS395839553	CC0_1_0	Cornell Lab of Ornithology	CLO	EBIRD	EOD - eBird Observation Dataset	HUMAN_OBSERVATION	URN:catalog:CLO:EBIRD:OBS395839553	OBS395839553	obsr302151	2	PRESENT	4/27/16 0:00	2016	4	27	US	California	Santa Barbara	Devereux Slough	34.4136	-119.876	2480830	Bubulcus ibis (Linnaeus, 1758)	Animalia	Chordata	Aves	Pelecaniformes	Ardeidae	Bubulcus	ibis	SPECIES	Cattle Egret	ACCEPTED	4fa7b334-ce0d-4e88-aaae-2e0c138d049e	US	12/16/20 12:03	TRUE	FALSE	2480830	2480830	1	44	212	7190953	3685	2480829	2480830	Bubulcus ibis	Bubulcus	Bubulcus ibis (Linnaeus, 1758)	Bubulcus ibis	DWC_ARCHIVE	12/16/20 12:03	6/30/20 8:20	FALSE	USA	United States	USA.5_1	California	USA.5.42_1	Santa Barbara	2016-4-27	TRUE
1732092855	OBS396416975	CC0_1_0	Cornell Lab of Ornithology	CLO	EBIRD	EOD - eBird Observation Dataset	HUMAN_OBSERVATION	URN:catalog:CLO:EBIRD:OBS396416975	OBS396416975	obsr53608	1	PRESENT	4/29/16 0:00	2016	4	29	US	California	Santa Barbara	Devereux Slough	34.4136	-119.876	5230862	Passerina caerulea (Linnaeus, 1758)	Animalia	Chordata	Aves	Passeriformes	Cardinalidae	Passerina	caerulea	SPECIES	Blue Grosbeak	ACCEPTED	4fa7b334-ce0d-4e88-aaae-2e0c138d049e	US	12/16/20 12:04	TRUE	FALSE	5230862	5230862	1	44	212	729	9285	2490326	5230862	Passerina caerulea	Passerina	Passerina caerulea (Linnaeus, 1758)	Passerina caerulea	DWC_ARCHIVE	12/16/20 12:04	6/30/20 8:20	FALSE	USA	United States	USA.5_1	California	USA.5.42_1	Santa Barbara	2016-4-29	FALSE
1732052015	OBS396391508	CC0_1_0	Cornell Lab of Ornithology	CLO	EBIRD	EOD - eBird Observation Dataset	HUMAN_OBSERVATION	URN:catalog:CLO:EBIRD:OBS396391508	OBS396391508	obsr309446	1	PRESENT	4/29/16 0:00	2016	4	29	US	California	Santa Barbara	Devereux Slough	34.4136	-119.876	5230862	Passerina caerulea (Linnaeus, 1758)	Animalia	Chordata	Aves	Passeriformes	Cardinalidae	Passerina	caerulea	SPECIES	Blue Grosbeak	ACCEPTED	4fa7b334-ce0d-4e88-aaae-2e0c138d049e	US	12/16/20 12:04	TRUE	FALSE	5230862	5230862	1	44	212	729	9285	2490326	5230862	Passerina caerulea	Passerina	Passerina caerulea (Linnaeus, 1758)	Passerina caerulea	DWC_ARCHIVE	12/16/20 12:04	6/30/20 8:20	FALSE	USA	United States	USA.5_1	California	USA.5.42_1	Santa Barbara	2016-4-29	FALSE
1725214308	OBS388090722	CC0_1_0	Cornell Lab of Ornithology	CLO	EBIRD	EOD - eBird Observation Dataset	HUMAN_OBSERVATION	URN:catalog:CLO:EBIRD:OBS388090722	OBS388090722	obsr337176	1	PRESENT	4/3/16 0:00	2016	4	3	US	California	Santa Barbara	Devereux Slough	34.4136	-119.876	2484340	Icterus galbula (Linnaeus, 1758)	Animalia	Chordata	Aves	Passeriformes	Icteridae	Icterus	galbula	SPECIES	Baltimore Oriole	ACCEPTED	4fa7b334-ce0d-4e88-aaae-2e0c138d049e	US	12/16/20 11:54	TRUE	FALSE	2484340	2484340	1	44	212	729	6176	2484282	2484340	Icterus galbula	Icterus	Icterus galbula (Linnaeus, 1758)	Icterus galbula	DWC_ARCHIVE	12/16/20 11:54	6/30/20 8:20	FALSE	USA	United States	USA.5_1	California	USA.5.42_1	Santa Barbara	2016-4-3	FALSE
1733045252	OBS397373461	CC0_1_0	Cornell Lab of Ornithology	CLO	EBIRD	EOD - eBird Observation Dataset	HUMAN_OBSERVATION	URN:catalog:CLO:EBIRD:OBS397373461	OBS397373461	obsr625166	1	PRESENT	4/30/16 0:00	2016	4	30	US	California	Santa Barbara	Devereux Slough	34.4136	-119.876	5230862	Passerina caerulea (Linnaeus, 1758)	Animalia	Chordata	Aves	Passeriformes	Cardinalidae	Passerina	caerulea	SPECIES	Blue Grosbeak	ACCEPTED	4fa7b334-ce0d-4e88-aaae-2e0c138d049e	US	12/16/20 12:04	TRUE	FALSE	5230862	5230862	1	44	212	729	9285	2490326	5230862	Passerina caerulea	Passerina	Passerina caerulea (Linnaeus, 1758)	Passerina caerulea	DWC_ARCHIVE	12/16/20 12:04	6/30/20 8:20	FALSE	USA	United States	USA.5_1	California	USA.5.42_1	Santa Barbara	2016-4-30	FALSE
1732409549	OBS396773857	CC0_1_0	Cornell Lab of Ornithology	CLO	EBIRD	EOD - eBird Observation Dataset	HUMAN_OBSERVATION	URN:catalog:CLO:EBIRD:OBS396773857	OBS396773857	obsr420881	1	PRESENT	4/30/16 0:00	2016	4	30	US	California	Santa Barbara	Devereux Slough	34.4136	-119.876	2481764	Calidris pusilla (Linnaeus, 1766)	Animalia	Chordata	Aves	Charadriiformes	Scolopacidae	Calidris	pusilla	SPECIES	Semipalmated Sandpiper	ACCEPTED	4fa7b334-ce0d-4e88-aaae-2e0c138d049e	US	12/16/20 11:54	TRUE	FALSE	2481764	2481764	1	44	212	7192402	5282	2481739	2481764	Calidris pusilla	Calidris	Calidris pusilla (Linnaeus, 1766)	Calidris pusilla	DWC_ARCHIVE	12/16/20 11:54	6/30/20 8:20	FALSE	USA	United States	USA.5_1	California	USA.5.42_1	Santa Barbara	2016-4-30	TRUE
1732316980	OBS396826334	CC0_1_0	Cornell Lab of Ornithology	CLO	EBIRD	EOD - eBird Observation Dataset	HUMAN_OBSERVATION	URN:catalog:CLO:EBIRD:OBS396826334	OBS396826334	obsr111092	1	PRESENT	4/30/16 0:00	2016	4	30	US	California	Santa Barbara	Devereux Slough	34.4136	-119.876	5846430	Leucophaeus pipixcan (Wagler, 1831)	Animalia	Chordata	Aves	Charadriiformes	Laridae	Leucophaeus	pipixcan	SPECIES	Franklin's Gull	ACCEPTED	4fa7b334-ce0d-4e88-aaae-2e0c138d049e	US	12/16/20 11:54	TRUE	FALSE	5846430	5846430	1	44	212	7192402	9316	4352369	5846430	Leucophaeus pipixcan	Leucophaeus	Leucophaeus pipixcan (Wagler, 1831)	Leucophaeus pipixcan	DWC_ARCHIVE	12/16/20 11:54	6/30/20 8:20	FALSE	USA	United States	USA.5_1	California	USA.5.42_1	Santa Barbara	2016-4-30	TRUE
1725639561	OBS388665895	CC0_1_0	Cornell Lab of Ornithology	CLO	EBIRD	EOD - eBird Observation Dataset	HUMAN_OBSERVATION	URN:catalog:CLO:EBIRD:OBS388665895	OBS388665895	obsr420881	1	PRESENT	4/5/16 0:00	2016	4	5	US	California	Santa Barbara	Devereux Slough	34.4136	-119.876	2484340	Icterus galbula (Linnaeus, 1758)	Animalia	Chordata	Aves	Passeriformes	Icteridae	Icterus	galbula	SPECIES	Baltimore Oriole	ACCEPTED	4fa7b334-ce0d-4e88-aaae-2e0c138d049e	US	12/16/20 12:15	TRUE	FALSE	2484340	2484340	1	44	212	729	6176	2484282	2484340	Icterus galbula	Icterus	Icterus galbula (Linnaeus, 1758)	Icterus galbula	DWC_ARCHIVE	12/16/20 12:15	6/30/20 8:20	FALSE	USA	United States	USA.5_1	California	USA.5.42_1	Santa Barbara	2016-4-5	TRUE
1737899421	OBS403364747	CC0_1_0	Cornell Lab of Ornithology	CLO	EBIRD	EOD - eBird Observation Dataset	HUMAN_OBSERVATION	URN:catalog:CLO:EBIRD:OBS403364747	OBS403364747	obsr501418	1	PRESENT	5/15/16 0:00	2016	5	15	US	California	Santa Barbara	Devereux Slough	34.4136	-119.876	9733156	Tringa incana (Gmelin, 1789)	Animalia	Chordata	Aves	Charadriiformes	Scolopacidae	Tringa	incana	SPECIES	Wandering Tattler	ACCEPTED	4fa7b334-ce0d-4e88-aaae-2e0c138d049e	US	12/16/20 12:04	TRUE	FALSE	9733156	9733156	1	44	212	7192402	5282	2481709	9733156	Tringa incana	Tringa	Tringa incana (Gmelin, 1789)	Tringa incana	DWC_ARCHIVE	12/16/20 12:04	6/30/20 8:20	FALSE	USA	United States	USA.5_1	California	USA.5.42_1	Santa Barbara	2016-5-15	FALSE
1737974227	OBS403317370	CC0_1_0	Cornell Lab of Ornithology	CLO	EBIRD	EOD - eBird Observation Dataset	HUMAN_OBSERVATION	URN:catalog:CLO:EBIRD:OBS403317370	OBS403317370	obsr211489	1	PRESENT	5/15/16 0:00	2016	5	15	US	California	Santa Barbara	Devereux Slough	34.4136	-119.876	9733156	Tringa incana (Gmelin, 1789)	Animalia	Chordata	Aves	Charadriiformes	Scolopacidae	Tringa	incana	SPECIES	Wandering Tattler	ACCEPTED	4fa7b334-ce0d-4e88-aaae-2e0c138d049e	US	12/16/20 12:05	TRUE	FALSE	9733156	9733156	1	44	212	7192402	5282	2481709	9733156	Tringa incana	Tringa	Tringa incana (Gmelin, 1789)	Tringa incana	DWC_ARCHIVE	12/16/20 12:05	6/30/20 8:20	FALSE	USA	United States	USA.5_1	California	USA.5.42_1	Santa Barbara	2016-5-15	FALSE
1738086198	OBS403555117	CC0_1_0	Cornell Lab of Ornithology	CLO	EBIRD	EOD - eBird Observation Dataset	HUMAN_OBSERVATION	URN:catalog:CLO:EBIRD:OBS403555117	OBS403555117	obsr554708	1	PRESENT	5/15/16 0:00	2016	5	15	US	California	Santa Barbara	Devereux Slough	34.4136	-119.876	9733156	Tringa incana (Gmelin, 1789)	Animalia	Chordata	Aves	Charadriiformes	Scolopacidae	Tringa	incana	SPECIES	Wandering Tattler	ACCEPTED	4fa7b334-ce0d-4e88-aaae-2e0c138d049e	US	12/16/20 11:54	TRUE	FALSE	9733156	9733156	1	44	212	7192402	5282	2481709	9733156	Tringa incana	Tringa	Tringa incana (Gmelin, 1789)	Tringa incana	DWC_ARCHIVE	12/16/20 11:54	6/30/20 8:20	FALSE	USA	United States	USA.5_1	California	USA.5.42_1	Santa Barbara	2016-5-15	FALSE
1738376073	OBS403901226	CC0_1_0	Cornell Lab of Ornithology	CLO	EBIRD	EOD - eBird Observation Dataset	HUMAN_OBSERVATION	URN:catalog:CLO:EBIRD:OBS403901226	OBS403901226	obsr337176	1	PRESENT	5/16/16 0:00	2016	5	16	US	California	Santa Barbara	Devereux Slough	34.4136	-119.876	2481192	Leucophaeus atricilla (Linnaeus, 1758)	Animalia	Chordata	Aves	Charadriiformes	Laridae	Larus	atricilla	SPECIES	Laughing Gull	SYNONYM	4fa7b334-ce0d-4e88-aaae-2e0c138d049e	US	12/16/20 12:05	TRUE	FALSE	6065844	2481192	1	44	212	7192402	9316	2481126	2481192	Larus atricilla	Leucophaeus	Larus atricilla Linnaeus, 1758	Leucophaeus atricilla	DWC_ARCHIVE	12/16/20 12:05	6/30/20 8:20	FALSE	USA	United States	USA.5_1	California	USA.5.42_1	Santa Barbara	2016-5-16	FALSE
1743031266	OBS409025979	CC0_1_0	Cornell Lab of Ornithology	CLO	EBIRD	EOD - eBird Observation Dataset	HUMAN_OBSERVATION	URN:catalog:CLO:EBIRD:OBS409025979	OBS409025979	obsr413715	1	PRESENT	6/1/16 0:00	2016	6	1	US	California	Santa Barbara	Devereux Slough	34.4136	-119.876	9552291	Vireo cassinii Xantus de Vesey, 1858	Animalia	Chordata	Aves	Passeriformes	Vireonidae	Vireo	cassinii	SPECIES	Cassin's Vireo	ACCEPTED	4fa7b334-ce0d-4e88-aaae-2e0c138d049e	US	12/16/20 12:07	TRUE	FALSE	9552291	9552291	1	44	212	729	9358	2487406	9552291	Vireo cassinii	Vireo	Vireo cassinii Xantus de Vesey, 1858	Vireo cassinii	DWC_ARCHIVE	12/16/20 12:07	6/30/20 8:20	FALSE	USA	United States	USA.5_1	California	USA.5.42_1	Santa Barbara	2016-6-1	FALSE
1747836432	OBS414730554	CC0_1_0	Cornell Lab of Ornithology	CLO	EBIRD	EOD - eBird Observation Dataset	HUMAN_OBSERVATION	URN:catalog:CLO:EBIRD:OBS414730554	OBS414730554	obsr638678	2	PRESENT	6/28/16 0:00	2016	6	28	US	California	Santa Barbara	Devereux Slough	34.4136	-119.876	5231643	Spinus lawrencei (Cassin, 1850)	Animalia	Chordata	Aves	Passeriformes	Fringillidae	Spinus	lawrencei	SPECIES	Lawrence's Goldfinch	ACCEPTED	4fa7b334-ce0d-4e88-aaae-2e0c138d049e	US	12/16/20 12:04	TRUE	FALSE	5231643	5231643	1	44	212	729	5242	8051475	5231643	Spinus lawrencei	Spinus	Spinus lawrencei (Cassin, 1850)	Spinus lawrencei	DWC_ARCHIVE	12/16/20 12:04	6/30/20 8:20	FALSE	USA	United States	USA.5_1	California	USA.5.42_1	Santa Barbara	2016-6-28	FALSE
1749974099	OBS418775496	CC0_1_0	Cornell Lab of Ornithology	CLO	EBIRD	EOD - eBird Observation Dataset	HUMAN_OBSERVATION	URN:catalog:CLO:EBIRD:OBS418775496	OBS418775496	obsr443167	3	PRESENT	7/11/16 0:00	2016	7	11	US	California	Santa Barbara	Devereux Slough	34.4136	-119.876	5231643	Spinus lawrencei (Cassin, 1850)	Animalia	Chordata	Aves	Passeriformes	Fringillidae	Spinus	lawrencei	SPECIES	Lawrence's Goldfinch	ACCEPTED	4fa7b334-ce0d-4e88-aaae-2e0c138d049e	US	12/16/20 11:54	TRUE	FALSE	5231643	5231643	1	44	212	729	5242	8051475	5231643	Spinus lawrencei	Spinus	Spinus lawrencei (Cassin, 1850)	Spinus lawrencei	DWC_ARCHIVE	12/16/20 11:54	6/30/20 8:20	FALSE	USA	United States	USA.5_1	California	USA.5.42_1	Santa Barbara	2016-7-11	FALSE
1750048885	OBS417415009	CC0_1_0	Cornell Lab of Ornithology	CLO	EBIRD	EOD - eBird Observation Dataset	HUMAN_OBSERVATION	URN:catalog:CLO:EBIRD:OBS417415009	OBS417415009	obsr98119	1	PRESENT	7/11/16 0:00	2016	7	11	US	California	Santa Barbara	Devereux Slough	34.4136	-119.876	5230862	Passerina caerulea (Linnaeus, 1758)	Animalia	Chordata	Aves	Passeriformes	Cardinalidae	Passerina	caerulea	SPECIES	Blue Grosbeak	ACCEPTED	4fa7b334-ce0d-4e88-aaae-2e0c138d049e	US	12/16/20 11:54	TRUE	FALSE	5230862	5230862	1	44	212	729	9285	2490326	5230862	Passerina caerulea	Passerina	Passerina caerulea (Linnaeus, 1758)	Passerina caerulea	DWC_ARCHIVE	12/16/20 11:54	6/30/20 8:20	FALSE	USA	United States	USA.5_1	California	USA.5.42_1	Santa Barbara	2016-7-11	FALSE
1752270027	OBS419921073	CC0_1_0	Cornell Lab of Ornithology	CLO	EBIRD	EOD - eBird Observation Dataset	HUMAN_OBSERVATION	URN:catalog:CLO:EBIRD:OBS419921073	OBS419921073	obsr53608	1	PRESENT	7/24/16 0:00	2016	7	24	US	California	Santa Barbara	Coal Oil Point--Devereux Beach and Sands Beach	34.4071	-119.878	2476675	Calypte costae (Bourcier, 1839)	Animalia	Chordata	Aves	Apodiformes	Trochilidae	Calypte	costae	SPECIES	Costa's Hummingbird	ACCEPTED	4fa7b334-ce0d-4e88-aaae-2e0c138d049e	US	12/16/20 12:04	TRUE	FALSE	2476675	2476675	1	44	212	1448	5289	2476673	2476675	Calypte costae	Calypte	Calypte costae (Bourcier, 1839)	Calypte costae	DWC_ARCHIVE	12/16/20 12:04	6/30/20 8:20	FALSE	USA	United States	USA.5_1	California	USA.5.42_1	Santa Barbara	2016-7-24	FALSE
1752262987	OBS419933614	CC0_1_0	Cornell Lab of Ornithology	CLO	EBIRD	EOD - eBird Observation Dataset	HUMAN_OBSERVATION	URN:catalog:CLO:EBIRD:OBS419933614	OBS419933614	obsr337176	1	PRESENT	7/24/16 0:00	2016	7	24	US	California	Santa Barbara	Coal Oil Point--Devereux Beach and Sands Beach	34.4071	-119.878	2476675	Calypte costae (Bourcier, 1839)	Animalia	Chordata	Aves	Apodiformes	Trochilidae	Calypte	costae	SPECIES	Costa's Hummingbird	ACCEPTED	4fa7b334-ce0d-4e88-aaae-2e0c138d049e	US	12/16/20 11:54	TRUE	FALSE	2476675	2476675	1	44	212	1448	5289	2476673	2476675	Calypte costae	Calypte	Calypte costae (Bourcier, 1839)	Calypte costae	DWC_ARCHIVE	12/16/20 11:54	6/30/20 8:20	FALSE	USA	United States	USA.5_1	California	USA.5.42_1	Santa Barbara	2016-7-24	FALSE
1752285255	OBS419912422	CC0_1_0	Cornell Lab of Ornithology	CLO	EBIRD	EOD - eBird Observation Dataset	HUMAN_OBSERVATION	URN:catalog:CLO:EBIRD:OBS419912422	OBS419912422	obsr309446	1	PRESENT	7/24/16 0:00	2016	7	24	US	California	Santa Barbara	Coal Oil Point--Devereux Beach and Sands Beach	34.4071	-119.878	2476675	Calypte costae (Bourcier, 1839)	Animalia	Chordata	Aves	Apodiformes	Trochilidae	Calypte	costae	SPECIES	Costa's Hummingbird	ACCEPTED	4fa7b334-ce0d-4e88-aaae-2e0c138d049e	US	12/16/20 12:04	TRUE	FALSE	2476675	2476675	1	44	212	1448	5289	2476673	2476675	Calypte costae	Calypte	Calypte costae (Bourcier, 1839)	Calypte costae	DWC_ARCHIVE	12/16/20 12:04	6/30/20 8:20	FALSE	USA	United States	USA.5_1	California	USA.5.42_1	Santa Barbara	2016-7-24	FALSE
1752375851	OBS419895238	CC0_1_0	Cornell Lab of Ornithology	CLO	EBIRD	EOD - eBird Observation Dataset	HUMAN_OBSERVATION	URN:catalog:CLO:EBIRD:OBS419895238	OBS419895238	obsr51183	2	PRESENT	7/24/16 0:00	2016	7	24	US	California	Santa Barbara	Coal Oil Point--Devereux Beach and Sands Beach	34.4071	-119.878	2476675	Calypte costae (Bourcier, 1839)	Animalia	Chordata	Aves	Apodiformes	Trochilidae	Calypte	costae	SPECIES	Costa's Hummingbird	ACCEPTED	4fa7b334-ce0d-4e88-aaae-2e0c138d049e	US	12/16/20 12:03	TRUE	FALSE	2476675	2476675	1	44	212	1448	5289	2476673	2476675	Calypte costae	Calypte	Calypte costae (Bourcier, 1839)	Calypte costae	DWC_ARCHIVE	12/16/20 12:03	6/30/20 8:20	FALSE	USA	United States	USA.5_1	California	USA.5.42_1	Santa Barbara	2016-7-24	TRUE
1748556985	OBS415680455	CC0_1_0	Cornell Lab of Ornithology	CLO	EBIRD	EOD - eBird Observation Dataset	HUMAN_OBSERVATION	URN:catalog:CLO:EBIRD:OBS415680455	OBS415680455	obsr51183	1	PRESENT	7/3/16 0:00	2016	7	3	US	California	Santa Barbara	Devereux Slough	34.4136	-119.876	5228513	Archilochus alexandri (Bourcier & Mulsant, 1846)	Animalia	Chordata	Aves	Apodiformes	Trochilidae	Archilochus	alexandri	SPECIES	Black-chinned Hummingbird	ACCEPTED	4fa7b334-ce0d-4e88-aaae-2e0c138d049e	US	12/16/20 11:54	TRUE	FALSE	5228513	5228513	1	44	212	1448	5289	2476402	5228513	Archilochus alexandri	Archilochus	Archilochus alexandri (Bourcier & Mulsant, 1846)	Archilochus alexandri	DWC_ARCHIVE	12/16/20 11:54	6/30/20 8:20	FALSE	USA	United States	USA.5_1	California	USA.5.42_1	Santa Barbara	2016-7-3	TRUE
1756588415	OBS424780471	CC0_1_0	Cornell Lab of Ornithology	CLO	EBIRD	EOD - eBird Observation Dataset	HUMAN_OBSERVATION	URN:catalog:CLO:EBIRD:OBS424780471	OBS424780471	obsr605751	1	PRESENT	8/18/16 0:00	2016	8	18	US	California	Santa Barbara	Coal Oil Point--Devereux Beach and Sands Beach	34.4071	-119.878	2482492	Corvus corax Linnaeus, 1758	Animalia	Chordata	Aves	Passeriformes	Corvidae	Corvus	corax	SPECIES	Common Raven	ACCEPTED	4fa7b334-ce0d-4e88-aaae-2e0c138d049e	US	12/16/20 11:54	TRUE	FALSE	2482492	2482492	1	44	212	729	5235	2482468	2482492	Corvus corax	Corvus	Corvus corax Linnaeus, 1758	Corvus corax	DWC_ARCHIVE	12/16/20 11:54	6/30/20 8:20	FALSE	USA	United States	USA.5_1	California	USA.5.42_1	Santa Barbara	2016-8-18	FALSE
1757323294	OBS425388039	CC0_1_0	Cornell Lab of Ornithology	CLO	EBIRD	EOD - eBird Observation Dataset	HUMAN_OBSERVATION	URN:catalog:CLO:EBIRD:OBS425388039	OBS425388039	obsr227271	1	PRESENT	8/25/16 0:00	2016	8	25	US	California	Santa Barbara	Devereux Slough	34.4136	-119.876	7341770	Setophaga nigrescens (J.K.Townsend, 1837)	Animalia	Chordata	Aves	Passeriformes	Parulidae	Setophaga	nigrescens	SPECIES	Black-throated Gray Warbler	ACCEPTED	4fa7b334-ce0d-4e88-aaae-2e0c138d049e	US	12/16/20 11:55	TRUE	FALSE	7341770	7341770	1	44	212	729	5263	2489984	7341770	Setophaga nigrescens	Setophaga	Setophaga nigrescens (J.K.Townsend, 1837)	Setophaga nigrescens	DWC_ARCHIVE	12/16/20 11:55	6/30/20 8:20	FALSE	USA	United States	USA.5_1	California	USA.5.42_1	Santa Barbara	2016-8-25	FALSE
1758666038	OBS426827808	CC0_1_0	Cornell Lab of Ornithology	CLO	EBIRD	EOD - eBird Observation Dataset	HUMAN_OBSERVATION	URN:catalog:CLO:EBIRD:OBS426827808	OBS426827808	obsr605751	1	PRESENT	8/30/16 0:00	2016	8	30	US	California	Santa Barbara	Coal Oil Point--Devereux Beach and Sands Beach	34.4071	-119.878	2482492	Corvus corax Linnaeus, 1758	Animalia	Chordata	Aves	Passeriformes	Corvidae	Corvus	corax	SPECIES	Common Raven	ACCEPTED	4fa7b334-ce0d-4e88-aaae-2e0c138d049e	US	12/16/20 11:54	TRUE	FALSE	2482492	2482492	1	44	212	729	5235	2482468	2482492	Corvus corax	Corvus	Corvus corax Linnaeus, 1758	Corvus corax	DWC_ARCHIVE	12/16/20 11:54	6/30/20 8:20	FALSE	USA	United States	USA.5_1	California	USA.5.42_1	Santa Barbara	2016-8-30	FALSE
1761480907	OBS429969133	CC0_1_0	Cornell Lab of Ornithology	CLO	EBIRD	EOD - eBird Observation Dataset	HUMAN_OBSERVATION	URN:catalog:CLO:EBIRD:OBS429969133	OBS429969133	obsr413715	1	PRESENT	9/15/16 0:00	2016	9	15	US	California	Santa Barbara	Devereux Slough	34.4136	-119.876	2482786	Empidonax traillii (Audubon, 1828)	Animalia	Chordata	Aves	Passeriformes	Tyrannidae	Empidonax	traillii	SPECIES	Willow Flycatcher	ACCEPTED	4fa7b334-ce0d-4e88-aaae-2e0c138d049e	US	12/16/20 11:55	TRUE	FALSE	2482786	2482786	1	44	212	729	5291	2482766	2482786	Empidonax traillii	Empidonax	Empidonax traillii (Audubon, 1828)	Empidonax traillii	DWC_ARCHIVE	12/16/20 11:55	6/30/20 8:20	FALSE	USA	United States	USA.5_1	California	USA.5.42_1	Santa Barbara	2016-9-15	FALSE
1764799316	OBS433730632	CC0_1_0	Cornell Lab of Ornithology	CLO	EBIRD	EOD - eBird Observation Dataset	HUMAN_OBSERVATION	URN:catalog:CLO:EBIRD:OBS433730632	OBS433730632	obsr800394	75	PRESENT	9/23/16 0:00	2016	9	23	US	California	Santa Barbara	Coal Oil Point--Devereux Beach and Sands Beach	34.4071	-119.878	5229356	Puffinus opisthomelas Coues, 1864	Animalia	Chordata	Aves	Procellariiformes	Procellariidae	Puffinus	opisthomelas	SPECIES	Black-vented Shearwater	ACCEPTED	4fa7b334-ce0d-4e88-aaae-2e0c138d049e	US	12/16/20 11:54	TRUE	FALSE	5229356	5229356	1	44	212	7192755	9339	5229335	5229356	Puffinus opisthomelas	Puffinus	Puffinus opisthomelas Coues, 1864	Puffinus opisthomelas	DWC_ARCHIVE	12/16/20 11:54	6/30/20 8:20	FALSE	USA	United States	USA.5_1	California	USA.5.42_1	Santa Barbara	2016-9-23	FALSE
1762821915	OBS431611045	CC0_1_0	Cornell Lab of Ornithology	CLO	EBIRD	EOD - eBird Observation Dataset	HUMAN_OBSERVATION	URN:catalog:CLO:EBIRD:OBS431611045	OBS431611045	obsr420881	75	PRESENT	9/23/16 0:00	2016	9	23	US	California	Santa Barbara	Coal Oil Point--Devereux Beach and Sands Beach	34.4071	-119.878	5229356	Puffinus opisthomelas Coues, 1864	Animalia	Chordata	Aves	Procellariiformes	Procellariidae	Puffinus	opisthomelas	SPECIES	Black-vented Shearwater	ACCEPTED	4fa7b334-ce0d-4e88-aaae-2e0c138d049e	US	12/16/20 12:04	TRUE	FALSE	5229356	5229356	1	44	212	7192755	9339	5229335	5229356	Puffinus opisthomelas	Puffinus	Puffinus opisthomelas Coues, 1864	Puffinus opisthomelas	DWC_ARCHIVE	12/16/20 12:04	6/30/20 8:20	FALSE	USA	United States	USA.5_1	California	USA.5.42_1	Santa Barbara	2016-9-23	TRUE
1763580221	OBS432241514	CC0_1_0	Cornell Lab of Ornithology	CLO	EBIRD	EOD - eBird Observation Dataset	HUMAN_OBSERVATION	URN:catalog:CLO:EBIRD:OBS432241514	OBS432241514	obsr420881	1	PRESENT	9/25/16 0:00	2016	9	25	US	California	Santa Barbara	Coal Oil Point--Devereux Beach and Sands Beach	34.4071	-119.878	2481221	Xema sabini (Sabine, 1819)	Animalia	Chordata	Aves	Charadriiformes	Laridae	Xema	sabini	SPECIES	Sabine's Gull	ACCEPTED	4fa7b334-ce0d-4e88-aaae-2e0c138d049e	US	12/16/20 12:04	TRUE	FALSE	2481221	2481221	1	44	212	7192402	9316	2481220	2481221	Xema sabini	Xema	Xema sabini (Sabine, 1819)	Xema sabini	DWC_ARCHIVE	12/16/20 12:04	6/30/20 8:20	FALSE	USA	United States	USA.5_1	California	USA.5.42_1	Santa Barbara	2016-9-25	TRUE
1764245823	OBS433121717	CC0_1_0	Cornell Lab of Ornithology	CLO	EBIRD	EOD - eBird Observation Dataset	HUMAN_OBSERVATION	URN:catalog:CLO:EBIRD:OBS433121717	OBS433121717	obsr246929	1	PRESENT	9/28/16 0:00	2016	9	28	US	California	Santa Barbara	Devereux Slough	34.4136	-119.876	2480272	Haematopus bachmani Audubon, 1838	Animalia	Chordata	Aves	Charadriiformes	Haematopodidae	Haematopus	bachmani	SPECIES	Black Oystercatcher	ACCEPTED	4fa7b334-ce0d-4e88-aaae-2e0c138d049e	US	12/16/20 12:03	TRUE	FALSE	2480272	2480272	1	44	212	7192402	4287243	2480260	2480272	Haematopus bachmani	Haematopus	Haematopus bachmani Audubon, 1838	Haematopus bachmani	DWC_ARCHIVE	12/16/20 12:03	6/30/20 8:20	FALSE	USA	United States	USA.5_1	California	USA.5.42_1	Santa Barbara	2016-9-28	FALSE
1760334082	OBS428699654	CC0_1_0	Cornell Lab of Ornithology	CLO	EBIRD_CAN	EOD - eBird Observation Dataset	HUMAN_OBSERVATION	URN:catalog:CLO:EBIRD_CAN:OBS428699654	OBS428699654	obsr534701	1	PRESENT	9/7/16 0:00	2016	9	7	US	California	Santa Barbara	Devereux Slough	34.4136	-119.876	9415596	Eremophila alpestris (Linnaeus, 1758)	Animalia	Chordata	Aves	Passeriformes	Alaudidae	Eremophila	alpestris	SPECIES	Horned Lark	ACCEPTED	4fa7b334-ce0d-4e88-aaae-2e0c138d049e	US	12/16/20 12:04	TRUE	FALSE	9415596	9415596	1	44	212	729	7211	2490615	9415596	Eremophila alpestris	Eremophila	Eremophila alpestris (Linnaeus, 1758)	Eremophila alpestris	DWC_ARCHIVE	12/16/20 12:04	6/30/20 8:20	FALSE	USA	United States	USA.5_1	California	USA.5.42_1	Santa Barbara	2016-9-7	FALSE
1760349760	OBS428788842	CC0_1_0	Cornell Lab of Ornithology	CLO	EBIRD_CAN	EOD - eBird Observation Dataset	HUMAN_OBSERVATION	URN:catalog:CLO:EBIRD_CAN:OBS428788842	OBS428788842	obsr497421	1	PRESENT	9/7/16 0:00	2016	9	7	US	California	Santa Barbara	Devereux Slough	34.4136	-119.876	9415596	Eremophila alpestris (Linnaeus, 1758)	Animalia	Chordata	Aves	Passeriformes	Alaudidae	Eremophila	alpestris	SPECIES	Horned Lark	ACCEPTED	4fa7b334-ce0d-4e88-aaae-2e0c138d049e	US	12/16/20 12:05	TRUE	FALSE	9415596	9415596	1	44	212	729	7211	2490615	9415596	Eremophila alpestris	Eremophila	Eremophila alpestris (Linnaeus, 1758)	Eremophila alpestris	DWC_ARCHIVE	12/16/20 12:05	6/30/20 8:20	FALSE	USA	United States	USA.5_1	California	USA.5.42_1	Santa Barbara	2016-9-7	FALSE
1760097415	OBS428626726	CC0_1_0	Cornell Lab of Ornithology	CLO	EBIRD_CAN	EOD - eBird Observation Dataset	HUMAN_OBSERVATION	URN:catalog:CLO:EBIRD_CAN:OBS428626726	OBS428626726	obsr306803	1	PRESENT	9/7/16 0:00	2016	9	7	US	California	Santa Barbara	Devereux Slough	34.4136	-119.876	9415596	Eremophila alpestris (Linnaeus, 1758)	Animalia	Chordata	Aves	Passeriformes	Alaudidae	Eremophila	alpestris	SPECIES	Horned Lark	ACCEPTED	4fa7b334-ce0d-4e88-aaae-2e0c138d049e	US	12/16/20 12:14	TRUE	FALSE	9415596	9415596	1	44	212	729	7211	2490615	9415596	Eremophila alpestris	Eremophila	Eremophila alpestris (Linnaeus, 1758)	Eremophila alpestris	DWC_ARCHIVE	12/16/20 12:14	6/30/20 8:20	FALSE	USA	United States	USA.5_1	California	USA.5.42_1	Santa Barbara	2016-9-7	FALSE
1760011562	OBS428365194	CC0_1_0	Cornell Lab of Ornithology	CLO	EBIRD_CAN	EOD - eBird Observation Dataset	HUMAN_OBSERVATION	URN:catalog:CLO:EBIRD_CAN:OBS428365194	OBS428365194	obsr131954	1	PRESENT	9/7/16 0:00	2016	9	7	US	California	Santa Barbara	Devereux Slough	34.4136	-119.876	9415596	Eremophila alpestris (Linnaeus, 1758)	Animalia	Chordata	Aves	Passeriformes	Alaudidae	Eremophila	alpestris	SPECIES	Horned Lark	ACCEPTED	4fa7b334-ce0d-4e88-aaae-2e0c138d049e	US	12/16/20 12:05	TRUE	FALSE	9415596	9415596	1	44	212	729	7211	2490615	9415596	Eremophila alpestris	Eremophila	Eremophila alpestris (Linnaeus, 1758)	Eremophila alpestris	DWC_ARCHIVE	12/16/20 12:05	6/30/20 8:20	FALSE	USA	United States	USA.5_1	California	USA.5.42_1	Santa Barbara	2016-9-7	FALSE
1760363136	OBS428758023	CC0_1_0	Cornell Lab of Ornithology	CLO	EBIRD_CAN	EOD - eBird Observation Dataset	HUMAN_OBSERVATION	URN:catalog:CLO:EBIRD_CAN:OBS428758023	OBS428758023	obsr434679	1	PRESENT	9/7/16 0:00	2016	9	7	US	California	Santa Barbara	Devereux Slough	34.4136	-119.876	9415596	Eremophila alpestris (Linnaeus, 1758)	Animalia	Chordata	Aves	Passeriformes	Alaudidae	Eremophila	alpestris	SPECIES	Horned Lark	ACCEPTED	4fa7b334-ce0d-4e88-aaae-2e0c138d049e	US	12/16/20 11:54	TRUE	FALSE	9415596	9415596	1	44	212	729	7211	2490615	9415596	Eremophila alpestris	Eremophila	Eremophila alpestris (Linnaeus, 1758)	Eremophila alpestris	DWC_ARCHIVE	12/16/20 11:54	6/30/20 8:20	FALSE	USA	United States	USA.5_1	California	USA.5.42_1	Santa Barbara	2016-9-7	FALSE
2038103105	OBS457098979	CC0_1_0	Cornell Lab of Ornithology	CLO	EBIRD	EOD - eBird Observation Dataset	HUMAN_OBSERVATION	URN:catalog:CLO:EBIRD:OBS457098979	OBS457098979	obsr420881	3500	PRESENT	1/14/17 0:00	2017	1	14	US	California	Santa Barbara	Coal Oil Point--Devereux Beach and Sands Beach	34.4071	-119.878	5229356	Puffinus opisthomelas Coues, 1864	Animalia	Chordata	Aves	Procellariiformes	Procellariidae	Puffinus	opisthomelas	SPECIES	Black-vented Shearwater	ACCEPTED	4fa7b334-ce0d-4e88-aaae-2e0c138d049e	US	12/16/20 11:54	TRUE	FALSE	5229356	5229356	1	44	212	7192755	9339	5229335	5229356	Puffinus opisthomelas	Puffinus	Puffinus opisthomelas Coues, 1864	Puffinus opisthomelas	DWC_ARCHIVE	12/16/20 11:54	6/30/20 8:20	FALSE	USA	United States	USA.5_1	California	USA.5.42_1	Santa Barbara	2017-1-14	TRUE
2033626004	OBS458110098	CC0_1_0	Cornell Lab of Ornithology	CLO	EBIRD	EOD - eBird Observation Dataset	HUMAN_OBSERVATION	URN:catalog:CLO:EBIRD:OBS458110098	OBS458110098	obsr188426	2	PRESENT	1/17/17 0:00	2017	1	17	US	California	Santa Barbara	Devereux Slough	34.4136	-119.876	2491872	Passerella iliaca (Merrem, 1786)	Animalia	Chordata	Aves	Passeriformes	Emberizidae	Passerella	iliaca	SPECIES	Fox Sparrow	ACCEPTED	4fa7b334-ce0d-4e88-aaae-2e0c138d049e	US	12/16/20 12:06	TRUE	FALSE	2491872	2491872	1	44	212	729	9608	2491871	2491872	Passerella iliaca	Passerella	Passerella iliaca (Merrem, 1786)	Passerella iliaca	DWC_ARCHIVE	12/16/20 12:06	6/30/20 8:20	FALSE	USA	United States	USA.5_1	California	USA.5.42_1	Santa Barbara	2017-1-17	FALSE
2030323933	OBS458116514	CC0_1_0	Cornell Lab of Ornithology	CLO	EBIRD	EOD - eBird Observation Dataset	HUMAN_OBSERVATION	URN:catalog:CLO:EBIRD:OBS458116514	OBS458116514	obsr188426	4	PRESENT	1/17/17 0:00	2017	1	17	US	California	Santa Barbara	Coal Oil Point--Devereux Beach and Sands Beach	34.4071	-119.878	5229356	Puffinus opisthomelas Coues, 1864	Animalia	Chordata	Aves	Procellariiformes	Procellariidae	Puffinus	opisthomelas	SPECIES	Black-vented Shearwater	ACCEPTED	4fa7b334-ce0d-4e88-aaae-2e0c138d049e	US	12/16/20 12:04	TRUE	FALSE	5229356	5229356	1	44	212	7192755	9339	5229335	5229356	Puffinus opisthomelas	Puffinus	Puffinus opisthomelas Coues, 1864	Puffinus opisthomelas	DWC_ARCHIVE	12/16/20 12:04	6/30/20 8:20	FALSE	USA	United States	USA.5_1	California	USA.5.42_1	Santa Barbara	2017-1-17	FALSE
2039198765	OBS458116490	CC0_1_0	Cornell Lab of Ornithology	CLO	EBIRD	EOD - eBird Observation Dataset	HUMAN_OBSERVATION	URN:catalog:CLO:EBIRD:OBS458116490	OBS458116490	obsr188426	1	PRESENT	1/17/17 0:00	2017	1	17	US	California	Santa Barbara	Coal Oil Point--Devereux Beach and Sands Beach	34.4071	-119.878	2481342	Uria aalge (Pontoppidan, 1763)	Animalia	Chordata	Aves	Charadriiformes	Alcidae	Uria	aalge	SPECIES	Common Murre	ACCEPTED	4fa7b334-ce0d-4e88-aaae-2e0c138d049e	US	12/16/20 12:15	TRUE	FALSE	2481342	2481342	1	44	212	7192402	2985	2481338	2481342	Uria aalge	Uria	Uria aalge (Pontoppidan, 1763)	Uria aalge	DWC_ARCHIVE	12/16/20 12:15	6/30/20 8:20	FALSE	USA	United States	USA.5_1	California	USA.5.42_1	Santa Barbara	2017-1-17	FALSE
2033628907	OBS458116516	CC0_1_0	Cornell Lab of Ornithology	CLO	EBIRD	EOD - eBird Observation Dataset	HUMAN_OBSERVATION	URN:catalog:CLO:EBIRD:OBS458116516	OBS458116516	obsr188426	2	PRESENT	1/17/17 0:00	2017	1	17	US	California	Santa Barbara	Coal Oil Point--Devereux Beach and Sands Beach	34.4071	-119.878	2491872	Passerella iliaca (Merrem, 1786)	Animalia	Chordata	Aves	Passeriformes	Emberizidae	Passerella	iliaca	SPECIES	Fox Sparrow	ACCEPTED	4fa7b334-ce0d-4e88-aaae-2e0c138d049e	US	12/16/20 12:15	TRUE	FALSE	2491872	2491872	1	44	212	729	9608	2491871	2491872	Passerella iliaca	Passerella	Passerella iliaca (Merrem, 1786)	Passerella iliaca	DWC_ARCHIVE	12/16/20 12:15	6/30/20 8:20	FALSE	USA	United States	USA.5_1	California	USA.5.42_1	Santa Barbara	2017-1-17	FALSE
2035726134	OBS459522715	CC0_1_0	Cornell Lab of Ornithology	CLO	EBIRD	EOD - eBird Observation Dataset	HUMAN_OBSERVATION	URN:catalog:CLO:EBIRD:OBS459522715	OBS459522715	obsr420881	1	PRESENT	1/22/17 0:00	2017	1	22	US	California	Santa Barbara	Coal Oil Point--Devereux Beach and Sands Beach	34.4071	-119.878	2481609	Stercorarius pomarinus (Temminck, 1815)	Animalia	Chordata	Aves	Charadriiformes	Stercorariidae	Stercorarius	pomarinus	SPECIES	Pomarine Jaeger	ACCEPTED	4fa7b334-ce0d-4e88-aaae-2e0c138d049e	US	12/16/20 12:04	TRUE	FALSE	2481609	2481609	1	44	212	7192402	9347	2481608	2481609	Stercorarius pomarinus	Stercorarius	Stercorarius pomarinus (Temminck, 1815)	Stercorarius pomarinus	DWC_ARCHIVE	12/16/20 12:04	6/30/20 8:20	FALSE	USA	United States	USA.5_1	California	USA.5.42_1	Santa Barbara	2017-1-22	TRUE
2035421863	OBS461432139	CC0_1_0	Cornell Lab of Ornithology	CLO	EBIRD	EOD - eBird Observation Dataset	HUMAN_OBSERVATION	URN:catalog:CLO:EBIRD:OBS461432139	OBS461432139	obsr337176	1	PRESENT	1/29/17 0:00	2017	1	29	US	California	Santa Barbara	Devereux Slough	34.4136	-119.876	2480331	Pluvialis fulva (Gmelin, 1789)	Animalia	Chordata	Aves	Charadriiformes	Charadriidae	Pluvialis	fulva	SPECIES	Pacific Golden-Plover	ACCEPTED	4fa7b334-ce0d-4e88-aaae-2e0c138d049e	US	12/16/20 11:55	TRUE	FALSE	2480331	2480331	1	44	212	7192402	2480210	2480326	2480331	Pluvialis fulva	Pluvialis	Pluvialis fulva (Gmelin, 1789)	Pluvialis fulva	DWC_ARCHIVE	12/16/20 11:55	6/30/20 8:20	FALSE	USA	United States	USA.5_1	California	USA.5.42_1	Santa Barbara	2017-1-29	FALSE
2031019386	OBS462243315	CC0_1_0	Cornell Lab of Ornithology	CLO	EBIRD	EOD - eBird Observation Dataset	HUMAN_OBSERVATION	URN:catalog:CLO:EBIRD:OBS462243315	OBS462243315	obsr306119	1	PRESENT	1/31/17 0:00	2017	1	31	US	California	Santa Barbara	Devereux Slough	34.4136	-119.876	2481192	Leucophaeus atricilla (Linnaeus, 1758)	Animalia	Chordata	Aves	Charadriiformes	Laridae	Larus	atricilla	SPECIES	Laughing Gull	SYNONYM	4fa7b334-ce0d-4e88-aaae-2e0c138d049e	US	12/16/20 12:03	TRUE	FALSE	6065844	2481192	1	44	212	7192402	9316	2481126	2481192	Larus atricilla	Leucophaeus	Larus atricilla Linnaeus, 1758	Leucophaeus atricilla	DWC_ARCHIVE	12/16/20 12:03	6/30/20 8:20	FALSE	USA	United States	USA.5_1	California	USA.5.42_1	Santa Barbara	2017-1-31	FALSE
2037595244	OBS462181588	CC0_1_0	Cornell Lab of Ornithology	CLO	EBIRD	EOD - eBird Observation Dataset	HUMAN_OBSERVATION	URN:catalog:CLO:EBIRD:OBS462181588	OBS462181588	obsr302151	1	PRESENT	1/31/17 0:00	2017	1	31	US	California	Santa Barbara	Devereux Slough	34.4136	-119.876	2481192	Leucophaeus atricilla (Linnaeus, 1758)	Animalia	Chordata	Aves	Charadriiformes	Laridae	Larus	atricilla	SPECIES	Laughing Gull	SYNONYM	4fa7b334-ce0d-4e88-aaae-2e0c138d049e	US	12/16/20 11:55	TRUE	FALSE	6065844	2481192	1	44	212	7192402	9316	2481126	2481192	Larus atricilla	Leucophaeus	Larus atricilla Linnaeus, 1758	Leucophaeus atricilla	DWC_ARCHIVE	12/16/20 11:55	6/30/20 8:20	FALSE	USA	United States	USA.5_1	California	USA.5.42_1	Santa Barbara	2017-1-31	TRUE
2033488857	OBS455242793	CC0_1_0	Cornell Lab of Ornithology	CLO	EBIRD	EOD - eBird Observation Dataset	HUMAN_OBSERVATION	URN:catalog:CLO:EBIRD:OBS455242793	OBS455242793	obsr337176	2	PRESENT	1/7/17 0:00	2017	1	7	US	California	Santa Barbara	Devereux Slough	34.4136	-119.876	2498338	Cygnus columbianus (Ord, 1815)	Animalia	Chordata	Aves	Anseriformes	Anatidae	Cygnus	columbianus	SPECIES	Tundra Swan	ACCEPTED	4fa7b334-ce0d-4e88-aaae-2e0c138d049e	US	12/16/20 12:04	TRUE	FALSE	2498338	2498338	1	44	212	1108	2986	2498334	2498338	Cygnus columbianus	Cygnus	Cygnus columbianus (Ord, 1815)	Cygnus columbianus	DWC_ARCHIVE	12/16/20 12:04	6/30/20 8:20	FALSE	USA	United States	USA.5_1	California	USA.5.42_1	Santa Barbara	2017-1-7	FALSE
2033487878	OBS455258896	CC0_1_0	Cornell Lab of Ornithology	CLO	EBIRD	EOD - eBird Observation Dataset	HUMAN_OBSERVATION	URN:catalog:CLO:EBIRD:OBS455258896	OBS455258896	obsr306119	2	PRESENT	1/7/17 0:00	2017	1	7	US	California	Santa Barbara	Devereux Slough	34.4136	-119.876	2498338	Cygnus columbianus (Ord, 1815)	Animalia	Chordata	Aves	Anseriformes	Anatidae	Cygnus	columbianus	SPECIES	Tundra Swan	ACCEPTED	4fa7b334-ce0d-4e88-aaae-2e0c138d049e	US	12/16/20 12:06	TRUE	FALSE	2498338	2498338	1	44	212	1108	2986	2498334	2498338	Cygnus columbianus	Cygnus	Cygnus columbianus (Ord, 1815)	Cygnus columbianus	DWC_ARCHIVE	12/16/20 12:06	6/30/20 8:20	FALSE	USA	United States	USA.5_1	California	USA.5.42_1	Santa Barbara	2017-1-7	FALSE
2033515224	OBS455299310	CC0_1_0	Cornell Lab of Ornithology	CLO	EBIRD	EOD - eBird Observation Dataset	HUMAN_OBSERVATION	URN:catalog:CLO:EBIRD:OBS455299310	OBS455299310	obsr221434	2	PRESENT	1/7/17 0:00	2017	1	7	US	California	Santa Barbara	Devereux Slough	34.4136	-119.876	2498338	Cygnus columbianus (Ord, 1815)	Animalia	Chordata	Aves	Anseriformes	Anatidae	Cygnus	columbianus	SPECIES	Tundra Swan	ACCEPTED	4fa7b334-ce0d-4e88-aaae-2e0c138d049e	US	12/16/20 12:03	TRUE	FALSE	2498338	2498338	1	44	212	1108	2986	2498334	2498338	Cygnus columbianus	Cygnus	Cygnus columbianus (Ord, 1815)	Cygnus columbianus	DWC_ARCHIVE	12/16/20 12:03	6/30/20 8:20	FALSE	USA	United States	USA.5_1	California	USA.5.42_1	Santa Barbara	2017-1-7	FALSE
2073274902	OBS501635748	CC0_1_0	Cornell Lab of Ornithology	CLO	EBIRD	EOD - eBird Observation Dataset	HUMAN_OBSERVATION	URN:catalog:CLO:EBIRD:OBS501635748	OBS501635748	obsr282891	2	PRESENT	1/7/17 0:00	2017	1	7	US	California	Santa Barbara	Devereux Slough	34.4136	-119.876	2498338	Cygnus columbianus (Ord, 1815)	Animalia	Chordata	Aves	Anseriformes	Anatidae	Cygnus	columbianus	SPECIES	Tundra Swan	ACCEPTED	4fa7b334-ce0d-4e88-aaae-2e0c138d049e	US	12/16/20 12:15	TRUE	FALSE	2498338	2498338	1	44	212	1108	2986	2498334	2498338	Cygnus columbianus	Cygnus	Cygnus columbianus (Ord, 1815)	Cygnus columbianus	DWC_ARCHIVE	12/16/20 12:15	6/30/20 8:20	FALSE	USA	United States	USA.5_1	California	USA.5.42_1	Santa Barbara	2017-1-7	FALSE
2032364005	OBS455332795	CC0_1_0	Cornell Lab of Ornithology	CLO	EBIRD	EOD - eBird Observation Dataset	HUMAN_OBSERVATION	URN:catalog:CLO:EBIRD:OBS455332795	OBS455332795	obsr687919	2	PRESENT	1/7/17 0:00	2017	1	7	US	California	Santa Barbara	Devereux Slough	34.4136	-119.876	2498338	Cygnus columbianus (Ord, 1815)	Animalia	Chordata	Aves	Anseriformes	Anatidae	Cygnus	columbianus	SPECIES	Tundra Swan	ACCEPTED	4fa7b334-ce0d-4e88-aaae-2e0c138d049e	US	12/16/20 12:05	TRUE	FALSE	2498338	2498338	1	44	212	1108	2986	2498334	2498338	Cygnus columbianus	Cygnus	Cygnus columbianus (Ord, 1815)	Cygnus columbianus	DWC_ARCHIVE	12/16/20 12:05	6/30/20 8:20	FALSE	USA	United States	USA.5_1	California	USA.5.42_1	Santa Barbara	2017-1-7	FALSE
2032389862	OBS455396049	CC0_1_0	Cornell Lab of Ornithology	CLO	EBIRD	EOD - eBird Observation Dataset	HUMAN_OBSERVATION	URN:catalog:CLO:EBIRD:OBS455396049	OBS455396049	obsr840725	2	PRESENT	1/7/17 0:00	2017	1	7	US	California	Santa Barbara	Devereux Slough	34.4136	-119.876	2498338	Cygnus columbianus (Ord, 1815)	Animalia	Chordata	Aves	Anseriformes	Anatidae	Cygnus	columbianus	SPECIES	Tundra Swan	ACCEPTED	4fa7b334-ce0d-4e88-aaae-2e0c138d049e	US	12/16/20 11:54	TRUE	FALSE	2498338	2498338	1	44	212	1108	2986	2498334	2498338	Cygnus columbianus	Cygnus	Cygnus columbianus (Ord, 1815)	Cygnus columbianus	DWC_ARCHIVE	12/16/20 11:54	6/30/20 8:20	FALSE	USA	United States	USA.5_1	California	USA.5.42_1	Santa Barbara	2017-1-7	FALSE
2036948050	OBS455278423	CC0_1_0	Cornell Lab of Ornithology	CLO	EBIRD	EOD - eBird Observation Dataset	HUMAN_OBSERVATION	URN:catalog:CLO:EBIRD:OBS455278423	OBS455278423	obsr309446	2	PRESENT	1/7/17 0:00	2017	1	7	US	California	Santa Barbara	Devereux Slough	34.4136	-119.876	2498338	Cygnus columbianus (Ord, 1815)	Animalia	Chordata	Aves	Anseriformes	Anatidae	Cygnus	columbianus	SPECIES	Tundra Swan	ACCEPTED	4fa7b334-ce0d-4e88-aaae-2e0c138d049e	US	12/16/20 12:05	TRUE	FALSE	2498338	2498338	1	44	212	1108	2986	2498334	2498338	Cygnus columbianus	Cygnus	Cygnus columbianus (Ord, 1815)	Cygnus columbianus	DWC_ARCHIVE	12/16/20 12:05	6/30/20 8:20	FALSE	USA	United States	USA.5_1	California	USA.5.42_1	Santa Barbara	2017-1-7	FALSE
2033514923	OBS455300618	CC0_1_0	Cornell Lab of Ornithology	CLO	EBIRD	EOD - eBird Observation Dataset	HUMAN_OBSERVATION	URN:catalog:CLO:EBIRD:OBS455300618	OBS455300618	obsr51183	2	PRESENT	1/7/17 0:00	2017	1	7	US	California	Santa Barbara	Devereux Slough	34.4136	-119.876	2498338	Cygnus columbianus (Ord, 1815)	Animalia	Chordata	Aves	Anseriformes	Anatidae	Cygnus	columbianus	SPECIES	Tundra Swan	ACCEPTED	4fa7b334-ce0d-4e88-aaae-2e0c138d049e	US	12/16/20 11:54	TRUE	FALSE	2498338	2498338	1	44	212	1108	2986	2498334	2498338	Cygnus columbianus	Cygnus	Cygnus columbianus (Ord, 1815)	Cygnus columbianus	DWC_ARCHIVE	12/16/20 11:54	6/30/20 8:20	FALSE	USA	United States	USA.5_1	California	USA.5.42_1	Santa Barbara	2017-1-7	TRUE
2036902661	OBS455219227	CC0_1_0	Cornell Lab of Ornithology	CLO	EBIRD	EOD - eBird Observation Dataset	HUMAN_OBSERVATION	URN:catalog:CLO:EBIRD:OBS455219227	OBS455219227	obsr548926	2	PRESENT	1/7/17 0:00	2017	1	7	US	California	Santa Barbara	Devereux Slough	34.4136	-119.876	2498338	Cygnus columbianus (Ord, 1815)	Animalia	Chordata	Aves	Anseriformes	Anatidae	Cygnus	columbianus	SPECIES	Tundra Swan	ACCEPTED	4fa7b334-ce0d-4e88-aaae-2e0c138d049e	US	12/16/20 11:55	TRUE	FALSE	2498338	2498338	1	44	212	1108	2986	2498334	2498338	Cygnus columbianus	Cygnus	Cygnus columbianus (Ord, 1815)	Cygnus columbianus	DWC_ARCHIVE	12/16/20 11:55	6/30/20 8:20	FALSE	USA	United States	USA.5_1	California	USA.5.42_1	Santa Barbara	2017-1-7	TRUE
2029902579	OBS455670047	CC0_1_0	Cornell Lab of Ornithology	CLO	EBIRD	EOD - eBird Observation Dataset	HUMAN_OBSERVATION	URN:catalog:CLO:EBIRD:OBS455670047	OBS455670047	obsr614277	2	PRESENT	1/8/17 0:00	2017	1	8	US	California	Santa Barbara	Devereux Slough	34.4136	-119.876	2498256	Aythya valisineria (A.Wilson, 1814)	Animalia	Chordata	Aves	Anseriformes	Anatidae	Aythya	valisineria	SPECIES	Canvasback	ACCEPTED	4fa7b334-ce0d-4e88-aaae-2e0c138d049e	US	12/16/20 12:05	TRUE	FALSE	2498256	2498256	1	44	212	1108	2986	2498254	2498256	Aythya valisineria	Aythya	Aythya valisineria (A.Wilson, 1814)	Aythya valisineria	DWC_ARCHIVE	12/16/20 12:05	6/30/20 8:20	FALSE	USA	United States	USA.5_1	California	USA.5.42_1	Santa Barbara	2017-1-8	FALSE
2033682245	OBS455726286	CC0_1_0	Cornell Lab of Ornithology	CLO	EBIRD	EOD - eBird Observation Dataset	HUMAN_OBSERVATION	URN:catalog:CLO:EBIRD:OBS455726286	OBS455726286	obsr184473	2	PRESENT	1/8/17 0:00	2017	1	8	US	California	Santa Barbara	Devereux Slough	34.4136	-119.876	2498256	Aythya valisineria (A.Wilson, 1814)	Animalia	Chordata	Aves	Anseriformes	Anatidae	Aythya	valisineria	SPECIES	Canvasback	ACCEPTED	4fa7b334-ce0d-4e88-aaae-2e0c138d049e	US	12/16/20 11:54	TRUE	FALSE	2498256	2498256	1	44	212	1108	2986	2498254	2498256	Aythya valisineria	Aythya	Aythya valisineria (A.Wilson, 1814)	Aythya valisineria	DWC_ARCHIVE	12/16/20 11:54	6/30/20 8:20	FALSE	USA	United States	USA.5_1	California	USA.5.42_1	Santa Barbara	2017-1-8	FALSE
2037177909	OBS455677974	CC0_1_0	Cornell Lab of Ornithology	CLO	EBIRD	EOD - eBird Observation Dataset	HUMAN_OBSERVATION	URN:catalog:CLO:EBIRD:OBS455677974	OBS455677974	obsr309446	2	PRESENT	1/8/17 0:00	2017	1	8	US	California	Santa Barbara	Devereux Slough	34.4136	-119.876	2498256	Aythya valisineria (A.Wilson, 1814)	Animalia	Chordata	Aves	Anseriformes	Anatidae	Aythya	valisineria	SPECIES	Canvasback	ACCEPTED	4fa7b334-ce0d-4e88-aaae-2e0c138d049e	US	12/16/20 11:56	TRUE	FALSE	2498256	2498256	1	44	212	1108	2986	2498254	2498256	Aythya valisineria	Aythya	Aythya valisineria (A.Wilson, 1814)	Aythya valisineria	DWC_ARCHIVE	12/16/20 11:56	6/30/20 8:20	FALSE	USA	United States	USA.5_1	California	USA.5.42_1	Santa Barbara	2017-1-8	FALSE
2029904714	OBS455670041	CC0_1_0	Cornell Lab of Ornithology	CLO	EBIRD	EOD - eBird Observation Dataset	HUMAN_OBSERVATION	URN:catalog:CLO:EBIRD:OBS455670041	OBS455670041	obsr614277	1	PRESENT	1/8/17 0:00	2017	1	8	US	California	Santa Barbara	Devereux Slough	34.4136	-119.876	5231483	Salpinctes obsoletus (Say, 1822)	Animalia	Chordata	Aves	Passeriformes	Troglodytidae	Salpinctes	obsoletus	SPECIES	Rock Wren	ACCEPTED	4fa7b334-ce0d-4e88-aaae-2e0c138d049e	US	12/16/20 12:05	TRUE	FALSE	5231483	5231483	1	44	212	729	9355	2493947	5231483	Salpinctes obsoletus	Salpinctes	Salpinctes obsoletus (Say, 1822)	Salpinctes obsoletus	DWC_ARCHIVE	12/16/20 12:05	6/30/20 8:20	FALSE	USA	United States	USA.5_1	California	USA.5.42_1	Santa Barbara	2017-1-8	FALSE
2037177517	OBS455686167	CC0_1_0	Cornell Lab of Ornithology	CLO	EBIRD	EOD - eBird Observation Dataset	HUMAN_OBSERVATION	URN:catalog:CLO:EBIRD:OBS455686167	OBS455686167	obsr683846	1	PRESENT	1/8/17 0:00	2017	1	8	US	California	Santa Barbara	Devereux Slough	34.4136	-119.876	2498256	Aythya valisineria (A.Wilson, 1814)	Animalia	Chordata	Aves	Anseriformes	Anatidae	Aythya	valisineria	SPECIES	Canvasback	ACCEPTED	4fa7b334-ce0d-4e88-aaae-2e0c138d049e	US	12/16/20 12:05	TRUE	FALSE	2498256	2498256	1	44	212	1108	2986	2498254	2498256	Aythya valisineria	Aythya	Aythya valisineria (A.Wilson, 1814)	Aythya valisineria	DWC_ARCHIVE	12/16/20 12:05	6/30/20 8:20	FALSE	USA	United States	USA.5_1	California	USA.5.42_1	Santa Barbara	2017-1-8	FALSE
2033673551	OBS455734626	CC0_1_0	Cornell Lab of Ornithology	CLO	EBIRD	EOD - eBird Observation Dataset	HUMAN_OBSERVATION	URN:catalog:CLO:EBIRD:OBS455734626	OBS455734626	obsr53608	2	PRESENT	1/8/17 0:00	2017	1	8	US	California	Santa Barbara	Devereux Slough	34.4136	-119.876	2498256	Aythya valisineria (A.Wilson, 1814)	Animalia	Chordata	Aves	Anseriformes	Anatidae	Aythya	valisineria	SPECIES	Canvasback	ACCEPTED	4fa7b334-ce0d-4e88-aaae-2e0c138d049e	US	12/16/20 12:05	TRUE	FALSE	2498256	2498256	1	44	212	1108	2986	2498254	2498256	Aythya valisineria	Aythya	Aythya valisineria (A.Wilson, 1814)	Aythya valisineria	DWC_ARCHIVE	12/16/20 12:05	6/30/20 8:20	FALSE	USA	United States	USA.5_1	California	USA.5.42_1	Santa Barbara	2017-1-8	FALSE
2037096223	OBS455534040	CC0_1_0	Cornell Lab of Ornithology	CLO	EBIRD	EOD - eBird Observation Dataset	HUMAN_OBSERVATION	URN:catalog:CLO:EBIRD:OBS455534040	OBS455534040	obsr420881	1	PRESENT	1/8/17 0:00	2017	1	8	US	California	Santa Barbara	Devereux Slough	34.4136	-119.876	2498256	Aythya valisineria (A.Wilson, 1814)	Animalia	Chordata	Aves	Anseriformes	Anatidae	Aythya	valisineria	SPECIES	Canvasback	ACCEPTED	4fa7b334-ce0d-4e88-aaae-2e0c138d049e	US	12/16/20 12:04	TRUE	FALSE	2498256	2498256	1	44	212	1108	2986	2498254	2498256	Aythya valisineria	Aythya	Aythya valisineria (A.Wilson, 1814)	Aythya valisineria	DWC_ARCHIVE	12/16/20 12:04	6/30/20 8:20	FALSE	USA	United States	USA.5_1	California	USA.5.42_1	Santa Barbara	2017-1-8	TRUE
2029965247	OBS456040133	CC0_1_0	Cornell Lab of Ornithology	CLO	EBIRD	EOD - eBird Observation Dataset	HUMAN_OBSERVATION	URN:catalog:CLO:EBIRD:OBS456040133	OBS456040133	obsr447864	1	PRESENT	1/9/17 0:00	2017	1	9	US	California	Santa Barbara	Devereux Slough	34.4136	-119.876	2498326	Bucephala clangula (Linnaeus, 1758)	Animalia	Chordata	Aves	Anseriformes	Anatidae	Bucephala	clangula	SPECIES	Common Goldeneye	ACCEPTED	4fa7b334-ce0d-4e88-aaae-2e0c138d049e	US	12/16/20 11:56	TRUE	FALSE	2498326	2498326	1	44	212	1108	2986	2498324	2498326	Bucephala clangula	Bucephala	Bucephala clangula (Linnaeus, 1758)	Bucephala clangula	DWC_ARCHIVE	12/16/20 11:56	6/30/20 8:20	FALSE	USA	United States	USA.5_1	California	USA.5.42_1	Santa Barbara	2017-1-9	FALSE
2029963872	OBS456040130	CC0_1_0	Cornell Lab of Ornithology	CLO	EBIRD	EOD - eBird Observation Dataset	HUMAN_OBSERVATION	URN:catalog:CLO:EBIRD:OBS456040130	OBS456040130	obsr447864	2	PRESENT	1/9/17 0:00	2017	1	9	US	California	Santa Barbara	Devereux Slough	34.4136	-119.876	2498256	Aythya valisineria (A.Wilson, 1814)	Animalia	Chordata	Aves	Anseriformes	Anatidae	Aythya	valisineria	SPECIES	Canvasback	ACCEPTED	4fa7b334-ce0d-4e88-aaae-2e0c138d049e	US	12/16/20 11:55	TRUE	FALSE	2498256	2498256	1	44	212	1108	2986	2498254	2498256	Aythya valisineria	Aythya	Aythya valisineria (A.Wilson, 1814)	Aythya valisineria	DWC_ARCHIVE	12/16/20 11:55	6/30/20 8:20	FALSE	USA	United States	USA.5_1	California	USA.5.42_1	Santa Barbara	2017-1-9	FALSE
2112139229	OBS548476671	CC0_1_0	Cornell Lab of Ornithology	CLO	EBIRD	EOD - eBird Observation Dataset	HUMAN_OBSERVATION	URN:catalog:CLO:EBIRD:OBS548476671	OBS548476671	obsr284646	1	PRESENT	11/10/17 0:00	2017	11	10	US	California	Santa Barbara	Coal Oil Point--Devereux Beach and Sands Beach	34.4071	-119.878	2491872	Passerella iliaca (Merrem, 1786)	Animalia	Chordata	Aves	Passeriformes	Emberizidae	Passerella	iliaca	SPECIES	Fox Sparrow	ACCEPTED	4fa7b334-ce0d-4e88-aaae-2e0c138d049e	US	12/16/20 12:06	TRUE	FALSE	2491872	2491872	1	44	212	729	9608	2491871	2491872	Passerella iliaca	Passerella	Passerella iliaca (Merrem, 1786)	Passerella iliaca	DWC_ARCHIVE	12/16/20 12:06	6/30/20 8:20	FALSE	USA	United States	USA.5_1	California	USA.5.42_1	Santa Barbara	2017-11-10	FALSE
2113230162	OBS549651976	CC0_1_0	Cornell Lab of Ornithology	CLO	EBIRD	EOD - eBird Observation Dataset	HUMAN_OBSERVATION	URN:catalog:CLO:EBIRD:OBS549651976	OBS549651976	obsr548926	1	PRESENT	11/12/17 0:00	2017	11	12	US	California	Santa Barbara	Devereux Slough	34.4136	-119.876	2497921	Tyto alba (Scopoli, 1769)	Animalia	Chordata	Aves	Strigiformes	Tytonidae	Tyto	alba	SPECIES	Barn Owl	ACCEPTED	4fa7b334-ce0d-4e88-aaae-2e0c138d049e	US	12/16/20 12:05	TRUE	FALSE	2497921	2497921	1	44	212	1450	5292	2497905	2497921	Tyto alba	Tyto	Tyto alba (Scopoli, 1769)	Tyto alba	DWC_ARCHIVE	12/16/20 12:05	6/30/20 8:20	FALSE	USA	United States	USA.5_1	California	USA.5.42_1	Santa Barbara	2017-11-12	TRUE
2111716331	OBS548032424	CC0_1_0	Cornell Lab of Ornithology	CLO	EBIRD	EOD - eBird Observation Dataset	HUMAN_OBSERVATION	URN:catalog:CLO:EBIRD:OBS548032424	OBS548032424	obsr413715	1	PRESENT	11/9/17 0:00	2017	11	9	US	California	Santa Barbara	Dune Pond at COPR	34.4137	-119.882	2492235	Melospiza georgiana (Latham, 1790)	Animalia	Chordata	Aves	Passeriformes	Emberizidae	Melospiza	georgiana	SPECIES	Swamp Sparrow	ACCEPTED	4fa7b334-ce0d-4e88-aaae-2e0c138d049e	US	12/16/20 11:56	TRUE	FALSE	2492235	2492235	1	44	212	729	9608	2492191	2492235	Melospiza georgiana	Melospiza	Melospiza georgiana (Latham, 1790)	Melospiza georgiana	DWC_ARCHIVE	12/16/20 11:56	6/30/20 8:20	FALSE	USA	United States	USA.5_1	California	USA.5.42_1	Santa Barbara	2017-11-9	FALSE
2108957428	OBS554038861	CC0_1_0	Cornell Lab of Ornithology	CLO	EBIRD	EOD - eBird Observation Dataset	HUMAN_OBSERVATION	URN:catalog:CLO:EBIRD:OBS554038861	OBS554038861	obsr88430	2	PRESENT	12/2/17 0:00	2017	12	2	US	California	Santa Barbara	Coal Oil Point--Devereux Beach and Sands Beach	34.4071	-119.878	2481609	Stercorarius pomarinus (Temminck, 1815)	Animalia	Chordata	Aves	Charadriiformes	Stercorariidae	Stercorarius	pomarinus	SPECIES	Pomarine Jaeger	ACCEPTED	4fa7b334-ce0d-4e88-aaae-2e0c138d049e	US	12/16/20 11:56	TRUE	FALSE	2481609	2481609	1	44	212	7192402	9347	2481608	2481609	Stercorarius pomarinus	Stercorarius	Stercorarius pomarinus (Temminck, 1815)	Stercorarius pomarinus	DWC_ARCHIVE	12/16/20 11:56	6/30/20 8:20	FALSE	USA	United States	USA.5_1	California	USA.5.42_1	Santa Barbara	2017-12-2	FALSE
2123358357	OBS561122708	CC0_1_0	Cornell Lab of Ornithology	CLO	EBIRD	EOD - eBird Observation Dataset	HUMAN_OBSERVATION	URN:catalog:CLO:EBIRD:OBS561122708	OBS561122708	obsr237677	1	PRESENT	12/27/17 0:00	2017	12	27	US	California	Santa Barbara	Devereux Slough	34.4136	-119.876	2480292	Charadrius montanus J.K.Townsend, 1837	Animalia	Chordata	Aves	Charadriiformes	Charadriidae	Charadrius	montanus	SPECIES	Mountain Plover	ACCEPTED	4fa7b334-ce0d-4e88-aaae-2e0c138d049e	US	12/16/20 11:57	TRUE	FALSE	2480292	2480292	1	44	212	7192402	2480210	2480277	2480292	Charadrius montanus	Charadrius	Charadrius montanus J.K.Townsend, 1837	Charadrius montanus	DWC_ARCHIVE	12/16/20 11:57	6/30/20 8:20	FALSE	USA	United States	USA.5_1	California	USA.5.42_1	Santa Barbara	2017-12-27	FALSE
2100711247	OBS560662183	CC0_1_0	Cornell Lab of Ornithology	CLO	EBIRD	EOD - eBird Observation Dataset	HUMAN_OBSERVATION	URN:catalog:CLO:EBIRD:OBS560662183	OBS560662183	obsr302151	1	PRESENT	12/27/17 0:00	2017	12	27	US	California	Santa Barbara	Coal Oil Point--Devereux Beach and Sands Beach	34.4071	-119.878	2480292	Charadrius montanus J.K.Townsend, 1837	Animalia	Chordata	Aves	Charadriiformes	Charadriidae	Charadrius	montanus	SPECIES	Mountain Plover	ACCEPTED	4fa7b334-ce0d-4e88-aaae-2e0c138d049e	US	12/16/20 12:05	TRUE	FALSE	2480292	2480292	1	44	212	7192402	2480210	2480277	2480292	Charadrius montanus	Charadrius	Charadrius montanus J.K.Townsend, 1837	Charadrius montanus	DWC_ARCHIVE	12/16/20 12:05	6/30/20 8:20	FALSE	USA	United States	USA.5_1	California	USA.5.42_1	Santa Barbara	2017-12-27	TRUE
2100817964	OBS560787073	CC0_1_0	Cornell Lab of Ornithology	CLO	EBIRD	EOD - eBird Observation Dataset	HUMAN_OBSERVATION	URN:catalog:CLO:EBIRD:OBS560787073	OBS560787073	obsr548926	1	PRESENT	12/27/17 0:00	2017	12	27	US	California	Santa Barbara	Devereux Slough	34.4136	-119.876	2480292	Charadrius montanus J.K.Townsend, 1837	Animalia	Chordata	Aves	Charadriiformes	Charadriidae	Charadrius	montanus	SPECIES	Mountain Plover	ACCEPTED	4fa7b334-ce0d-4e88-aaae-2e0c138d049e	US	12/16/20 11:56	TRUE	FALSE	2480292	2480292	1	44	212	7192402	2480210	2480277	2480292	Charadrius montanus	Charadrius	Charadrius montanus J.K.Townsend, 1837	Charadrius montanus	DWC_ARCHIVE	12/16/20 11:56	6/30/20 8:20	FALSE	USA	United States	USA.5_1	California	USA.5.42_1	Santa Barbara	2017-12-27	TRUE
2033709273	OBS470150826	CC0_1_0	Cornell Lab of Ornithology	CLO	EBIRD	EOD - eBird Observation Dataset	HUMAN_OBSERVATION	URN:catalog:CLO:EBIRD:OBS470150826	OBS470150826	obsr227271	1	PRESENT	2/24/17 0:00	2017	2	24	US	California	Santa Barbara	Devereux Slough	34.4136	-119.876	9537647	Mergus merganser Linnaeus, 1758	Animalia	Chordata	Aves	Anseriformes	Anatidae	Mergus	merganser	SPECIES	Common Merganser	ACCEPTED	4fa7b334-ce0d-4e88-aaae-2e0c138d049e	US	12/16/20 11:55	TRUE	FALSE	9537647	9537647	1	44	212	1108	2986	2498368	9537647	Mergus merganser	Mergus	Mergus merganser Linnaeus, 1758	Mergus merganser	DWC_ARCHIVE	12/16/20 11:55	6/30/20 8:20	FALSE	USA	United States	USA.5_1	California	USA.5.42_1	Santa Barbara	2017-2-24	FALSE
2065256306	OBS491195140	CC0_1_0	Cornell Lab of Ornithology	CLO	EBIRD	EOD - eBird Observation Dataset	HUMAN_OBSERVATION	URN:catalog:CLO:EBIRD:OBS491195140	OBS491195140	obsr302151	2	PRESENT	4/27/17 0:00	2017	4	27	US	California	Santa Barbara	Devereux Slough	34.4136	-119.876	5846430	Leucophaeus pipixcan (Wagler, 1831)	Animalia	Chordata	Aves	Charadriiformes	Laridae	Leucophaeus	pipixcan	SPECIES	Franklin's Gull	ACCEPTED	4fa7b334-ce0d-4e88-aaae-2e0c138d049e	US	12/16/20 12:06	TRUE	FALSE	5846430	5846430	1	44	212	7192402	9316	4352369	5846430	Leucophaeus pipixcan	Leucophaeus	Leucophaeus pipixcan (Wagler, 1831)	Leucophaeus pipixcan	DWC_ARCHIVE	12/16/20 12:06	6/30/20 8:20	FALSE	USA	United States	USA.5_1	California	USA.5.42_1	Santa Barbara	2017-4-27	TRUE
2047792754	OBS491710383	CC0_1_0	Cornell Lab of Ornithology	CLO	EBIRD	EOD - eBird Observation Dataset	HUMAN_OBSERVATION	URN:catalog:CLO:EBIRD:OBS491710383	OBS491710383	obsr302151	1	PRESENT	4/28/17 0:00	2017	4	28	US	California	Santa Barbara	Devereux Slough	34.4136	-119.876	5846430	Leucophaeus pipixcan (Wagler, 1831)	Animalia	Chordata	Aves	Charadriiformes	Laridae	Leucophaeus	pipixcan	SPECIES	Franklin's Gull	ACCEPTED	4fa7b334-ce0d-4e88-aaae-2e0c138d049e	US	12/16/20 12:04	TRUE	FALSE	5846430	5846430	1	44	212	7192402	9316	4352369	5846430	Leucophaeus pipixcan	Leucophaeus	Leucophaeus pipixcan (Wagler, 1831)	Leucophaeus pipixcan	DWC_ARCHIVE	12/16/20 12:04	6/30/20 8:20	FALSE	USA	United States	USA.5_1	California	USA.5.42_1	Santa Barbara	2017-4-28	TRUE
2050942929	OBS481992592	CC0_1_0	Cornell Lab of Ornithology	CLO	EBIRD	EOD - eBird Observation Dataset	HUMAN_OBSERVATION	URN:catalog:CLO:EBIRD:OBS481992592	OBS481992592	obsr337176	1	PRESENT	4/4/17 0:00	2017	4	4	US	California	Santa Barbara	Coal Oil Point--Devereux Beach and Sands Beach	34.4071	-119.878	9537647	Mergus merganser Linnaeus, 1758	Animalia	Chordata	Aves	Anseriformes	Anatidae	Mergus	merganser	SPECIES	Common Merganser	ACCEPTED	4fa7b334-ce0d-4e88-aaae-2e0c138d049e	US	12/16/20 12:04	TRUE	FALSE	9537647	9537647	1	44	212	1108	2986	2498368	9537647	Mergus merganser	Mergus	Mergus merganser Linnaeus, 1758	Mergus merganser	DWC_ARCHIVE	12/16/20 12:04	6/30/20 8:20	FALSE	USA	United States	USA.5_1	California	USA.5.42_1	Santa Barbara	2017-4-4	FALSE
2052143672	OBS483433742	CC0_1_0	Cornell Lab of Ornithology	CLO	EBIRD	EOD - eBird Observation Dataset	HUMAN_OBSERVATION	URN:catalog:CLO:EBIRD:OBS483433742	OBS483433742	obsr306119	1	PRESENT	4/8/17 0:00	2017	4	8	US	California	Santa Barbara	Devereux Slough	34.4136	-119.876	2498261	Aythya fuligula (Linnaeus, 1758)	Animalia	Chordata	Aves	Anseriformes	Anatidae	Aythya	fuligula	SPECIES	Tufted Duck	ACCEPTED	4fa7b334-ce0d-4e88-aaae-2e0c138d049e	US	12/16/20 11:56	TRUE	FALSE	2498261	2498261	1	44	212	1108	2986	2498254	2498261	Aythya fuligula	Aythya	Aythya fuligula (Linnaeus, 1758)	Aythya fuligula	DWC_ARCHIVE	12/16/20 11:56	6/30/20 8:20	FALSE	USA	United States	USA.5_1	California	USA.5.42_1	Santa Barbara	2017-4-8	FALSE
2042557533	OBS483959078	CC0_1_0	Cornell Lab of Ornithology	CLO	EBIRD	EOD - eBird Observation Dataset	HUMAN_OBSERVATION	URN:catalog:CLO:EBIRD:OBS483959078	OBS483959078	obsr420881	1	PRESENT	4/9/17 0:00	2017	4	9	US	California	Santa Barbara	Devereux Slough	34.4136	-119.876	2498261	Aythya fuligula (Linnaeus, 1758)	Animalia	Chordata	Aves	Anseriformes	Anatidae	Aythya	fuligula	SPECIES	Tufted Duck	ACCEPTED	4fa7b334-ce0d-4e88-aaae-2e0c138d049e	US	12/16/20 12:05	TRUE	FALSE	2498261	2498261	1	44	212	1108	2986	2498254	2498261	Aythya fuligula	Aythya	Aythya fuligula (Linnaeus, 1758)	Aythya fuligula	DWC_ARCHIVE	12/16/20 12:05	6/30/20 8:20	FALSE	USA	United States	USA.5_1	California	USA.5.42_1	Santa Barbara	2017-4-9	TRUE
2059197319	OBS483708466	CC0_1_0	Cornell Lab of Ornithology	CLO	EBIRD	EOD - eBird Observation Dataset	HUMAN_OBSERVATION	URN:catalog:CLO:EBIRD:OBS483708466	OBS483708466	obsr548926	1	PRESENT	4/9/17 0:00	2017	4	9	US	California	Santa Barbara	Devereux Slough	34.4136	-119.876	2498261	Aythya fuligula (Linnaeus, 1758)	Animalia	Chordata	Aves	Anseriformes	Anatidae	Aythya	fuligula	SPECIES	Tufted Duck	ACCEPTED	4fa7b334-ce0d-4e88-aaae-2e0c138d049e	US	12/16/20 11:55	TRUE	FALSE	2498261	2498261	1	44	212	1108	2986	2498254	2498261	Aythya fuligula	Aythya	Aythya fuligula (Linnaeus, 1758)	Aythya fuligula	DWC_ARCHIVE	12/16/20 11:55	6/30/20 8:20	FALSE	USA	United States	USA.5_1	California	USA.5.42_1	Santa Barbara	2017-4-9	TRUE
2071006409	OBS499110604	CC0_1_0	Cornell Lab of Ornithology	CLO	EBIRD	EOD - eBird Observation Dataset	HUMAN_OBSERVATION	URN:catalog:CLO:EBIRD:OBS499110604	OBS499110604	obsr302151	1	PRESENT	5/13/17 0:00	2017	5	13	US	California	Santa Barbara	Devereux Slough	34.4136	-119.876	2481764	Calidris pusilla (Linnaeus, 1766)	Animalia	Chordata	Aves	Charadriiformes	Scolopacidae	Calidris	pusilla	SPECIES	Semipalmated Sandpiper	ACCEPTED	4fa7b334-ce0d-4e88-aaae-2e0c138d049e	US	12/16/20 11:55	TRUE	FALSE	2481764	2481764	1	44	212	7192402	5282	2481739	2481764	Calidris pusilla	Calidris	Calidris pusilla (Linnaeus, 1766)	Calidris pusilla	DWC_ARCHIVE	12/16/20 11:55	6/30/20 8:20	FALSE	USA	United States	USA.5_1	California	USA.5.42_1	Santa Barbara	2017-5-13	TRUE
2078248307	OBS514143119	CC0_1_0	Cornell Lab of Ornithology	CLO	EBIRD	EOD - eBird Observation Dataset	HUMAN_OBSERVATION	URN:catalog:CLO:EBIRD:OBS514143119	OBS514143119	obsr336926	1	PRESENT	6/25/17 0:00	2017	6	25	US	California	Santa Barbara	Coal Oil Point--Devereux Beach and Sands Beach	34.4071	-119.878	2481776	Arenaria interpres (Linnaeus, 1758)	Animalia	Chordata	Aves	Charadriiformes	Scolopacidae	Arenaria	interpres	SPECIES	Ruddy Turnstone	ACCEPTED	4fa7b334-ce0d-4e88-aaae-2e0c138d049e	US	12/16/20 12:08	TRUE	FALSE	2481776	2481776	1	44	212	7192402	5282	2481774	2481776	Arenaria interpres	Arenaria	Arenaria interpres (Linnaeus, 1758)	Arenaria interpres	DWC_ARCHIVE	12/16/20 12:08	6/30/20 8:20	FALSE	USA	United States	USA.5_1	California	USA.5.42_1	Santa Barbara	2017-6-25	FALSE
2208253397	OBS668315724	CC0_1_0	Cornell Lab of Ornithology	CLO	EBIRD	EOD - eBird Observation Dataset	HUMAN_OBSERVATION	URN:catalog:CLO:EBIRD:OBS668315724	OBS668315724	obsr336926	1	PRESENT	6/25/17 0:00	2017	6	25	US	California	Santa Barbara	Devereux Slough	34.4136	-119.876	2481776	Arenaria interpres (Linnaeus, 1758)	Animalia	Chordata	Aves	Charadriiformes	Scolopacidae	Arenaria	interpres	SPECIES	Ruddy Turnstone	ACCEPTED	4fa7b334-ce0d-4e88-aaae-2e0c138d049e	US	12/16/20 12:07	TRUE	FALSE	2481776	2481776	1	44	212	7192402	5282	2481774	2481776	Arenaria interpres	Arenaria	Arenaria interpres (Linnaeus, 1758)	Arenaria interpres	DWC_ARCHIVE	12/16/20 12:07	6/30/20 8:20	FALSE	USA	United States	USA.5_1	California	USA.5.42_1	Santa Barbara	2017-6-25	FALSE
2078448158	OBS515377514	CC0_1_0	Cornell Lab of Ornithology	CLO	EBIRD	EOD - eBird Observation Dataset	HUMAN_OBSERVATION	URN:catalog:CLO:EBIRD:OBS515377514	OBS515377514	obsr420881	5	PRESENT	7/1/17 0:00	2017	7	1	US	California	Santa Barbara	Coal Oil Point--Devereux Beach and Sands Beach	34.4071	-119.878	2481342	Uria aalge (Pontoppidan, 1763)	Animalia	Chordata	Aves	Charadriiformes	Alcidae	Uria	aalge	SPECIES	Common Murre	ACCEPTED	4fa7b334-ce0d-4e88-aaae-2e0c138d049e	US	12/16/20 11:56	TRUE	FALSE	2481342	2481342	1	44	212	7192402	2985	2481338	2481342	Uria aalge	Uria	Uria aalge (Pontoppidan, 1763)	Uria aalge	DWC_ARCHIVE	12/16/20 11:56	6/30/20 8:20	FALSE	USA	United States	USA.5_1	California	USA.5.42_1	Santa Barbara	2017-7-1	TRUE
2084265648	OBS515377516	CC0_1_0	Cornell Lab of Ornithology	CLO	EBIRD	EOD - eBird Observation Dataset	HUMAN_OBSERVATION	URN:catalog:CLO:EBIRD:OBS515377516	OBS515377516	obsr420881	2500	PRESENT	7/1/17 0:00	2017	7	1	US	California	Santa Barbara	Coal Oil Point--Devereux Beach and Sands Beach	34.4071	-119.878	5739277	Ardenna grisea (Gmelin, 1789)	Animalia	Chordata	Aves	Procellariiformes	Procellariidae	Puffinus	grisea	SPECIES	Sooty Shearwater	SYNONYM	4fa7b334-ce0d-4e88-aaae-2e0c138d049e	US	12/16/20 11:56	TRUE	FALSE	8249990	5739277	1	44	212	7192755	9339	5229335	5739277	Puffinus griseus	Ardenna	Puffinus griseus (Gmelin, 1789)	Ardenna grisea	DWC_ARCHIVE	12/16/20 11:56	6/30/20 8:20	FALSE	USA	United States	USA.5_1	California	USA.5.42_1	Santa Barbara	2017-7-1	TRUE
2068232703	OBS517884990	CC0_1_0	Cornell Lab of Ornithology	CLO	EBIRD	EOD - eBird Observation Dataset	HUMAN_OBSERVATION	URN:catalog:CLO:EBIRD:OBS517884990	OBS517884990	obsr420881	20	PRESENT	7/10/17 0:00	2017	7	10	US	California	Santa Barbara	Coal Oil Point--Devereux Beach and Sands Beach	34.4071	-119.878	5739277	Ardenna grisea (Gmelin, 1789)	Animalia	Chordata	Aves	Procellariiformes	Procellariidae	Puffinus	grisea	SPECIES	Sooty Shearwater	SYNONYM	4fa7b334-ce0d-4e88-aaae-2e0c138d049e	US	12/16/20 12:05	TRUE	FALSE	8249990	5739277	1	44	212	7192755	9339	5229335	5739277	Puffinus griseus	Ardenna	Puffinus griseus (Gmelin, 1789)	Ardenna grisea	DWC_ARCHIVE	12/16/20 12:05	6/30/20 8:20	FALSE	USA	United States	USA.5_1	California	USA.5.42_1	Santa Barbara	2017-7-10	TRUE
2080174103	OBS517023474	CC0_1_0	Cornell Lab of Ornithology	CLO	EBIRD	EOD - eBird Observation Dataset	HUMAN_OBSERVATION	URN:catalog:CLO:EBIRD:OBS517023474	OBS517023474	obsr605751	1	PRESENT	7/6/17 0:00	2017	7	6	US	California	Santa Barbara	Coal Oil Point--Devereux Beach and Sands Beach	34.4071	-119.878	2480446	Haliaeetus leucocephalus (Linnaeus, 1766)	Animalia	Chordata	Aves	Accipitriformes	Accipitridae	Haliaeetus	leucocephalus	SPECIES	Bald Eagle	ACCEPTED	4fa7b334-ce0d-4e88-aaae-2e0c138d049e	US	12/16/20 12:05	TRUE	FALSE	2480446	2480446	1	44	212	7191147	2877	2480444	2480446	Haliaeetus leucocephalus	Haliaeetus	Haliaeetus leucocephalus (Linnaeus, 1766)	Haliaeetus leucocephalus	DWC_ARCHIVE	12/16/20 12:05	6/30/20 8:20	FALSE	USA	United States	USA.5_1	California	USA.5.42_1	Santa Barbara	2017-7-6	FALSE
2097841477	OBS531957965	CC0_1_0	Cornell Lab of Ornithology	CLO	EBIRD	EOD - eBird Observation Dataset	HUMAN_OBSERVATION	URN:catalog:CLO:EBIRD:OBS531957965	OBS531957965	obsr302151	2	PRESENT	9/10/17 0:00	2017	9	10	US	California	Santa Barbara	Coal Oil Point--Devereux Beach and Sands Beach	34.4071	-119.878	2497052	Chordeiles acutipennis (Hermann, 1783)	Animalia	Chordata	Aves	Caprimulgiformes	Caprimulgidae	Chordeiles	acutipennis	SPECIES	Lesser Nighthawk	ACCEPTED	4fa7b334-ce0d-4e88-aaae-2e0c138d049e	US	12/16/20 12:05	TRUE	FALSE	2497052	2497052	1	44	212	8510645	5225	2497027	2497052	Chordeiles acutipennis	Chordeiles	Chordeiles acutipennis (Hermann, 1783)	Chordeiles acutipennis	DWC_ARCHIVE	12/16/20 12:05	6/30/20 8:20	FALSE	USA	United States	USA.5_1	California	USA.5.42_1	Santa Barbara	2017-9-10	TRUE
2091840967	OBS532063765	CC0_1_0	Cornell Lab of Ornithology	CLO	EBIRD	EOD - eBird Observation Dataset	HUMAN_OBSERVATION	URN:catalog:CLO:EBIRD:OBS532063765	OBS532063765	obsr53608	1	PRESENT	9/11/17 0:00	2017	9	11	US	California	Santa Barbara	Coal Oil Point--Devereux Beach and Sands Beach	34.4071	-119.878	7964835	Calidris virgata	Animalia	Chordata	Aves	Charadriiformes	Scolopacidae	Calidris	virgata	SPECIES	Surfbird	ACCEPTED	4fa7b334-ce0d-4e88-aaae-2e0c138d049e	US	12/16/20 11:57	TRUE	FALSE	7964835	7964835	1	44	212	7192402	5282	2481739	7964835	Calidris virgata	Calidris	Calidris virgata	Calidris virgata	DWC_ARCHIVE	12/16/20 11:57	6/30/20 8:20	FALSE	USA	United States	USA.5_1	California	USA.5.42_1	Santa Barbara	2017-9-11	FALSE
2080139614	OBS532144605	CC0_1_0	Cornell Lab of Ornithology	CLO	EBIRD	EOD - eBird Observation Dataset	HUMAN_OBSERVATION	URN:catalog:CLO:EBIRD:OBS532144605	OBS532144605	obsr309446	1	PRESENT	9/11/17 0:00	2017	9	11	US	California	Santa Barbara	Coal Oil Point--Devereux Beach and Sands Beach	34.4071	-119.878	7964835	Calidris virgata	Animalia	Chordata	Aves	Charadriiformes	Scolopacidae	Calidris	virgata	SPECIES	Surfbird	ACCEPTED	4fa7b334-ce0d-4e88-aaae-2e0c138d049e	US	12/16/20 12:05	TRUE	FALSE	7964835	7964835	1	44	212	7192402	5282	2481739	7964835	Calidris virgata	Calidris	Calidris virgata	Calidris virgata	DWC_ARCHIVE	12/16/20 12:05	6/30/20 8:20	FALSE	USA	United States	USA.5_1	California	USA.5.42_1	Santa Barbara	2017-9-11	FALSE
2092960593	OBS533395837	CC0_1_0	Cornell Lab of Ornithology	CLO	EBIRD	EOD - eBird Observation Dataset	HUMAN_OBSERVATION	URN:catalog:CLO:EBIRD:OBS533395837	OBS533395837	obsr413715	2	PRESENT	9/16/17 0:00	2017	9	16	US	California	Santa Barbara	Dune Pond at COPR	34.4137	-119.882	2497052	Chordeiles acutipennis (Hermann, 1783)	Animalia	Chordata	Aves	Caprimulgiformes	Caprimulgidae	Chordeiles	acutipennis	SPECIES	Lesser Nighthawk	ACCEPTED	4fa7b334-ce0d-4e88-aaae-2e0c138d049e	US	12/16/20 12:03	TRUE	FALSE	2497052	2497052	1	44	212	8510645	5225	2497027	2497052	Chordeiles acutipennis	Chordeiles	Chordeiles acutipennis (Hermann, 1783)	Chordeiles acutipennis	DWC_ARCHIVE	12/16/20 12:03	6/30/20 8:20	FALSE	USA	United States	USA.5_1	California	USA.5.42_1	Santa Barbara	2017-9-16	FALSE
2099719660	OBS533996605	CC0_1_0	Cornell Lab of Ornithology	CLO	EBIRD	EOD - eBird Observation Dataset	HUMAN_OBSERVATION	URN:catalog:CLO:EBIRD:OBS533996605	OBS533996605	obsr785343	2	PRESENT	9/18/17 0:00	2017	9	18	US	California	Santa Barbara	Dune Pond at COPR	34.4137	-119.882	2497052	Chordeiles acutipennis (Hermann, 1783)	Animalia	Chordata	Aves	Caprimulgiformes	Caprimulgidae	Chordeiles	acutipennis	SPECIES	Lesser Nighthawk	ACCEPTED	4fa7b334-ce0d-4e88-aaae-2e0c138d049e	US	12/16/20 12:06	TRUE	FALSE	2497052	2497052	1	44	212	8510645	5225	2497027	2497052	Chordeiles acutipennis	Chordeiles	Chordeiles acutipennis (Hermann, 1783)	Chordeiles acutipennis	DWC_ARCHIVE	12/16/20 12:06	6/30/20 8:20	FALSE	USA	United States	USA.5_1	California	USA.5.42_1	Santa Barbara	2017-9-18	FALSE
2099979337	OBS534381637	CC0_1_0	Cornell Lab of Ornithology	CLO	EBIRD	EOD - eBird Observation Dataset	HUMAN_OBSERVATION	URN:catalog:CLO:EBIRD:OBS534381637	OBS534381637	obsr262872	2	PRESENT	9/19/17 0:00	2017	9	19	US	California	Santa Barbara	Dune Pond at COPR	34.4137	-119.882	2497052	Chordeiles acutipennis (Hermann, 1783)	Animalia	Chordata	Aves	Caprimulgiformes	Caprimulgidae	Chordeiles	acutipennis	SPECIES	Lesser Nighthawk	ACCEPTED	4fa7b334-ce0d-4e88-aaae-2e0c138d049e	US	12/16/20 11:55	TRUE	FALSE	2497052	2497052	1	44	212	8510645	5225	2497027	2497052	Chordeiles acutipennis	Chordeiles	Chordeiles acutipennis (Hermann, 1783)	Chordeiles acutipennis	DWC_ARCHIVE	12/16/20 11:55	6/30/20 8:20	FALSE	USA	United States	USA.5_1	California	USA.5.42_1	Santa Barbara	2017-9-19	FALSE
2093867897	OBS534769466	CC0_1_0	Cornell Lab of Ornithology	CLO	EBIRD	EOD - eBird Observation Dataset	HUMAN_OBSERVATION	URN:catalog:CLO:EBIRD:OBS534769466	OBS534769466	obsr420881	1	PRESENT	9/21/17 0:00	2017	9	21	US	California	Santa Barbara	Coal Oil Point--Devereux Beach and Sands Beach	34.4071	-119.878	9733156	Tringa incana (Gmelin, 1789)	Animalia	Chordata	Aves	Charadriiformes	Scolopacidae	Tringa	incana	SPECIES	Wandering Tattler	ACCEPTED	4fa7b334-ce0d-4e88-aaae-2e0c138d049e	US	12/16/20 11:56	TRUE	FALSE	9733156	9733156	1	44	212	7192402	5282	2481709	9733156	Tringa incana	Tringa	Tringa incana (Gmelin, 1789)	Tringa incana	DWC_ARCHIVE	12/16/20 11:56	6/30/20 8:20	FALSE	USA	United States	USA.5_1	California	USA.5.42_1	Santa Barbara	2017-9-21	TRUE
2101090668	OBS535597162	CC0_1_0	Cornell Lab of Ornithology	CLO	EBIRD	EOD - eBird Observation Dataset	HUMAN_OBSERVATION	URN:catalog:CLO:EBIRD:OBS535597162	OBS535597162	obsr413715	1	PRESENT	9/24/17 0:00	2017	9	24	US	California	Santa Barbara	Dune Pond at COPR	34.4137	-119.882	2481710	Tringa solitaria Wilson, 1813	Animalia	Chordata	Aves	Charadriiformes	Scolopacidae	Tringa	solitaria	SPECIES	Solitary Sandpiper	ACCEPTED	4fa7b334-ce0d-4e88-aaae-2e0c138d049e	US	12/16/20 11:57	TRUE	FALSE	2481710	2481710	1	44	212	7192402	5282	2481709	2481710	Tringa solitaria	Tringa	Tringa solitaria Wilson, 1813	Tringa solitaria	DWC_ARCHIVE	12/16/20 11:57	6/30/20 8:20	FALSE	USA	United States	USA.5_1	California	USA.5.42_1	Santa Barbara	2017-9-24	FALSE
2100935920	OBS535457595	CC0_1_0	Cornell Lab of Ornithology	CLO	EBIRD	EOD - eBird Observation Dataset	HUMAN_OBSERVATION	URN:catalog:CLO:EBIRD:OBS535457595	OBS535457595	obsr420881	1	PRESENT	9/24/17 0:00	2017	9	24	US	California	Santa Barbara	Dune Pond at COPR	34.4137	-119.882	2481710	Tringa solitaria Wilson, 1813	Animalia	Chordata	Aves	Charadriiformes	Scolopacidae	Tringa	solitaria	SPECIES	Solitary Sandpiper	ACCEPTED	4fa7b334-ce0d-4e88-aaae-2e0c138d049e	US	12/16/20 12:04	TRUE	FALSE	2481710	2481710	1	44	212	7192402	5282	2481709	2481710	Tringa solitaria	Tringa	Tringa solitaria Wilson, 1813	Tringa solitaria	DWC_ARCHIVE	12/16/20 12:04	6/30/20 8:20	FALSE	USA	United States	USA.5_1	California	USA.5.42_1	Santa Barbara	2017-9-24	TRUE
2101733187	OBS536627436	CC0_1_0	Cornell Lab of Ornithology	CLO	EBIRD	EOD - eBird Observation Dataset	HUMAN_OBSERVATION	URN:catalog:CLO:EBIRD:OBS536627436	OBS536627436	obsr689353	1	PRESENT	9/25/17 0:00	2017	9	25	US	California	Santa Barbara	Dune Pond at COPR	34.4137	-119.882	2481710	Tringa solitaria Wilson, 1813	Animalia	Chordata	Aves	Charadriiformes	Scolopacidae	Tringa	solitaria	SPECIES	Solitary Sandpiper	ACCEPTED	4fa7b334-ce0d-4e88-aaae-2e0c138d049e	US	12/16/20 11:57	TRUE	FALSE	2481710	2481710	1	44	212	7192402	5282	2481709	2481710	Tringa solitaria	Tringa	Tringa solitaria Wilson, 1813	Tringa solitaria	DWC_ARCHIVE	12/16/20 11:57	6/30/20 8:20	FALSE	USA	United States	USA.5_1	California	USA.5.42_1	Santa Barbara	2017-9-25	FALSE
2082965066	OBS535903719	CC0_1_0	Cornell Lab of Ornithology	CLO	EBIRD	EOD - eBird Observation Dataset	HUMAN_OBSERVATION	URN:catalog:CLO:EBIRD:OBS535903719	OBS535903719	obsr172576	1	PRESENT	9/25/17 0:00	2017	9	25	US	California	Santa Barbara	Dune Pond at COPR	34.4137	-119.882	2481710	Tringa solitaria Wilson, 1813	Animalia	Chordata	Aves	Charadriiformes	Scolopacidae	Tringa	solitaria	SPECIES	Solitary Sandpiper	ACCEPTED	4fa7b334-ce0d-4e88-aaae-2e0c138d049e	US	12/16/20 12:06	TRUE	FALSE	2481710	2481710	1	44	212	7192402	5282	2481709	2481710	Tringa solitaria	Tringa	Tringa solitaria Wilson, 1813	Tringa solitaria	DWC_ARCHIVE	12/16/20 12:06	6/30/20 8:20	FALSE	USA	United States	USA.5_1	California	USA.5.42_1	Santa Barbara	2017-9-25	FALSE
2101421158	OBS536000958	CC0_1_0	Cornell Lab of Ornithology	CLO	EBIRD	EOD - eBird Observation Dataset	HUMAN_OBSERVATION	URN:catalog:CLO:EBIRD:OBS536000958	OBS536000958	obsr302151	1	PRESENT	9/25/17 0:00	2017	9	25	US	California	Santa Barbara	Coal Oil Point--Devereux Beach and Sands Beach	34.4071	-119.878	2481710	Tringa solitaria Wilson, 1813	Animalia	Chordata	Aves	Charadriiformes	Scolopacidae	Tringa	solitaria	SPECIES	Solitary Sandpiper	ACCEPTED	4fa7b334-ce0d-4e88-aaae-2e0c138d049e	US	12/16/20 12:05	TRUE	FALSE	2481710	2481710	1	44	212	7192402	5282	2481709	2481710	Tringa solitaria	Tringa	Tringa solitaria Wilson, 1813	Tringa solitaria	DWC_ARCHIVE	12/16/20 12:05	6/30/20 8:20	FALSE	USA	United States	USA.5_1	California	USA.5.42_1	Santa Barbara	2017-9-25	TRUE
2101343741	OBS535905054	CC0_1_0	Cornell Lab of Ornithology	CLO	EBIRD	EOD - eBird Observation Dataset	HUMAN_OBSERVATION	URN:catalog:CLO:EBIRD:OBS535905054	OBS535905054	obsr111092	1	PRESENT	9/25/17 0:00	2017	9	25	US	California	Santa Barbara	Dune Pond at COPR	34.4137	-119.882	2481710	Tringa solitaria Wilson, 1813	Animalia	Chordata	Aves	Charadriiformes	Scolopacidae	Tringa	solitaria	SPECIES	Solitary Sandpiper	ACCEPTED	4fa7b334-ce0d-4e88-aaae-2e0c138d049e	US	12/16/20 12:05	TRUE	FALSE	2481710	2481710	1	44	212	7192402	5282	2481709	2481710	Tringa solitaria	Tringa	Tringa solitaria Wilson, 1813	Tringa solitaria	DWC_ARCHIVE	12/16/20 12:05	6/30/20 8:20	FALSE	USA	United States	USA.5_1	California	USA.5.42_1	Santa Barbara	2017-9-25	TRUE
2095883841	OBS529796717	CC0_1_0	Cornell Lab of Ornithology	CLO	EBIRD	EOD - eBird Observation Dataset	HUMAN_OBSERVATION	URN:catalog:CLO:EBIRD:OBS529796717	OBS529796717	obsr302151	2	PRESENT	9/3/17 0:00	2017	9	3	US	California	Santa Barbara	Coal Oil Point--Devereux Beach and Sands Beach	34.4071	-119.878	2474825	Rallus limicola Vieillot, 1819	Animalia	Chordata	Aves	Gruiformes	Rallidae	Rallus	limicola	SPECIES	Virginia Rail	ACCEPTED	4fa7b334-ce0d-4e88-aaae-2e0c138d049e	US	12/16/20 12:16	TRUE	FALSE	2474825	2474825	1	44	212	1493	9342	2474794	2474825	Rallus limicola	Rallus	Rallus limicola Vieillot, 1819	Rallus limicola	DWC_ARCHIVE	12/16/20 12:16	6/30/20 8:20	FALSE	USA	United States	USA.5_1	California	USA.5.42_1	Santa Barbara	2017-9-3	TRUE
2089944633	OBS529796708	CC0_1_0	Cornell Lab of Ornithology	CLO	EBIRD	EOD - eBird Observation Dataset	HUMAN_OBSERVATION	URN:catalog:CLO:EBIRD:OBS529796708	OBS529796708	obsr302151	1	PRESENT	9/3/17 0:00	2017	9	3	US	California	Santa Barbara	Coal Oil Point--Devereux Beach and Sands Beach	34.4071	-119.878	2481776	Arenaria interpres (Linnaeus, 1758)	Animalia	Chordata	Aves	Charadriiformes	Scolopacidae	Arenaria	interpres	SPECIES	Ruddy Turnstone	ACCEPTED	4fa7b334-ce0d-4e88-aaae-2e0c138d049e	US	12/16/20 11:56	TRUE	FALSE	2481776	2481776	1	44	212	7192402	5282	2481774	2481776	Arenaria interpres	Arenaria	Arenaria interpres (Linnaeus, 1758)	Arenaria interpres	DWC_ARCHIVE	12/16/20 11:56	6/30/20 8:20	FALSE	USA	United States	USA.5_1	California	USA.5.42_1	Santa Barbara	2017-9-3	TRUE
2078075650	OBS530298418	CC0_1_0	Cornell Lab of Ornithology	CLO	EBIRD	EOD - eBird Observation Dataset	HUMAN_OBSERVATION	URN:catalog:CLO:EBIRD:OBS530298418	OBS530298418	obsr302151	1	PRESENT	9/4/17 0:00	2017	9	4	US	California	Santa Barbara	Coal Oil Point--Devereux Beach and Sands Beach	34.4071	-119.878	9367409	Sterna hirundo Linnaeus, 1758	Animalia	Chordata	Aves	Charadriiformes	Laridae	Sterna	hirundo	SPECIES	Common Tern	ACCEPTED	4fa7b334-ce0d-4e88-aaae-2e0c138d049e	US	12/16/20 12:17	TRUE	FALSE	9367409	9367409	1	44	212	7192402	9316	2481227	9367409	Sterna hirundo	Sterna	Sterna hirundo Linnaeus, 1758	Sterna hirundo	DWC_ARCHIVE	12/16/20 12:17	6/30/20 8:20	FALSE	USA	United States	USA.5_1	California	USA.5.42_1	Santa Barbara	2017-9-4	TRUE
2096341958	OBS530298431	CC0_1_0	Cornell Lab of Ornithology	CLO	EBIRD	EOD - eBird Observation Dataset	HUMAN_OBSERVATION	URN:catalog:CLO:EBIRD:OBS530298431	OBS530298431	obsr302151	1	PRESENT	9/4/17 0:00	2017	9	4	US	California	Santa Barbara	Coal Oil Point--Devereux Beach and Sands Beach	34.4071	-119.878	2484195	Xanthocephalus xanthocephalus (Bonaparte, 1826)	Animalia	Chordata	Aves	Passeriformes	Icteridae	Xanthocephalus	xanthocephalus	SPECIES	Yellow-headed Blackbird	ACCEPTED	4fa7b334-ce0d-4e88-aaae-2e0c138d049e	US	12/16/20 12:16	TRUE	FALSE	2484195	2484195	1	44	212	729	6176	2484194	2484195	Xanthocephalus xanthocephalus	Xanthocephalus	Xanthocephalus xanthocephalus (Bonaparte, 1826)	Xanthocephalus xanthocephalus	DWC_ARCHIVE	12/16/20 12:16	6/30/20 8:20	FALSE	USA	United States	USA.5_1	California	USA.5.42_1	Santa Barbara	2017-9-4	TRUE
2078816418	OBS530938257	CC0_1_0	Cornell Lab of Ornithology	CLO	EBIRD	EOD - eBird Observation Dataset	HUMAN_OBSERVATION	URN:catalog:CLO:EBIRD:OBS530938257	OBS530938257	obsr605751	1	PRESENT	9/5/17 0:00	2017	9	5	US	California	Santa Barbara	Coal Oil Point--Devereux Beach and Sands Beach	34.4071	-119.878	9367409	Sterna hirundo Linnaeus, 1758	Animalia	Chordata	Aves	Charadriiformes	Laridae	Sterna	hirundo	SPECIES	Common Tern	ACCEPTED	4fa7b334-ce0d-4e88-aaae-2e0c138d049e	US	12/16/20 12:16	TRUE	FALSE	9367409	9367409	1	44	212	7192402	9316	2481227	9367409	Sterna hirundo	Sterna	Sterna hirundo Linnaeus, 1758	Sterna hirundo	DWC_ARCHIVE	12/16/20 12:16	6/30/20 8:20	FALSE	USA	United States	USA.5_1	California	USA.5.42_1	Santa Barbara	2017-9-5	FALSE
2089875947	OBS530486475	CC0_1_0	Cornell Lab of Ornithology	CLO	EBIRD	EOD - eBird Observation Dataset	HUMAN_OBSERVATION	URN:catalog:CLO:EBIRD:OBS530486475	OBS530486475	obsr111092	1	PRESENT	9/5/17 0:00	2017	9	5	US	California	Santa Barbara	Devereux Beach	34.4092	-119.881	9367409	Sterna hirundo Linnaeus, 1758	Animalia	Chordata	Aves	Charadriiformes	Laridae	Sterna	hirundo	SPECIES	Common Tern	ACCEPTED	4fa7b334-ce0d-4e88-aaae-2e0c138d049e	US	12/16/20 12:05	TRUE	FALSE	9367409	9367409	1	44	212	7192402	9316	2481227	9367409	Sterna hirundo	Sterna	Sterna hirundo Linnaeus, 1758	Sterna hirundo	DWC_ARCHIVE	12/16/20 12:05	6/30/20 8:20	FALSE	NA	NA	NA	NA	NA	NA	2017-9-5	TRUE
2089867620	OBS530486485	CC0_1_0	Cornell Lab of Ornithology	CLO	EBIRD	EOD - eBird Observation Dataset	HUMAN_OBSERVATION	URN:catalog:CLO:EBIRD:OBS530486485	OBS530486485	obsr111092	1	PRESENT	9/5/17 0:00	2017	9	5	US	California	Santa Barbara	Devereux Beach	34.4092	-119.881	2481776	Arenaria interpres (Linnaeus, 1758)	Animalia	Chordata	Aves	Charadriiformes	Scolopacidae	Arenaria	interpres	SPECIES	Ruddy Turnstone	ACCEPTED	4fa7b334-ce0d-4e88-aaae-2e0c138d049e	US	12/16/20 12:05	TRUE	FALSE	2481776	2481776	1	44	212	7192402	5282	2481774	2481776	Arenaria interpres	Arenaria	Arenaria interpres (Linnaeus, 1758)	Arenaria interpres	DWC_ARCHIVE	12/16/20 12:05	6/30/20 8:20	FALSE	NA	NA	NA	NA	NA	NA	2017-9-5	TRUE
2119295248	OBS565982026	CC0_1_0	Cornell Lab of Ornithology	CLO	EBIRD	EOD - eBird Observation Dataset	HUMAN_OBSERVATION	URN:catalog:CLO:EBIRD:OBS565982026	OBS565982026	obsr840725	NA	PRESENT	1/10/18 0:00	2018	1	10	US	California	Santa Barbara	Devereux Slough	34.4136	-119.876	5232452	Branta hutchinsii (Richardson, 1832)	Animalia	Chordata	Aves	Anseriformes	Anatidae	Branta	hutchinsii	SPECIES	Cackling Goose	ACCEPTED	4fa7b334-ce0d-4e88-aaae-2e0c138d049e	US	12/16/20 12:05	TRUE	FALSE	5232452	5232452	1	44	212	1108	2986	2498190	5232452	Branta hutchinsii	Branta	Branta hutchinsii (Richardson, 1832)	Branta hutchinsii	DWC_ARCHIVE	12/16/20 12:05	6/30/20 8:20	FALSE	USA	United States	USA.5_1	California	USA.5.42_1	Santa Barbara	2018-1-10	FALSE
2119282430	OBS565973066	CC0_1_0	Cornell Lab of Ornithology	CLO	EBIRD	EOD - eBird Observation Dataset	HUMAN_OBSERVATION	URN:catalog:CLO:EBIRD:OBS565973066	OBS565973066	obsr413715	2	PRESENT	1/10/18 0:00	2018	1	10	US	California	Santa Barbara	Devereux Slough	34.4136	-119.876	5232452	Branta hutchinsii (Richardson, 1832)	Animalia	Chordata	Aves	Anseriformes	Anatidae	Branta	hutchinsii	SPECIES	Cackling Goose	ACCEPTED	4fa7b334-ce0d-4e88-aaae-2e0c138d049e	US	12/16/20 11:56	TRUE	FALSE	5232452	5232452	1	44	212	1108	2986	2498190	5232452	Branta hutchinsii	Branta	Branta hutchinsii (Richardson, 1832)	Branta hutchinsii	DWC_ARCHIVE	12/16/20 11:56	6/30/20 8:20	FALSE	USA	United States	USA.5_1	California	USA.5.42_1	Santa Barbara	2018-1-10	FALSE
2127930833	OBS566107777	CC0_1_0	Cornell Lab of Ornithology	CLO	EBIRD	EOD - eBird Observation Dataset	HUMAN_OBSERVATION	URN:catalog:CLO:EBIRD:OBS566107777	OBS566107777	obsr842316	NA	PRESENT	1/10/18 0:00	2018	1	10	US	California	Santa Barbara	Devereux Slough	34.4136	-119.876	5232452	Branta hutchinsii (Richardson, 1832)	Animalia	Chordata	Aves	Anseriformes	Anatidae	Branta	hutchinsii	SPECIES	Cackling Goose	ACCEPTED	4fa7b334-ce0d-4e88-aaae-2e0c138d049e	US	12/16/20 12:06	TRUE	FALSE	5232452	5232452	1	44	212	1108	2986	2498190	5232452	Branta hutchinsii	Branta	Branta hutchinsii (Richardson, 1832)	Branta hutchinsii	DWC_ARCHIVE	12/16/20 12:06	6/30/20 8:20	FALSE	USA	United States	USA.5_1	California	USA.5.42_1	Santa Barbara	2018-1-10	FALSE
2118187641	OBS566400660	CC0_1_0	Cornell Lab of Ornithology	CLO	EBIRD	EOD - eBird Observation Dataset	HUMAN_OBSERVATION	URN:catalog:CLO:EBIRD:OBS566400660	OBS566400660	obsr420881	22	PRESENT	1/10/18 0:00	2018	1	10	US	California	Santa Barbara	Devereux Slough	34.4136	-119.876	5232452	Branta hutchinsii (Richardson, 1832)	Animalia	Chordata	Aves	Anseriformes	Anatidae	Branta	hutchinsii	SPECIES	Cackling Goose	ACCEPTED	4fa7b334-ce0d-4e88-aaae-2e0c138d049e	US	12/16/20 12:06	TRUE	FALSE	5232452	5232452	1	44	212	1108	2986	2498190	5232452	Branta hutchinsii	Branta	Branta hutchinsii (Richardson, 1832)	Branta hutchinsii	DWC_ARCHIVE	12/16/20 12:06	6/30/20 8:20	FALSE	USA	United States	USA.5_1	California	USA.5.42_1	Santa Barbara	2018-1-10	TRUE
2104893282	OBS566617087	CC0_1_0	Cornell Lab of Ornithology	CLO	EBIRD	EOD - eBird Observation Dataset	HUMAN_OBSERVATION	URN:catalog:CLO:EBIRD:OBS566617087	OBS566617087	obsr337176	5	PRESENT	1/12/18 0:00	2018	1	12	US	California	Santa Barbara	Devereux Slough	34.4136	-119.876	2498165	Anser caerulescens (Linnaeus, 1758)	Animalia	Chordata	Aves	Anseriformes	Anatidae	Chen	caerulescens	SPECIES	Snow Goose	SYNONYM	4fa7b334-ce0d-4e88-aaae-2e0c138d049e	US	12/16/20 11:57	TRUE	FALSE	2498167	2498165	1	44	212	1108	2986	2498159	2498165	Chen caerulescens	Anser	Chen caerulescens (Linnaeus, 1758)	Anser caerulescens	DWC_ARCHIVE	12/16/20 11:57	6/30/20 8:20	FALSE	USA	United States	USA.5_1	California	USA.5.42_1	Santa Barbara	2018-1-12	FALSE
2111111128	OBS574620074	CC0_1_0	Cornell Lab of Ornithology	CLO	EBIRD	EOD - eBird Observation Dataset	HUMAN_OBSERVATION	URN:catalog:CLO:EBIRD:OBS574620074	OBS574620074	obsr301252	NA	PRESENT	1/20/18 0:00	2018	1	20	US	California	Santa Barbara	Devereux Slough	34.4136	-119.876	5231140	Zonotrichia albicollis (J.F.Gmelin, 1789)	Animalia	Chordata	Aves	Passeriformes	Emberizidae	Zonotrichia	albicollis	SPECIES	White-throated Sparrow	ACCEPTED	4fa7b334-ce0d-4e88-aaae-2e0c138d049e	US	12/16/20 12:07	TRUE	FALSE	5231140	5231140	1	44	212	729	9608	6173226	5231140	Zonotrichia albicollis	Zonotrichia	Zonotrichia albicollis (J.F.Gmelin, 1789)	Zonotrichia albicollis	DWC_ARCHIVE	12/16/20 12:07	6/30/20 8:20	FALSE	USA	United States	USA.5_1	California	USA.5.42_1	Santa Barbara	2018-1-20	FALSE
2111112514	OBS574619910	CC0_1_0	Cornell Lab of Ornithology	CLO	EBIRD	EOD - eBird Observation Dataset	HUMAN_OBSERVATION	URN:catalog:CLO:EBIRD:OBS574619910	OBS574619910	obsr163406	NA	PRESENT	1/20/18 0:00	2018	1	20	US	California	Santa Barbara	Devereux Slough	34.4136	-119.876	5231140	Zonotrichia albicollis (J.F.Gmelin, 1789)	Animalia	Chordata	Aves	Passeriformes	Emberizidae	Zonotrichia	albicollis	SPECIES	White-throated Sparrow	ACCEPTED	4fa7b334-ce0d-4e88-aaae-2e0c138d049e	US	12/16/20 11:56	TRUE	FALSE	5231140	5231140	1	44	212	729	9608	6173226	5231140	Zonotrichia albicollis	Zonotrichia	Zonotrichia albicollis (J.F.Gmelin, 1789)	Zonotrichia albicollis	DWC_ARCHIVE	12/16/20 11:56	6/30/20 8:20	FALSE	USA	United States	USA.5_1	California	USA.5.42_1	Santa Barbara	2018-1-20	FALSE
2122220245	OBS571038451	CC0_1_0	Cornell Lab of Ornithology	CLO	EBIRD	EOD - eBird Observation Dataset	HUMAN_OBSERVATION	URN:catalog:CLO:EBIRD:OBS571038451	OBS571038451	obsr420881	1	PRESENT	1/25/18 0:00	2018	1	25	US	California	Santa Barbara	Coal Oil Point--Devereux Beach and Sands Beach	34.4071	-119.878	2481609	Stercorarius pomarinus (Temminck, 1815)	Animalia	Chordata	Aves	Charadriiformes	Stercorariidae	Stercorarius	pomarinus	SPECIES	Pomarine Jaeger	ACCEPTED	4fa7b334-ce0d-4e88-aaae-2e0c138d049e	US	12/16/20 12:06	TRUE	FALSE	2481609	2481609	1	44	212	7192402	9347	2481608	2481609	Stercorarius pomarinus	Stercorarius	Stercorarius pomarinus (Temminck, 1815)	Stercorarius pomarinus	DWC_ARCHIVE	12/16/20 12:06	6/30/20 8:20	FALSE	USA	United States	USA.5_1	California	USA.5.42_1	Santa Barbara	2018-1-25	TRUE
2122216308	OBS571038435	CC0_1_0	Cornell Lab of Ornithology	CLO	EBIRD	EOD - eBird Observation Dataset	HUMAN_OBSERVATION	URN:catalog:CLO:EBIRD:OBS571038435	OBS571038435	obsr420881	15	PRESENT	1/25/18 0:00	2018	1	25	US	California	Santa Barbara	Coal Oil Point--Devereux Beach and Sands Beach	34.4071	-119.878	5229356	Puffinus opisthomelas Coues, 1864	Animalia	Chordata	Aves	Procellariiformes	Procellariidae	Puffinus	opisthomelas	SPECIES	Black-vented Shearwater	ACCEPTED	4fa7b334-ce0d-4e88-aaae-2e0c138d049e	US	12/16/20 12:06	TRUE	FALSE	5229356	5229356	1	44	212	7192755	9339	5229335	5229356	Puffinus opisthomelas	Puffinus	Puffinus opisthomelas Coues, 1864	Puffinus opisthomelas	DWC_ARCHIVE	12/16/20 12:06	6/30/20 8:20	FALSE	USA	United States	USA.5_1	California	USA.5.42_1	Santa Barbara	2018-1-25	TRUE
2123959172	OBS571038424	CC0_1_0	Cornell Lab of Ornithology	CLO	EBIRD	EOD - eBird Observation Dataset	HUMAN_OBSERVATION	URN:catalog:CLO:EBIRD:OBS571038424	OBS571038424	obsr420881	2	PRESENT	1/25/18 0:00	2018	1	25	US	California	Santa Barbara	Coal Oil Point--Devereux Beach and Sands Beach	34.4071	-119.878	2481621	Stercorarius parasiticus (Linnaeus, 1758)	Animalia	Chordata	Aves	Charadriiformes	Stercorariidae	Stercorarius	parasiticus	SPECIES	Parasitic Jaeger	ACCEPTED	4fa7b334-ce0d-4e88-aaae-2e0c138d049e	US	12/16/20 12:05	TRUE	FALSE	2481621	2481621	1	44	212	7192402	9347	2481608	2481621	Stercorarius parasiticus	Stercorarius	Stercorarius parasiticus (Linnaeus, 1758)	Stercorarius parasiticus	DWC_ARCHIVE	12/16/20 12:05	6/30/20 8:20	FALSE	USA	United States	USA.5_1	California	USA.5.42_1	Santa Barbara	2018-1-25	TRUE
2133445548	OBS572111183	CC0_1_0	Cornell Lab of Ornithology	CLO	EBIRD	EOD - eBird Observation Dataset	HUMAN_OBSERVATION	URN:catalog:CLO:EBIRD:OBS572111183	OBS572111183	obsr34952	2	PRESENT	1/28/18 0:00	2018	1	28	US	California	Santa Barbara	Devereux Slough	34.4136	-119.876	2495266	Patagioenas fasciata (Say, 1823)	Animalia	Chordata	Aves	Columbiformes	Columbidae	Patagioenas	fasciata	SPECIES	Band-tailed Pigeon	ACCEPTED	4fa7b334-ce0d-4e88-aaae-2e0c138d049e	US	12/16/20 11:56	TRUE	FALSE	2495266	2495266	1	44	212	1446	5233	2495265	2495266	Patagioenas fasciata	Patagioenas	Patagioenas fasciata (Say, 1823)	Patagioenas fasciata	DWC_ARCHIVE	12/16/20 11:56	6/30/20 8:20	FALSE	USA	United States	USA.5_1	California	USA.5.42_1	Santa Barbara	2018-1-28	FALSE
2123117839	OBS572112338	CC0_1_0	Cornell Lab of Ornithology	CLO	EBIRD	EOD - eBird Observation Dataset	HUMAN_OBSERVATION	URN:catalog:CLO:EBIRD:OBS572112338	OBS572112338	obsr34952	1	PRESENT	1/28/18 0:00	2018	1	28	US	California	Santa Barbara	Coal Oil Point--Devereux Beach and Sands Beach	34.4071	-119.878	2481621	Stercorarius parasiticus (Linnaeus, 1758)	Animalia	Chordata	Aves	Charadriiformes	Stercorariidae	Stercorarius	parasiticus	SPECIES	Parasitic Jaeger	ACCEPTED	4fa7b334-ce0d-4e88-aaae-2e0c138d049e	US	12/16/20 11:56	TRUE	FALSE	2481621	2481621	1	44	212	7192402	9347	2481608	2481621	Stercorarius parasiticus	Stercorarius	Stercorarius parasiticus (Linnaeus, 1758)	Stercorarius parasiticus	DWC_ARCHIVE	12/16/20 11:56	6/30/20 8:20	FALSE	USA	United States	USA.5_1	California	USA.5.42_1	Santa Barbara	2018-1-28	FALSE
2117780053	OBS565932782	CC0_1_0	Cornell Lab of Ornithology	CLO	EBIRD	EOD - eBird Observation Dataset	HUMAN_OBSERVATION	URN:catalog:CLO:EBIRD:OBS565932782	OBS565932782	obsr417931	4	PRESENT	1/9/18 0:00	2018	1	9	US	California	Santa Barbara	Devereux Slough	34.4136	-119.876	2498165	Anser caerulescens (Linnaeus, 1758)	Animalia	Chordata	Aves	Anseriformes	Anatidae	Chen	caerulescens	SPECIES	Snow Goose	SYNONYM	4fa7b334-ce0d-4e88-aaae-2e0c138d049e	US	12/16/20 12:16	TRUE	FALSE	2498167	2498165	1	44	212	1108	2986	2498159	2498165	Chen caerulescens	Anser	Chen caerulescens (Linnaeus, 1758)	Anser caerulescens	DWC_ARCHIVE	12/16/20 12:16	6/30/20 8:20	FALSE	USA	United States	USA.5_1	California	USA.5.42_1	Santa Barbara	2018-1-9	FALSE
2119175173	OBS565845249	CC0_1_0	Cornell Lab of Ornithology	CLO	EBIRD	EOD - eBird Observation Dataset	HUMAN_OBSERVATION	URN:catalog:CLO:EBIRD:OBS565845249	OBS565845249	obsr420881	4	PRESENT	1/9/18 0:00	2018	1	9	US	California	Santa Barbara	Devereux Slough	34.4136	-119.876	2498165	Anser caerulescens (Linnaeus, 1758)	Animalia	Chordata	Aves	Anseriformes	Anatidae	Chen	caerulescens	SPECIES	Snow Goose	SYNONYM	4fa7b334-ce0d-4e88-aaae-2e0c138d049e	US	12/16/20 12:06	TRUE	FALSE	2498167	2498165	1	44	212	1108	2986	2498159	2498165	Chen caerulescens	Anser	Chen caerulescens (Linnaeus, 1758)	Anser caerulescens	DWC_ARCHIVE	12/16/20 12:06	6/30/20 8:20	FALSE	USA	United States	USA.5_1	California	USA.5.42_1	Santa Barbara	2018-1-9	TRUE
2212824181	OBS669907565	CC0_1_0	Cornell Lab of Ornithology	CLO	EBIRD	EOD - eBird Observation Dataset	HUMAN_OBSERVATION	URN:catalog:CLO:EBIRD:OBS669907565	OBS669907565	obsr689353	1	PRESENT	10/23/18 0:00	2018	10	23	US	California	Santa Barbara	Devereux Slough	34.4136	-119.876	2481744	Calidris melanotos (Vieillot, 1819)	Animalia	Chordata	Aves	Charadriiformes	Scolopacidae	Calidris	melanotos	SPECIES	Pectoral Sandpiper	ACCEPTED	4fa7b334-ce0d-4e88-aaae-2e0c138d049e	US	12/16/20 12:06	TRUE	FALSE	2481744	2481744	1	44	212	7192402	5282	2481739	2481744	Calidris melanotos	Calidris	Calidris melanotos (Vieillot, 1819)	Calidris melanotos	DWC_ARCHIVE	12/16/20 12:06	6/30/20 8:20	FALSE	USA	United States	USA.5_1	California	USA.5.42_1	Santa Barbara	2018-10-23	FALSE
2209598848	OBS669764206	CC0_1_0	Cornell Lab of Ornithology	CLO	EBIRD	EOD - eBird Observation Dataset	HUMAN_OBSERVATION	URN:catalog:CLO:EBIRD:OBS669764206	OBS669764206	obsr987555	1	PRESENT	10/23/18 0:00	2018	10	23	US	California	Santa Barbara	Devereux Slough	34.4136	-119.876	2481744	Calidris melanotos (Vieillot, 1819)	Animalia	Chordata	Aves	Charadriiformes	Scolopacidae	Calidris	melanotos	SPECIES	Pectoral Sandpiper	ACCEPTED	4fa7b334-ce0d-4e88-aaae-2e0c138d049e	US	12/16/20 11:57	TRUE	FALSE	2481744	2481744	1	44	212	7192402	5282	2481739	2481744	Calidris melanotos	Calidris	Calidris melanotos (Vieillot, 1819)	Calidris melanotos	DWC_ARCHIVE	12/16/20 11:57	6/30/20 8:20	FALSE	USA	United States	USA.5_1	California	USA.5.42_1	Santa Barbara	2018-10-23	FALSE
2221963503	OBS669706173	CC0_1_0	Cornell Lab of Ornithology	CLO	EBIRD	EOD - eBird Observation Dataset	HUMAN_OBSERVATION	URN:catalog:CLO:EBIRD:OBS669706173	OBS669706173	obsr111092	1	PRESENT	10/23/18 0:00	2018	10	23	US	California	Santa Barbara	Devereux Slough	34.4136	-119.876	2481744	Calidris melanotos (Vieillot, 1819)	Animalia	Chordata	Aves	Charadriiformes	Scolopacidae	Calidris	melanotos	SPECIES	Pectoral Sandpiper	ACCEPTED	4fa7b334-ce0d-4e88-aaae-2e0c138d049e	US	12/16/20 12:07	TRUE	FALSE	2481744	2481744	1	44	212	7192402	5282	2481739	2481744	Calidris melanotos	Calidris	Calidris melanotos (Vieillot, 1819)	Calidris melanotos	DWC_ARCHIVE	12/16/20 12:07	6/30/20 8:20	FALSE	USA	United States	USA.5_1	California	USA.5.42_1	Santa Barbara	2018-10-23	TRUE
2213762082	OBS670802409	CC0_1_0	Cornell Lab of Ornithology	CLO	EBIRD	EOD - eBird Observation Dataset	HUMAN_OBSERVATION	URN:catalog:CLO:EBIRD:OBS670802409	OBS670802409	obsr933209	1	PRESENT	10/27/18 0:00	2018	10	27	US	California	Santa Barbara	Devereux Slough	34.4136	-119.876	2481744	Calidris melanotos (Vieillot, 1819)	Animalia	Chordata	Aves	Charadriiformes	Scolopacidae	Calidris	melanotos	SPECIES	Pectoral Sandpiper	ACCEPTED	4fa7b334-ce0d-4e88-aaae-2e0c138d049e	US	12/16/20 12:17	TRUE	FALSE	2481744	2481744	1	44	212	7192402	5282	2481739	2481744	Calidris melanotos	Calidris	Calidris melanotos (Vieillot, 1819)	Calidris melanotos	DWC_ARCHIVE	12/16/20 12:17	6/30/20 8:20	FALSE	USA	United States	USA.5_1	California	USA.5.42_1	Santa Barbara	2018-10-27	FALSE
2191334264	OBS663091825	CC0_1_0	Cornell Lab of Ornithology	CLO	EBIRD	EOD - eBird Observation Dataset	HUMAN_OBSERVATION	URN:catalog:CLO:EBIRD:OBS663091825	OBS663091825	obsr933209	1	PRESENT	10/4/18 0:00	2018	10	4	US	California	Santa Barbara	Devereux Slough	34.4136	-119.876	2481770	Calidris bairdii (Coues, 1861)	Animalia	Chordata	Aves	Charadriiformes	Scolopacidae	Calidris	bairdii	SPECIES	Baird's Sandpiper	ACCEPTED	4fa7b334-ce0d-4e88-aaae-2e0c138d049e	US	12/16/20 12:06	TRUE	FALSE	2481770	2481770	1	44	212	7192402	5282	2481739	2481770	Calidris bairdii	Calidris	Calidris bairdii (Coues, 1861)	Calidris bairdii	DWC_ARCHIVE	12/16/20 12:06	6/30/20 8:20	FALSE	USA	United States	USA.5_1	California	USA.5.42_1	Santa Barbara	2018-10-4	FALSE
2191453073	OBS663220270	CC0_1_0	Cornell Lab of Ornithology	CLO	EBIRD	EOD - eBird Observation Dataset	HUMAN_OBSERVATION	URN:catalog:CLO:EBIRD:OBS663220270	OBS663220270	obsr629596	1	PRESENT	10/4/18 0:00	2018	10	4	US	California	Santa Barbara	Devereux Slough	34.4136	-119.876	2481770	Calidris bairdii (Coues, 1861)	Animalia	Chordata	Aves	Charadriiformes	Scolopacidae	Calidris	bairdii	SPECIES	Baird's Sandpiper	ACCEPTED	4fa7b334-ce0d-4e88-aaae-2e0c138d049e	US	12/16/20 11:57	TRUE	FALSE	2481770	2481770	1	44	212	7192402	5282	2481739	2481770	Calidris bairdii	Calidris	Calidris bairdii (Coues, 1861)	Calidris bairdii	DWC_ARCHIVE	12/16/20 11:57	6/30/20 8:20	FALSE	USA	United States	USA.5_1	California	USA.5.42_1	Santa Barbara	2018-10-4	FALSE
2231640293	OBS684628884	CC0_1_0	Cornell Lab of Ornithology	CLO	EBIRD	EOD - eBird Observation Dataset	HUMAN_OBSERVATION	URN:catalog:CLO:EBIRD:OBS684628884	OBS684628884	obsr337176	1	PRESENT	12/10/18 0:00	2018	12	10	US	California	Santa Barbara	Devereux Slough	34.4136	-119.876	5229155	Pelecanus erythrorhynchos Gmelin, 1789	Animalia	Chordata	Aves	Pelecaniformes	Pelecanidae	Pelecanus	erythrorhynchos	SPECIES	American White Pelican	ACCEPTED	4fa7b334-ce0d-4e88-aaae-2e0c138d049e	US	12/16/20 12:07	TRUE	FALSE	5229155	5229155	1	44	212	7190953	9329	10650925	5229155	Pelecanus erythrorhynchos	Pelecanus	Pelecanus erythrorhynchos Gmelin, 1789	Pelecanus erythrorhynchos	DWC_ARCHIVE	12/16/20 12:07	6/30/20 8:20	FALSE	USA	United States	USA.5_1	California	USA.5.42_1	Santa Barbara	2018-12-10	FALSE
2211349442	OBS684785005	CC0_1_0	Cornell Lab of Ornithology	CLO	EBIRD	EOD - eBird Observation Dataset	HUMAN_OBSERVATION	URN:catalog:CLO:EBIRD:OBS684785005	OBS684785005	obsr302151	3	PRESENT	12/10/18 0:00	2018	12	10	US	California	Santa Barbara	Devereux Slough	34.4136	-119.876	2498326	Bucephala clangula (Linnaeus, 1758)	Animalia	Chordata	Aves	Anseriformes	Anatidae	Bucephala	clangula	SPECIES	Common Goldeneye	ACCEPTED	4fa7b334-ce0d-4e88-aaae-2e0c138d049e	US	12/16/20 12:07	TRUE	FALSE	2498326	2498326	1	44	212	1108	2986	2498324	2498326	Bucephala clangula	Bucephala	Bucephala clangula (Linnaeus, 1758)	Bucephala clangula	DWC_ARCHIVE	12/16/20 12:07	6/30/20 8:20	FALSE	USA	United States	USA.5_1	California	USA.5.42_1	Santa Barbara	2018-12-10	TRUE
2213680172	OBS687566742	CC0_1_0	Cornell Lab of Ornithology	CLO	EBIRD	EOD - eBird Observation Dataset	HUMAN_OBSERVATION	URN:catalog:CLO:EBIRD:OBS687566742	OBS687566742	obsr689353	2	PRESENT	12/18/18 0:00	2018	12	18	US	California	Santa Barbara	Devereux Slough	34.4136	-119.876	2498387	Aix sponsa (Linnaeus, 1758)	Animalia	Chordata	Aves	Anseriformes	Anatidae	Aix	sponsa	SPECIES	Wood Duck	ACCEPTED	4fa7b334-ce0d-4e88-aaae-2e0c138d049e	US	12/16/20 12:07	TRUE	FALSE	2498387	2498387	1	44	212	1108	2986	2498386	2498387	Aix sponsa	Aix	Aix sponsa (Linnaeus, 1758)	Aix sponsa	DWC_ARCHIVE	12/16/20 12:07	6/30/20 8:20	FALSE	USA	United States	USA.5_1	California	USA.5.42_1	Santa Barbara	2018-12-18	FALSE
2226804704	OBS687239130	CC0_1_0	Cornell Lab of Ornithology	CLO	EBIRD	EOD - eBird Observation Dataset	HUMAN_OBSERVATION	URN:catalog:CLO:EBIRD:OBS687239130	OBS687239130	obsr785343	4	PRESENT	12/18/18 0:00	2018	12	18	US	California	Santa Barbara	Devereux Slough	34.4136	-119.876	5229155	Pelecanus erythrorhynchos Gmelin, 1789	Animalia	Chordata	Aves	Pelecaniformes	Pelecanidae	Pelecanus	erythrorhynchos	SPECIES	American White Pelican	ACCEPTED	4fa7b334-ce0d-4e88-aaae-2e0c138d049e	US	12/16/20 12:07	TRUE	FALSE	5229155	5229155	1	44	212	7190953	9329	10650925	5229155	Pelecanus erythrorhynchos	Pelecanus	Pelecanus erythrorhynchos Gmelin, 1789	Pelecanus erythrorhynchos	DWC_ARCHIVE	12/16/20 12:07	6/30/20 8:20	FALSE	USA	United States	USA.5_1	California	USA.5.42_1	Santa Barbara	2018-12-18	FALSE
2232258440	OBS687428012	CC0_1_0	Cornell Lab of Ornithology	CLO	EBIRD	EOD - eBird Observation Dataset	HUMAN_OBSERVATION	URN:catalog:CLO:EBIRD:OBS687428012	OBS687428012	obsr111092	2	PRESENT	12/18/18 0:00	2018	12	18	US	California	Santa Barbara	Devereux Slough	34.4136	-119.876	2498387	Aix sponsa (Linnaeus, 1758)	Animalia	Chordata	Aves	Anseriformes	Anatidae	Aix	sponsa	SPECIES	Wood Duck	ACCEPTED	4fa7b334-ce0d-4e88-aaae-2e0c138d049e	US	12/16/20 12:07	TRUE	FALSE	2498387	2498387	1	44	212	1108	2986	2498386	2498387	Aix sponsa	Aix	Aix sponsa (Linnaeus, 1758)	Aix sponsa	DWC_ARCHIVE	12/16/20 12:07	6/30/20 8:20	FALSE	USA	United States	USA.5_1	California	USA.5.42_1	Santa Barbara	2018-12-18	TRUE
2224623509	OBS688596937	CC0_1_0	Cornell Lab of Ornithology	CLO	EBIRD	EOD - eBird Observation Dataset	HUMAN_OBSERVATION	URN:catalog:CLO:EBIRD:OBS688596937	OBS688596937	obsr1205914	4	PRESENT	12/22/18 0:00	2018	12	22	US	California	Santa Barbara	University of California, Santa Barbara - West Campus, Goleta US-CA (34.4116,-119.8772)	34.4116	-119.877	2480272	Haematopus bachmani Audubon, 1838	Animalia	Chordata	Aves	Charadriiformes	Haematopodidae	Haematopus	bachmani	SPECIES	Black Oystercatcher	ACCEPTED	4fa7b334-ce0d-4e88-aaae-2e0c138d049e	US	12/16/20 11:57	TRUE	FALSE	2480272	2480272	1	44	212	7192402	4287243	2480260	2480272	Haematopus bachmani	Haematopus	Haematopus bachmani Audubon, 1838	Haematopus bachmani	DWC_ARCHIVE	12/16/20 11:57	6/30/20 8:20	FALSE	USA	United States	USA.5_1	California	USA.5.42_1	Santa Barbara	2018-12-22	FALSE
2223892247	OBS682724461	CC0_1_0	Cornell Lab of Ornithology	CLO	EBIRD	EOD - eBird Observation Dataset	HUMAN_OBSERVATION	URN:catalog:CLO:EBIRD:OBS682724461	OBS682724461	obsr933209	3	PRESENT	12/4/18 0:00	2018	12	4	US	California	Santa Barbara	Devereux Slough	34.4136	-119.876	5232452	Branta hutchinsii (Richardson, 1832)	Animalia	Chordata	Aves	Anseriformes	Anatidae	Branta	hutchinsii	SPECIES	Cackling Goose	ACCEPTED	4fa7b334-ce0d-4e88-aaae-2e0c138d049e	US	12/16/20 11:58	TRUE	FALSE	5232452	5232452	1	44	212	1108	2986	2498190	5232452	Branta hutchinsii	Branta	Branta hutchinsii (Richardson, 1832)	Branta hutchinsii	DWC_ARCHIVE	12/16/20 11:58	6/30/20 8:20	FALSE	USA	United States	USA.5_1	California	USA.5.42_1	Santa Barbara	2018-12-4	FALSE
2134640816	OBS582772826	CC0_1_0	Cornell Lab of Ornithology	CLO	EBIRD	EOD - eBird Observation Dataset	HUMAN_OBSERVATION	URN:catalog:CLO:EBIRD:OBS582772826	OBS582772826	obsr413715	15	PRESENT	2/27/18 0:00	2018	2	27	US	California	Santa Barbara	Dune Pond at COPR	34.4137	-119.882	2495266	Patagioenas fasciata (Say, 1823)	Animalia	Chordata	Aves	Columbiformes	Columbidae	Patagioenas	fasciata	SPECIES	Band-tailed Pigeon	ACCEPTED	4fa7b334-ce0d-4e88-aaae-2e0c138d049e	US	12/16/20 12:06	TRUE	FALSE	2495266	2495266	1	44	212	1446	5233	2495265	2495266	Patagioenas fasciata	Patagioenas	Patagioenas fasciata (Say, 1823)	Patagioenas fasciata	DWC_ARCHIVE	12/16/20 12:06	6/30/20 8:20	FALSE	USA	United States	USA.5_1	California	USA.5.42_1	Santa Barbara	2018-2-27	FALSE
2143018549	OBS583109512	CC0_1_0	Cornell Lab of Ornithology	CLO	EBIRD	EOD - eBird Observation Dataset	HUMAN_OBSERVATION	URN:catalog:CLO:EBIRD:OBS583109512	OBS583109512	obsr275822	2	PRESENT	2/28/18 0:00	2018	2	28	US	California	Santa Barbara	Devereux Slough	34.4136	-119.876	2474825	Rallus limicola Vieillot, 1819	Animalia	Chordata	Aves	Gruiformes	Rallidae	Rallus	limicola	SPECIES	Virginia Rail	ACCEPTED	4fa7b334-ce0d-4e88-aaae-2e0c138d049e	US	12/16/20 12:16	TRUE	FALSE	2474825	2474825	1	44	212	1493	9342	2474794	2474825	Rallus limicola	Rallus	Rallus limicola Vieillot, 1819	Rallus limicola	DWC_ARCHIVE	12/16/20 12:16	6/30/20 8:20	FALSE	USA	United States	USA.5_1	California	USA.5.42_1	Santa Barbara	2018-2-28	FALSE
2145775610	OBS587010084	CC0_1_0	Cornell Lab of Ornithology	CLO	EBIRD	EOD - eBird Observation Dataset	HUMAN_OBSERVATION	URN:catalog:CLO:EBIRD:OBS587010084	OBS587010084	obsr842316	1	PRESENT	3/11/18 0:00	2018	3	11	US	California	Santa Barbara	Devereux Slough	34.4136	-119.876	2489160	Riparia riparia (Linnaeus, 1758)	Animalia	Chordata	Aves	Passeriformes	Hirundinidae	Riparia	riparia	SPECIES	Bank Swallow	ACCEPTED	4fa7b334-ce0d-4e88-aaae-2e0c138d049e	US	12/16/20 11:56	TRUE	FALSE	2489160	2489160	1	44	212	729	5248	2489158	2489160	Riparia riparia	Riparia	Riparia riparia (Linnaeus, 1758)	Riparia riparia	DWC_ARCHIVE	12/16/20 11:56	6/30/20 8:20	FALSE	USA	United States	USA.5_1	California	USA.5.42_1	Santa Barbara	2018-3-11	FALSE
2138409430	OBS586918207	CC0_1_0	Cornell Lab of Ornithology	CLO	EBIRD	EOD - eBird Observation Dataset	HUMAN_OBSERVATION	URN:catalog:CLO:EBIRD:OBS586918207	OBS586918207	obsr420881	1	PRESENT	3/11/18 0:00	2018	3	11	US	California	Santa Barbara	Devereux Slough	34.4136	-119.876	2489160	Riparia riparia (Linnaeus, 1758)	Animalia	Chordata	Aves	Passeriformes	Hirundinidae	Riparia	riparia	SPECIES	Bank Swallow	ACCEPTED	4fa7b334-ce0d-4e88-aaae-2e0c138d049e	US	12/16/20 12:05	TRUE	FALSE	2489160	2489160	1	44	212	729	5248	2489158	2489160	Riparia riparia	Riparia	Riparia riparia (Linnaeus, 1758)	Riparia riparia	DWC_ARCHIVE	12/16/20 12:05	6/30/20 8:20	FALSE	USA	United States	USA.5_1	California	USA.5.42_1	Santa Barbara	2018-3-11	TRUE
2134236885	OBS586908913	CC0_1_0	Cornell Lab of Ornithology	CLO	EBIRD	EOD - eBird Observation Dataset	HUMAN_OBSERVATION	URN:catalog:CLO:EBIRD:OBS586908913	OBS586908913	obsr548926	1	PRESENT	3/11/18 0:00	2018	3	11	US	California	Santa Barbara	Devereux Slough	34.4136	-119.876	2489160	Riparia riparia (Linnaeus, 1758)	Animalia	Chordata	Aves	Passeriformes	Hirundinidae	Riparia	riparia	SPECIES	Bank Swallow	ACCEPTED	4fa7b334-ce0d-4e88-aaae-2e0c138d049e	US	12/16/20 11:56	TRUE	FALSE	2489160	2489160	1	44	212	729	5248	2489158	2489160	Riparia riparia	Riparia	Riparia riparia (Linnaeus, 1758)	Riparia riparia	DWC_ARCHIVE	12/16/20 11:56	6/30/20 8:20	FALSE	USA	United States	USA.5_1	California	USA.5.42_1	Santa Barbara	2018-3-11	TRUE
2121276882	OBS586881915	CC0_1_0	Cornell Lab of Ornithology	CLO	EBIRD	EOD - eBird Observation Dataset	HUMAN_OBSERVATION	URN:catalog:CLO:EBIRD:OBS586881915	OBS586881915	obsr51183	1	PRESENT	3/11/18 0:00	2018	3	11	US	California	Santa Barbara	Devereux Slough	34.4136	-119.876	2489160	Riparia riparia (Linnaeus, 1758)	Animalia	Chordata	Aves	Passeriformes	Hirundinidae	Riparia	riparia	SPECIES	Bank Swallow	ACCEPTED	4fa7b334-ce0d-4e88-aaae-2e0c138d049e	US	12/16/20 11:57	TRUE	FALSE	2489160	2489160	1	44	212	729	5248	2489158	2489160	Riparia riparia	Riparia	Riparia riparia (Linnaeus, 1758)	Riparia riparia	DWC_ARCHIVE	12/16/20 11:57	6/30/20 8:20	FALSE	USA	United States	USA.5_1	California	USA.5.42_1	Santa Barbara	2018-3-11	TRUE
2121443557	OBS587151794	CC0_1_0	Cornell Lab of Ornithology	CLO	EBIRD	EOD - eBird Observation Dataset	HUMAN_OBSERVATION	URN:catalog:CLO:EBIRD:OBS587151794	OBS587151794	obsr413715	1	PRESENT	3/12/18 0:00	2018	3	12	US	California	Santa Barbara	Devereux Slough	34.4136	-119.876	2489160	Riparia riparia (Linnaeus, 1758)	Animalia	Chordata	Aves	Passeriformes	Hirundinidae	Riparia	riparia	SPECIES	Bank Swallow	ACCEPTED	4fa7b334-ce0d-4e88-aaae-2e0c138d049e	US	12/16/20 12:06	TRUE	FALSE	2489160	2489160	1	44	212	729	5248	2489158	2489160	Riparia riparia	Riparia	Riparia riparia (Linnaeus, 1758)	Riparia riparia	DWC_ARCHIVE	12/16/20 12:06	6/30/20 8:20	FALSE	USA	United States	USA.5_1	California	USA.5.42_1	Santa Barbara	2018-3-12	FALSE
2138716392	OBS587300024	CC0_1_0	Cornell Lab of Ornithology	CLO	EBIRD	EOD - eBird Observation Dataset	HUMAN_OBSERVATION	URN:catalog:CLO:EBIRD:OBS587300024	OBS587300024	obsr785343	1	PRESENT	3/12/18 0:00	2018	3	12	US	California	Santa Barbara	Devereux Slough	34.4136	-119.876	2489160	Riparia riparia (Linnaeus, 1758)	Animalia	Chordata	Aves	Passeriformes	Hirundinidae	Riparia	riparia	SPECIES	Bank Swallow	ACCEPTED	4fa7b334-ce0d-4e88-aaae-2e0c138d049e	US	12/16/20 12:05	TRUE	FALSE	2489160	2489160	1	44	212	729	5248	2489158	2489160	Riparia riparia	Riparia	Riparia riparia (Linnaeus, 1758)	Riparia riparia	DWC_ARCHIVE	12/16/20 12:05	6/30/20 8:20	FALSE	USA	United States	USA.5_1	California	USA.5.42_1	Santa Barbara	2018-3-12	FALSE
2136630766	OBS589630177	CC0_1_0	Cornell Lab of Ornithology	CLO	EBIRD	EOD - eBird Observation Dataset	HUMAN_OBSERVATION	URN:catalog:CLO:EBIRD:OBS589630177	OBS589630177	obsr230614	1	PRESENT	3/19/18 0:00	2018	3	19	US	California	Santa Barbara	Devereux Slough	34.4136	-119.876	2476855	Selasphorus rufus (Gmelin, 1788)	Animalia	Chordata	Aves	Apodiformes	Trochilidae	Selasphorus	rufus	SPECIES	Rufous Hummingbird	ACCEPTED	4fa7b334-ce0d-4e88-aaae-2e0c138d049e	US	12/16/20 12:16	TRUE	FALSE	2476855	2476855	1	44	212	1448	5289	2476843	2476855	Selasphorus rufus	Selasphorus	Selasphorus rufus (Gmelin, 1788)	Selasphorus rufus	DWC_ARCHIVE	12/16/20 12:16	6/30/20 8:20	FALSE	USA	United States	USA.5_1	California	USA.5.42_1	Santa Barbara	2018-3-19	FALSE
2136640657	OBS589630183	CC0_1_0	Cornell Lab of Ornithology	CLO	EBIRD	EOD - eBird Observation Dataset	HUMAN_OBSERVATION	URN:catalog:CLO:EBIRD:OBS589630183	OBS589630183	obsr230614	1	PRESENT	3/19/18 0:00	2018	3	19	US	California	Santa Barbara	Devereux Slough	34.4136	-119.876	2495266	Patagioenas fasciata (Say, 1823)	Animalia	Chordata	Aves	Columbiformes	Columbidae	Patagioenas	fasciata	SPECIES	Band-tailed Pigeon	ACCEPTED	4fa7b334-ce0d-4e88-aaae-2e0c138d049e	US	12/16/20 11:57	TRUE	FALSE	2495266	2495266	1	44	212	1446	5233	2495265	2495266	Patagioenas fasciata	Patagioenas	Patagioenas fasciata (Say, 1823)	Patagioenas fasciata	DWC_ARCHIVE	12/16/20 11:57	6/30/20 8:20	FALSE	USA	United States	USA.5_1	California	USA.5.42_1	Santa Barbara	2018-3-19	FALSE
2141708284	OBS590666757	CC0_1_0	Cornell Lab of Ornithology	CLO	EBIRD	EOD - eBird Observation Dataset	HUMAN_OBSERVATION	URN:catalog:CLO:EBIRD:OBS590666757	OBS590666757	obsr413715	1	PRESENT	3/22/18 0:00	2018	3	22	US	California	Santa Barbara	Devereux Slough	34.4136	-119.876	2476855	Selasphorus rufus (Gmelin, 1788)	Animalia	Chordata	Aves	Apodiformes	Trochilidae	Selasphorus	rufus	SPECIES	Rufous Hummingbird	ACCEPTED	4fa7b334-ce0d-4e88-aaae-2e0c138d049e	US	12/16/20 12:07	TRUE	FALSE	2476855	2476855	1	44	212	1448	5289	2476843	2476855	Selasphorus rufus	Selasphorus	Selasphorus rufus (Gmelin, 1788)	Selasphorus rufus	DWC_ARCHIVE	12/16/20 12:07	6/30/20 8:20	FALSE	USA	United States	USA.5_1	California	USA.5.42_1	Santa Barbara	2018-3-22	FALSE
2145864913	OBS595827099	CC0_1_0	Cornell Lab of Ornithology	CLO	EBIRD	EOD - eBird Observation Dataset	HUMAN_OBSERVATION	URN:catalog:CLO:EBIRD:OBS595827099	OBS595827099	obsr420881	4	PRESENT	3/31/18 0:00	2018	3	31	US	California	Santa Barbara	Devereux Slough	34.4136	-119.876	2476855	Selasphorus rufus (Gmelin, 1788)	Animalia	Chordata	Aves	Apodiformes	Trochilidae	Selasphorus	rufus	SPECIES	Rufous Hummingbird	ACCEPTED	4fa7b334-ce0d-4e88-aaae-2e0c138d049e	US	12/16/20 12:06	TRUE	FALSE	2476855	2476855	1	44	212	1448	5289	2476843	2476855	Selasphorus rufus	Selasphorus	Selasphorus rufus (Gmelin, 1788)	Selasphorus rufus	DWC_ARCHIVE	12/16/20 12:06	6/30/20 8:20	FALSE	USA	United States	USA.5_1	California	USA.5.42_1	Santa Barbara	2018-3-31	TRUE
2132963540	OBS585226927	CC0_1_0	Cornell Lab of Ornithology	CLO	EBIRD	EOD - eBird Observation Dataset	HUMAN_OBSERVATION	URN:catalog:CLO:EBIRD:OBS585226927	OBS585226927	obsr414700	1	PRESENT	3/6/18 0:00	2018	3	6	US	California	Santa Barbara	Devereux Slough	34.4136	-119.876	9740253	Accipiter striatus Vieillot, 1808	Animalia	Chordata	Aves	Accipitriformes	Accipitridae	Accipiter	striatus	SPECIES	Sharp-shinned Hawk	ACCEPTED	4fa7b334-ce0d-4e88-aaae-2e0c138d049e	US	12/16/20 12:05	TRUE	FALSE	9740253	9740253	1	44	212	7191147	2877	9405810	9740253	Accipiter striatus	Accipiter	Accipiter striatus Vieillot, 1808	Accipiter striatus	DWC_ARCHIVE	12/16/20 12:05	6/30/20 8:20	FALSE	USA	United States	USA.5_1	California	USA.5.42_1	Santa Barbara	2018-3-6	FALSE
2136737432	OBS585226941	CC0_1_0	Cornell Lab of Ornithology	CLO	EBIRD	EOD - eBird Observation Dataset	HUMAN_OBSERVATION	URN:catalog:CLO:EBIRD:OBS585226941	OBS585226941	obsr414700	1	PRESENT	3/6/18 0:00	2018	3	6	US	California	Santa Barbara	Devereux Slough	34.4136	-119.876	2481139	Larus argentatus Pontoppidan, 1763	Animalia	Chordata	Aves	Charadriiformes	Laridae	Larus	argentatus	SPECIES	Herring Gull	ACCEPTED	4fa7b334-ce0d-4e88-aaae-2e0c138d049e	US	12/16/20 12:06	TRUE	FALSE	2481139	2481139	1	44	212	7192402	9316	2481126	2481139	Larus argentatus	Larus	Larus argentatus Pontoppidan, 1763	Larus argentatus	DWC_ARCHIVE	12/16/20 12:06	6/30/20 8:20	FALSE	USA	United States	USA.5_1	California	USA.5.42_1	Santa Barbara	2018-3-6	FALSE
2162483834	OBS605106382	CC0_1_0	Cornell Lab of Ornithology	CLO	EBIRD	EOD - eBird Observation Dataset	HUMAN_OBSERVATION	URN:catalog:CLO:EBIRD:OBS605106382	OBS605106382	obsr1078954	1	PRESENT	4/11/18 0:00	2018	4	11	US	California	Santa Barbara	Devereux Slough	34.4136	-119.876	2477108	Aeronautes saxatalis (Woodhouse, 1853)	Animalia	Chordata	Aves	Apodiformes	Apodidae	Aeronautes	saxatalis	SPECIES	White-throated Swift	ACCEPTED	4fa7b334-ce0d-4e88-aaae-2e0c138d049e	US	12/16/20 11:56	TRUE	FALSE	2477108	2477108	1	44	212	1448	2993	2477107	2477108	Aeronautes saxatalis	Aeronautes	Aeronautes saxatalis (Woodhouse, 1853)	Aeronautes saxatalis	DWC_ARCHIVE	12/16/20 11:56	6/30/20 8:20	FALSE	USA	United States	USA.5_1	California	USA.5.42_1	Santa Barbara	2018-4-11	FALSE
2148560000	OBS598499363	CC0_1_0	Cornell Lab of Ornithology	CLO	EBIRD	EOD - eBird Observation Dataset	HUMAN_OBSERVATION	URN:catalog:CLO:EBIRD:OBS598499363	OBS598499363	obsr548926	1	PRESENT	4/11/18 0:00	2018	4	11	US	California	Santa Barbara	Devereux Slough	34.4136	-119.876	2477108	Aeronautes saxatalis (Woodhouse, 1853)	Animalia	Chordata	Aves	Apodiformes	Apodidae	Aeronautes	saxatalis	SPECIES	White-throated Swift	ACCEPTED	4fa7b334-ce0d-4e88-aaae-2e0c138d049e	US	12/16/20 11:57	TRUE	FALSE	2477108	2477108	1	44	212	1448	2993	2477107	2477108	Aeronautes saxatalis	Aeronautes	Aeronautes saxatalis (Woodhouse, 1853)	Aeronautes saxatalis	DWC_ARCHIVE	12/16/20 11:57	6/30/20 8:20	FALSE	USA	United States	USA.5_1	California	USA.5.42_1	Santa Barbara	2018-4-11	TRUE
2157629323	OBS599931340	CC0_1_0	Cornell Lab of Ornithology	CLO	EBIRD	EOD - eBird Observation Dataset	HUMAN_OBSERVATION	URN:catalog:CLO:EBIRD:OBS599931340	OBS599931340	obsr349570	1	PRESENT	4/14/18 0:00	2018	4	14	US	California	Santa Barbara	Devereux Slough	34.4136	-119.876	5230862	Passerina caerulea (Linnaeus, 1758)	Animalia	Chordata	Aves	Passeriformes	Cardinalidae	Passerina	caerulea	SPECIES	Blue Grosbeak	ACCEPTED	4fa7b334-ce0d-4e88-aaae-2e0c138d049e	US	12/16/20 12:07	TRUE	FALSE	5230862	5230862	1	44	212	729	9285	2490326	5230862	Passerina caerulea	Passerina	Passerina caerulea (Linnaeus, 1758)	Passerina caerulea	DWC_ARCHIVE	12/16/20 12:07	6/30/20 8:20	FALSE	USA	United States	USA.5_1	California	USA.5.42_1	Santa Barbara	2018-4-14	FALSE
2157498219	OBS599788486	CC0_1_0	Cornell Lab of Ornithology	CLO	EBIRD	EOD - eBird Observation Dataset	HUMAN_OBSERVATION	URN:catalog:CLO:EBIRD:OBS599788486	OBS599788486	obsr113508	1	PRESENT	4/14/18 0:00	2018	4	14	US	California	Santa Barbara	Devereux Slough	34.4136	-119.876	5230862	Passerina caerulea (Linnaeus, 1758)	Animalia	Chordata	Aves	Passeriformes	Cardinalidae	Passerina	caerulea	SPECIES	Blue Grosbeak	ACCEPTED	4fa7b334-ce0d-4e88-aaae-2e0c138d049e	US	12/16/20 12:07	TRUE	FALSE	5230862	5230862	1	44	212	729	9285	2490326	5230862	Passerina caerulea	Passerina	Passerina caerulea (Linnaeus, 1758)	Passerina caerulea	DWC_ARCHIVE	12/16/20 12:07	6/30/20 8:20	FALSE	USA	United States	USA.5_1	California	USA.5.42_1	Santa Barbara	2018-4-14	FALSE
2191623141	OBS649994824	CC0_1_0	Cornell Lab of Ornithology	CLO	EBIRD	EOD - eBird Observation Dataset	HUMAN_OBSERVATION	URN:catalog:CLO:EBIRD:OBS649994824	OBS649994824	obsr689353	1	PRESENT	4/18/18 0:00	2018	4	18	US	California	Santa Barbara	Dune Pond at COPR	34.4137	-119.882	5230861	Passerina amoena (Say, 1822)	Animalia	Chordata	Aves	Passeriformes	Cardinalidae	Passerina	amoena	SPECIES	Lazuli Bunting	ACCEPTED	4fa7b334-ce0d-4e88-aaae-2e0c138d049e	US	12/16/20 11:57	TRUE	FALSE	5230861	5230861	1	44	212	729	9285	2490326	5230861	Passerina amoena	Passerina	Passerina amoena (Say, 1822)	Passerina amoena	DWC_ARCHIVE	12/16/20 11:57	6/30/20 8:20	FALSE	USA	United States	USA.5_1	California	USA.5.42_1	Santa Barbara	2018-4-18	FALSE
2159668723	OBS601906658	CC0_1_0	Cornell Lab of Ornithology	CLO	EBIRD	EOD - eBird Observation Dataset	HUMAN_OBSERVATION	URN:catalog:CLO:EBIRD:OBS601906658	OBS601906658	obsr111092	1	PRESENT	4/18/18 0:00	2018	4	18	US	California	Santa Barbara	Dune Pond at COPR	34.4137	-119.882	5230861	Passerina amoena (Say, 1822)	Animalia	Chordata	Aves	Passeriformes	Cardinalidae	Passerina	amoena	SPECIES	Lazuli Bunting	ACCEPTED	4fa7b334-ce0d-4e88-aaae-2e0c138d049e	US	12/16/20 11:57	TRUE	FALSE	5230861	5230861	1	44	212	729	9285	2490326	5230861	Passerina amoena	Passerina	Passerina amoena (Say, 1822)	Passerina amoena	DWC_ARCHIVE	12/16/20 11:57	6/30/20 8:20	FALSE	USA	United States	USA.5_1	California	USA.5.42_1	Santa Barbara	2018-4-18	TRUE
2152600917	OBS602124917	CC0_1_0	Cornell Lab of Ornithology	CLO	EBIRD	EOD - eBird Observation Dataset	HUMAN_OBSERVATION	URN:catalog:CLO:EBIRD:OBS602124917	OBS602124917	obsr34952	5	PRESENT	4/19/18 0:00	2018	4	19	US	California	Santa Barbara	Coal Oil Point--Devereux Beach and Sands Beach	34.4071	-119.878	5228612	Chaetura vauxi (J.K.Townsend, 1839)	Animalia	Chordata	Aves	Apodiformes	Apodidae	Chaetura	vauxi	SPECIES	Vaux's Swift	ACCEPTED	4fa7b334-ce0d-4e88-aaae-2e0c138d049e	US	12/16/20 12:06	TRUE	FALSE	5228612	5228612	1	44	212	1448	2993	2477150	5228612	Chaetura vauxi	Chaetura	Chaetura vauxi (J.K.Townsend, 1839)	Chaetura vauxi	DWC_ARCHIVE	12/16/20 12:06	6/30/20 8:20	FALSE	USA	United States	USA.5_1	California	USA.5.42_1	Santa Barbara	2018-4-19	FALSE
2159807066	OBS602125054	CC0_1_0	Cornell Lab of Ornithology	CLO	EBIRD	EOD - eBird Observation Dataset	HUMAN_OBSERVATION	URN:catalog:CLO:EBIRD:OBS602125054	OBS602125054	obsr34952	1	PRESENT	4/19/18 0:00	2018	4	19	US	California	Santa Barbara	Dune Pond at COPR	34.4137	-119.882	5230754	Tachycineta thalassina (Swainson, 1827)	Animalia	Chordata	Aves	Passeriformes	Hirundinidae	Tachycineta	thalassina	SPECIES	Violet-green Swallow	ACCEPTED	4fa7b334-ce0d-4e88-aaae-2e0c138d049e	US	12/16/20 11:57	TRUE	FALSE	5230754	5230754	1	44	212	729	5248	2489178	5230754	Tachycineta thalassina	Tachycineta	Tachycineta thalassina (Swainson, 1827)	Tachycineta thalassina	DWC_ARCHIVE	12/16/20 11:57	6/30/20 8:20	FALSE	USA	United States	USA.5_1	California	USA.5.42_1	Santa Barbara	2018-4-19	FALSE
2148856367	OBS602124542	CC0_1_0	Cornell Lab of Ornithology	CLO	EBIRD	EOD - eBird Observation Dataset	HUMAN_OBSERVATION	URN:catalog:CLO:EBIRD:OBS602124542	OBS602124542	obsr34952	1	PRESENT	4/19/18 0:00	2018	4	19	US	California	Santa Barbara	Devereux Slough	34.4136	-119.876	5228612	Chaetura vauxi (J.K.Townsend, 1839)	Animalia	Chordata	Aves	Apodiformes	Apodidae	Chaetura	vauxi	SPECIES	Vaux's Swift	ACCEPTED	4fa7b334-ce0d-4e88-aaae-2e0c138d049e	US	12/16/20 12:16	TRUE	FALSE	5228612	5228612	1	44	212	1448	2993	2477150	5228612	Chaetura vauxi	Chaetura	Chaetura vauxi (J.K.Townsend, 1839)	Chaetura vauxi	DWC_ARCHIVE	12/16/20 12:16	6/30/20 8:20	FALSE	USA	United States	USA.5_1	California	USA.5.42_1	Santa Barbara	2018-4-19	FALSE
2152608378	OBS602124548	CC0_1_0	Cornell Lab of Ornithology	CLO	EBIRD	EOD - eBird Observation Dataset	HUMAN_OBSERVATION	URN:catalog:CLO:EBIRD:OBS602124548	OBS602124548	obsr34952	1	PRESENT	4/19/18 0:00	2018	4	19	US	California	Santa Barbara	Devereux Slough	34.4136	-119.876	5230754	Tachycineta thalassina (Swainson, 1827)	Animalia	Chordata	Aves	Passeriformes	Hirundinidae	Tachycineta	thalassina	SPECIES	Violet-green Swallow	ACCEPTED	4fa7b334-ce0d-4e88-aaae-2e0c138d049e	US	12/16/20 11:56	TRUE	FALSE	5230754	5230754	1	44	212	729	5248	2489178	5230754	Tachycineta thalassina	Tachycineta	Tachycineta thalassina (Swainson, 1827)	Tachycineta thalassina	DWC_ARCHIVE	12/16/20 11:56	6/30/20 8:20	FALSE	USA	United States	USA.5_1	California	USA.5.42_1	Santa Barbara	2018-4-19	FALSE
2148854316	OBS602123369	CC0_1_0	Cornell Lab of Ornithology	CLO	EBIRD	EOD - eBird Observation Dataset	HUMAN_OBSERVATION	URN:catalog:CLO:EBIRD:OBS602123369	OBS602123369	obsr302151	1	PRESENT	4/19/18 0:00	2018	4	19	US	California	Santa Barbara	Coal Oil Point--Devereux Beach and Sands Beach	34.4071	-119.878	7964835	Calidris virgata	Animalia	Chordata	Aves	Charadriiformes	Scolopacidae	Calidris	virgata	SPECIES	Surfbird	ACCEPTED	4fa7b334-ce0d-4e88-aaae-2e0c138d049e	US	12/16/20 12:07	TRUE	FALSE	7964835	7964835	1	44	212	7192402	5282	2481739	7964835	Calidris virgata	Calidris	Calidris virgata	Calidris virgata	DWC_ARCHIVE	12/16/20 12:07	6/30/20 8:20	FALSE	USA	United States	USA.5_1	California	USA.5.42_1	Santa Barbara	2018-4-19	TRUE
1932340620	17770437	CC_BY_NC_4_0	iNaturalist.org	iNaturalist	Observations	iNaturalist Research-grade Observations	HUMAN_OBSERVATION	https://www.inaturalist.org/observations/17770437	17770437	Tom Turner	NA	PRESENT	4/21/18 9:09	2018	4	21	US	California	NA	NA	34.416752	-119.875294	2474953	Antigone canadensis (Linnaeus, 1758)	Animalia	Chordata	Aves	Gruiformes	Gruidae	Grus	canadensis	SPECIES	NA	SYNONYM	50c9509d-22c7-4a22-a47d-8c48425ef4a7	US	2/21/21 5:09	TRUE	FALSE	9036008	2474953	1	44	212	1493	9313	2474940	2474953	Grus canadensis	Antigone	Grus canadensis (Linnaeus, 1758)	Antigone canadensis	DWC_ARCHIVE	2/21/21 5:09	2/21/21 2:33	FALSE	USA	United States	USA.5_1	California	USA.5.42_1	Santa Barbara	2018-4-21	TRUE
2164473633	OBS607473355	CC0_1_0	Cornell Lab of Ornithology	CLO	EBIRD	EOD - eBird Observation Dataset	HUMAN_OBSERVATION	URN:catalog:CLO:EBIRD:OBS607473355	OBS607473355	obsr1078954	2	PRESENT	4/25/18 0:00	2018	4	25	US	California	Santa Barbara	Devereux Slough	34.4136	-119.876	2477108	Aeronautes saxatalis (Woodhouse, 1853)	Animalia	Chordata	Aves	Apodiformes	Apodidae	Aeronautes	saxatalis	SPECIES	White-throated Swift	ACCEPTED	4fa7b334-ce0d-4e88-aaae-2e0c138d049e	US	12/16/20 12:05	TRUE	FALSE	2477108	2477108	1	44	212	1448	2993	2477107	2477108	Aeronautes saxatalis	Aeronautes	Aeronautes saxatalis (Woodhouse, 1853)	Aeronautes saxatalis	DWC_ARCHIVE	12/16/20 12:05	6/30/20 8:20	FALSE	USA	United States	USA.5_1	California	USA.5.42_1	Santa Barbara	2018-4-25	FALSE
2152838662	OBS607473366	CC0_1_0	Cornell Lab of Ornithology	CLO	EBIRD	EOD - eBird Observation Dataset	HUMAN_OBSERVATION	URN:catalog:CLO:EBIRD:OBS607473366	OBS607473366	obsr1078954	1	PRESENT	4/25/18 0:00	2018	4	25	US	California	Santa Barbara	Devereux Slough	34.4136	-119.876	5230861	Passerina amoena (Say, 1822)	Animalia	Chordata	Aves	Passeriformes	Cardinalidae	Passerina	amoena	SPECIES	Lazuli Bunting	ACCEPTED	4fa7b334-ce0d-4e88-aaae-2e0c138d049e	US	12/16/20 12:05	TRUE	FALSE	5230861	5230861	1	44	212	729	9285	2490326	5230861	Passerina amoena	Passerina	Passerina amoena (Say, 1822)	Passerina amoena	DWC_ARCHIVE	12/16/20 12:05	6/30/20 8:20	FALSE	USA	United States	USA.5_1	California	USA.5.42_1	Santa Barbara	2018-4-25	FALSE
2155079609	OBS605299401	CC0_1_0	Cornell Lab of Ornithology	CLO	EBIRD	EOD - eBird Observation Dataset	HUMAN_OBSERVATION	URN:catalog:CLO:EBIRD:OBS605299401	OBS605299401	obsr548926	2	PRESENT	4/25/18 0:00	2018	4	25	US	California	Santa Barbara	Devereux Slough	34.4136	-119.876	2477108	Aeronautes saxatalis (Woodhouse, 1853)	Animalia	Chordata	Aves	Apodiformes	Apodidae	Aeronautes	saxatalis	SPECIES	White-throated Swift	ACCEPTED	4fa7b334-ce0d-4e88-aaae-2e0c138d049e	US	12/16/20 11:57	TRUE	FALSE	2477108	2477108	1	44	212	1448	2993	2477107	2477108	Aeronautes saxatalis	Aeronautes	Aeronautes saxatalis (Woodhouse, 1853)	Aeronautes saxatalis	DWC_ARCHIVE	12/16/20 11:57	6/30/20 8:20	FALSE	USA	United States	USA.5_1	California	USA.5.42_1	Santa Barbara	2018-4-25	TRUE
2162643776	OBS605299412	CC0_1_0	Cornell Lab of Ornithology	CLO	EBIRD	EOD - eBird Observation Dataset	HUMAN_OBSERVATION	URN:catalog:CLO:EBIRD:OBS605299412	OBS605299412	obsr548926	1	PRESENT	4/25/18 0:00	2018	4	25	US	California	Santa Barbara	Devereux Slough	34.4136	-119.876	5230861	Passerina amoena (Say, 1822)	Animalia	Chordata	Aves	Passeriformes	Cardinalidae	Passerina	amoena	SPECIES	Lazuli Bunting	ACCEPTED	4fa7b334-ce0d-4e88-aaae-2e0c138d049e	US	12/16/20 11:58	TRUE	FALSE	5230861	5230861	1	44	212	729	9285	2490326	5230861	Passerina amoena	Passerina	Passerina amoena (Say, 1822)	Passerina amoena	DWC_ARCHIVE	12/16/20 11:58	6/30/20 8:20	FALSE	USA	United States	USA.5_1	California	USA.5.42_1	Santa Barbara	2018-4-25	TRUE
2140569022	OBS607439257	CC0_1_0	Cornell Lab of Ornithology	CLO	EBIRD	EOD - eBird Observation Dataset	HUMAN_OBSERVATION	URN:catalog:CLO:EBIRD:OBS607439257	OBS607439257	obsr654966	1	PRESENT	4/29/18 0:00	2018	4	29	US	California	Santa Barbara	Devereux Slough	34.4136	-119.876	2487446	Vireo gilvus (Vieillot, 1808)	Animalia	Chordata	Aves	Passeriformes	Vireonidae	Vireo	gilvus	SPECIES	Warbling Vireo	ACCEPTED	4fa7b334-ce0d-4e88-aaae-2e0c138d049e	US	12/16/20 12:16	TRUE	FALSE	2487446	2487446	1	44	212	729	9358	2487406	2487446	Vireo gilvus	Vireo	Vireo gilvus (Vieillot, 1808)	Vireo gilvus	DWC_ARCHIVE	12/16/20 12:16	6/30/20 8:20	FALSE	USA	United States	USA.5_1	California	USA.5.42_1	Santa Barbara	2018-4-29	FALSE
2164462781	OBS607474181	CC0_1_0	Cornell Lab of Ornithology	CLO	EBIRD	EOD - eBird Observation Dataset	HUMAN_OBSERVATION	URN:catalog:CLO:EBIRD:OBS607474181	OBS607474181	obsr991892	1	PRESENT	4/29/18 0:00	2018	4	29	US	California	Santa Barbara	Devereux Slough	34.4136	-119.876	2498343	Cygnus olor (Gmelin, 1789)	Animalia	Chordata	Aves	Anseriformes	Anatidae	Cygnus	olor	SPECIES	Mute Swan	ACCEPTED	4fa7b334-ce0d-4e88-aaae-2e0c138d049e	US	12/16/20 12:04	TRUE	FALSE	2498343	2498343	1	44	212	1108	2986	2498334	2498343	Cygnus olor	Cygnus	Cygnus olor (Gmelin, 1789)	Cygnus olor	DWC_ARCHIVE	12/16/20 12:04	6/30/20 8:20	FALSE	USA	United States	USA.5_1	California	USA.5.42_1	Santa Barbara	2018-4-29	FALSE
2156508642	OBS607474174	CC0_1_0	Cornell Lab of Ornithology	CLO	EBIRD	EOD - eBird Observation Dataset	HUMAN_OBSERVATION	URN:catalog:CLO:EBIRD:OBS607474174	OBS607474174	obsr991892	1	PRESENT	4/29/18 0:00	2018	4	29	US	California	Santa Barbara	Devereux Slough	34.4136	-119.876	2487446	Vireo gilvus (Vieillot, 1808)	Animalia	Chordata	Aves	Passeriformes	Vireonidae	Vireo	gilvus	SPECIES	Warbling Vireo	ACCEPTED	4fa7b334-ce0d-4e88-aaae-2e0c138d049e	US	12/16/20 11:56	TRUE	FALSE	2487446	2487446	1	44	212	729	9358	2487406	2487446	Vireo gilvus	Vireo	Vireo gilvus (Vieillot, 1808)	Vireo gilvus	DWC_ARCHIVE	12/16/20 11:56	6/30/20 8:20	FALSE	USA	United States	USA.5_1	California	USA.5.42_1	Santa Barbara	2018-4-29	FALSE
2164427493	OBS607439264	CC0_1_0	Cornell Lab of Ornithology	CLO	EBIRD	EOD - eBird Observation Dataset	HUMAN_OBSERVATION	URN:catalog:CLO:EBIRD:OBS607439264	OBS607439264	obsr654966	1	PRESENT	4/29/18 0:00	2018	4	29	US	California	Santa Barbara	Devereux Slough	34.4136	-119.876	2498343	Cygnus olor (Gmelin, 1789)	Animalia	Chordata	Aves	Anseriformes	Anatidae	Cygnus	olor	SPECIES	Mute Swan	ACCEPTED	4fa7b334-ce0d-4e88-aaae-2e0c138d049e	US	12/16/20 11:57	TRUE	FALSE	2498343	2498343	1	44	212	1108	2986	2498334	2498343	Cygnus olor	Cygnus	Cygnus olor (Gmelin, 1789)	Cygnus olor	DWC_ARCHIVE	12/16/20 11:57	6/30/20 8:20	FALSE	USA	United States	USA.5_1	California	USA.5.42_1	Santa Barbara	2018-4-29	FALSE
2130928941	OBS597345174	CC0_1_0	Cornell Lab of Ornithology	CLO	EBIRD	EOD - eBird Observation Dataset	HUMAN_OBSERVATION	URN:catalog:CLO:EBIRD:OBS597345174	OBS597345174	obsr51183	1	PRESENT	4/8/18 0:00	2018	4	8	US	California	Santa Barbara	Devereux Slough	34.4136	-119.876	2498265	Aythya marila (Linnaeus, 1761)	Animalia	Chordata	Aves	Anseriformes	Anatidae	Aythya	marila	SPECIES	Greater Scaup	ACCEPTED	4fa7b334-ce0d-4e88-aaae-2e0c138d049e	US	12/16/20 11:57	TRUE	FALSE	2498265	2498265	1	44	212	1108	2986	2498254	2498265	Aythya marila	Aythya	Aythya marila (Linnaeus, 1761)	Aythya marila	DWC_ARCHIVE	12/16/20 11:57	6/30/20 8:20	FALSE	USA	United States	USA.5_1	California	USA.5.42_1	Santa Barbara	2018-4-8	TRUE
2143961586	OBS597795530	CC0_1_0	Cornell Lab of Ornithology	CLO	EBIRD	EOD - eBird Observation Dataset	HUMAN_OBSERVATION	URN:catalog:CLO:EBIRD:OBS597795530	OBS597795530	obsr302151	1	PRESENT	4/9/18 0:00	2018	4	9	US	California	Santa Barbara	Devereux Slough	34.4136	-119.876	2498265	Aythya marila (Linnaeus, 1761)	Animalia	Chordata	Aves	Anseriformes	Anatidae	Aythya	marila	SPECIES	Greater Scaup	ACCEPTED	4fa7b334-ce0d-4e88-aaae-2e0c138d049e	US	12/16/20 11:57	TRUE	FALSE	2498265	2498265	1	44	212	1108	2986	2498254	2498265	Aythya marila	Aythya	Aythya marila (Linnaeus, 1761)	Aythya marila	DWC_ARCHIVE	12/16/20 11:57	6/30/20 8:20	FALSE	USA	United States	USA.5_1	California	USA.5.42_1	Santa Barbara	2018-4-9	TRUE
2165820313	OBS608944192	CC0_1_0	Cornell Lab of Ornithology	CLO	EBIRD	EOD - eBird Observation Dataset	HUMAN_OBSERVATION	URN:catalog:CLO:EBIRD:OBS608944192	OBS608944192	obsr420881	1	PRESENT	5/1/18 0:00	2018	5	1	US	California	Santa Barbara	Coal Oil Point--Devereux Beach and Sands Beach	34.4071	-119.878	2481621	Stercorarius parasiticus (Linnaeus, 1758)	Animalia	Chordata	Aves	Charadriiformes	Stercorariidae	Stercorarius	parasiticus	SPECIES	Parasitic Jaeger	ACCEPTED	4fa7b334-ce0d-4e88-aaae-2e0c138d049e	US	12/16/20 11:58	TRUE	FALSE	2481621	2481621	1	44	212	7192402	9347	2481608	2481621	Stercorarius parasiticus	Stercorarius	Stercorarius parasiticus (Linnaeus, 1758)	Stercorarius parasiticus	DWC_ARCHIVE	12/16/20 11:58	6/30/20 8:20	FALSE	USA	United States	USA.5_1	California	USA.5.42_1	Santa Barbara	2018-5-1	TRUE
2165784987	OBS608943822	CC0_1_0	Cornell Lab of Ornithology	CLO	EBIRD	EOD - eBird Observation Dataset	HUMAN_OBSERVATION	URN:catalog:CLO:EBIRD:OBS608943822	OBS608943822	obsr420881	18	PRESENT	5/1/18 0:00	2018	5	1	US	California	Santa Barbara	Devereux Slough	34.4136	-119.876	5228612	Chaetura vauxi (J.K.Townsend, 1839)	Animalia	Chordata	Aves	Apodiformes	Apodidae	Chaetura	vauxi	SPECIES	Vaux's Swift	ACCEPTED	4fa7b334-ce0d-4e88-aaae-2e0c138d049e	US	12/16/20 12:07	TRUE	FALSE	5228612	5228612	1	44	212	1448	2993	2477150	5228612	Chaetura vauxi	Chaetura	Chaetura vauxi (J.K.Townsend, 1839)	Chaetura vauxi	DWC_ARCHIVE	12/16/20 12:07	6/30/20 8:20	FALSE	USA	United States	USA.5_1	California	USA.5.42_1	Santa Barbara	2018-5-1	TRUE
2177388074	OBS621544666	CC0_1_0	Cornell Lab of Ornithology	CLO	EBIRD	EOD - eBird Observation Dataset	HUMAN_OBSERVATION	URN:catalog:CLO:EBIRD:OBS621544666	OBS621544666	obsr167390	1	PRESENT	5/19/18 0:00	2018	5	19	US	California	Santa Barbara	Coal Oil Point--Devereux Beach and Sands Beach	34.4071	-119.878	5229743	Contopus cooperi (Nuttall, 1831)	Animalia	Chordata	Aves	Passeriformes	Tyrannidae	Contopus	cooperi	SPECIES	Olive-sided Flycatcher	ACCEPTED	4fa7b334-ce0d-4e88-aaae-2e0c138d049e	US	12/16/20 12:07	TRUE	FALSE	5229743	5229743	1	44	212	729	5291	2483729	5229743	Contopus cooperi	Contopus	Contopus cooperi (Nuttall, 1831)	Contopus cooperi	DWC_ARCHIVE	12/16/20 12:07	6/30/20 8:20	FALSE	USA	United States	USA.5_1	California	USA.5.42_1	Santa Barbara	2018-5-19	FALSE
2175804528	OBS628207234	CC0_1_0	Cornell Lab of Ornithology	CLO	EBIRD	EOD - eBird Observation Dataset	HUMAN_OBSERVATION	URN:catalog:CLO:EBIRD:OBS628207234	OBS628207234	obsr902013	1	PRESENT	5/19/18 0:00	2018	5	19	US	California	Santa Barbara	Coal Oil Point--Devereux Beach and Sands Beach	34.4071	-119.878	5229743	Contopus cooperi (Nuttall, 1831)	Animalia	Chordata	Aves	Passeriformes	Tyrannidae	Contopus	cooperi	SPECIES	Olive-sided Flycatcher	ACCEPTED	4fa7b334-ce0d-4e88-aaae-2e0c138d049e	US	12/16/20 11:57	TRUE	FALSE	5229743	5229743	1	44	212	729	5291	2483729	5229743	Contopus cooperi	Contopus	Contopus cooperi (Nuttall, 1831)	Contopus cooperi	DWC_ARCHIVE	12/16/20 11:57	6/30/20 8:20	FALSE	USA	United States	USA.5_1	California	USA.5.42_1	Santa Barbara	2018-5-19	FALSE
2176722860	OBS620699713	CC0_1_0	Cornell Lab of Ornithology	CLO	EBIRD	EOD - eBird Observation Dataset	HUMAN_OBSERVATION	URN:catalog:CLO:EBIRD:OBS620699713	OBS620699713	obsr111358	1	PRESENT	5/19/18 0:00	2018	5	19	US	California	Santa Barbara	Coal Oil Point--Devereux Beach and Sands Beach	34.4071	-119.878	5229743	Contopus cooperi (Nuttall, 1831)	Animalia	Chordata	Aves	Passeriformes	Tyrannidae	Contopus	cooperi	SPECIES	Olive-sided Flycatcher	ACCEPTED	4fa7b334-ce0d-4e88-aaae-2e0c138d049e	US	12/16/20 12:06	TRUE	FALSE	5229743	5229743	1	44	212	729	5291	2483729	5229743	Contopus cooperi	Contopus	Contopus cooperi (Nuttall, 1831)	Contopus cooperi	DWC_ARCHIVE	12/16/20 12:06	6/30/20 8:20	FALSE	USA	United States	USA.5_1	California	USA.5.42_1	Santa Barbara	2018-5-19	FALSE
2165358432	OBS620531863	CC0_1_0	Cornell Lab of Ornithology	CLO	EBIRD	EOD - eBird Observation Dataset	HUMAN_OBSERVATION	URN:catalog:CLO:EBIRD:OBS620531863	OBS620531863	obsr34981	1	PRESENT	5/19/18 0:00	2018	5	19	US	California	Santa Barbara	Coal Oil Point--Devereux Beach and Sands Beach	34.4071	-119.878	5229743	Contopus cooperi (Nuttall, 1831)	Animalia	Chordata	Aves	Passeriformes	Tyrannidae	Contopus	cooperi	SPECIES	Olive-sided Flycatcher	ACCEPTED	4fa7b334-ce0d-4e88-aaae-2e0c138d049e	US	12/16/20 11:56	TRUE	FALSE	5229743	5229743	1	44	212	729	5291	2483729	5229743	Contopus cooperi	Contopus	Contopus cooperi (Nuttall, 1831)	Contopus cooperi	DWC_ARCHIVE	12/16/20 11:56	6/30/20 8:20	FALSE	USA	United States	USA.5_1	California	USA.5.42_1	Santa Barbara	2018-5-19	FALSE
2168589838	OBS612484296	CC0_1_0	Cornell Lab of Ornithology	CLO	EBIRD	EOD - eBird Observation Dataset	HUMAN_OBSERVATION	URN:catalog:CLO:EBIRD:OBS612484296	OBS612484296	obsr51183	1	PRESENT	5/6/18 0:00	2018	5	6	US	California	Santa Barbara	Devereux Slough	34.4136	-119.876	2498265	Aythya marila (Linnaeus, 1761)	Animalia	Chordata	Aves	Anseriformes	Anatidae	Aythya	marila	SPECIES	Greater Scaup	ACCEPTED	4fa7b334-ce0d-4e88-aaae-2e0c138d049e	US	12/16/20 12:07	TRUE	FALSE	2498265	2498265	1	44	212	1108	2986	2498254	2498265	Aythya marila	Aythya	Aythya marila (Linnaeus, 1761)	Aythya marila	DWC_ARCHIVE	12/16/20 12:07	6/30/20 8:20	FALSE	USA	United States	USA.5_1	California	USA.5.42_1	Santa Barbara	2018-5-6	TRUE
2162955163	OBS630383658	CC0_1_0	Cornell Lab of Ornithology	CLO	EBIRD	EOD - eBird Observation Dataset	HUMAN_OBSERVATION	URN:catalog:CLO:EBIRD:OBS630383658	OBS630383658	obsr290777	1	PRESENT	5/9/18 0:00	2018	5	9	US	California	Santa Barbara	Devereux Slough	34.4136	-119.876	5229743	Contopus cooperi (Nuttall, 1831)	Animalia	Chordata	Aves	Passeriformes	Tyrannidae	Contopus	cooperi	SPECIES	Olive-sided Flycatcher	ACCEPTED	4fa7b334-ce0d-4e88-aaae-2e0c138d049e	US	12/16/20 11:56	TRUE	FALSE	5229743	5229743	1	44	212	729	5291	2483729	5229743	Contopus cooperi	Contopus	Contopus cooperi (Nuttall, 1831)	Contopus cooperi	DWC_ARCHIVE	12/16/20 11:56	6/30/20 8:20	FALSE	USA	United States	USA.5_1	California	USA.5.42_1	Santa Barbara	2018-5-9	FALSE
2190427585	OBS635925492	CC0_1_0	Cornell Lab of Ornithology	CLO	EBIRD	EOD - eBird Observation Dataset	HUMAN_OBSERVATION	URN:catalog:CLO:EBIRD:OBS635925492	OBS635925492	obsr193133	1	PRESENT	6/24/18 0:00	2018	6	24	US	California	Santa Barbara	Devereux Slough	34.4136	-119.876	2476675	Calypte costae (Bourcier, 1839)	Animalia	Chordata	Aves	Apodiformes	Trochilidae	Calypte	costae	SPECIES	Costa's Hummingbird	ACCEPTED	4fa7b334-ce0d-4e88-aaae-2e0c138d049e	US	12/16/20 12:06	TRUE	FALSE	2476675	2476675	1	44	212	1448	5289	2476673	2476675	Calypte costae	Calypte	Calypte costae (Bourcier, 1839)	Calypte costae	DWC_ARCHIVE	12/16/20 12:06	6/30/20 8:20	FALSE	USA	United States	USA.5_1	California	USA.5.42_1	Santa Barbara	2018-6-24	FALSE
2195856068	OBS649994849	CC0_1_0	Cornell Lab of Ornithology	CLO	EBIRD	EOD - eBird Observation Dataset	HUMAN_OBSERVATION	URN:catalog:CLO:EBIRD:OBS649994849	OBS649994849	obsr689353	1	PRESENT	7/12/18 0:00	2018	7	12	US	California	Santa Barbara	Devereux Slough	34.4136	-119.876	2490821	Catharus ustulatus (Nuttall, 1840)	Animalia	Chordata	Aves	Passeriformes	Turdidae	Catharus	ustulatus	SPECIES	Swainson's Thrush	ACCEPTED	4fa7b334-ce0d-4e88-aaae-2e0c138d049e	US	12/16/20 12:06	TRUE	FALSE	2490821	2490821	1	44	212	729	5290	2490799	2490821	Catharus ustulatus	Catharus	Catharus ustulatus (Nuttall, 1840)	Catharus ustulatus	DWC_ARCHIVE	12/16/20 12:06	6/30/20 8:20	FALSE	USA	United States	USA.5_1	California	USA.5.42_1	Santa Barbara	2018-7-12	FALSE
2182394779	OBS639233965	CC0_1_0	Cornell Lab of Ornithology	CLO	EBIRD	EOD - eBird Observation Dataset	HUMAN_OBSERVATION	URN:catalog:CLO:EBIRD:OBS639233965	OBS639233965	obsr111092	1	PRESENT	7/12/18 0:00	2018	7	12	US	California	Santa Barbara	Devereux Slough	34.4136	-119.876	2490821	Catharus ustulatus (Nuttall, 1840)	Animalia	Chordata	Aves	Passeriformes	Turdidae	Catharus	ustulatus	SPECIES	Swainson's Thrush	ACCEPTED	4fa7b334-ce0d-4e88-aaae-2e0c138d049e	US	12/16/20 12:05	TRUE	FALSE	2490821	2490821	1	44	212	729	5290	2490799	2490821	Catharus ustulatus	Catharus	Catharus ustulatus (Nuttall, 1840)	Catharus ustulatus	DWC_ARCHIVE	12/16/20 12:05	6/30/20 8:20	FALSE	USA	United States	USA.5_1	California	USA.5.42_1	Santa Barbara	2018-7-12	TRUE
2186114464	OBS643683075	CC0_1_0	Cornell Lab of Ornithology	CLO	EBIRD	EOD - eBird Observation Dataset	HUMAN_OBSERVATION	URN:catalog:CLO:EBIRD:OBS643683075	OBS643683075	obsr933209	1	PRESENT	7/28/18 0:00	2018	7	28	US	California	Santa Barbara	Devereux Slough	34.4136	-119.876	2498017	Anser albifrons (Scopoli, 1769)	Animalia	Chordata	Aves	Anseriformes	Anatidae	Anser	albifrons	SPECIES	Greater White-fronted Goose	ACCEPTED	4fa7b334-ce0d-4e88-aaae-2e0c138d049e	US	12/16/20 12:06	TRUE	FALSE	2498017	2498017	1	44	212	1108	2986	2498016	2498017	Anser albifrons	Anser	Anser albifrons (Scopoli, 1769)	Anser albifrons	DWC_ARCHIVE	12/16/20 12:06	6/30/20 8:20	FALSE	USA	United States	USA.5_1	California	USA.5.42_1	Santa Barbara	2018-7-28	FALSE
2189502397	OBS647864503	CC0_1_0	Cornell Lab of Ornithology	CLO	EBIRD	EOD - eBird Observation Dataset	HUMAN_OBSERVATION	URN:catalog:CLO:EBIRD:OBS647864503	OBS647864503	obsr338068	2	PRESENT	8/12/18 0:00	2018	8	12	US	California	Santa Barbara	Devereux Slough	34.4136	-119.876	2495266	Patagioenas fasciata (Say, 1823)	Animalia	Chordata	Aves	Columbiformes	Columbidae	Patagioenas	fasciata	SPECIES	Band-tailed Pigeon	ACCEPTED	4fa7b334-ce0d-4e88-aaae-2e0c138d049e	US	12/16/20 12:09	TRUE	FALSE	2495266	2495266	1	44	212	1446	5233	2495265	2495266	Patagioenas fasciata	Patagioenas	Patagioenas fasciata (Say, 1823)	Patagioenas fasciata	DWC_ARCHIVE	12/16/20 12:09	6/30/20 8:20	FALSE	USA	United States	USA.5_1	California	USA.5.42_1	Santa Barbara	2018-8-12	FALSE
2178246913	OBS648107448	CC0_1_0	Cornell Lab of Ornithology	CLO	EBIRD	EOD - eBird Observation Dataset	HUMAN_OBSERVATION	URN:catalog:CLO:EBIRD:OBS648107448	OBS648107448	obsr413715	1	PRESENT	8/13/18 0:00	2018	8	13	US	California	Santa Barbara	Coal Oil Point--Devereux Beach and Sands Beach	34.4071	-119.878	2481776	Arenaria interpres (Linnaeus, 1758)	Animalia	Chordata	Aves	Charadriiformes	Scolopacidae	Arenaria	interpres	SPECIES	Ruddy Turnstone	ACCEPTED	4fa7b334-ce0d-4e88-aaae-2e0c138d049e	US	12/16/20 11:58	TRUE	FALSE	2481776	2481776	1	44	212	7192402	5282	2481774	2481776	Arenaria interpres	Arenaria	Arenaria interpres (Linnaeus, 1758)	Arenaria interpres	DWC_ARCHIVE	12/16/20 11:58	6/30/20 8:20	FALSE	USA	United States	USA.5_1	California	USA.5.42_1	Santa Barbara	2018-8-13	FALSE
2175974158	OBS645151767	CC0_1_0	Cornell Lab of Ornithology	CLO	EBIRD_CAN	EOD - eBird Observation Dataset	HUMAN_OBSERVATION	URN:catalog:CLO:EBIRD_CAN:OBS645151767	OBS645151767	obsr6572	2	PRESENT	8/2/18 0:00	2018	8	2	US	California	Santa Barbara	Devereux Slough	34.4136	-119.876	2476675	Calypte costae (Bourcier, 1839)	Animalia	Chordata	Aves	Apodiformes	Trochilidae	Calypte	costae	SPECIES	Costa's Hummingbird	ACCEPTED	4fa7b334-ce0d-4e88-aaae-2e0c138d049e	US	12/16/20 12:05	TRUE	FALSE	2476675	2476675	1	44	212	1448	5289	2476673	2476675	Calypte costae	Calypte	Calypte costae (Bourcier, 1839)	Calypte costae	DWC_ARCHIVE	12/16/20 12:05	6/30/20 8:20	FALSE	USA	United States	USA.5_1	California	USA.5.42_1	Santa Barbara	2018-8-2	FALSE
2181157041	OBS651293920	CC0_1_0	Cornell Lab of Ornithology	CLO	EBIRD	EOD - eBird Observation Dataset	HUMAN_OBSERVATION	URN:catalog:CLO:EBIRD:OBS651293920	OBS651293920	obsr446850	2	PRESENT	8/25/18 0:00	2018	8	25	US	California	Santa Barbara	Devereux Slough	34.4136	-119.876	5229390	Phalaropus fulicarius (Linnaeus, 1758)	Animalia	Chordata	Aves	Charadriiformes	Scolopacidae	Phalaropus	fulicarius	SPECIES	Red Phalarope	ACCEPTED	4fa7b334-ce0d-4e88-aaae-2e0c138d049e	US	12/16/20 11:56	TRUE	FALSE	5229390	5229390	1	44	212	7192402	5282	7237089	5229390	Phalaropus fulicarius	Phalaropus	Phalaropus fulicarius (Linnaeus, 1758)	Phalaropus fulicarius	DWC_ARCHIVE	12/16/20 11:56	6/30/20 8:20	FALSE	USA	United States	USA.5_1	California	USA.5.42_1	Santa Barbara	2018-8-25	FALSE
2198261160	OBS652863959	CC0_1_0	Cornell Lab of Ornithology	CLO	EBIRD	EOD - eBird Observation Dataset	HUMAN_OBSERVATION	URN:catalog:CLO:EBIRD:OBS652863959	OBS652863959	obsr933209	1	PRESENT	8/31/18 0:00	2018	8	31	US	California	Santa Barbara	Coal Oil Point--Devereux Beach and Sands Beach	34.4071	-119.878	2481770	Calidris bairdii (Coues, 1861)	Animalia	Chordata	Aves	Charadriiformes	Scolopacidae	Calidris	bairdii	SPECIES	Baird's Sandpiper	ACCEPTED	4fa7b334-ce0d-4e88-aaae-2e0c138d049e	US	12/16/20 11:57	TRUE	FALSE	2481770	2481770	1	44	212	7192402	5282	2481739	2481770	Calidris bairdii	Calidris	Calidris bairdii (Coues, 1861)	Calidris bairdii	DWC_ARCHIVE	12/16/20 11:57	6/30/20 8:20	FALSE	USA	United States	USA.5_1	California	USA.5.42_1	Santa Barbara	2018-8-31	FALSE
2182477146	OBS652853032	CC0_1_0	Cornell Lab of Ornithology	CLO	EBIRD	EOD - eBird Observation Dataset	HUMAN_OBSERVATION	URN:catalog:CLO:EBIRD:OBS652853032	OBS652853032	obsr413715	1	PRESENT	8/31/18 0:00	2018	8	31	US	California	Santa Barbara	Coal Oil Point--Devereux Beach and Sands Beach	34.4071	-119.878	2481770	Calidris bairdii (Coues, 1861)	Animalia	Chordata	Aves	Charadriiformes	Scolopacidae	Calidris	bairdii	SPECIES	Baird's Sandpiper	ACCEPTED	4fa7b334-ce0d-4e88-aaae-2e0c138d049e	US	12/16/20 12:07	TRUE	FALSE	2481770	2481770	1	44	212	7192402	5282	2481739	2481770	Calidris bairdii	Calidris	Calidris bairdii (Coues, 1861)	Calidris bairdii	DWC_ARCHIVE	12/16/20 12:07	6/30/20 8:20	FALSE	USA	United States	USA.5_1	California	USA.5.42_1	Santa Barbara	2018-8-31	FALSE
2177235709	OBS646506244	CC0_1_0	Cornell Lab of Ornithology	CLO	EBIRD	EOD - eBird Observation Dataset	HUMAN_OBSERVATION	URN:catalog:CLO:EBIRD:OBS646506244	OBS646506244	obsr337176	1	PRESENT	8/7/18 0:00	2018	8	7	US	California	Santa Barbara	Devereux Slough	34.4136	-119.876	2480830	Bubulcus ibis (Linnaeus, 1758)	Animalia	Chordata	Aves	Pelecaniformes	Ardeidae	Bubulcus	ibis	SPECIES	Cattle Egret	ACCEPTED	4fa7b334-ce0d-4e88-aaae-2e0c138d049e	US	12/16/20 11:56	TRUE	FALSE	2480830	2480830	1	44	212	7190953	3685	2480829	2480830	Bubulcus ibis	Bubulcus	Bubulcus ibis (Linnaeus, 1758)	Bubulcus ibis	DWC_ARCHIVE	12/16/20 11:56	6/30/20 8:20	FALSE	USA	United States	USA.5_1	California	USA.5.42_1	Santa Barbara	2018-8-7	FALSE
2177466482	OBS646865591	CC0_1_0	Cornell Lab of Ornithology	CLO	EBIRD	EOD - eBird Observation Dataset	HUMAN_OBSERVATION	URN:catalog:CLO:EBIRD:OBS646865591	OBS646865591	obsr270826	1	PRESENT	8/8/18 0:00	2018	8	8	US	California	Santa Barbara	Devereux Slough	34.4136	-119.876	9476062	Quiscalus mexicanus (Gmelin, 1788)	Animalia	Chordata	Aves	Passeriformes	Icteridae	Quiscalus	mexicanus	SPECIES	Great-tailed Grackle	ACCEPTED	4fa7b334-ce0d-4e88-aaae-2e0c138d049e	US	12/16/20 12:06	TRUE	FALSE	9476062	9476062	1	44	212	729	6176	2484132	9476062	Quiscalus mexicanus	Quiscalus	Quiscalus mexicanus (Gmelin, 1788)	Quiscalus mexicanus	DWC_ARCHIVE	12/16/20 12:06	6/30/20 8:20	FALSE	USA	United States	USA.5_1	California	USA.5.42_1	Santa Barbara	2018-8-8	FALSE
2200885384	OBS646764175	CC0_1_0	Cornell Lab of Ornithology	CLO	EBIRD	EOD - eBird Observation Dataset	HUMAN_OBSERVATION	URN:catalog:CLO:EBIRD:OBS646764175	OBS646764175	obsr34952	1	PRESENT	8/8/18 0:00	2018	8	8	US	California	Santa Barbara	Devereux Slough	34.4136	-119.876	2498017	Anser albifrons (Scopoli, 1769)	Animalia	Chordata	Aves	Anseriformes	Anatidae	Anser	albifrons	SPECIES	Greater White-fronted Goose	ACCEPTED	4fa7b334-ce0d-4e88-aaae-2e0c138d049e	US	12/16/20 11:57	TRUE	FALSE	2498017	2498017	1	44	212	1108	2986	2498016	2498017	Anser albifrons	Anser	Anser albifrons (Scopoli, 1769)	Anser albifrons	DWC_ARCHIVE	12/16/20 11:57	6/30/20 8:20	FALSE	USA	United States	USA.5_1	California	USA.5.42_1	Santa Barbara	2018-8-8	FALSE
2177498899	OBS646911305	CC0_1_0	Cornell Lab of Ornithology	CLO	EBIRD	EOD - eBird Observation Dataset	HUMAN_OBSERVATION	URN:catalog:CLO:EBIRD:OBS646911305	OBS646911305	obsr302151	1	PRESENT	8/8/18 0:00	2018	8	8	US	California	Santa Barbara	Devereux Slough	34.4136	-119.876	2495370	Zenaida asiatica (Linnaeus, 1758)	Animalia	Chordata	Aves	Columbiformes	Columbidae	Zenaida	asiatica	SPECIES	White-winged Dove	ACCEPTED	4fa7b334-ce0d-4e88-aaae-2e0c138d049e	US	12/16/20 11:57	TRUE	FALSE	2495370	2495370	1	44	212	1446	5233	2495346	2495370	Zenaida asiatica	Zenaida	Zenaida asiatica (Linnaeus, 1758)	Zenaida asiatica	DWC_ARCHIVE	12/16/20 11:57	6/30/20 8:20	FALSE	USA	United States	USA.5_1	California	USA.5.42_1	Santa Barbara	2018-8-8	TRUE
2202200435	OBS657920698	CC0_1_0	Cornell Lab of Ornithology	CLO	EBIRD	EOD - eBird Observation Dataset	HUMAN_OBSERVATION	URN:catalog:CLO:EBIRD:OBS657920698	OBS657920698	obsr842316	1	PRESENT	9/15/18 0:00	2018	9	15	US	California	Santa Barbara	Devereux Slough	34.4136	-119.876	2481764	Calidris pusilla (Linnaeus, 1766)	Animalia	Chordata	Aves	Charadriiformes	Scolopacidae	Calidris	pusilla	SPECIES	Semipalmated Sandpiper	ACCEPTED	4fa7b334-ce0d-4e88-aaae-2e0c138d049e	US	12/16/20 11:58	TRUE	FALSE	2481764	2481764	1	44	212	7192402	5282	2481739	2481764	Calidris pusilla	Calidris	Calidris pusilla (Linnaeus, 1766)	Calidris pusilla	DWC_ARCHIVE	12/16/20 11:58	6/30/20 8:20	FALSE	USA	United States	USA.5_1	California	USA.5.42_1	Santa Barbara	2018-9-15	FALSE
2186884740	OBS658889266	CC0_1_0	Cornell Lab of Ornithology	CLO	EBIRD	EOD - eBird Observation Dataset	HUMAN_OBSERVATION	URN:catalog:CLO:EBIRD:OBS658889266	OBS658889266	obsr119489	8	PRESENT	9/20/18 0:00	2018	9	20	US	California	Santa Barbara	Devereux Slough	34.4136	-119.876	5228612	Chaetura vauxi (J.K.Townsend, 1839)	Animalia	Chordata	Aves	Apodiformes	Apodidae	Chaetura	vauxi	SPECIES	Vaux's Swift	ACCEPTED	4fa7b334-ce0d-4e88-aaae-2e0c138d049e	US	12/16/20 12:07	TRUE	FALSE	5228612	5228612	1	44	212	1448	2993	2477150	5228612	Chaetura vauxi	Chaetura	Chaetura vauxi (J.K.Townsend, 1839)	Chaetura vauxi	DWC_ARCHIVE	12/16/20 12:07	6/30/20 8:20	FALSE	USA	United States	USA.5_1	California	USA.5.42_1	Santa Barbara	2018-9-20	FALSE
2227906621	OBS677460172	CC0_1_0	Cornell Lab of Ornithology	CLO	EBIRD	EOD - eBird Observation Dataset	HUMAN_OBSERVATION	URN:catalog:CLO:EBIRD:OBS677460172	OBS677460172	obsr145758	1	PRESENT	9/29/18 0:00	2018	9	29	US	California	Santa Barbara	Devereux Slough	34.4136	-119.876	5229754	Contopus sordidulus P.L.Sclater, 1859	Animalia	Chordata	Aves	Passeriformes	Tyrannidae	Contopus	sordidulus	SPECIES	Western Wood-Pewee	ACCEPTED	4fa7b334-ce0d-4e88-aaae-2e0c138d049e	US	12/16/20 12:06	TRUE	FALSE	5229754	5229754	1	44	212	729	5291	2483729	5229754	Contopus sordidulus	Contopus	Contopus sordidulus P.L.Sclater, 1859	Contopus sordidulus	DWC_ARCHIVE	12/16/20 12:06	6/30/20 8:20	FALSE	USA	United States	USA.5_1	California	USA.5.42_1	Santa Barbara	2018-9-29	FALSE
2209337988	OBS666126004	CC0_1_0	Cornell Lab of Ornithology	CLO	EBIRD	EOD - eBird Observation Dataset	HUMAN_OBSERVATION	URN:catalog:CLO:EBIRD:OBS666126004	OBS666126004	obsr290433	1	PRESENT	9/29/18 0:00	2018	9	29	US	California	Santa Barbara	Devereux Slough	34.4136	-119.876	5229754	Contopus sordidulus P.L.Sclater, 1859	Animalia	Chordata	Aves	Passeriformes	Tyrannidae	Contopus	sordidulus	SPECIES	Western Wood-Pewee	ACCEPTED	4fa7b334-ce0d-4e88-aaae-2e0c138d049e	US	12/16/20 12:06	TRUE	FALSE	5229754	5229754	1	44	212	729	5291	2483729	5229754	Contopus sordidulus	Contopus	Contopus sordidulus P.L.Sclater, 1859	Contopus sordidulus	DWC_ARCHIVE	12/16/20 12:06	6/30/20 8:20	FALSE	USA	United States	USA.5_1	California	USA.5.42_1	Santa Barbara	2018-9-29	FALSE
2206798156	OBS662712124	CC0_1_0	Cornell Lab of Ornithology	CLO	EBIRD	EOD - eBird Observation Dataset	HUMAN_OBSERVATION	URN:catalog:CLO:EBIRD:OBS662712124	OBS662712124	obsr165010	1	PRESENT	9/29/18 0:00	2018	9	29	US	California	Santa Barbara	Devereux Slough	34.4136	-119.876	5229754	Contopus sordidulus P.L.Sclater, 1859	Animalia	Chordata	Aves	Passeriformes	Tyrannidae	Contopus	sordidulus	SPECIES	Western Wood-Pewee	ACCEPTED	4fa7b334-ce0d-4e88-aaae-2e0c138d049e	US	12/16/20 11:57	TRUE	FALSE	5229754	5229754	1	44	212	729	5291	2483729	5229754	Contopus sordidulus	Contopus	Contopus sordidulus P.L.Sclater, 1859	Contopus sordidulus	DWC_ARCHIVE	12/16/20 11:57	6/30/20 8:20	FALSE	USA	United States	USA.5_1	California	USA.5.42_1	Santa Barbara	2018-9-29	FALSE
2209293992	OBS666085552	CC0_1_0	Cornell Lab of Ornithology	CLO	EBIRD	EOD - eBird Observation Dataset	HUMAN_OBSERVATION	URN:catalog:CLO:EBIRD:OBS666085552	OBS666085552	obsr159137	1	PRESENT	9/29/18 0:00	2018	9	29	US	California	Santa Barbara	Devereux Slough	34.4136	-119.876	5229754	Contopus sordidulus P.L.Sclater, 1859	Animalia	Chordata	Aves	Passeriformes	Tyrannidae	Contopus	sordidulus	SPECIES	Western Wood-Pewee	ACCEPTED	4fa7b334-ce0d-4e88-aaae-2e0c138d049e	US	12/16/20 12:07	TRUE	FALSE	5229754	5229754	1	44	212	729	5291	2483729	5229754	Contopus sordidulus	Contopus	Contopus sordidulus P.L.Sclater, 1859	Contopus sordidulus	DWC_ARCHIVE	12/16/20 12:07	6/30/20 8:20	FALSE	USA	United States	USA.5_1	California	USA.5.42_1	Santa Barbara	2018-9-29	FALSE
2216383973	OBS673458665	CC0_1_0	Cornell Lab of Ornithology	CLO	EBIRD	EOD - eBird Observation Dataset	HUMAN_OBSERVATION	URN:catalog:CLO:EBIRD:OBS673458665	OBS673458665	obsr1057013	1	PRESENT	9/29/18 0:00	2018	9	29	US	California	Santa Barbara	Devereux Slough	34.4136	-119.876	5229754	Contopus sordidulus P.L.Sclater, 1859	Animalia	Chordata	Aves	Passeriformes	Tyrannidae	Contopus	sordidulus	SPECIES	Western Wood-Pewee	ACCEPTED	4fa7b334-ce0d-4e88-aaae-2e0c138d049e	US	12/16/20 11:57	TRUE	FALSE	5229754	5229754	1	44	212	729	5291	2483729	5229754	Contopus sordidulus	Contopus	Contopus sordidulus P.L.Sclater, 1859	Contopus sordidulus	DWC_ARCHIVE	12/16/20 11:57	6/30/20 8:20	FALSE	USA	United States	USA.5_1	California	USA.5.42_1	Santa Barbara	2018-9-29	FALSE
2225341269	OBS685067832	CC0_1_0	Cornell Lab of Ornithology	CLO	EBIRD	EOD - eBird Observation Dataset	HUMAN_OBSERVATION	URN:catalog:CLO:EBIRD:OBS685067832	OBS685067832	obsr191301	1	PRESENT	9/29/18 0:00	2018	9	29	US	California	Santa Barbara	Devereux Lagoon	34.4116	-119.877	5229754	Contopus sordidulus P.L.Sclater, 1859	Animalia	Chordata	Aves	Passeriformes	Tyrannidae	Contopus	sordidulus	SPECIES	Western Wood-Pewee	ACCEPTED	4fa7b334-ce0d-4e88-aaae-2e0c138d049e	US	12/16/20 12:06	TRUE	FALSE	5229754	5229754	1	44	212	729	5291	2483729	5229754	Contopus sordidulus	Contopus	Contopus sordidulus P.L.Sclater, 1859	Contopus sordidulus	DWC_ARCHIVE	12/16/20 12:06	6/30/20 8:20	FALSE	USA	United States	USA.5_1	California	USA.5.42_1	Santa Barbara	2018-9-29	FALSE
2205482158	OBS661420854	CC0_1_0	Cornell Lab of Ornithology	CLO	EBIRD	EOD - eBird Observation Dataset	HUMAN_OBSERVATION	URN:catalog:CLO:EBIRD:OBS661420854	OBS661420854	obsr165010	1	PRESENT	9/29/18 0:00	2018	9	29	US	California	Santa Barbara	Devereux Slough	34.4136	-119.876	5229754	Contopus sordidulus P.L.Sclater, 1859	Animalia	Chordata	Aves	Passeriformes	Tyrannidae	Contopus	sordidulus	SPECIES	Western Wood-Pewee	ACCEPTED	4fa7b334-ce0d-4e88-aaae-2e0c138d049e	US	12/16/20 12:07	TRUE	FALSE	5229754	5229754	1	44	212	729	5291	2483729	5229754	Contopus sordidulus	Contopus	Contopus sordidulus P.L.Sclater, 1859	Contopus sordidulus	DWC_ARCHIVE	12/16/20 12:07	6/30/20 8:20	FALSE	USA	United States	USA.5_1	California	USA.5.42_1	Santa Barbara	2018-9-29	FALSE
2190489337	OBS662211391	CC0_1_0	Cornell Lab of Ornithology	CLO	EBIRD	EOD - eBird Observation Dataset	HUMAN_OBSERVATION	URN:catalog:CLO:EBIRD:OBS662211391	OBS662211391	obsr51183	1	PRESENT	9/29/18 0:00	2018	9	29	US	California	Santa Barbara	Devereux Slough	34.4136	-119.876	5229754	Contopus sordidulus P.L.Sclater, 1859	Animalia	Chordata	Aves	Passeriformes	Tyrannidae	Contopus	sordidulus	SPECIES	Western Wood-Pewee	ACCEPTED	4fa7b334-ce0d-4e88-aaae-2e0c138d049e	US	12/16/20 11:57	TRUE	FALSE	5229754	5229754	1	44	212	729	5291	2483729	5229754	Contopus sordidulus	Contopus	Contopus sordidulus P.L.Sclater, 1859	Contopus sordidulus	DWC_ARCHIVE	12/16/20 11:57	6/30/20 8:20	FALSE	USA	United States	USA.5_1	California	USA.5.42_1	Santa Barbara	2018-9-29	TRUE
2214597442	OBS661890857	CC0_1_0	Cornell Lab of Ornithology	CLO	EBIRD	EOD - eBird Observation Dataset	HUMAN_OBSERVATION	URN:catalog:CLO:EBIRD:OBS661890857	OBS661890857	obsr139709	1	PRESENT	9/30/18 0:00	2018	9	30	US	California	Santa Barbara	Devereux Slough	34.4136	-119.876	5231643	Spinus lawrencei (Cassin, 1850)	Animalia	Chordata	Aves	Passeriformes	Fringillidae	Spinus	lawrencei	SPECIES	Lawrence's Goldfinch	ACCEPTED	4fa7b334-ce0d-4e88-aaae-2e0c138d049e	US	12/16/20 12:08	TRUE	FALSE	5231643	5231643	1	44	212	729	5242	8051475	5231643	Spinus lawrencei	Spinus	Spinus lawrencei (Cassin, 1850)	Spinus lawrencei	DWC_ARCHIVE	12/16/20 12:08	6/30/20 8:20	FALSE	USA	United States	USA.5_1	California	USA.5.42_1	Santa Barbara	2018-9-30	FALSE
2214568199	OBS661862812	CC0_1_0	Cornell Lab of Ornithology	CLO	EBIRD	EOD - eBird Observation Dataset	HUMAN_OBSERVATION	URN:catalog:CLO:EBIRD:OBS661862812	OBS661862812	obsr1112294	1	PRESENT	9/30/18 0:00	2018	9	30	US	California	Santa Barbara	Devereux Slough	34.4136	-119.876	5229754	Contopus sordidulus P.L.Sclater, 1859	Animalia	Chordata	Aves	Passeriformes	Tyrannidae	Contopus	sordidulus	SPECIES	Western Wood-Pewee	ACCEPTED	4fa7b334-ce0d-4e88-aaae-2e0c138d049e	US	12/16/20 12:07	TRUE	FALSE	5229754	5229754	1	44	212	729	5291	2483729	5229754	Contopus sordidulus	Contopus	Contopus sordidulus P.L.Sclater, 1859	Contopus sordidulus	DWC_ARCHIVE	12/16/20 12:07	6/30/20 8:20	FALSE	USA	United States	USA.5_1	California	USA.5.42_1	Santa Barbara	2018-9-30	FALSE
2214615834	OBS661910509	CC0_1_0	Cornell Lab of Ornithology	CLO	EBIRD	EOD - eBird Observation Dataset	HUMAN_OBSERVATION	URN:catalog:CLO:EBIRD:OBS661910509	OBS661910509	obsr111092	1	PRESENT	9/30/18 0:00	2018	9	30	US	California	Santa Barbara	Devereux Slough	34.4136	-119.876	5229754	Contopus sordidulus P.L.Sclater, 1859	Animalia	Chordata	Aves	Passeriformes	Tyrannidae	Contopus	sordidulus	SPECIES	Western Wood-Pewee	ACCEPTED	4fa7b334-ce0d-4e88-aaae-2e0c138d049e	US	12/16/20 12:07	TRUE	FALSE	5229754	5229754	1	44	212	729	5291	2483729	5229754	Contopus sordidulus	Contopus	Contopus sordidulus P.L.Sclater, 1859	Contopus sordidulus	DWC_ARCHIVE	12/16/20 12:07	6/30/20 8:20	FALSE	USA	United States	USA.5_1	California	USA.5.42_1	Santa Barbara	2018-9-30	TRUE
2653582559	OBS698491790	CC0_1_0	Cornell Lab of Ornithology	CLO	EBIRD	EOD - eBird Observation Dataset	HUMAN_OBSERVATION	URN:catalog:CLO:EBIRD:OBS698491790	OBS698491790	obsr277359	20	PRESENT	1/14/19 0:00	2019	1	14	US	California	Santa Barbara	Devereux Slough	34.4136	-119.876	2481209	Rynchops niger Linnaeus, 1758	Animalia	Chordata	Aves	Charadriiformes	Laridae	Rynchops	niger	SPECIES	Black Skimmer	ACCEPTED	4fa7b334-ce0d-4e88-aaae-2e0c138d049e	US	12/16/20 11:58	TRUE	FALSE	2481209	2481209	1	44	212	7192402	9316	2481206	2481209	Rynchops niger	Rynchops	Rynchops niger Linnaeus, 1758	Rynchops niger	DWC_ARCHIVE	12/16/20 11:58	6/30/20 8:20	FALSE	USA	United States	USA.5_1	California	USA.5.42_1	Santa Barbara	2019-1-14	FALSE
2655654905	OBS698689988	CC0_1_0	Cornell Lab of Ornithology	CLO	EBIRD	EOD - eBird Observation Dataset	HUMAN_OBSERVATION	URN:catalog:CLO:EBIRD:OBS698689988	OBS698689988	obsr172576	40	PRESENT	1/14/19 0:00	2019	1	14	US	California	Santa Barbara	DevereuxSouthOverlook	34.4119	-119.877	2481209	Rynchops niger Linnaeus, 1758	Animalia	Chordata	Aves	Charadriiformes	Laridae	Rynchops	niger	SPECIES	Black Skimmer	ACCEPTED	4fa7b334-ce0d-4e88-aaae-2e0c138d049e	US	12/16/20 12:17	TRUE	FALSE	2481209	2481209	1	44	212	7192402	9316	2481206	2481209	Rynchops niger	Rynchops	Rynchops niger Linnaeus, 1758	Rynchops niger	DWC_ARCHIVE	12/16/20 12:17	6/30/20 8:20	FALSE	USA	United States	USA.5_1	California	USA.5.42_1	Santa Barbara	2019-1-14	FALSE
2663737326	OBS698387229	CC0_1_0	Cornell Lab of Ornithology	CLO	EBIRD	EOD - eBird Observation Dataset	HUMAN_OBSERVATION	URN:catalog:CLO:EBIRD:OBS698387229	OBS698387229	obsr246929	25	PRESENT	1/14/19 0:00	2019	1	14	US	California	Santa Barbara	Devereux Slough	34.4136	-119.876	2481209	Rynchops niger Linnaeus, 1758	Animalia	Chordata	Aves	Charadriiformes	Laridae	Rynchops	niger	SPECIES	Black Skimmer	ACCEPTED	4fa7b334-ce0d-4e88-aaae-2e0c138d049e	US	12/16/20 11:59	TRUE	FALSE	2481209	2481209	1	44	212	7192402	9316	2481206	2481209	Rynchops niger	Rynchops	Rynchops niger Linnaeus, 1758	Rynchops niger	DWC_ARCHIVE	12/16/20 11:59	6/30/20 8:20	FALSE	USA	United States	USA.5_1	California	USA.5.42_1	Santa Barbara	2019-1-14	FALSE
2734974764	OBS699351280	CC0_1_0	Cornell Lab of Ornithology	CLO	EBIRD	EOD - eBird Observation Dataset	HUMAN_OBSERVATION	URN:catalog:CLO:EBIRD:OBS699351280	OBS699351280	obsr420881	1	PRESENT	1/16/19 0:00	2019	1	16	US	California	Santa Barbara	Coal Oil Point--Devereux Beach and Sands Beach	34.4071	-119.878	2481621	Stercorarius parasiticus (Linnaeus, 1758)	Animalia	Chordata	Aves	Charadriiformes	Stercorariidae	Stercorarius	parasiticus	SPECIES	Parasitic Jaeger	ACCEPTED	4fa7b334-ce0d-4e88-aaae-2e0c138d049e	US	12/16/20 12:06	TRUE	FALSE	2481621	2481621	1	44	212	7192402	9347	2481608	2481621	Stercorarius parasiticus	Stercorarius	Stercorarius parasiticus (Linnaeus, 1758)	Stercorarius parasiticus	DWC_ARCHIVE	12/16/20 12:06	6/30/20 8:20	FALSE	USA	United States	USA.5_1	California	USA.5.42_1	Santa Barbara	2019-1-16	TRUE
2729998315	OBS703283756	CC0_1_0	Cornell Lab of Ornithology	CLO	EBIRD	EOD - eBird Observation Dataset	HUMAN_OBSERVATION	URN:catalog:CLO:EBIRD:OBS703283756	OBS703283756	obsr668907	3	PRESENT	1/25/19 0:00	2019	1	25	US	California	Santa Barbara	Coal Oil Point--Devereux Beach and Sands Beach	34.4071	-119.878	2481139	Larus argentatus Pontoppidan, 1763	Animalia	Chordata	Aves	Charadriiformes	Laridae	Larus	argentatus	SPECIES	Herring Gull	ACCEPTED	4fa7b334-ce0d-4e88-aaae-2e0c138d049e	US	12/16/20 12:06	TRUE	FALSE	2481139	2481139	1	44	212	7192402	9316	2481126	2481139	Larus argentatus	Larus	Larus argentatus Pontoppidan, 1763	Larus argentatus	DWC_ARCHIVE	12/16/20 12:06	6/30/20 8:20	FALSE	USA	United States	USA.5_1	California	USA.5.42_1	Santa Barbara	2019-1-25	FALSE
2663191965	OBS704347820	CC0_1_0	Cornell Lab of Ornithology	CLO	EBIRD	EOD - eBird Observation Dataset	HUMAN_OBSERVATION	URN:catalog:CLO:EBIRD:OBS704347820	OBS704347820	obsr1123609	2	PRESENT	1/29/19 0:00	2019	1	29	US	California	Santa Barbara	Devereux Slough	34.4136	-119.876	2482492	Corvus corax Linnaeus, 1758	Animalia	Chordata	Aves	Passeriformes	Corvidae	Corvus	corax	SPECIES	Common Raven	ACCEPTED	4fa7b334-ce0d-4e88-aaae-2e0c138d049e	US	12/16/20 11:58	TRUE	FALSE	2482492	2482492	1	44	212	729	5235	2482468	2482492	Corvus corax	Corvus	Corvus corax Linnaeus, 1758	Corvus corax	DWC_ARCHIVE	12/16/20 11:58	6/30/20 8:20	FALSE	USA	United States	USA.5_1	California	USA.5.42_1	Santa Barbara	2019-1-29	FALSE
2665061874	OBS704347839	CC0_1_0	Cornell Lab of Ornithology	CLO	EBIRD	EOD - eBird Observation Dataset	HUMAN_OBSERVATION	URN:catalog:CLO:EBIRD:OBS704347839	OBS704347839	obsr1123609	1	PRESENT	1/29/19 0:00	2019	1	29	US	California	Santa Barbara	Devereux Slough	34.4136	-119.876	2498165	Anser caerulescens (Linnaeus, 1758)	Animalia	Chordata	Aves	Anseriformes	Anatidae	Chen	caerulescens	SPECIES	Snow Goose	SYNONYM	4fa7b334-ce0d-4e88-aaae-2e0c138d049e	US	12/16/20 12:17	TRUE	FALSE	2498167	2498165	1	44	212	1108	2986	2498159	2498165	Chen caerulescens	Anser	Chen caerulescens (Linnaeus, 1758)	Anser caerulescens	DWC_ARCHIVE	12/16/20 12:17	6/30/20 8:20	FALSE	USA	United States	USA.5_1	California	USA.5.42_1	Santa Barbara	2019-1-29	FALSE
2656830705	OBS705584779	CC0_1_0	Cornell Lab of Ornithology	CLO	EBIRD	EOD - eBird Observation Dataset	HUMAN_OBSERVATION	URN:catalog:CLO:EBIRD:OBS705584779	OBS705584779	obsr655294	1	PRESENT	1/29/19 0:00	2019	1	29	US	California	Santa Barbara	Coal Oil Point--Devereux Beach and Sands Beach	34.4071	-119.878	2481342	Uria aalge (Pontoppidan, 1763)	Animalia	Chordata	Aves	Charadriiformes	Alcidae	Uria	aalge	SPECIES	Common Murre	ACCEPTED	4fa7b334-ce0d-4e88-aaae-2e0c138d049e	US	12/16/20 11:58	TRUE	FALSE	2481342	2481342	1	44	212	7192402	2985	2481338	2481342	Uria aalge	Uria	Uria aalge (Pontoppidan, 1763)	Uria aalge	DWC_ARCHIVE	12/16/20 11:58	6/30/20 8:20	FALSE	USA	United States	USA.5_1	California	USA.5.42_1	Santa Barbara	2019-1-29	FALSE
2734585852	OBS698029509	CC0_1_0	Cornell Lab of Ornithology	CLO	EBIRD	EOD - eBird Observation Dataset	HUMAN_OBSERVATION	URN:catalog:CLO:EBIRD:OBS698029509	OBS698029509	obsr183319	1	PRESENT	1/5/19 0:00	2019	1	5	US	California	Santa Barbara	Devereux Slough	34.4136	-119.876	5229155	Pelecanus erythrorhynchos Gmelin, 1789	Animalia	Chordata	Aves	Pelecaniformes	Pelecanidae	Pelecanus	erythrorhynchos	SPECIES	American White Pelican	ACCEPTED	4fa7b334-ce0d-4e88-aaae-2e0c138d049e	US	12/16/20 12:06	TRUE	FALSE	5229155	5229155	1	44	212	7190953	9329	10650925	5229155	Pelecanus erythrorhynchos	Pelecanus	Pelecanus erythrorhynchos Gmelin, 1789	Pelecanus erythrorhynchos	DWC_ARCHIVE	12/16/20 12:06	6/30/20 8:20	FALSE	USA	United States	USA.5_1	California	USA.5.42_1	Santa Barbara	2019-1-5	FALSE
2653652887	OBS694883914	CC0_1_0	Cornell Lab of Ornithology	CLO	EBIRD	EOD - eBird Observation Dataset	HUMAN_OBSERVATION	URN:catalog:CLO:EBIRD:OBS694883914	OBS694883914	obsr34952	1	PRESENT	1/6/19 0:00	2019	1	6	US	California	Santa Barbara	Devereux Slough	34.4136	-119.876	2490810	Catharus guttatus (Pallas, 1811)	Animalia	Chordata	Aves	Passeriformes	Turdidae	Catharus	guttatus	SPECIES	Hermit Thrush	ACCEPTED	4fa7b334-ce0d-4e88-aaae-2e0c138d049e	US	12/16/20 11:58	TRUE	FALSE	2490810	2490810	1	44	212	729	5290	2490799	2490810	Catharus guttatus	Catharus	Catharus guttatus (Pallas, 1811)	Catharus guttatus	DWC_ARCHIVE	12/16/20 11:58	6/30/20 8:20	FALSE	USA	United States	USA.5_1	California	USA.5.42_1	Santa Barbara	2019-1-6	FALSE
2746338518	OBS695835639	CC0_1_0	Cornell Lab of Ornithology	CLO	EBIRD	EOD - eBird Observation Dataset	HUMAN_OBSERVATION	URN:catalog:CLO:EBIRD:OBS695835639	OBS695835639	obsr933209	3	PRESENT	1/8/19 0:00	2019	1	8	US	California	Santa Barbara	Devereux Slough	34.4136	-119.876	2498017	Anser albifrons (Scopoli, 1769)	Animalia	Chordata	Aves	Anseriformes	Anatidae	Anser	albifrons	SPECIES	Greater White-fronted Goose	ACCEPTED	4fa7b334-ce0d-4e88-aaae-2e0c138d049e	US	12/16/20 12:08	TRUE	FALSE	2498017	2498017	1	44	212	1108	2986	2498016	2498017	Anser albifrons	Anser	Anser albifrons (Scopoli, 1769)	Anser albifrons	DWC_ARCHIVE	12/16/20 12:08	6/30/20 8:20	FALSE	USA	United States	USA.5_1	California	USA.5.42_1	Santa Barbara	2019-1-8	FALSE
2659004149	OBS696143970	CC0_1_0	Cornell Lab of Ornithology	CLO	EBIRD	EOD - eBird Observation Dataset	HUMAN_OBSERVATION	URN:catalog:CLO:EBIRD:OBS696143970	OBS696143970	obsr618806	8	PRESENT	1/8/19 0:00	2019	1	8	US	California	Santa Barbara	Devereux Slough	34.4136	-119.876	2495266	Patagioenas fasciata (Say, 1823)	Animalia	Chordata	Aves	Columbiformes	Columbidae	Patagioenas	fasciata	SPECIES	Band-tailed Pigeon	ACCEPTED	4fa7b334-ce0d-4e88-aaae-2e0c138d049e	US	12/16/20 12:17	TRUE	FALSE	2495266	2495266	1	44	212	1446	5233	2495265	2495266	Patagioenas fasciata	Patagioenas	Patagioenas fasciata (Say, 1823)	Patagioenas fasciata	DWC_ARCHIVE	12/16/20 12:17	6/30/20 8:20	FALSE	USA	United States	USA.5_1	California	USA.5.42_1	Santa Barbara	2019-1-8	FALSE
2653531350	OBS696352650	CC0_1_0	Cornell Lab of Ornithology	CLO	EBIRD	EOD - eBird Observation Dataset	HUMAN_OBSERVATION	URN:catalog:CLO:EBIRD:OBS696352650	OBS696352650	obsr20285	2	PRESENT	1/9/19 0:00	2019	1	9	US	California	Santa Barbara	Devereux Slough	34.4136	-119.876	2482059	Podiceps auritus (Linnaeus, 1758)	Animalia	Chordata	Aves	Podicipediformes	Podicipedidae	Podiceps	auritus	SPECIES	Horned Grebe	ACCEPTED	4fa7b334-ce0d-4e88-aaae-2e0c138d049e	US	12/16/20 11:57	TRUE	FALSE	2482059	2482059	1	44	212	7191588	9338	2482049	2482059	Podiceps auritus	Podiceps	Podiceps auritus (Linnaeus, 1758)	Podiceps auritus	DWC_ARCHIVE	12/16/20 11:57	6/30/20 8:20	FALSE	USA	United States	USA.5_1	California	USA.5.42_1	Santa Barbara	2019-1-9	FALSE
2710006752	OBS814975592	CC0_1_0	Cornell Lab of Ornithology	CLO	EBIRD	EOD - eBird Observation Dataset	HUMAN_OBSERVATION	URN:catalog:CLO:EBIRD:OBS814975592	OBS814975592	obsr525798	1	PRESENT	10/10/19 0:00	2019	10	10	US	California	Santa Barbara	Devereux Slough	34.4136	-119.876	2490810	Catharus guttatus (Pallas, 1811)	Animalia	Chordata	Aves	Passeriformes	Turdidae	Catharus	guttatus	SPECIES	Hermit Thrush	ACCEPTED	4fa7b334-ce0d-4e88-aaae-2e0c138d049e	US	12/16/20 11:58	TRUE	FALSE	2490810	2490810	1	44	212	729	5290	2490799	2490810	Catharus guttatus	Catharus	Catharus guttatus (Pallas, 1811)	Catharus guttatus	DWC_ARCHIVE	12/16/20 11:58	6/30/20 8:20	FALSE	USA	United States	USA.5_1	California	USA.5.42_1	Santa Barbara	2019-10-10	FALSE
2701347482	OBS814895278	CC0_1_0	Cornell Lab of Ornithology	CLO	EBIRD	EOD - eBird Observation Dataset	HUMAN_OBSERVATION	URN:catalog:CLO:EBIRD:OBS814895278	OBS814895278	obsr413715	8	PRESENT	10/10/19 0:00	2019	10	10	US	California	Santa Barbara	Devereux Slough	34.4136	-119.876	5229155	Pelecanus erythrorhynchos Gmelin, 1789	Animalia	Chordata	Aves	Pelecaniformes	Pelecanidae	Pelecanus	erythrorhynchos	SPECIES	American White Pelican	ACCEPTED	4fa7b334-ce0d-4e88-aaae-2e0c138d049e	US	12/16/20 11:59	TRUE	FALSE	5229155	5229155	1	44	212	7190953	9329	10650925	5229155	Pelecanus erythrorhynchos	Pelecanus	Pelecanus erythrorhynchos Gmelin, 1789	Pelecanus erythrorhynchos	DWC_ARCHIVE	12/16/20 11:59	6/30/20 8:20	FALSE	USA	United States	USA.5_1	California	USA.5.42_1	Santa Barbara	2019-10-10	FALSE
2718814695	OBS817553264	CC0_1_0	Cornell Lab of Ornithology	CLO	EBIRD	EOD - eBird Observation Dataset	HUMAN_OBSERVATION	URN:catalog:CLO:EBIRD:OBS817553264	OBS817553264	obsr525798	3	PRESENT	10/17/19 0:00	2019	10	17	US	California	Santa Barbara	Devereux Slough	34.4136	-119.876	2498017	Anser albifrons (Scopoli, 1769)	Animalia	Chordata	Aves	Anseriformes	Anatidae	Anser	albifrons	SPECIES	Greater White-fronted Goose	ACCEPTED	4fa7b334-ce0d-4e88-aaae-2e0c138d049e	US	12/16/20 12:00	TRUE	FALSE	2498017	2498017	1	44	212	1108	2986	2498016	2498017	Anser albifrons	Anser	Anser albifrons (Scopoli, 1769)	Anser albifrons	DWC_ARCHIVE	12/16/20 12:00	6/30/20 8:20	FALSE	USA	United States	USA.5_1	California	USA.5.42_1	Santa Barbara	2019-10-17	FALSE
2715010879	OBS818200290	CC0_1_0	Cornell Lab of Ornithology	CLO	EBIRD	EOD - eBird Observation Dataset	HUMAN_OBSERVATION	URN:catalog:CLO:EBIRD:OBS818200290	OBS818200290	obsr548926	1	PRESENT	10/19/19 0:00	2019	10	19	US	California	Santa Barbara	Devereux Slough	34.4136	-119.876	2484879	Sitta canadensis Linnaeus, 1766	Animalia	Chordata	Aves	Passeriformes	Sittidae	Sitta	canadensis	SPECIES	Red-breasted Nuthatch	ACCEPTED	4fa7b334-ce0d-4e88-aaae-2e0c138d049e	US	12/16/20 12:00	TRUE	FALSE	2484879	2484879	1	44	212	729	5283	2484878	2484879	Sitta canadensis	Sitta	Sitta canadensis Linnaeus, 1766	Sitta canadensis	DWC_ARCHIVE	12/16/20 12:00	6/30/20 8:20	FALSE	USA	United States	USA.5_1	California	USA.5.42_1	Santa Barbara	2019-10-19	TRUE
2697655148	OBS812502054	CC0_1_0	Cornell Lab of Ornithology	CLO	EBIRD	EOD - eBird Observation Dataset	HUMAN_OBSERVATION	URN:catalog:CLO:EBIRD:OBS812502054	OBS812502054	obsr525798	1	PRESENT	10/3/19 0:00	2019	10	3	US	California	Santa Barbara	Coal Oil Point--Devereux Beach and Sands Beach	34.4071	-119.878	7341606	Cardellina pusilla (A.Wilson, 1811)	Animalia	Chordata	Aves	Passeriformes	Parulidae	Cardellina	pusilla	SPECIES	Wilson's Warbler	ACCEPTED	4fa7b334-ce0d-4e88-aaae-2e0c138d049e	US	12/16/20 11:59	TRUE	FALSE	7341606	7341606	1	44	212	729	5263	2489633	7341606	Cardellina pusilla	Cardellina	Cardellina pusilla (A.Wilson, 1811)	Cardellina pusilla	DWC_ARCHIVE	12/16/20 11:59	6/30/20 8:20	FALSE	USA	United States	USA.5_1	California	USA.5.42_1	Santa Barbara	2019-10-3	FALSE
2701244387	OBS812502059	CC0_1_0	Cornell Lab of Ornithology	CLO	EBIRD	EOD - eBird Observation Dataset	HUMAN_OBSERVATION	URN:catalog:CLO:EBIRD:OBS812502059	OBS812502059	obsr525798	2	PRESENT	10/3/19 0:00	2019	10	3	US	California	Santa Barbara	Coal Oil Point--Devereux Beach and Sands Beach	34.4071	-119.878	2487446	Vireo gilvus (Vieillot, 1808)	Animalia	Chordata	Aves	Passeriformes	Vireonidae	Vireo	gilvus	SPECIES	Warbling Vireo	ACCEPTED	4fa7b334-ce0d-4e88-aaae-2e0c138d049e	US	12/16/20 11:58	TRUE	FALSE	2487446	2487446	1	44	212	729	9358	2487406	2487446	Vireo gilvus	Vireo	Vireo gilvus (Vieillot, 1808)	Vireo gilvus	DWC_ARCHIVE	12/16/20 11:58	6/30/20 8:20	FALSE	USA	United States	USA.5_1	California	USA.5.42_1	Santa Barbara	2019-10-3	FALSE
2707070807	OBS822811588	CC0_1_0	Cornell Lab of Ornithology	CLO	EBIRD	EOD - eBird Observation Dataset	HUMAN_OBSERVATION	URN:catalog:CLO:EBIRD:OBS822811588	OBS822811588	obsr449041	4	PRESENT	10/30/19 0:00	2019	10	30	US	California	Santa Barbara	Devereux Slough	34.4136	-119.876	5231190	Passer domesticus (Linnaeus, 1758)	Animalia	Chordata	Aves	Passeriformes	Passeridae	Passer	domesticus	SPECIES	House Sparrow	ACCEPTED	4fa7b334-ce0d-4e88-aaae-2e0c138d049e	US	12/16/20 11:59	TRUE	FALSE	5231190	5231190	1	44	212	729	5264	2492321	5231190	Passer domesticus	Passer	Passer domesticus (Linnaeus, 1758)	Passer domesticus	DWC_ARCHIVE	12/16/20 11:59	6/30/20 8:20	FALSE	USA	United States	USA.5_1	California	USA.5.42_1	Santa Barbara	2019-10-30	FALSE
2789454315	OBS827702680	CC0_1_0	Cornell Lab of Ornithology	CLO	EBIRD	EOD - eBird Observation Dataset	HUMAN_OBSERVATION	URN:catalog:CLO:EBIRD:OBS827702680	OBS827702680	obsr689353	1	PRESENT	10/31/19 0:00	2019	10	31	US	California	Santa Barbara	Dune Pond at COPR	34.4137	-119.882	2474825	Rallus limicola Vieillot, 1819	Animalia	Chordata	Aves	Gruiformes	Rallidae	Rallus	limicola	SPECIES	Virginia Rail	ACCEPTED	4fa7b334-ce0d-4e88-aaae-2e0c138d049e	US	12/16/20 12:07	TRUE	FALSE	2474825	2474825	1	44	212	1493	9342	2474794	2474825	Rallus limicola	Rallus	Rallus limicola Vieillot, 1819	Rallus limicola	DWC_ARCHIVE	12/16/20 12:07	6/30/20 8:20	FALSE	USA	United States	USA.5_1	California	USA.5.42_1	Santa Barbara	2019-10-31	FALSE
2707282944	OBS823267911	CC0_1_0	Cornell Lab of Ornithology	CLO	EBIRD	EOD - eBird Observation Dataset	HUMAN_OBSERVATION	URN:catalog:CLO:EBIRD:OBS823267911	OBS823267911	obsr111092	1	PRESENT	10/31/19 0:00	2019	10	31	US	California	Santa Barbara	Dune Pond at COPR	34.4137	-119.882	2474825	Rallus limicola Vieillot, 1819	Animalia	Chordata	Aves	Gruiformes	Rallidae	Rallus	limicola	SPECIES	Virginia Rail	ACCEPTED	4fa7b334-ce0d-4e88-aaae-2e0c138d049e	US	12/16/20 11:59	TRUE	FALSE	2474825	2474825	1	44	212	1493	9342	2474794	2474825	Rallus limicola	Rallus	Rallus limicola Vieillot, 1819	Rallus limicola	DWC_ARCHIVE	12/16/20 11:59	6/30/20 8:20	FALSE	USA	United States	USA.5_1	California	USA.5.42_1	Santa Barbara	2019-10-31	TRUE
2788157242	OBS812993618	CC0_1_0	Cornell Lab of Ornithology	CLO	EBIRD	EOD - eBird Observation Dataset	HUMAN_OBSERVATION	URN:catalog:CLO:EBIRD:OBS812993618	OBS812993618	obsr548926	1	PRESENT	10/5/19 0:00	2019	10	5	US	California	Santa Barbara	Devereux Slough	34.4136	-119.876	7341770	Setophaga nigrescens (J.K.Townsend, 1837)	Animalia	Chordata	Aves	Passeriformes	Parulidae	Setophaga	nigrescens	SPECIES	Black-throated Gray Warbler	ACCEPTED	4fa7b334-ce0d-4e88-aaae-2e0c138d049e	US	12/16/20 12:08	TRUE	FALSE	7341770	7341770	1	44	212	729	5263	2489984	7341770	Setophaga nigrescens	Setophaga	Setophaga nigrescens (J.K.Townsend, 1837)	Setophaga nigrescens	DWC_ARCHIVE	12/16/20 12:08	6/30/20 8:20	FALSE	USA	United States	USA.5_1	California	USA.5.42_1	Santa Barbara	2019-10-5	TRUE
2451688382	35171268	CC_BY_NC_4_0	iNaturalist.org	iNaturalist	Observations	iNaturalist Research-grade Observations	HUMAN_OBSERVATION	https://www.inaturalist.org/observations/35171268	35171268	Tom Turner	NA	PRESENT	11/1/19 10:47	2019	11	1	US	California	NA	NA	34.408959	-119.878059	2484879	Sitta canadensis Linnaeus, 1766	Animalia	Chordata	Aves	Passeriformes	Sittidae	Sitta	canadensis	SPECIES	NA	ACCEPTED	50c9509d-22c7-4a22-a47d-8c48425ef4a7	US	2/21/21 4:37	TRUE	FALSE	2484879	2484879	1	44	212	729	5283	2484878	2484879	Sitta canadensis	Sitta	Sitta canadensis Linnaeus, 1766	Sitta canadensis	DWC_ARCHIVE	2/21/21 4:37	2/21/21 2:33	FALSE	USA	United States	USA.5_1	California	USA.5.42_1	Santa Barbara	2019-11-1	TRUE
2550159103	37290459	CC_BY_NC_4_0	iNaturalist.org	iNaturalist	Observations	iNaturalist Research-grade Observations	HUMAN_OBSERVATION	https://www.inaturalist.org/observations/37290459	37290459	Tom Turner	NA	PRESENT	11/1/19 10:47	2019	11	1	US	California	NA	NA	34.40923	-119.878329	2484879	Sitta canadensis Linnaeus, 1766	Animalia	Chordata	Aves	Passeriformes	Sittidae	Sitta	canadensis	SPECIES	NA	ACCEPTED	50c9509d-22c7-4a22-a47d-8c48425ef4a7	US	2/21/21 4:37	TRUE	FALSE	2484879	2484879	1	44	212	729	5283	2484878	2484879	Sitta canadensis	Sitta	Sitta canadensis Linnaeus, 1766	Sitta canadensis	DWC_ARCHIVE	2/21/21 4:37	2/21/21 2:33	FALSE	USA	United States	USA.5_1	California	USA.5.42_1	Santa Barbara	2019-11-1	TRUE
2707666653	OBS827263359	CC0_1_0	Cornell Lab of Ornithology	CLO	EBIRD	EOD - eBird Observation Dataset	HUMAN_OBSERVATION	URN:catalog:CLO:EBIRD:OBS827263359	OBS827263359	obsr227271	1	PRESENT	11/12/19 0:00	2019	11	12	US	California	Santa Barbara	Coal Oil Point--Devereux Beach and Sands Beach	34.4071	-119.878	2490810	Catharus guttatus (Pallas, 1811)	Animalia	Chordata	Aves	Passeriformes	Turdidae	Catharus	guttatus	SPECIES	Hermit Thrush	ACCEPTED	4fa7b334-ce0d-4e88-aaae-2e0c138d049e	US	12/16/20 12:00	TRUE	FALSE	2490810	2490810	1	44	212	729	5290	2490799	2490810	Catharus guttatus	Catharus	Catharus guttatus (Pallas, 1811)	Catharus guttatus	DWC_ARCHIVE	12/16/20 12:00	6/30/20 8:20	FALSE	USA	United States	USA.5_1	California	USA.5.42_1	Santa Barbara	2019-11-12	FALSE
2790015152	OBS829735367	CC0_1_0	Cornell Lab of Ornithology	CLO	EBIRD	EOD - eBird Observation Dataset	HUMAN_OBSERVATION	URN:catalog:CLO:EBIRD:OBS829735367	OBS829735367	obsr755806	1	PRESENT	11/18/19 0:00	2019	11	18	US	California	Santa Barbara	Dune Pond at COPR	34.4137	-119.882	2492192	Melospiza lincolnii (Audubon, 1834)	Animalia	Chordata	Aves	Passeriformes	Emberizidae	Melospiza	lincolnii	SPECIES	Lincoln's Sparrow	ACCEPTED	4fa7b334-ce0d-4e88-aaae-2e0c138d049e	US	12/16/20 12:08	TRUE	FALSE	2492192	2492192	1	44	212	729	9608	2492191	2492192	Melospiza lincolnii	Melospiza	Melospiza lincolnii (Audubon, 1834)	Melospiza lincolnii	DWC_ARCHIVE	12/16/20 12:08	6/30/20 8:20	FALSE	USA	United States	USA.5_1	California	USA.5.42_1	Santa Barbara	2019-11-18	FALSE
2723283712	OBS829569859	CC0_1_0	Cornell Lab of Ornithology	CLO	EBIRD	EOD - eBird Observation Dataset	HUMAN_OBSERVATION	URN:catalog:CLO:EBIRD:OBS829569859	OBS829569859	obsr111092	1	PRESENT	11/18/19 0:00	2019	11	18	US	California	Santa Barbara	Dune Pond at COPR	34.4137	-119.882	2492192	Melospiza lincolnii (Audubon, 1834)	Animalia	Chordata	Aves	Passeriformes	Emberizidae	Melospiza	lincolnii	SPECIES	Lincoln's Sparrow	ACCEPTED	4fa7b334-ce0d-4e88-aaae-2e0c138d049e	US	12/16/20 12:18	TRUE	FALSE	2492192	2492192	1	44	212	729	9608	2492191	2492192	Melospiza lincolnii	Melospiza	Melospiza lincolnii (Audubon, 1834)	Melospiza lincolnii	DWC_ARCHIVE	12/16/20 12:18	6/30/20 8:20	FALSE	USA	United States	USA.5_1	California	USA.5.42_1	Santa Barbara	2019-11-18	TRUE
2722481904	OBS829702058	CC0_1_0	Cornell Lab of Ornithology	CLO	EBIRD	EOD - eBird Observation Dataset	HUMAN_OBSERVATION	URN:catalog:CLO:EBIRD:OBS829702058	OBS829702058	obsr225668	1	PRESENT	11/19/19 0:00	2019	11	19	US	California	Santa Barbara	Devereux Slough	34.4136	-119.876	5231140	Zonotrichia albicollis (J.F.Gmelin, 1789)	Animalia	Chordata	Aves	Passeriformes	Emberizidae	Zonotrichia	albicollis	SPECIES	White-throated Sparrow	ACCEPTED	4fa7b334-ce0d-4e88-aaae-2e0c138d049e	US	12/16/20 12:00	TRUE	FALSE	5231140	5231140	1	44	212	729	9608	6173226	5231140	Zonotrichia albicollis	Zonotrichia	Zonotrichia albicollis (J.F.Gmelin, 1789)	Zonotrichia albicollis	DWC_ARCHIVE	12/16/20 12:00	6/30/20 8:20	FALSE	USA	United States	USA.5_1	California	USA.5.42_1	Santa Barbara	2019-11-19	FALSE
2797291651	OBS834601627	CC0_1_0	Cornell Lab of Ornithology	CLO	EBIRD	EOD - eBird Observation Dataset	HUMAN_OBSERVATION	URN:catalog:CLO:EBIRD:OBS834601627	OBS834601627	obsr967018	NA	PRESENT	11/19/19 0:00	2019	11	19	US	California	Santa Barbara	Devereux Slough	34.4136	-119.876	9740253	Accipiter striatus Vieillot, 1808	Animalia	Chordata	Aves	Accipitriformes	Accipitridae	Accipiter	striatus	SPECIES	Sharp-shinned Hawk	ACCEPTED	4fa7b334-ce0d-4e88-aaae-2e0c138d049e	US	12/16/20 12:11	TRUE	FALSE	9740253	9740253	1	44	212	7191147	2877	9405810	9740253	Accipiter striatus	Accipiter	Accipiter striatus Vieillot, 1808	Accipiter striatus	DWC_ARCHIVE	12/16/20 12:11	6/30/20 8:20	FALSE	USA	United States	USA.5_1	California	USA.5.42_1	Santa Barbara	2019-11-19	FALSE
2451709183	35256713	CC_BY_NC_4_0	iNaturalist.org	iNaturalist	Observations	iNaturalist Research-grade Observations	HUMAN_OBSERVATION	https://www.inaturalist.org/observations/35256713	35256713	Max Roberts	NA	PRESENT	11/2/19 11:15	2019	11	2	US	California	NA	NA	34.414387	-119.878523	2497921	Tyto alba (Scopoli, 1769)	Animalia	Chordata	Aves	Strigiformes	Tytonidae	Tyto	alba	SPECIES	NA	ACCEPTED	50c9509d-22c7-4a22-a47d-8c48425ef4a7	US	2/21/21 4:36	TRUE	FALSE	2497921	2497921	1	44	212	1450	5292	2497905	2497921	Tyto alba	Tyto	Tyto alba (Scopoli, 1769)	Tyto alba	DWC_ARCHIVE	2/21/21 4:36	2/21/21 2:33	FALSE	USA	United States	USA.5_1	California	USA.5.42_1	Santa Barbara	2019-11-2	FALSE
2721199185	OBS832045449	CC0_1_0	Cornell Lab of Ornithology	CLO	EBIRD	EOD - eBird Observation Dataset	HUMAN_OBSERVATION	URN:catalog:CLO:EBIRD:OBS832045449	OBS832045449	obsr1217968	1	PRESENT	11/23/19 0:00	2019	11	23	US	California	Santa Barbara	Devereux Slough	34.4136	-119.876	2490810	Catharus guttatus (Pallas, 1811)	Animalia	Chordata	Aves	Passeriformes	Turdidae	Catharus	guttatus	SPECIES	Hermit Thrush	ACCEPTED	4fa7b334-ce0d-4e88-aaae-2e0c138d049e	US	12/16/20 11:59	TRUE	FALSE	2490810	2490810	1	44	212	729	5290	2490799	2490810	Catharus guttatus	Catharus	Catharus guttatus (Pallas, 1811)	Catharus guttatus	DWC_ARCHIVE	12/16/20 11:59	6/30/20 8:20	FALSE	USA	United States	USA.5_1	California	USA.5.42_1	Santa Barbara	2019-11-23	FALSE
2709454175	OBS832043004	CC0_1_0	Cornell Lab of Ornithology	CLO	EBIRD	EOD - eBird Observation Dataset	HUMAN_OBSERVATION	URN:catalog:CLO:EBIRD:OBS832043004	OBS832043004	obsr1217968	1	PRESENT	11/23/19 0:00	2019	11	23	US	California	Santa Barbara	Dune Pond at COPR	34.4137	-119.882	2492109	Spizella passerina (Bechstein, 1798)	Animalia	Chordata	Aves	Passeriformes	Emberizidae	Spizella	passerina	SPECIES	Chipping Sparrow	ACCEPTED	4fa7b334-ce0d-4e88-aaae-2e0c138d049e	US	12/16/20 11:59	TRUE	FALSE	2492109	2492109	1	44	212	729	9608	2492093	2492109	Spizella passerina	Spizella	Spizella passerina (Bechstein, 1798)	Spizella passerina	DWC_ARCHIVE	12/16/20 11:59	6/30/20 8:20	FALSE	USA	United States	USA.5_1	California	USA.5.42_1	Santa Barbara	2019-11-23	FALSE
2721390170	OBS832043018	CC0_1_0	Cornell Lab of Ornithology	CLO	EBIRD	EOD - eBird Observation Dataset	HUMAN_OBSERVATION	URN:catalog:CLO:EBIRD:OBS832043018	OBS832043018	obsr1217968	1	PRESENT	11/23/19 0:00	2019	11	23	US	California	Santa Barbara	Dune Pond at COPR	34.4137	-119.882	2492192	Melospiza lincolnii (Audubon, 1834)	Animalia	Chordata	Aves	Passeriformes	Emberizidae	Melospiza	lincolnii	SPECIES	Lincoln's Sparrow	ACCEPTED	4fa7b334-ce0d-4e88-aaae-2e0c138d049e	US	12/16/20 11:59	TRUE	FALSE	2492192	2492192	1	44	212	729	9608	2492191	2492192	Melospiza lincolnii	Melospiza	Melospiza lincolnii (Audubon, 1834)	Melospiza lincolnii	DWC_ARCHIVE	12/16/20 11:59	6/30/20 8:20	FALSE	USA	United States	USA.5_1	California	USA.5.42_1	Santa Barbara	2019-11-23	FALSE
2709024781	OBS831714460	CC0_1_0	Cornell Lab of Ornithology	CLO	EBIRD	EOD - eBird Observation Dataset	HUMAN_OBSERVATION	URN:catalog:CLO:EBIRD:OBS831714460	OBS831714460	obsr172576	1	PRESENT	11/24/19 0:00	2019	11	24	US	California	Santa Barbara	Dune Pond at COPR	34.4137	-119.882	2492192	Melospiza lincolnii (Audubon, 1834)	Animalia	Chordata	Aves	Passeriformes	Emberizidae	Melospiza	lincolnii	SPECIES	Lincoln's Sparrow	ACCEPTED	4fa7b334-ce0d-4e88-aaae-2e0c138d049e	US	12/16/20 11:59	TRUE	FALSE	2492192	2492192	1	44	212	729	9608	2492191	2492192	Melospiza lincolnii	Melospiza	Melospiza lincolnii (Audubon, 1834)	Melospiza lincolnii	DWC_ARCHIVE	12/16/20 11:59	6/30/20 8:20	FALSE	USA	United States	USA.5_1	California	USA.5.42_1	Santa Barbara	2019-11-24	FALSE
2710482372	OBS833160217	CC0_1_0	Cornell Lab of Ornithology	CLO	EBIRD	EOD - eBird Observation Dataset	HUMAN_OBSERVATION	URN:catalog:CLO:EBIRD:OBS833160217	OBS833160217	obsr415170	1	PRESENT	11/29/19 0:00	2019	11	29	US	California	Santa Barbara	Devereux Slough	34.4136	-119.876	9813242	Falco columbarius Linnaeus, 1758	Animalia	Chordata	Aves	Falconiformes	Falconidae	Falco	columbarius	SPECIES	Merlin	ACCEPTED	4fa7b334-ce0d-4e88-aaae-2e0c138d049e	US	12/16/20 12:00	TRUE	FALSE	9813242	9813242	1	44	212	7191407	5240	2480996	9813242	Falco columbarius	Falco	Falco columbarius Linnaeus, 1758	Falco columbarius	DWC_ARCHIVE	12/16/20 12:00	6/30/20 8:20	FALSE	USA	United States	USA.5_1	California	USA.5.42_1	Santa Barbara	2019-11-29	FALSE
2784095802	OBS824476726	CC0_1_0	Cornell Lab of Ornithology	CLO	EBIRD	EOD - eBird Observation Dataset	HUMAN_OBSERVATION	URN:catalog:CLO:EBIRD:OBS824476726	OBS824476726	obsr1217968	1	PRESENT	11/3/19 0:00	2019	11	3	US	California	Santa Barbara	Dune Pond at COPR	34.4137	-119.882	2482059	Podiceps auritus (Linnaeus, 1758)	Animalia	Chordata	Aves	Podicipediformes	Podicipedidae	Podiceps	auritus	SPECIES	Horned Grebe	ACCEPTED	4fa7b334-ce0d-4e88-aaae-2e0c138d049e	US	12/16/20 12:09	TRUE	FALSE	2482059	2482059	1	44	212	7191588	9338	2482049	2482059	Podiceps auritus	Podiceps	Podiceps auritus (Linnaeus, 1758)	Podiceps auritus	DWC_ARCHIVE	12/16/20 12:09	6/30/20 8:20	FALSE	USA	United States	USA.5_1	California	USA.5.42_1	Santa Barbara	2019-11-3	FALSE
2782886649	OBS823919309	CC0_1_0	Cornell Lab of Ornithology	CLO	EBIRD	EOD - eBird Observation Dataset	HUMAN_OBSERVATION	URN:catalog:CLO:EBIRD:OBS823919309	OBS823919309	obsr202490	NA	PRESENT	11/3/19 0:00	2019	11	3	US	California	Santa Barbara	Devereux Slough	34.4136	-119.876	2484879	Sitta canadensis Linnaeus, 1766	Animalia	Chordata	Aves	Passeriformes	Sittidae	Sitta	canadensis	SPECIES	Red-breasted Nuthatch	ACCEPTED	4fa7b334-ce0d-4e88-aaae-2e0c138d049e	US	12/16/20 12:07	TRUE	FALSE	2484879	2484879	1	44	212	729	5283	2484878	2484879	Sitta canadensis	Sitta	Sitta canadensis Linnaeus, 1766	Sitta canadensis	DWC_ARCHIVE	12/16/20 12:07	6/30/20 8:20	FALSE	USA	United States	USA.5_1	California	USA.5.42_1	Santa Barbara	2019-11-3	FALSE
2718210722	OBS824105326	CC0_1_0	Cornell Lab of Ornithology	CLO	EBIRD	EOD - eBird Observation Dataset	HUMAN_OBSERVATION	URN:catalog:CLO:EBIRD:OBS824105326	OBS824105326	obsr111092	1	PRESENT	11/3/19 0:00	2019	11	3	US	California	Santa Barbara	Dune Pond at COPR	34.4137	-119.882	9813242	Falco columbarius Linnaeus, 1758	Animalia	Chordata	Aves	Falconiformes	Falconidae	Falco	columbarius	SPECIES	Merlin	ACCEPTED	4fa7b334-ce0d-4e88-aaae-2e0c138d049e	US	12/16/20 11:58	TRUE	FALSE	9813242	9813242	1	44	212	7191407	5240	2480996	9813242	Falco columbarius	Falco	Falco columbarius Linnaeus, 1758	Falco columbarius	DWC_ARCHIVE	12/16/20 11:58	6/30/20 8:20	FALSE	USA	United States	USA.5_1	California	USA.5.42_1	Santa Barbara	2019-11-3	TRUE
2706275982	OBS824105305	CC0_1_0	Cornell Lab of Ornithology	CLO	EBIRD	EOD - eBird Observation Dataset	HUMAN_OBSERVATION	URN:catalog:CLO:EBIRD:OBS824105305	OBS824105305	obsr111092	1	PRESENT	11/3/19 0:00	2019	11	3	US	California	Santa Barbara	Dune Pond at COPR	34.4137	-119.882	2481817	Gallinago delicata (Ord, 1825)	Animalia	Chordata	Aves	Charadriiformes	Scolopacidae	Gallinago	delicata	SPECIES	Wilson's Snipe	ACCEPTED	4fa7b334-ce0d-4e88-aaae-2e0c138d049e	US	12/16/20 11:59	TRUE	FALSE	2481817	2481817	1	44	212	7192402	5282	2481808	2481817	Gallinago delicata	Gallinago	Gallinago delicata (Ord, 1825)	Gallinago delicata	DWC_ARCHIVE	12/16/20 11:59	6/30/20 8:20	FALSE	USA	United States	USA.5_1	California	USA.5.42_1	Santa Barbara	2019-11-3	TRUE
2784625517	OBS833352667	CC0_1_0	Cornell Lab of Ornithology	CLO	EBIRD	EOD - eBird Observation Dataset	HUMAN_OBSERVATION	URN:catalog:CLO:EBIRD:OBS833352667	OBS833352667	obsr413715	1	PRESENT	11/30/19 0:00	2019	11	30	US	California	Santa Barbara	Dune Pond at COPR	34.4137	-119.882	2481817	Gallinago delicata (Ord, 1825)	Animalia	Chordata	Aves	Charadriiformes	Scolopacidae	Gallinago	delicata	SPECIES	Wilson's Snipe	ACCEPTED	4fa7b334-ce0d-4e88-aaae-2e0c138d049e	US	12/16/20 12:09	TRUE	FALSE	2481817	2481817	1	44	212	7192402	5282	2481808	2481817	Gallinago delicata	Gallinago	Gallinago delicata (Ord, 1825)	Gallinago delicata	DWC_ARCHIVE	12/16/20 12:09	6/30/20 8:20	FALSE	USA	United States	USA.5_1	California	USA.5.42_1	Santa Barbara	2019-11-30	FALSE
2712415675	OBS833394694	CC0_1_0	Cornell Lab of Ornithology	CLO	EBIRD	EOD - eBird Observation Dataset	HUMAN_OBSERVATION	URN:catalog:CLO:EBIRD:OBS833394694	OBS833394694	obsr455908	1	PRESENT	11/30/19 0:00	2019	11	30	US	California	Santa Barbara	Devereux Slough	34.4136	-119.876	2498111	Mareca penelope (Linnaeus, 1758)	Animalia	Chordata	Aves	Anseriformes	Anatidae	Anas	penelope	SPECIES	Eurasian Wigeon	SYNONYM	4fa7b334-ce0d-4e88-aaae-2e0c138d049e	US	12/16/20 12:19	TRUE	FALSE	8000602	2498111	1	44	212	1108	2986	2498056	2498111	Anas penelope	Mareca	Anas penelope Linnaeus, 1758	Mareca penelope	DWC_ARCHIVE	12/16/20 12:19	6/30/20 8:20	FALSE	USA	United States	USA.5_1	California	USA.5.42_1	Santa Barbara	2019-11-30	FALSE
2712314601	OBS833394685	CC0_1_0	Cornell Lab of Ornithology	CLO	EBIRD	EOD - eBird Observation Dataset	HUMAN_OBSERVATION	URN:catalog:CLO:EBIRD:OBS833394685	OBS833394685	obsr216717	1	PRESENT	11/30/19 0:00	2019	11	30	US	California	Santa Barbara	Devereux Slough	34.4136	-119.876	2498111	Mareca penelope (Linnaeus, 1758)	Animalia	Chordata	Aves	Anseriformes	Anatidae	Anas	penelope	SPECIES	Eurasian Wigeon	SYNONYM	4fa7b334-ce0d-4e88-aaae-2e0c138d049e	US	12/16/20 12:00	TRUE	FALSE	8000602	2498111	1	44	212	1108	2986	2498056	2498111	Anas penelope	Mareca	Anas penelope Linnaeus, 1758	Mareca penelope	DWC_ARCHIVE	12/16/20 12:00	6/30/20 8:20	FALSE	USA	United States	USA.5_1	California	USA.5.42_1	Santa Barbara	2019-11-30	FALSE
2795488470	OBS825134507	CC0_1_0	Cornell Lab of Ornithology	CLO	EBIRD	EOD - eBird Observation Dataset	HUMAN_OBSERVATION	URN:catalog:CLO:EBIRD:OBS825134507	OBS825134507	obsr350658	1	PRESENT	11/6/19 0:00	2019	11	6	US	California	Santa Barbara	Coal Oil Point--Devereux Beach and Sands Beach	34.4071	-119.878	2498375	Mergus serrator Linnaeus, 1758	Animalia	Chordata	Aves	Anseriformes	Anatidae	Mergus	serrator	SPECIES	Red-breasted Merganser	ACCEPTED	4fa7b334-ce0d-4e88-aaae-2e0c138d049e	US	12/16/20 12:11	TRUE	FALSE	2498375	2498375	1	44	212	1108	2986	2498368	2498375	Mergus serrator	Mergus	Mergus serrator Linnaeus, 1758	Mergus serrator	DWC_ARCHIVE	12/16/20 12:11	6/30/20 8:20	FALSE	USA	United States	USA.5_1	California	USA.5.42_1	Santa Barbara	2019-11-6	FALSE
2778524502	OBS826074122	CC0_1_0	Cornell Lab of Ornithology	CLO	EBIRD	EOD - eBird Observation Dataset	HUMAN_OBSERVATION	URN:catalog:CLO:EBIRD:OBS826074122	OBS826074122	obsr111092	2	PRESENT	11/9/19 0:00	2019	11	9	US	California	Santa Barbara	Dune Pond at COPR	34.4137	-119.882	2481817	Gallinago delicata (Ord, 1825)	Animalia	Chordata	Aves	Charadriiformes	Scolopacidae	Gallinago	delicata	SPECIES	Wilson's Snipe	ACCEPTED	4fa7b334-ce0d-4e88-aaae-2e0c138d049e	US	12/16/20 12:08	TRUE	FALSE	2481817	2481817	1	44	212	7192402	5282	2481808	2481817	Gallinago delicata	Gallinago	Gallinago delicata (Ord, 1825)	Gallinago delicata	DWC_ARCHIVE	12/16/20 12:08	6/30/20 8:20	FALSE	USA	United States	USA.5_1	California	USA.5.42_1	Santa Barbara	2019-11-9	TRUE
2783958307	OBS825948501	CC0_1_0	Cornell Lab of Ornithology	CLO	EBIRD	EOD - eBird Observation Dataset	HUMAN_OBSERVATION	URN:catalog:CLO:EBIRD:OBS825948501	OBS825948501	obsr302151	1	PRESENT	11/9/19 0:00	2019	11	9	US	California	Santa Barbara	Devereux Slough	34.4136	-119.876	2498017	Anser albifrons (Scopoli, 1769)	Animalia	Chordata	Aves	Anseriformes	Anatidae	Anser	albifrons	SPECIES	Greater White-fronted Goose	ACCEPTED	4fa7b334-ce0d-4e88-aaae-2e0c138d049e	US	12/16/20 12:08	TRUE	FALSE	2498017	2498017	1	44	212	1108	2986	2498016	2498017	Anser albifrons	Anser	Anser albifrons (Scopoli, 1769)	Anser albifrons	DWC_ARCHIVE	12/16/20 12:08	6/30/20 8:20	FALSE	USA	United States	USA.5_1	California	USA.5.42_1	Santa Barbara	2019-11-9	TRUE
2776170480	OBS826074127	CC0_1_0	Cornell Lab of Ornithology	CLO	EBIRD	EOD - eBird Observation Dataset	HUMAN_OBSERVATION	URN:catalog:CLO:EBIRD:OBS826074127	OBS826074127	obsr111092	1	PRESENT	11/9/19 0:00	2019	11	9	US	California	Santa Barbara	Dune Pond at COPR	34.4137	-119.882	2474825	Rallus limicola Vieillot, 1819	Animalia	Chordata	Aves	Gruiformes	Rallidae	Rallus	limicola	SPECIES	Virginia Rail	ACCEPTED	4fa7b334-ce0d-4e88-aaae-2e0c138d049e	US	12/16/20 12:08	TRUE	FALSE	2474825	2474825	1	44	212	1493	9342	2474794	2474825	Rallus limicola	Rallus	Rallus limicola Vieillot, 1819	Rallus limicola	DWC_ARCHIVE	12/16/20 12:08	6/30/20 8:20	FALSE	USA	United States	USA.5_1	California	USA.5.42_1	Santa Barbara	2019-11-9	TRUE
2799449158	OBS837436094	CC0_1_0	Cornell Lab of Ornithology	CLO	EBIRD	EOD - eBird Observation Dataset	HUMAN_OBSERVATION	URN:catalog:CLO:EBIRD:OBS837436094	OBS837436094	obsr172576	1	PRESENT	12/12/19 0:00	2019	12	12	US	California	Santa Barbara	Coal Oil Point--Devereux Beach and Sands Beach	34.4071	-119.878	2480331	Pluvialis fulva (Gmelin, 1789)	Animalia	Chordata	Aves	Charadriiformes	Charadriidae	Pluvialis	fulva	SPECIES	Pacific Golden-Plover	ACCEPTED	4fa7b334-ce0d-4e88-aaae-2e0c138d049e	US	12/16/20 12:09	TRUE	FALSE	2480331	2480331	1	44	212	7192402	2480210	2480326	2480331	Pluvialis fulva	Pluvialis	Pluvialis fulva (Gmelin, 1789)	Pluvialis fulva	DWC_ARCHIVE	12/16/20 12:09	6/30/20 8:20	FALSE	USA	United States	USA.5_1	California	USA.5.42_1	Santa Barbara	2019-12-12	FALSE
2722667285	OBS837607975	CC0_1_0	Cornell Lab of Ornithology	CLO	EBIRD	EOD - eBird Observation Dataset	HUMAN_OBSERVATION	URN:catalog:CLO:EBIRD:OBS837607975	OBS837607975	obsr689353	1	PRESENT	12/12/19 0:00	2019	12	12	US	California	Santa Barbara	Devereux Beach	34.4092	-119.881	2480331	Pluvialis fulva (Gmelin, 1789)	Animalia	Chordata	Aves	Charadriiformes	Charadriidae	Pluvialis	fulva	SPECIES	Pacific Golden-Plover	ACCEPTED	4fa7b334-ce0d-4e88-aaae-2e0c138d049e	US	12/16/20 12:00	TRUE	FALSE	2480331	2480331	1	44	212	7192402	2480210	2480326	2480331	Pluvialis fulva	Pluvialis	Pluvialis fulva (Gmelin, 1789)	Pluvialis fulva	DWC_ARCHIVE	12/16/20 12:00	6/30/20 8:20	FALSE	NA	NA	NA	NA	NA	NA	2019-12-12	FALSE
2708236920	OBS837421533	CC0_1_0	Cornell Lab of Ornithology	CLO	EBIRD	EOD - eBird Observation Dataset	HUMAN_OBSERVATION	URN:catalog:CLO:EBIRD:OBS837421533	OBS837421533	obsr111092	1	PRESENT	12/12/19 0:00	2019	12	12	US	California	Santa Barbara	Dune Pond at COPR	34.4137	-119.882	2481817	Gallinago delicata (Ord, 1825)	Animalia	Chordata	Aves	Charadriiformes	Scolopacidae	Gallinago	delicata	SPECIES	Wilson's Snipe	ACCEPTED	4fa7b334-ce0d-4e88-aaae-2e0c138d049e	US	12/16/20 12:00	TRUE	FALSE	2481817	2481817	1	44	212	7192402	5282	2481808	2481817	Gallinago delicata	Gallinago	Gallinago delicata (Ord, 1825)	Gallinago delicata	DWC_ARCHIVE	12/16/20 12:00	6/30/20 8:20	FALSE	USA	United States	USA.5_1	California	USA.5.42_1	Santa Barbara	2019-12-12	TRUE
2772010177	OBS837433122	CC0_1_0	Cornell Lab of Ornithology	CLO	EBIRD	EOD - eBird Observation Dataset	HUMAN_OBSERVATION	URN:catalog:CLO:EBIRD:OBS837433122	OBS837433122	obsr111092	1	PRESENT	12/12/19 0:00	2019	12	12	US	California	Santa Barbara	Devereux Beach	34.4092	-119.881	2480331	Pluvialis fulva (Gmelin, 1789)	Animalia	Chordata	Aves	Charadriiformes	Charadriidae	Pluvialis	fulva	SPECIES	Pacific Golden-Plover	ACCEPTED	4fa7b334-ce0d-4e88-aaae-2e0c138d049e	US	12/16/20 12:07	TRUE	FALSE	2480331	2480331	1	44	212	7192402	2480210	2480326	2480331	Pluvialis fulva	Pluvialis	Pluvialis fulva (Gmelin, 1789)	Pluvialis fulva	DWC_ARCHIVE	12/16/20 12:07	6/30/20 8:20	FALSE	NA	NA	NA	NA	NA	NA	2019-12-12	TRUE
2722226818	OBS837347089	CC0_1_0	Cornell Lab of Ornithology	CLO	EBIRD	EOD - eBird Observation Dataset	HUMAN_OBSERVATION	URN:catalog:CLO:EBIRD:OBS837347089	OBS837347089	obsr302151	1	PRESENT	12/12/19 0:00	2019	12	12	US	California	Santa Barbara	Coal Oil Point--Devereux Beach and Sands Beach	34.4071	-119.878	2480331	Pluvialis fulva (Gmelin, 1789)	Animalia	Chordata	Aves	Charadriiformes	Charadriidae	Pluvialis	fulva	SPECIES	Pacific Golden-Plover	ACCEPTED	4fa7b334-ce0d-4e88-aaae-2e0c138d049e	US	12/16/20 12:00	TRUE	FALSE	2480331	2480331	1	44	212	7192402	2480210	2480326	2480331	Pluvialis fulva	Pluvialis	Pluvialis fulva (Gmelin, 1789)	Pluvialis fulva	DWC_ARCHIVE	12/16/20 12:00	6/30/20 8:20	FALSE	USA	United States	USA.5_1	California	USA.5.42_1	Santa Barbara	2019-12-12	TRUE
2719842592	OBS834240418	CC0_1_0	Cornell Lab of Ornithology	CLO	EBIRD	EOD - eBird Observation Dataset	HUMAN_OBSERVATION	URN:catalog:CLO:EBIRD:OBS834240418	OBS834240418	obsr625102	1	PRESENT	12/2/19 0:00	2019	12	2	US	California	Santa Barbara	Devereux Slough	34.4136	-119.876	9813242	Falco columbarius Linnaeus, 1758	Animalia	Chordata	Aves	Falconiformes	Falconidae	Falco	columbarius	SPECIES	Merlin	ACCEPTED	4fa7b334-ce0d-4e88-aaae-2e0c138d049e	US	12/16/20 12:00	TRUE	FALSE	9813242	9813242	1	44	212	7191407	5240	2480996	9813242	Falco columbarius	Falco	Falco columbarius Linnaeus, 1758	Falco columbarius	DWC_ARCHIVE	12/16/20 12:00	6/30/20 8:20	FALSE	USA	United States	USA.5_1	California	USA.5.42_1	Santa Barbara	2019-12-2	FALSE
2772061463	OBS834240451	CC0_1_0	Cornell Lab of Ornithology	CLO	EBIRD	EOD - eBird Observation Dataset	HUMAN_OBSERVATION	URN:catalog:CLO:EBIRD:OBS834240451	OBS834240451	obsr13267	1	PRESENT	12/2/19 0:00	2019	12	2	US	California	Santa Barbara	Devereux Slough	34.4136	-119.876	9813242	Falco columbarius Linnaeus, 1758	Animalia	Chordata	Aves	Falconiformes	Falconidae	Falco	columbarius	SPECIES	Merlin	ACCEPTED	4fa7b334-ce0d-4e88-aaae-2e0c138d049e	US	12/16/20 12:09	TRUE	FALSE	9813242	9813242	1	44	212	7191407	5240	2480996	9813242	Falco columbarius	Falco	Falco columbarius Linnaeus, 1758	Falco columbarius	DWC_ARCHIVE	12/16/20 12:09	6/30/20 8:20	FALSE	USA	United States	USA.5_1	California	USA.5.42_1	Santa Barbara	2019-12-2	FALSE
2788032607	OBS834240455	CC0_1_0	Cornell Lab of Ornithology	CLO	EBIRD	EOD - eBird Observation Dataset	HUMAN_OBSERVATION	URN:catalog:CLO:EBIRD:OBS834240455	OBS834240455	obsr13267	1	PRESENT	12/2/19 0:00	2019	12	2	US	California	Santa Barbara	Devereux Slough	34.4136	-119.876	6092651	Setophaga townsendi (J.K.Townsend, 1837)	Animalia	Chordata	Aves	Passeriformes	Parulidae	Setophaga	townsendi	SPECIES	Townsend's Warbler	ACCEPTED	4fa7b334-ce0d-4e88-aaae-2e0c138d049e	US	12/16/20 12:08	TRUE	FALSE	6092651	6092651	1	44	212	729	5263	2489984	6092651	Setophaga townsendi	Setophaga	Setophaga townsendi (J.K.Townsend, 1837)	Setophaga townsendi	DWC_ARCHIVE	12/16/20 12:08	6/30/20 8:20	FALSE	USA	United States	USA.5_1	California	USA.5.42_1	Santa Barbara	2019-12-2	FALSE
2712033169	OBS834240422	CC0_1_0	Cornell Lab of Ornithology	CLO	EBIRD	EOD - eBird Observation Dataset	HUMAN_OBSERVATION	URN:catalog:CLO:EBIRD:OBS834240422	OBS834240422	obsr625102	1	PRESENT	12/2/19 0:00	2019	12	2	US	California	Santa Barbara	Devereux Slough	34.4136	-119.876	6092651	Setophaga townsendi (J.K.Townsend, 1837)	Animalia	Chordata	Aves	Passeriformes	Parulidae	Setophaga	townsendi	SPECIES	Townsend's Warbler	ACCEPTED	4fa7b334-ce0d-4e88-aaae-2e0c138d049e	US	12/16/20 12:06	TRUE	FALSE	6092651	6092651	1	44	212	729	5263	2489984	6092651	Setophaga townsendi	Setophaga	Setophaga townsendi (J.K.Townsend, 1837)	Setophaga townsendi	DWC_ARCHIVE	12/16/20 12:06	6/30/20 8:20	FALSE	USA	United States	USA.5_1	California	USA.5.42_1	Santa Barbara	2019-12-2	FALSE
2778933697	OBS840702394	CC0_1_0	Cornell Lab of Ornithology	CLO	EBIRD	EOD - eBird Observation Dataset	HUMAN_OBSERVATION	URN:catalog:CLO:EBIRD:OBS840702394	OBS840702394	obsr202490	NA	PRESENT	12/21/19 0:00	2019	12	21	US	California	Santa Barbara	Devereux Slough	34.4136	-119.876	2498375	Mergus serrator Linnaeus, 1758	Animalia	Chordata	Aves	Anseriformes	Anatidae	Mergus	serrator	SPECIES	Red-breasted Merganser	ACCEPTED	4fa7b334-ce0d-4e88-aaae-2e0c138d049e	US	12/16/20 12:09	TRUE	FALSE	2498375	2498375	1	44	212	1108	2986	2498368	2498375	Mergus serrator	Mergus	Mergus serrator Linnaeus, 1758	Mergus serrator	DWC_ARCHIVE	12/16/20 12:09	6/30/20 8:20	FALSE	USA	United States	USA.5_1	California	USA.5.42_1	Santa Barbara	2019-12-21	FALSE
2722774278	OBS842678949	CC0_1_0	Cornell Lab of Ornithology	CLO	EBIRD	EOD - eBird Observation Dataset	HUMAN_OBSERVATION	URN:catalog:CLO:EBIRD:OBS842678949	OBS842678949	obsr230614	1	PRESENT	12/27/19 0:00	2019	12	27	US	California	Santa Barbara	Devereux Slough	34.4136	-119.876	5231138	Zonotrichia atricapilla (J.F.Gmelin, 1789)	Animalia	Chordata	Aves	Passeriformes	Emberizidae	Zonotrichia	atricapilla	SPECIES	Golden-crowned Sparrow	ACCEPTED	4fa7b334-ce0d-4e88-aaae-2e0c138d049e	US	12/16/20 12:00	TRUE	FALSE	5231138	5231138	1	44	212	729	9608	6173226	5231138	Zonotrichia atricapilla	Zonotrichia	Zonotrichia atricapilla (J.F.Gmelin, 1789)	Zonotrichia atricapilla	DWC_ARCHIVE	12/16/20 12:00	6/30/20 8:20	FALSE	USA	United States	USA.5_1	California	USA.5.42_1	Santa Barbara	2019-12-27	FALSE
2722026329	OBS842678941	CC0_1_0	Cornell Lab of Ornithology	CLO	EBIRD	EOD - eBird Observation Dataset	HUMAN_OBSERVATION	URN:catalog:CLO:EBIRD:OBS842678941	OBS842678941	obsr230614	1	PRESENT	12/27/19 0:00	2019	12	27	US	California	Santa Barbara	Devereux Slough	34.4136	-119.876	2498408	Lophodytes cucullatus (Linnaeus, 1758)	Animalia	Chordata	Aves	Anseriformes	Anatidae	Lophodytes	cucullatus	SPECIES	Hooded Merganser	ACCEPTED	4fa7b334-ce0d-4e88-aaae-2e0c138d049e	US	12/16/20 12:00	TRUE	FALSE	2498408	2498408	1	44	212	1108	2986	2498407	2498408	Lophodytes cucullatus	Lophodytes	Lophodytes cucullatus (Linnaeus, 1758)	Lophodytes cucullatus	DWC_ARCHIVE	12/16/20 12:00	6/30/20 8:20	FALSE	USA	United States	USA.5_1	California	USA.5.42_1	Santa Barbara	2019-12-27	FALSE
2799336389	OBS842704402	CC0_1_0	Cornell Lab of Ornithology	CLO	EBIRD	EOD - eBird Observation Dataset	HUMAN_OBSERVATION	URN:catalog:CLO:EBIRD:OBS842704402	OBS842704402	obsr230614	1	PRESENT	12/27/19 0:00	2019	12	27	US	California	Santa Barbara	Coal Oil Point--Devereux Beach and Sands Beach	34.4071	-119.878	5231138	Zonotrichia atricapilla (J.F.Gmelin, 1789)	Animalia	Chordata	Aves	Passeriformes	Emberizidae	Zonotrichia	atricapilla	SPECIES	Golden-crowned Sparrow	ACCEPTED	4fa7b334-ce0d-4e88-aaae-2e0c138d049e	US	12/16/20 12:09	TRUE	FALSE	5231138	5231138	1	44	212	729	9608	6173226	5231138	Zonotrichia atricapilla	Zonotrichia	Zonotrichia atricapilla (J.F.Gmelin, 1789)	Zonotrichia atricapilla	DWC_ARCHIVE	12/16/20 12:09	6/30/20 8:20	FALSE	USA	United States	USA.5_1	California	USA.5.42_1	Santa Barbara	2019-12-27	FALSE
2715170462	OBS843158968	CC0_1_0	Cornell Lab of Ornithology	CLO	EBIRD	EOD - eBird Observation Dataset	HUMAN_OBSERVATION	URN:catalog:CLO:EBIRD:OBS843158968	OBS843158968	obsr859935	1	PRESENT	12/28/19 0:00	2019	12	28	US	California	Santa Barbara	Devereux Slough	34.4136	-119.876	6092651	Setophaga townsendi (J.K.Townsend, 1837)	Animalia	Chordata	Aves	Passeriformes	Parulidae	Setophaga	townsendi	SPECIES	Townsend's Warbler	ACCEPTED	4fa7b334-ce0d-4e88-aaae-2e0c138d049e	US	12/16/20 12:00	TRUE	FALSE	6092651	6092651	1	44	212	729	5263	2489984	6092651	Setophaga townsendi	Setophaga	Setophaga townsendi (J.K.Townsend, 1837)	Setophaga townsendi	DWC_ARCHIVE	12/16/20 12:00	6/30/20 8:20	FALSE	USA	United States	USA.5_1	California	USA.5.42_1	Santa Barbara	2019-12-28	FALSE
2801125347	OBS843158951	CC0_1_0	Cornell Lab of Ornithology	CLO	EBIRD	EOD - eBird Observation Dataset	HUMAN_OBSERVATION	URN:catalog:CLO:EBIRD:OBS843158951	OBS843158951	obsr859935	2	PRESENT	12/28/19 0:00	2019	12	28	US	California	Santa Barbara	Devereux Slough	34.4136	-119.876	2498375	Mergus serrator Linnaeus, 1758	Animalia	Chordata	Aves	Anseriformes	Anatidae	Mergus	serrator	SPECIES	Red-breasted Merganser	ACCEPTED	4fa7b334-ce0d-4e88-aaae-2e0c138d049e	US	12/16/20 12:09	TRUE	FALSE	2498375	2498375	1	44	212	1108	2986	2498368	2498375	Mergus serrator	Mergus	Mergus serrator Linnaeus, 1758	Mergus serrator	DWC_ARCHIVE	12/16/20 12:09	6/30/20 8:20	FALSE	USA	United States	USA.5_1	California	USA.5.42_1	Santa Barbara	2019-12-28	FALSE
2796506357	OBS851341247	CC0_1_0	Cornell Lab of Ornithology	CLO	EBIRD	EOD - eBird Observation Dataset	HUMAN_OBSERVATION	URN:catalog:CLO:EBIRD:OBS851341247	OBS851341247	obsr1508825	1	PRESENT	12/28/19 0:00	2019	12	28	US	California	Santa Barbara	Devereux Slough	34.4136	-119.876	2498408	Lophodytes cucullatus (Linnaeus, 1758)	Animalia	Chordata	Aves	Anseriformes	Anatidae	Lophodytes	cucullatus	SPECIES	Hooded Merganser	ACCEPTED	4fa7b334-ce0d-4e88-aaae-2e0c138d049e	US	12/16/20 12:09	TRUE	FALSE	2498408	2498408	1	44	212	1108	2986	2498407	2498408	Lophodytes cucullatus	Lophodytes	Lophodytes cucullatus (Linnaeus, 1758)	Lophodytes cucullatus	DWC_ARCHIVE	12/16/20 12:09	6/30/20 8:20	FALSE	USA	United States	USA.5_1	California	USA.5.42_1	Santa Barbara	2019-12-28	FALSE
2721802321	OBS843158983	CC0_1_0	Cornell Lab of Ornithology	CLO	EBIRD	EOD - eBird Observation Dataset	HUMAN_OBSERVATION	URN:catalog:CLO:EBIRD:OBS843158983	OBS843158983	obsr859935	4	PRESENT	12/28/19 0:00	2019	12	28	US	California	Santa Barbara	Devereux Slough	34.4136	-119.876	2482492	Corvus corax Linnaeus, 1758	Animalia	Chordata	Aves	Passeriformes	Corvidae	Corvus	corax	SPECIES	Common Raven	ACCEPTED	4fa7b334-ce0d-4e88-aaae-2e0c138d049e	US	12/16/20 12:18	TRUE	FALSE	2482492	2482492	1	44	212	729	5235	2482468	2482492	Corvus corax	Corvus	Corvus corax Linnaeus, 1758	Corvus corax	DWC_ARCHIVE	12/16/20 12:18	6/30/20 8:20	FALSE	USA	United States	USA.5_1	California	USA.5.42_1	Santa Barbara	2019-12-28	FALSE
2714815847	OBS846593642	CC0_1_0	Cornell Lab of Ornithology	CLO	EBIRD	EOD - eBird Observation Dataset	HUMAN_OBSERVATION	URN:catalog:CLO:EBIRD:OBS846593642	OBS846593642	obsr230597	1	PRESENT	12/29/19 0:00	2019	12	29	US	California	Santa Barbara	Devereux Slough	34.4136	-119.876	2498408	Lophodytes cucullatus (Linnaeus, 1758)	Animalia	Chordata	Aves	Anseriformes	Anatidae	Lophodytes	cucullatus	SPECIES	Hooded Merganser	ACCEPTED	4fa7b334-ce0d-4e88-aaae-2e0c138d049e	US	12/16/20 11:59	TRUE	FALSE	2498408	2498408	1	44	212	1108	2986	2498407	2498408	Lophodytes cucullatus	Lophodytes	Lophodytes cucullatus (Linnaeus, 1758)	Lophodytes cucullatus	DWC_ARCHIVE	12/16/20 11:59	6/30/20 8:20	FALSE	USA	United States	USA.5_1	California	USA.5.42_1	Santa Barbara	2019-12-29	FALSE
2707027027	OBS834570832	CC0_1_0	Cornell Lab of Ornithology	CLO	EBIRD	EOD - eBird Observation Dataset	HUMAN_OBSERVATION	URN:catalog:CLO:EBIRD:OBS834570832	OBS834570832	obsr246929	1	PRESENT	12/3/19 0:00	2019	12	3	US	California	Santa Barbara	Devereux Slough	34.4136	-119.876	2498111	Mareca penelope (Linnaeus, 1758)	Animalia	Chordata	Aves	Anseriformes	Anatidae	Anas	penelope	SPECIES	Eurasian Wigeon	SYNONYM	4fa7b334-ce0d-4e88-aaae-2e0c138d049e	US	12/16/20 12:00	TRUE	FALSE	8000602	2498111	1	44	212	1108	2986	2498056	2498111	Anas penelope	Mareca	Anas penelope Linnaeus, 1758	Mareca penelope	DWC_ARCHIVE	12/16/20 12:00	6/30/20 8:20	FALSE	USA	United States	USA.5_1	California	USA.5.42_1	Santa Barbara	2019-12-3	FALSE
2796957902	OBS844534441	CC0_1_0	Cornell Lab of Ornithology	CLO	EBIRD	EOD - eBird Observation Dataset	HUMAN_OBSERVATION	URN:catalog:CLO:EBIRD:OBS844534441	OBS844534441	obsr850296	2	PRESENT	12/31/19 0:00	2019	12	31	US	California	Santa Barbara	Devereux Slough	34.4136	-119.876	2498264	Aythya collaris (Donovan, 1809)	Animalia	Chordata	Aves	Anseriformes	Anatidae	Aythya	collaris	SPECIES	Ring-necked Duck	ACCEPTED	4fa7b334-ce0d-4e88-aaae-2e0c138d049e	US	12/16/20 12:09	TRUE	FALSE	2498264	2498264	1	44	212	1108	2986	2498254	2498264	Aythya collaris	Aythya	Aythya collaris (Donovan, 1809)	Aythya collaris	DWC_ARCHIVE	12/16/20 12:09	6/30/20 8:20	FALSE	USA	United States	USA.5_1	California	USA.5.42_1	Santa Barbara	2019-12-31	FALSE
2712218837	OBS844547295	CC0_1_0	Cornell Lab of Ornithology	CLO	EBIRD	EOD - eBird Observation Dataset	HUMAN_OBSERVATION	URN:catalog:CLO:EBIRD:OBS844547295	OBS844547295	obsr172576	1	PRESENT	12/31/19 0:00	2019	12	31	US	California	Santa Barbara	Dune Pond at COPR	34.4137	-119.882	5229662	Tyrannus melancholicus Vieillot, 1819	Animalia	Chordata	Aves	Passeriformes	Tyrannidae	Tyrannus	melancholicus	SPECIES	Tropical Kingbird	ACCEPTED	4fa7b334-ce0d-4e88-aaae-2e0c138d049e	US	12/16/20 12:18	TRUE	FALSE	5229662	5229662	1	44	212	729	5291	2483336	5229662	Tyrannus melancholicus	Tyrannus	Tyrannus melancholicus Vieillot, 1819	Tyrannus melancholicus	DWC_ARCHIVE	12/16/20 12:18	6/30/20 8:20	FALSE	USA	United States	USA.5_1	California	USA.5.42_1	Santa Barbara	2019-12-31	FALSE
2712203852	OBS844534470	CC0_1_0	Cornell Lab of Ornithology	CLO	EBIRD	EOD - eBird Observation Dataset	HUMAN_OBSERVATION	URN:catalog:CLO:EBIRD:OBS844534470	OBS844534470	obsr850296	2	PRESENT	12/31/19 0:00	2019	12	31	US	California	Santa Barbara	Devereux Slough	34.4136	-119.876	9596413	Sturnella neglecta Audubon, 1844	Animalia	Chordata	Aves	Passeriformes	Icteridae	Sturnella	neglecta	SPECIES	Western Meadowlark	ACCEPTED	4fa7b334-ce0d-4e88-aaae-2e0c138d049e	US	12/16/20 11:59	TRUE	FALSE	9596413	9596413	1	44	212	729	6176	2484248	9596413	Sturnella neglecta	Sturnella	Sturnella neglecta Audubon, 1844	Sturnella neglecta	DWC_ARCHIVE	12/16/20 11:59	6/30/20 8:20	FALSE	USA	United States	USA.5_1	California	USA.5.42_1	Santa Barbara	2019-12-31	FALSE
2712822752	OBS844534464	CC0_1_0	Cornell Lab of Ornithology	CLO	EBIRD	EOD - eBird Observation Dataset	HUMAN_OBSERVATION	URN:catalog:CLO:EBIRD:OBS844534464	OBS844534464	obsr850296	1	PRESENT	12/31/19 0:00	2019	12	31	US	California	Santa Barbara	Devereux Slough	34.4136	-119.876	2498408	Lophodytes cucullatus (Linnaeus, 1758)	Animalia	Chordata	Aves	Anseriformes	Anatidae	Lophodytes	cucullatus	SPECIES	Hooded Merganser	ACCEPTED	4fa7b334-ce0d-4e88-aaae-2e0c138d049e	US	12/16/20 12:00	TRUE	FALSE	2498408	2498408	1	44	212	1108	2986	2498407	2498408	Lophodytes cucullatus	Lophodytes	Lophodytes cucullatus (Linnaeus, 1758)	Lophodytes cucullatus	DWC_ARCHIVE	12/16/20 12:00	6/30/20 8:20	FALSE	USA	United States	USA.5_1	California	USA.5.42_1	Santa Barbara	2019-12-31	FALSE
2723224501	OBS844392445	CC0_1_0	Cornell Lab of Ornithology	CLO	EBIRD	EOD - eBird Observation Dataset	HUMAN_OBSERVATION	URN:catalog:CLO:EBIRD:OBS844392445	OBS844392445	obsr548926	3	PRESENT	12/31/19 0:00	2019	12	31	US	California	Santa Barbara	Devereux Slough	34.4136	-119.876	2498375	Mergus serrator Linnaeus, 1758	Animalia	Chordata	Aves	Anseriformes	Anatidae	Mergus	serrator	SPECIES	Red-breasted Merganser	ACCEPTED	4fa7b334-ce0d-4e88-aaae-2e0c138d049e	US	12/16/20 11:59	TRUE	FALSE	2498375	2498375	1	44	212	1108	2986	2498368	2498375	Mergus serrator	Mergus	Mergus serrator Linnaeus, 1758	Mergus serrator	DWC_ARCHIVE	12/16/20 11:59	6/30/20 8:20	FALSE	USA	United States	USA.5_1	California	USA.5.42_1	Santa Barbara	2019-12-31	TRUE
2726037068	OBS836927299	CC0_1_0	Cornell Lab of Ornithology	CLO	EBIRD	EOD - eBird Observation Dataset	HUMAN_OBSERVATION	URN:catalog:CLO:EBIRD:OBS836927299	OBS836927299	obsr729081	1	PRESENT	12/6/19 0:00	2019	12	6	US	California	Santa Barbara	Devereux Slough	34.4136	-119.876	2498111	Mareca penelope (Linnaeus, 1758)	Animalia	Chordata	Aves	Anseriformes	Anatidae	Anas	penelope	SPECIES	Eurasian Wigeon	SYNONYM	4fa7b334-ce0d-4e88-aaae-2e0c138d049e	US	12/16/20 12:00	TRUE	FALSE	8000602	2498111	1	44	212	1108	2986	2498056	2498111	Anas penelope	Mareca	Anas penelope Linnaeus, 1758	Mareca penelope	DWC_ARCHIVE	12/16/20 12:00	6/30/20 8:20	FALSE	USA	United States	USA.5_1	California	USA.5.42_1	Santa Barbara	2019-12-6	FALSE
2796358621	OBS836119467	CC0_1_0	Cornell Lab of Ornithology	CLO	EBIRD	EOD - eBird Observation Dataset	HUMAN_OBSERVATION	URN:catalog:CLO:EBIRD:OBS836119467	OBS836119467	obsr302151	1	PRESENT	12/8/19 0:00	2019	12	8	US	California	Santa Barbara	Devereux Slough	34.4136	-119.876	2498111	Mareca penelope (Linnaeus, 1758)	Animalia	Chordata	Aves	Anseriformes	Anatidae	Anas	penelope	SPECIES	Eurasian Wigeon	SYNONYM	4fa7b334-ce0d-4e88-aaae-2e0c138d049e	US	12/16/20 12:08	TRUE	FALSE	8000602	2498111	1	44	212	1108	2986	2498056	2498111	Anas penelope	Mareca	Anas penelope Linnaeus, 1758	Mareca penelope	DWC_ARCHIVE	12/16/20 12:08	6/30/20 8:20	FALSE	USA	United States	USA.5_1	California	USA.5.42_1	Santa Barbara	2019-12-8	TRUE
2671228650	OBS710484102	CC0_1_0	Cornell Lab of Ornithology	CLO	EBIRD	EOD - eBird Observation Dataset	HUMAN_OBSERVATION	URN:catalog:CLO:EBIRD:OBS710484102	OBS710484102	obsr605751	17	PRESENT	2/12/19 0:00	2019	2	12	US	California	Santa Barbara	Coal Oil Point--Devereux Beach and Sands Beach	34.4071	-119.878	9596413	Sturnella neglecta Audubon, 1844	Animalia	Chordata	Aves	Passeriformes	Icteridae	Sturnella	neglecta	SPECIES	Western Meadowlark	ACCEPTED	4fa7b334-ce0d-4e88-aaae-2e0c138d049e	US	12/16/20 11:58	TRUE	FALSE	9596413	9596413	1	44	212	729	6176	2484248	9596413	Sturnella neglecta	Sturnella	Sturnella neglecta Audubon, 1844	Sturnella neglecta	DWC_ARCHIVE	12/16/20 11:58	6/30/20 8:20	FALSE	USA	United States	USA.5_1	California	USA.5.42_1	Santa Barbara	2019-2-12	FALSE
2748653679	OBS711888821	CC0_1_0	Cornell Lab of Ornithology	CLO	EBIRD	EOD - eBird Observation Dataset	HUMAN_OBSERVATION	URN:catalog:CLO:EBIRD:OBS711888821	OBS711888821	obsr933209	2	PRESENT	2/17/19 0:00	2019	2	17	US	California	Santa Barbara	Devereux Slough	34.4136	-119.876	2498264	Aythya collaris (Donovan, 1809)	Animalia	Chordata	Aves	Anseriformes	Anatidae	Aythya	collaris	SPECIES	Ring-necked Duck	ACCEPTED	4fa7b334-ce0d-4e88-aaae-2e0c138d049e	US	12/16/20 12:08	TRUE	FALSE	2498264	2498264	1	44	212	1108	2986	2498254	2498264	Aythya collaris	Aythya	Aythya collaris (Donovan, 1809)	Aythya collaris	DWC_ARCHIVE	12/16/20 12:08	6/30/20 8:20	FALSE	USA	United States	USA.5_1	California	USA.5.42_1	Santa Barbara	2019-2-17	FALSE
2737212627	OBS711888815	CC0_1_0	Cornell Lab of Ornithology	CLO	EBIRD	EOD - eBird Observation Dataset	HUMAN_OBSERVATION	URN:catalog:CLO:EBIRD:OBS711888815	OBS711888815	obsr933209	1	PRESENT	2/17/19 0:00	2019	2	17	US	California	Santa Barbara	Devereux Slough	34.4136	-119.876	9740253	Accipiter striatus Vieillot, 1808	Animalia	Chordata	Aves	Accipitriformes	Accipitridae	Accipiter	striatus	SPECIES	Sharp-shinned Hawk	ACCEPTED	4fa7b334-ce0d-4e88-aaae-2e0c138d049e	US	12/16/20 12:07	TRUE	FALSE	9740253	9740253	1	44	212	7191147	2877	9405810	9740253	Accipiter striatus	Accipiter	Accipiter striatus Vieillot, 1808	Accipiter striatus	DWC_ARCHIVE	12/16/20 12:07	6/30/20 8:20	FALSE	USA	United States	USA.5_1	California	USA.5.42_1	Santa Barbara	2019-2-17	FALSE
2657118689	OBS711888843	CC0_1_0	Cornell Lab of Ornithology	CLO	EBIRD	EOD - eBird Observation Dataset	HUMAN_OBSERVATION	URN:catalog:CLO:EBIRD:OBS711888843	OBS711888843	obsr933209	20	PRESENT	2/17/19 0:00	2019	2	17	US	California	Santa Barbara	Devereux Slough	34.4136	-119.876	5230754	Tachycineta thalassina (Swainson, 1827)	Animalia	Chordata	Aves	Passeriformes	Hirundinidae	Tachycineta	thalassina	SPECIES	Violet-green Swallow	ACCEPTED	4fa7b334-ce0d-4e88-aaae-2e0c138d049e	US	12/16/20 11:58	TRUE	FALSE	5230754	5230754	1	44	212	729	5248	2489178	5230754	Tachycineta thalassina	Tachycineta	Tachycineta thalassina (Swainson, 1827)	Tachycineta thalassina	DWC_ARCHIVE	12/16/20 11:58	6/30/20 8:20	FALSE	USA	United States	USA.5_1	California	USA.5.42_1	Santa Barbara	2019-2-17	FALSE
2757863222	OBS714297017	CC0_1_0	Cornell Lab of Ornithology	CLO	EBIRD	EOD - eBird Observation Dataset	HUMAN_OBSERVATION	URN:catalog:CLO:EBIRD:OBS714297017	OBS714297017	obsr605751	3	PRESENT	2/19/19 0:00	2019	2	19	US	California	Santa Barbara	Coal Oil Point--Devereux Beach and Sands Beach	34.4071	-119.878	2490263	Anthus rubescens (Tunstall, 1771)	Animalia	Chordata	Aves	Passeriformes	Motacillidae	Anthus	rubescens	SPECIES	American Pipit	ACCEPTED	4fa7b334-ce0d-4e88-aaae-2e0c138d049e	US	12/16/20 12:07	TRUE	FALSE	2490263	2490263	1	44	212	729	5257	2490241	2490263	Anthus rubescens	Anthus	Anthus rubescens (Tunstall, 1771)	Anthus rubescens	DWC_ARCHIVE	12/16/20 12:07	6/30/20 8:20	FALSE	USA	United States	USA.5_1	California	USA.5.42_1	Santa Barbara	2019-2-19	FALSE
2656981192	OBS713075524	CC0_1_0	Cornell Lab of Ornithology	CLO	EBIRD	EOD - eBird Observation Dataset	HUMAN_OBSERVATION	URN:catalog:CLO:EBIRD:OBS713075524	OBS713075524	obsr413715	20	PRESENT	2/19/19 0:00	2019	2	19	US	California	Santa Barbara	Dune Pond at COPR	34.4137	-119.882	9596413	Sturnella neglecta Audubon, 1844	Animalia	Chordata	Aves	Passeriformes	Icteridae	Sturnella	neglecta	SPECIES	Western Meadowlark	ACCEPTED	4fa7b334-ce0d-4e88-aaae-2e0c138d049e	US	12/16/20 11:58	TRUE	FALSE	9596413	9596413	1	44	212	729	6176	2484248	9596413	Sturnella neglecta	Sturnella	Sturnella neglecta Audubon, 1844	Sturnella neglecta	DWC_ARCHIVE	12/16/20 11:58	6/30/20 8:20	FALSE	USA	United States	USA.5_1	California	USA.5.42_1	Santa Barbara	2019-2-19	FALSE
2796528136	OBS794312979	CC0_1_0	Cornell Lab of Ornithology	CLO	EBIRD	EOD - eBird Observation Dataset	HUMAN_OBSERVATION	URN:catalog:CLO:EBIRD:OBS794312979	OBS794312979	obsr689353	1	PRESENT	2/19/19 0:00	2019	2	19	US	California	Santa Barbara	Devereux Slough	34.4136	-119.876	2498265	Aythya marila (Linnaeus, 1761)	Animalia	Chordata	Aves	Anseriformes	Anatidae	Aythya	marila	SPECIES	Greater Scaup	ACCEPTED	4fa7b334-ce0d-4e88-aaae-2e0c138d049e	US	12/16/20 12:08	TRUE	FALSE	2498265	2498265	1	44	212	1108	2986	2498254	2498265	Aythya marila	Aythya	Aythya marila (Linnaeus, 1761)	Aythya marila	DWC_ARCHIVE	12/16/20 12:08	6/30/20 8:20	FALSE	USA	United States	USA.5_1	California	USA.5.42_1	Santa Barbara	2019-2-19	FALSE
2762978335	OBS794312918	CC0_1_0	Cornell Lab of Ornithology	CLO	EBIRD	EOD - eBird Observation Dataset	HUMAN_OBSERVATION	URN:catalog:CLO:EBIRD:OBS794312918	OBS794312918	obsr689353	2	PRESENT	2/19/19 0:00	2019	2	19	US	California	Santa Barbara	Devereux Beach	34.4092	-119.881	2490263	Anthus rubescens (Tunstall, 1771)	Animalia	Chordata	Aves	Passeriformes	Motacillidae	Anthus	rubescens	SPECIES	American Pipit	ACCEPTED	4fa7b334-ce0d-4e88-aaae-2e0c138d049e	US	12/16/20 12:07	TRUE	FALSE	2490263	2490263	1	44	212	729	5257	2490241	2490263	Anthus rubescens	Anthus	Anthus rubescens (Tunstall, 1771)	Anthus rubescens	DWC_ARCHIVE	12/16/20 12:07	6/30/20 8:20	FALSE	NA	NA	NA	NA	NA	NA	2019-2-19	FALSE
2657849740	OBS713375200	CC0_1_0	Cornell Lab of Ornithology	CLO	EBIRD	EOD - eBird Observation Dataset	HUMAN_OBSERVATION	URN:catalog:CLO:EBIRD:OBS713375200	OBS713375200	obsr111092	2	PRESENT	2/19/19 0:00	2019	2	19	US	California	Santa Barbara	Devereux Beach	34.4092	-119.881	2490263	Anthus rubescens (Tunstall, 1771)	Animalia	Chordata	Aves	Passeriformes	Motacillidae	Anthus	rubescens	SPECIES	American Pipit	ACCEPTED	4fa7b334-ce0d-4e88-aaae-2e0c138d049e	US	12/16/20 11:59	TRUE	FALSE	2490263	2490263	1	44	212	729	5257	2490241	2490263	Anthus rubescens	Anthus	Anthus rubescens (Tunstall, 1771)	Anthus rubescens	DWC_ARCHIVE	12/16/20 11:59	6/30/20 8:20	FALSE	NA	NA	NA	NA	NA	NA	2019-2-19	TRUE
2743021396	OBS713270776	CC0_1_0	Cornell Lab of Ornithology	CLO	EBIRD	EOD - eBird Observation Dataset	HUMAN_OBSERVATION	URN:catalog:CLO:EBIRD:OBS713270776	OBS713270776	obsr111092	1	PRESENT	2/19/19 0:00	2019	2	19	US	California	Santa Barbara	Devereux Slough	34.4136	-119.876	2498265	Aythya marila (Linnaeus, 1761)	Animalia	Chordata	Aves	Anseriformes	Anatidae	Aythya	marila	SPECIES	Greater Scaup	ACCEPTED	4fa7b334-ce0d-4e88-aaae-2e0c138d049e	US	12/16/20 12:08	TRUE	FALSE	2498265	2498265	1	44	212	1108	2986	2498254	2498265	Aythya marila	Aythya	Aythya marila (Linnaeus, 1761)	Aythya marila	DWC_ARCHIVE	12/16/20 12:08	6/30/20 8:20	FALSE	USA	United States	USA.5_1	California	USA.5.42_1	Santa Barbara	2019-2-19	TRUE
2759308833	OBS714738614	CC0_1_0	Cornell Lab of Ornithology	CLO	EBIRD	EOD - eBird Observation Dataset	HUMAN_OBSERVATION	URN:catalog:CLO:EBIRD:OBS714738614	OBS714738614	obsr1210457	1	PRESENT	2/21/19 0:00	2019	2	21	US	California	Santa Barbara	Devereux Slough	34.4136	-119.876	2482059	Podiceps auritus (Linnaeus, 1758)	Animalia	Chordata	Aves	Podicipediformes	Podicipedidae	Podiceps	auritus	SPECIES	Horned Grebe	ACCEPTED	4fa7b334-ce0d-4e88-aaae-2e0c138d049e	US	12/16/20 12:08	TRUE	FALSE	2482059	2482059	1	44	212	7191588	9338	2482049	2482059	Podiceps auritus	Podiceps	Podiceps auritus (Linnaeus, 1758)	Podiceps auritus	DWC_ARCHIVE	12/16/20 12:08	6/30/20 8:20	FALSE	USA	United States	USA.5_1	California	USA.5.42_1	Santa Barbara	2019-2-21	FALSE
2742585063	OBS714181789	CC0_1_0	Cornell Lab of Ornithology	CLO	EBIRD	EOD - eBird Observation Dataset	HUMAN_OBSERVATION	URN:catalog:CLO:EBIRD:OBS714181789	OBS714181789	obsr933209	1	PRESENT	2/22/19 0:00	2019	2	22	US	California	Santa Barbara	Coal Oil Point--Devereux Beach and Sands Beach	34.4071	-119.878	2481196	Larus glaucescens J.F.Naumann, 1840	Animalia	Chordata	Aves	Charadriiformes	Laridae	Larus	glaucescens	SPECIES	Glaucous-winged Gull	ACCEPTED	4fa7b334-ce0d-4e88-aaae-2e0c138d049e	US	12/16/20 12:06	TRUE	FALSE	2481196	2481196	1	44	212	7192402	9316	2481126	2481196	Larus glaucescens	Larus	Larus glaucescens J.F.Naumann, 1840	Larus glaucescens	DWC_ARCHIVE	12/16/20 12:06	6/30/20 8:20	FALSE	USA	United States	USA.5_1	California	USA.5.42_1	Santa Barbara	2019-2-22	FALSE
2671450925	OBS714181801	CC0_1_0	Cornell Lab of Ornithology	CLO	EBIRD	EOD - eBird Observation Dataset	HUMAN_OBSERVATION	URN:catalog:CLO:EBIRD:OBS714181801	OBS714181801	obsr933209	1	PRESENT	2/22/19 0:00	2019	2	22	US	California	Santa Barbara	Coal Oil Point--Devereux Beach and Sands Beach	34.4071	-119.878	5229662	Tyrannus melancholicus Vieillot, 1819	Animalia	Chordata	Aves	Passeriformes	Tyrannidae	Tyrannus	melancholicus	SPECIES	Tropical Kingbird	ACCEPTED	4fa7b334-ce0d-4e88-aaae-2e0c138d049e	US	12/16/20 11:58	TRUE	FALSE	5229662	5229662	1	44	212	729	5291	2483336	5229662	Tyrannus melancholicus	Tyrannus	Tyrannus melancholicus Vieillot, 1819	Tyrannus melancholicus	DWC_ARCHIVE	12/16/20 11:58	6/30/20 8:20	FALSE	USA	United States	USA.5_1	California	USA.5.42_1	Santa Barbara	2019-2-22	FALSE
2736758956	OBS714181769	CC0_1_0	Cornell Lab of Ornithology	CLO	EBIRD	EOD - eBird Observation Dataset	HUMAN_OBSERVATION	URN:catalog:CLO:EBIRD:OBS714181769	OBS714181769	obsr933209	1	PRESENT	2/22/19 0:00	2019	2	22	US	California	Santa Barbara	Coal Oil Point--Devereux Beach and Sands Beach	34.4071	-119.878	2490263	Anthus rubescens (Tunstall, 1771)	Animalia	Chordata	Aves	Passeriformes	Motacillidae	Anthus	rubescens	SPECIES	American Pipit	ACCEPTED	4fa7b334-ce0d-4e88-aaae-2e0c138d049e	US	12/16/20 12:06	TRUE	FALSE	2490263	2490263	1	44	212	729	5257	2490241	2490263	Anthus rubescens	Anthus	Anthus rubescens (Tunstall, 1771)	Anthus rubescens	DWC_ARCHIVE	12/16/20 12:06	6/30/20 8:20	FALSE	USA	United States	USA.5_1	California	USA.5.42_1	Santa Barbara	2019-2-22	FALSE
2660131166	OBS714789599	CC0_1_0	Cornell Lab of Ornithology	CLO	EBIRD	EOD - eBird Observation Dataset	HUMAN_OBSERVATION	URN:catalog:CLO:EBIRD:OBS714789599	OBS714789599	obsr172576	1	PRESENT	2/23/19 0:00	2019	2	23	US	California	Santa Barbara	Coal Oil Point--Devereux Beach and Sands Beach	34.4071	-119.878	2481196	Larus glaucescens J.F.Naumann, 1840	Animalia	Chordata	Aves	Charadriiformes	Laridae	Larus	glaucescens	SPECIES	Glaucous-winged Gull	ACCEPTED	4fa7b334-ce0d-4e88-aaae-2e0c138d049e	US	12/16/20 12:17	TRUE	FALSE	2481196	2481196	1	44	212	7192402	9316	2481126	2481196	Larus glaucescens	Larus	Larus glaucescens J.F.Naumann, 1840	Larus glaucescens	DWC_ARCHIVE	12/16/20 12:17	6/30/20 8:20	FALSE	USA	United States	USA.5_1	California	USA.5.42_1	Santa Barbara	2019-2-23	FALSE
2752723193	OBS714769405	CC0_1_0	Cornell Lab of Ornithology	CLO	EBIRD	EOD - eBird Observation Dataset	HUMAN_OBSERVATION	URN:catalog:CLO:EBIRD:OBS714769405	OBS714769405	obsr933209	1	PRESENT	2/23/19 0:00	2019	2	23	US	California	Santa Barbara	Dune Pond at COPR	34.4137	-119.882	2482059	Podiceps auritus (Linnaeus, 1758)	Animalia	Chordata	Aves	Podicipediformes	Podicipedidae	Podiceps	auritus	SPECIES	Horned Grebe	ACCEPTED	4fa7b334-ce0d-4e88-aaae-2e0c138d049e	US	12/16/20 12:07	TRUE	FALSE	2482059	2482059	1	44	212	7191588	9338	2482049	2482059	Podiceps auritus	Podiceps	Podiceps auritus (Linnaeus, 1758)	Podiceps auritus	DWC_ARCHIVE	12/16/20 12:07	6/30/20 8:20	FALSE	USA	United States	USA.5_1	California	USA.5.42_1	Santa Barbara	2019-2-23	FALSE
2728557201	OBS714815400	CC0_1_0	Cornell Lab of Ornithology	CLO	EBIRD	EOD - eBird Observation Dataset	HUMAN_OBSERVATION	URN:catalog:CLO:EBIRD:OBS714815400	OBS714815400	obsr553136	2	PRESENT	2/23/19 0:00	2019	2	23	US	California	Santa Barbara	Devereux Slough	34.4136	-119.876	2492109	Spizella passerina (Bechstein, 1798)	Animalia	Chordata	Aves	Passeriformes	Emberizidae	Spizella	passerina	SPECIES	Chipping Sparrow	ACCEPTED	4fa7b334-ce0d-4e88-aaae-2e0c138d049e	US	12/16/20 12:06	TRUE	FALSE	2492109	2492109	1	44	212	729	9608	2492093	2492109	Spizella passerina	Spizella	Spizella passerina (Bechstein, 1798)	Spizella passerina	DWC_ARCHIVE	12/16/20 12:06	6/30/20 8:20	FALSE	USA	United States	USA.5_1	California	USA.5.42_1	Santa Barbara	2019-2-23	FALSE
2742026194	OBS714767657	CC0_1_0	Cornell Lab of Ornithology	CLO	EBIRD	EOD - eBird Observation Dataset	HUMAN_OBSERVATION	URN:catalog:CLO:EBIRD:OBS714767657	OBS714767657	obsr933209	1	PRESENT	2/23/19 0:00	2019	2	23	US	California	Santa Barbara	Devereux Slough	34.4136	-119.876	5231138	Zonotrichia atricapilla (J.F.Gmelin, 1789)	Animalia	Chordata	Aves	Passeriformes	Emberizidae	Zonotrichia	atricapilla	SPECIES	Golden-crowned Sparrow	ACCEPTED	4fa7b334-ce0d-4e88-aaae-2e0c138d049e	US	12/16/20 12:08	TRUE	FALSE	5231138	5231138	1	44	212	729	9608	6173226	5231138	Zonotrichia atricapilla	Zonotrichia	Zonotrichia atricapilla (J.F.Gmelin, 1789)	Zonotrichia atricapilla	DWC_ARCHIVE	12/16/20 12:08	6/30/20 8:20	FALSE	USA	United States	USA.5_1	California	USA.5.42_1	Santa Barbara	2019-2-23	FALSE
2658994058	OBS717078769	CC0_1_0	Cornell Lab of Ornithology	CLO	EBIRD	EOD - eBird Observation Dataset	HUMAN_OBSERVATION	URN:catalog:CLO:EBIRD:OBS717078769	OBS717078769	obsr605751	3	PRESENT	2/26/19 0:00	2019	2	26	US	California	Santa Barbara	Coal Oil Point--Devereux Beach and Sands Beach	34.4071	-119.878	2490263	Anthus rubescens (Tunstall, 1771)	Animalia	Chordata	Aves	Passeriformes	Motacillidae	Anthus	rubescens	SPECIES	American Pipit	ACCEPTED	4fa7b334-ce0d-4e88-aaae-2e0c138d049e	US	12/16/20 11:59	TRUE	FALSE	2490263	2490263	1	44	212	729	5257	2490241	2490263	Anthus rubescens	Anthus	Anthus rubescens (Tunstall, 1771)	Anthus rubescens	DWC_ARCHIVE	12/16/20 11:59	6/30/20 8:20	FALSE	USA	United States	USA.5_1	California	USA.5.42_1	Santa Barbara	2019-2-26	FALSE
2658320799	OBS715832611	CC0_1_0	Cornell Lab of Ornithology	CLO	EBIRD	EOD - eBird Observation Dataset	HUMAN_OBSERVATION	URN:catalog:CLO:EBIRD:OBS715832611	OBS715832611	obsr413715	2	PRESENT	2/26/19 0:00	2019	2	26	US	California	Santa Barbara	Coal Oil Point--Devereux Beach and Sands Beach	34.4071	-119.878	2481139	Larus argentatus Pontoppidan, 1763	Animalia	Chordata	Aves	Charadriiformes	Laridae	Larus	argentatus	SPECIES	Herring Gull	ACCEPTED	4fa7b334-ce0d-4e88-aaae-2e0c138d049e	US	12/16/20 11:57	TRUE	FALSE	2481139	2481139	1	44	212	7192402	9316	2481126	2481139	Larus argentatus	Larus	Larus argentatus Pontoppidan, 1763	Larus argentatus	DWC_ARCHIVE	12/16/20 11:57	6/30/20 8:20	FALSE	USA	United States	USA.5_1	California	USA.5.42_1	Santa Barbara	2019-2-26	FALSE
2734568821	OBS706298054	CC0_1_0	Cornell Lab of Ornithology	CLO	EBIRD	EOD - eBird Observation Dataset	HUMAN_OBSERVATION	URN:catalog:CLO:EBIRD:OBS706298054	OBS706298054	obsr1209964	1	PRESENT	2/3/19 0:00	2019	2	3	US	California	Santa Barbara	Devereux Slough	34.4136	-119.876	5231138	Zonotrichia atricapilla (J.F.Gmelin, 1789)	Animalia	Chordata	Aves	Passeriformes	Emberizidae	Zonotrichia	atricapilla	SPECIES	Golden-crowned Sparrow	ACCEPTED	4fa7b334-ce0d-4e88-aaae-2e0c138d049e	US	12/16/20 12:06	TRUE	FALSE	5231138	5231138	1	44	212	729	9608	6173226	5231138	Zonotrichia atricapilla	Zonotrichia	Zonotrichia atricapilla (J.F.Gmelin, 1789)	Zonotrichia atricapilla	DWC_ARCHIVE	12/16/20 12:06	6/30/20 8:20	FALSE	USA	United States	USA.5_1	California	USA.5.42_1	Santa Barbara	2019-2-3	FALSE
2671095753	OBS706298052	CC0_1_0	Cornell Lab of Ornithology	CLO	EBIRD	EOD - eBird Observation Dataset	HUMAN_OBSERVATION	URN:catalog:CLO:EBIRD:OBS706298052	OBS706298052	obsr1209964	1	PRESENT	2/3/19 0:00	2019	2	3	US	California	Santa Barbara	Devereux Slough	34.4136	-119.876	2490810	Catharus guttatus (Pallas, 1811)	Animalia	Chordata	Aves	Passeriformes	Turdidae	Catharus	guttatus	SPECIES	Hermit Thrush	ACCEPTED	4fa7b334-ce0d-4e88-aaae-2e0c138d049e	US	12/16/20 12:07	TRUE	FALSE	2490810	2490810	1	44	212	729	5290	2490799	2490810	Catharus guttatus	Catharus	Catharus guttatus (Pallas, 1811)	Catharus guttatus	DWC_ARCHIVE	12/16/20 12:07	6/30/20 8:20	FALSE	USA	United States	USA.5_1	California	USA.5.42_1	Santa Barbara	2019-2-3	FALSE
2657326068	OBS709999330	CC0_1_0	Cornell Lab of Ornithology	CLO	EBIRD	EOD - eBird Observation Dataset	HUMAN_OBSERVATION	URN:catalog:CLO:EBIRD:OBS709999330	OBS709999330	obsr605751	3	PRESENT	2/5/19 0:00	2019	2	5	US	California	Santa Barbara	Coal Oil Point--Devereux Beach and Sands Beach	34.4071	-119.878	9362842	Junco hyemalis (Linnaeus, 1758)	Animalia	Chordata	Aves	Passeriformes	Emberizidae	Junco	hyemalis	SPECIES	Dark-eyed Junco	ACCEPTED	4fa7b334-ce0d-4e88-aaae-2e0c138d049e	US	12/16/20 11:58	TRUE	FALSE	9362842	9362842	1	44	212	729	9608	2492009	9362842	Junco hyemalis	Junco	Junco hyemalis (Linnaeus, 1758)	Junco hyemalis	DWC_ARCHIVE	12/16/20 11:58	6/30/20 8:20	FALSE	USA	United States	USA.5_1	California	USA.5.42_1	Santa Barbara	2019-2-5	FALSE
2658074221	OBS709999337	CC0_1_0	Cornell Lab of Ornithology	CLO	EBIRD	EOD - eBird Observation Dataset	HUMAN_OBSERVATION	URN:catalog:CLO:EBIRD:OBS709999337	OBS709999337	obsr605751	3	PRESENT	2/5/19 0:00	2019	2	5	US	California	Santa Barbara	Coal Oil Point--Devereux Beach and Sands Beach	34.4071	-119.878	2490263	Anthus rubescens (Tunstall, 1771)	Animalia	Chordata	Aves	Passeriformes	Motacillidae	Anthus	rubescens	SPECIES	American Pipit	ACCEPTED	4fa7b334-ce0d-4e88-aaae-2e0c138d049e	US	12/16/20 11:58	TRUE	FALSE	2490263	2490263	1	44	212	729	5257	2490241	2490263	Anthus rubescens	Anthus	Anthus rubescens (Tunstall, 1771)	Anthus rubescens	DWC_ARCHIVE	12/16/20 11:58	6/30/20 8:20	FALSE	USA	United States	USA.5_1	California	USA.5.42_1	Santa Barbara	2019-2-5	FALSE
2658674353	OBS709999312	CC0_1_0	Cornell Lab of Ornithology	CLO	EBIRD	EOD - eBird Observation Dataset	HUMAN_OBSERVATION	URN:catalog:CLO:EBIRD:OBS709999312	OBS709999312	obsr605751	17	PRESENT	2/5/19 0:00	2019	2	5	US	California	Santa Barbara	Coal Oil Point--Devereux Beach and Sands Beach	34.4071	-119.878	9596413	Sturnella neglecta Audubon, 1844	Animalia	Chordata	Aves	Passeriformes	Icteridae	Sturnella	neglecta	SPECIES	Western Meadowlark	ACCEPTED	4fa7b334-ce0d-4e88-aaae-2e0c138d049e	US	12/16/20 11:58	TRUE	FALSE	9596413	9596413	1	44	212	729	6176	2484248	9596413	Sturnella neglecta	Sturnella	Sturnella neglecta Audubon, 1844	Sturnella neglecta	DWC_ARCHIVE	12/16/20 11:58	6/30/20 8:20	FALSE	USA	United States	USA.5_1	California	USA.5.42_1	Santa Barbara	2019-2-5	FALSE
2739981634	OBS723838876	CC0_1_0	Cornell Lab of Ornithology	CLO	EBIRD	EOD - eBird Observation Dataset	HUMAN_OBSERVATION	URN:catalog:CLO:EBIRD:OBS723838876	OBS723838876	obsr933209	2	PRESENT	3/13/19 0:00	2019	3	13	US	California	Santa Barbara	Coal Oil Point--Devereux Beach and Sands Beach	34.4071	-119.878	5232446	Branta bernicla (Linnaeus, 1758)	Animalia	Chordata	Aves	Anseriformes	Anatidae	Branta	bernicla	SPECIES	Brant	ACCEPTED	4fa7b334-ce0d-4e88-aaae-2e0c138d049e	US	12/16/20 12:08	TRUE	FALSE	5232446	5232446	1	44	212	1108	2986	2498190	5232446	Branta bernicla	Branta	Branta bernicla (Linnaeus, 1758)	Branta bernicla	DWC_ARCHIVE	12/16/20 12:08	6/30/20 8:20	FALSE	USA	United States	USA.5_1	California	USA.5.42_1	Santa Barbara	2019-3-13	FALSE
2748788259	OBS726473168	CC0_1_0	Cornell Lab of Ornithology	CLO	EBIRD	EOD - eBird Observation Dataset	HUMAN_OBSERVATION	URN:catalog:CLO:EBIRD:OBS726473168	OBS726473168	obsr1214821	1	PRESENT	3/18/19 0:00	2019	3	18	US	California	Santa Barbara	Devereux Slough	34.4136	-119.876	6092651	Setophaga townsendi (J.K.Townsend, 1837)	Animalia	Chordata	Aves	Passeriformes	Parulidae	Setophaga	townsendi	SPECIES	Townsend's Warbler	ACCEPTED	4fa7b334-ce0d-4e88-aaae-2e0c138d049e	US	12/16/20 12:07	TRUE	FALSE	6092651	6092651	1	44	212	729	5263	2489984	6092651	Setophaga townsendi	Setophaga	Setophaga townsendi (J.K.Townsend, 1837)	Setophaga townsendi	DWC_ARCHIVE	12/16/20 12:07	6/30/20 8:20	FALSE	USA	United States	USA.5_1	California	USA.5.42_1	Santa Barbara	2019-3-18	FALSE
2662815366	OBS726473203	CC0_1_0	Cornell Lab of Ornithology	CLO	EBIRD	EOD - eBird Observation Dataset	HUMAN_OBSERVATION	URN:catalog:CLO:EBIRD:OBS726473203	OBS726473203	obsr1214821	1	PRESENT	3/18/19 0:00	2019	3	18	US	California	Santa Barbara	Coal Oil Point--Devereux Beach and Sands Beach	34.4071	-119.878	7982160	Larus canus Linnaeus, 1758	Animalia	Chordata	Aves	Charadriiformes	Laridae	Larus	canus	SPECIES	Mew Gull	ACCEPTED	4fa7b334-ce0d-4e88-aaae-2e0c138d049e	US	12/16/20 11:59	TRUE	FALSE	7982160	7982160	1	44	212	7192402	9316	2481126	7982160	Larus canus	Larus	Larus canus Linnaeus, 1758	Larus canus	DWC_ARCHIVE	12/16/20 11:59	6/30/20 8:20	FALSE	USA	United States	USA.5_1	California	USA.5.42_1	Santa Barbara	2019-3-18	FALSE
2739131434	OBS726473161	CC0_1_0	Cornell Lab of Ornithology	CLO	EBIRD	EOD - eBird Observation Dataset	HUMAN_OBSERVATION	URN:catalog:CLO:EBIRD:OBS726473161	OBS726473161	obsr1214821	4	PRESENT	3/18/19 0:00	2019	3	18	US	California	Santa Barbara	Devereux Slough	34.4136	-119.876	2498264	Aythya collaris (Donovan, 1809)	Animalia	Chordata	Aves	Anseriformes	Anatidae	Aythya	collaris	SPECIES	Ring-necked Duck	ACCEPTED	4fa7b334-ce0d-4e88-aaae-2e0c138d049e	US	12/16/20 12:07	TRUE	FALSE	2498264	2498264	1	44	212	1108	2986	2498254	2498264	Aythya collaris	Aythya	Aythya collaris (Donovan, 1809)	Aythya collaris	DWC_ARCHIVE	12/16/20 12:07	6/30/20 8:20	FALSE	USA	United States	USA.5_1	California	USA.5.42_1	Santa Barbara	2019-3-18	FALSE
2732900978	OBS726294663	CC0_1_0	Cornell Lab of Ornithology	CLO	EBIRD	EOD - eBird Observation Dataset	HUMAN_OBSERVATION	URN:catalog:CLO:EBIRD:OBS726294663	OBS726294663	obsr802615	1	PRESENT	3/18/19 0:00	2019	3	18	US	California	Santa Barbara	Coal Oil Point--Devereux Beach and Sands Beach	34.4071	-119.878	7982160	Larus canus Linnaeus, 1758	Animalia	Chordata	Aves	Charadriiformes	Laridae	Larus	canus	SPECIES	Mew Gull	ACCEPTED	4fa7b334-ce0d-4e88-aaae-2e0c138d049e	US	12/16/20 12:06	TRUE	FALSE	7982160	7982160	1	44	212	7192402	9316	2481126	7982160	Larus canus	Larus	Larus canus Linnaeus, 1758	Larus canus	DWC_ARCHIVE	12/16/20 12:06	6/30/20 8:20	FALSE	USA	United States	USA.5_1	California	USA.5.42_1	Santa Barbara	2019-3-18	FALSE
2735887162	OBS726293085	CC0_1_0	Cornell Lab of Ornithology	CLO	EBIRD	EOD - eBird Observation Dataset	HUMAN_OBSERVATION	URN:catalog:CLO:EBIRD:OBS726293085	OBS726293085	obsr802615	1	PRESENT	3/18/19 0:00	2019	3	18	US	California	Santa Barbara	Devereux Slough	34.4136	-119.876	6092651	Setophaga townsendi (J.K.Townsend, 1837)	Animalia	Chordata	Aves	Passeriformes	Parulidae	Setophaga	townsendi	SPECIES	Townsend's Warbler	ACCEPTED	4fa7b334-ce0d-4e88-aaae-2e0c138d049e	US	12/16/20 12:06	TRUE	FALSE	6092651	6092651	1	44	212	729	5263	2489984	6092651	Setophaga townsendi	Setophaga	Setophaga townsendi (J.K.Townsend, 1837)	Setophaga townsendi	DWC_ARCHIVE	12/16/20 12:06	6/30/20 8:20	FALSE	USA	United States	USA.5_1	California	USA.5.42_1	Santa Barbara	2019-3-18	FALSE
2662157151	OBS726293078	CC0_1_0	Cornell Lab of Ornithology	CLO	EBIRD	EOD - eBird Observation Dataset	HUMAN_OBSERVATION	URN:catalog:CLO:EBIRD:OBS726293078	OBS726293078	obsr802615	4	PRESENT	3/18/19 0:00	2019	3	18	US	California	Santa Barbara	Devereux Slough	34.4136	-119.876	2498264	Aythya collaris (Donovan, 1809)	Animalia	Chordata	Aves	Anseriformes	Anatidae	Aythya	collaris	SPECIES	Ring-necked Duck	ACCEPTED	4fa7b334-ce0d-4e88-aaae-2e0c138d049e	US	12/16/20 12:06	TRUE	FALSE	2498264	2498264	1	44	212	1108	2986	2498254	2498264	Aythya collaris	Aythya	Aythya collaris (Donovan, 1809)	Aythya collaris	DWC_ARCHIVE	12/16/20 12:06	6/30/20 8:20	FALSE	USA	United States	USA.5_1	California	USA.5.42_1	Santa Barbara	2019-3-18	FALSE
2742322339	OBS727019882	CC0_1_0	Cornell Lab of Ornithology	CLO	EBIRD	EOD - eBird Observation Dataset	HUMAN_OBSERVATION	URN:catalog:CLO:EBIRD:OBS727019882	OBS727019882	obsr605751	1	PRESENT	3/19/19 0:00	2019	3	19	US	California	Santa Barbara	Coal Oil Point--Devereux Beach and Sands Beach	34.4071	-119.878	5231138	Zonotrichia atricapilla (J.F.Gmelin, 1789)	Animalia	Chordata	Aves	Passeriformes	Emberizidae	Zonotrichia	atricapilla	SPECIES	Golden-crowned Sparrow	ACCEPTED	4fa7b334-ce0d-4e88-aaae-2e0c138d049e	US	12/16/20 12:07	TRUE	FALSE	5231138	5231138	1	44	212	729	9608	6173226	5231138	Zonotrichia atricapilla	Zonotrichia	Zonotrichia atricapilla (J.F.Gmelin, 1789)	Zonotrichia atricapilla	DWC_ARCHIVE	12/16/20 12:07	6/30/20 8:20	FALSE	USA	United States	USA.5_1	California	USA.5.42_1	Santa Barbara	2019-3-19	FALSE
2661951368	OBS727019935	CC0_1_0	Cornell Lab of Ornithology	CLO	EBIRD	EOD - eBird Observation Dataset	HUMAN_OBSERVATION	URN:catalog:CLO:EBIRD:OBS727019935	OBS727019935	obsr605751	3	PRESENT	3/19/19 0:00	2019	3	19	US	California	Santa Barbara	Coal Oil Point--Devereux Beach and Sands Beach	34.4071	-119.878	2484597	Regulus calendula (Linnaeus, 1766)	Animalia	Chordata	Aves	Passeriformes	Regulidae	Regulus	calendula	SPECIES	Ruby-crowned Kinglet	ACCEPTED	4fa7b334-ce0d-4e88-aaae-2e0c138d049e	US	12/16/20 12:17	TRUE	FALSE	2484597	2484597	1	44	212	729	5279	2484589	2484597	Regulus calendula	Regulus	Regulus calendula (Linnaeus, 1766)	Regulus calendula	DWC_ARCHIVE	12/16/20 12:17	6/30/20 8:20	FALSE	USA	United States	USA.5_1	California	USA.5.42_1	Santa Barbara	2019-3-19	FALSE
2738957300	OBS727005470	CC0_1_0	Cornell Lab of Ornithology	CLO	EBIRD	EOD - eBird Observation Dataset	HUMAN_OBSERVATION	URN:catalog:CLO:EBIRD:OBS727005470	OBS727005470	obsr933209	1	PRESENT	3/20/19 0:00	2019	3	20	US	California	Santa Barbara	Coal Oil Point--Devereux Beach and Sands Beach	34.4071	-119.878	2481139	Larus argentatus Pontoppidan, 1763	Animalia	Chordata	Aves	Charadriiformes	Laridae	Larus	argentatus	SPECIES	Herring Gull	ACCEPTED	4fa7b334-ce0d-4e88-aaae-2e0c138d049e	US	12/16/20 12:07	TRUE	FALSE	2481139	2481139	1	44	212	7192402	9316	2481126	2481139	Larus argentatus	Larus	Larus argentatus Pontoppidan, 1763	Larus argentatus	DWC_ARCHIVE	12/16/20 12:07	6/30/20 8:20	FALSE	USA	United States	USA.5_1	California	USA.5.42_1	Santa Barbara	2019-3-20	FALSE
2739922429	OBS727005455	CC0_1_0	Cornell Lab of Ornithology	CLO	EBIRD	EOD - eBird Observation Dataset	HUMAN_OBSERVATION	URN:catalog:CLO:EBIRD:OBS727005455	OBS727005455	obsr933209	1	PRESENT	3/20/19 0:00	2019	3	20	US	California	Santa Barbara	Coal Oil Point--Devereux Beach and Sands Beach	34.4071	-119.878	2481621	Stercorarius parasiticus (Linnaeus, 1758)	Animalia	Chordata	Aves	Charadriiformes	Stercorariidae	Stercorarius	parasiticus	SPECIES	Parasitic Jaeger	ACCEPTED	4fa7b334-ce0d-4e88-aaae-2e0c138d049e	US	12/16/20 12:06	TRUE	FALSE	2481621	2481621	1	44	212	7192402	9347	2481608	2481621	Stercorarius parasiticus	Stercorarius	Stercorarius parasiticus (Linnaeus, 1758)	Stercorarius parasiticus	DWC_ARCHIVE	12/16/20 12:06	6/30/20 8:20	FALSE	USA	United States	USA.5_1	California	USA.5.42_1	Santa Barbara	2019-3-20	FALSE
2736576292	OBS727005469	CC0_1_0	Cornell Lab of Ornithology	CLO	EBIRD	EOD - eBird Observation Dataset	HUMAN_OBSERVATION	URN:catalog:CLO:EBIRD:OBS727005469	OBS727005469	obsr933209	2	PRESENT	3/20/19 0:00	2019	3	20	US	California	Santa Barbara	Coal Oil Point--Devereux Beach and Sands Beach	34.4071	-119.878	2498375	Mergus serrator Linnaeus, 1758	Animalia	Chordata	Aves	Anseriformes	Anatidae	Mergus	serrator	SPECIES	Red-breasted Merganser	ACCEPTED	4fa7b334-ce0d-4e88-aaae-2e0c138d049e	US	12/16/20 12:06	TRUE	FALSE	2498375	2498375	1	44	212	1108	2986	2498368	2498375	Mergus serrator	Mergus	Mergus serrator Linnaeus, 1758	Mergus serrator	DWC_ARCHIVE	12/16/20 12:06	6/30/20 8:20	FALSE	USA	United States	USA.5_1	California	USA.5.42_1	Santa Barbara	2019-3-20	FALSE
2754594694	OBS730020167	CC0_1_0	Cornell Lab of Ornithology	CLO	EBIRD	EOD - eBird Observation Dataset	HUMAN_OBSERVATION	URN:catalog:CLO:EBIRD:OBS730020167	OBS730020167	obsr172576	1	PRESENT	3/26/19 0:00	2019	3	26	US	California	Santa Barbara	Dune Pond at COPR	34.4137	-119.882	2484445	Agelaius tricolor (Audubon, 1837)	Animalia	Chordata	Aves	Passeriformes	Icteridae	Agelaius	tricolor	SPECIES	Tricolored Blackbird	ACCEPTED	4fa7b334-ce0d-4e88-aaae-2e0c138d049e	US	12/16/20 11:59	TRUE	FALSE	2484445	2484445	1	44	212	729	6176	2484444	2484445	Agelaius tricolor	Agelaius	Agelaius tricolor (Audubon, 1837)	Agelaius tricolor	DWC_ARCHIVE	12/16/20 11:59	6/30/20 8:20	FALSE	USA	United States	USA.5_1	California	USA.5.42_1	Santa Barbara	2019-3-26	FALSE
2731442085	OBS730021944	CC0_1_0	Cornell Lab of Ornithology	CLO	EBIRD	EOD - eBird Observation Dataset	HUMAN_OBSERVATION	URN:catalog:CLO:EBIRD:OBS730021944	OBS730021944	obsr172576	1	PRESENT	3/26/19 0:00	2019	3	26	US	California	Santa Barbara	WestSideDevereux(PondTrail)	34.4159	-119.877	6065818	Chroicocephalus philadelphia (Ord, 1815)	Animalia	Chordata	Aves	Charadriiformes	Laridae	Chroicocephalus	philadelphia	SPECIES	Bonaparte's Gull	ACCEPTED	4fa7b334-ce0d-4e88-aaae-2e0c138d049e	US	12/16/20 12:06	TRUE	FALSE	6065818	6065818	1	44	212	7192402	9316	4848452	6065818	Chroicocephalus philadelphia	Chroicocephalus	Chroicocephalus philadelphia (Ord, 1815)	Chroicocephalus philadelphia	DWC_ARCHIVE	12/16/20 12:06	6/30/20 8:20	FALSE	USA	United States	USA.5_1	California	USA.5.42_1	Santa Barbara	2019-3-26	FALSE
2664477794	OBS729987310	CC0_1_0	Cornell Lab of Ornithology	CLO	EBIRD	EOD - eBird Observation Dataset	HUMAN_OBSERVATION	URN:catalog:CLO:EBIRD:OBS729987310	OBS729987310	obsr933209	1	PRESENT	3/27/19 0:00	2019	3	27	US	California	Santa Barbara	Coal Oil Point--Devereux Beach and Sands Beach	34.4071	-119.878	6065818	Chroicocephalus philadelphia (Ord, 1815)	Animalia	Chordata	Aves	Charadriiformes	Laridae	Chroicocephalus	philadelphia	SPECIES	Bonaparte's Gull	ACCEPTED	4fa7b334-ce0d-4e88-aaae-2e0c138d049e	US	12/16/20 11:58	TRUE	FALSE	6065818	6065818	1	44	212	7192402	9316	4848452	6065818	Chroicocephalus philadelphia	Chroicocephalus	Chroicocephalus philadelphia (Ord, 1815)	Chroicocephalus philadelphia	DWC_ARCHIVE	12/16/20 11:58	6/30/20 8:20	FALSE	USA	United States	USA.5_1	California	USA.5.42_1	Santa Barbara	2019-3-27	FALSE
2663718783	OBS729987336	CC0_1_0	Cornell Lab of Ornithology	CLO	EBIRD	EOD - eBird Observation Dataset	HUMAN_OBSERVATION	URN:catalog:CLO:EBIRD:OBS729987336	OBS729987336	obsr933209	2	PRESENT	3/27/19 0:00	2019	3	27	US	California	Santa Barbara	Coal Oil Point--Devereux Beach and Sands Beach	34.4071	-119.878	2498246	Melanitta perspicillata (Linnaeus, 1758)	Animalia	Chordata	Aves	Anseriformes	Anatidae	Melanitta	perspicillata	SPECIES	Surf Scoter	ACCEPTED	4fa7b334-ce0d-4e88-aaae-2e0c138d049e	US	12/16/20 12:06	TRUE	FALSE	2498246	2498246	1	44	212	1108	2986	2498237	2498246	Melanitta perspicillata	Melanitta	Melanitta perspicillata (Linnaeus, 1758)	Melanitta perspicillata	DWC_ARCHIVE	12/16/20 12:06	6/30/20 8:20	FALSE	USA	United States	USA.5_1	California	USA.5.42_1	Santa Barbara	2019-3-27	FALSE
2672916428	OBS730986136	CC0_1_0	Cornell Lab of Ornithology	CLO	EBIRD	EOD - eBird Observation Dataset	HUMAN_OBSERVATION	URN:catalog:CLO:EBIRD:OBS730986136	OBS730986136	obsr754031	2	PRESENT	3/29/19 0:00	2019	3	29	US	California	Santa Barbara	Devereux Slough	34.4136	-119.876	2476855	Selasphorus rufus (Gmelin, 1788)	Animalia	Chordata	Aves	Apodiformes	Trochilidae	Selasphorus	rufus	SPECIES	Rufous Hummingbird	ACCEPTED	4fa7b334-ce0d-4e88-aaae-2e0c138d049e	US	12/16/20 11:58	TRUE	FALSE	2476855	2476855	1	44	212	1448	5289	2476843	2476855	Selasphorus rufus	Selasphorus	Selasphorus rufus (Gmelin, 1788)	Selasphorus rufus	DWC_ARCHIVE	12/16/20 11:58	6/30/20 8:20	FALSE	USA	United States	USA.5_1	California	USA.5.42_1	Santa Barbara	2019-3-29	FALSE
2657860593	OBS718000581	CC0_1_0	Cornell Lab of Ornithology	CLO	EBIRD	EOD - eBird Observation Dataset	HUMAN_OBSERVATION	URN:catalog:CLO:EBIRD:OBS718000581	OBS718000581	obsr754031	1	PRESENT	3/3/19 0:00	2019	3	3	US	California	Santa Barbara	Devereux Slough	34.4136	-119.876	2498329	Bucephala albeola (Linnaeus, 1758)	Animalia	Chordata	Aves	Anseriformes	Anatidae	Bucephala	albeola	SPECIES	Bufflehead	ACCEPTED	4fa7b334-ce0d-4e88-aaae-2e0c138d049e	US	12/16/20 11:59	TRUE	FALSE	2498329	2498329	1	44	212	1108	2986	2498324	2498329	Bucephala albeola	Bucephala	Bucephala albeola (Linnaeus, 1758)	Bucephala albeola	DWC_ARCHIVE	12/16/20 11:59	6/30/20 8:20	FALSE	USA	United States	USA.5_1	California	USA.5.42_1	Santa Barbara	2019-3-3	FALSE
2674019504	OBS718000574	CC0_1_0	Cornell Lab of Ornithology	CLO	EBIRD	EOD - eBird Observation Dataset	HUMAN_OBSERVATION	URN:catalog:CLO:EBIRD:OBS718000574	OBS718000574	obsr754031	1	PRESENT	3/3/19 0:00	2019	3	3	US	California	Santa Barbara	Devereux Slough	34.4136	-119.876	2482032	Aechmophorus clarkii (Lawrence, 1858)	Animalia	Chordata	Aves	Podicipediformes	Podicipedidae	Aechmophorus	clarkii	SPECIES	Clark's Grebe	ACCEPTED	4fa7b334-ce0d-4e88-aaae-2e0c138d049e	US	12/16/20 12:17	TRUE	FALSE	2482032	2482032	1	44	212	7191588	9338	2482031	2482032	Aechmophorus clarkii	Aechmophorus	Aechmophorus clarkii (Lawrence, 1858)	Aechmophorus clarkii	DWC_ARCHIVE	12/16/20 12:17	6/30/20 8:20	FALSE	USA	United States	USA.5_1	California	USA.5.42_1	Santa Barbara	2019-3-3	FALSE
2664689283	OBS731949050	CC0_1_0	Cornell Lab of Ornithology	CLO	EBIRD	EOD - eBird Observation Dataset	HUMAN_OBSERVATION	URN:catalog:CLO:EBIRD:OBS731949050	OBS731949050	obsr302151	8	PRESENT	3/31/19 0:00	2019	3	31	US	California	Santa Barbara	Coal Oil Point--Devereux Beach and Sands Beach	34.4071	-119.878	7964835	Calidris virgata	Animalia	Chordata	Aves	Charadriiformes	Scolopacidae	Calidris	virgata	SPECIES	Surfbird	ACCEPTED	4fa7b334-ce0d-4e88-aaae-2e0c138d049e	US	12/16/20 12:00	TRUE	FALSE	7964835	7964835	1	44	212	7192402	5282	2481739	7964835	Calidris virgata	Calidris	Calidris virgata	Calidris virgata	DWC_ARCHIVE	12/16/20 12:00	6/30/20 8:20	FALSE	USA	United States	USA.5_1	California	USA.5.42_1	Santa Barbara	2019-3-31	TRUE
2740767179	OBS718470569	CC0_1_0	Cornell Lab of Ornithology	CLO	EBIRD	EOD - eBird Observation Dataset	HUMAN_OBSERVATION	URN:catalog:CLO:EBIRD:OBS718470569	OBS718470569	obsr17450	4	PRESENT	3/4/19 0:00	2019	3	4	US	California	Santa Barbara	Devereux Slough	34.4136	-119.876	2498264	Aythya collaris (Donovan, 1809)	Animalia	Chordata	Aves	Anseriformes	Anatidae	Aythya	collaris	SPECIES	Ring-necked Duck	ACCEPTED	4fa7b334-ce0d-4e88-aaae-2e0c138d049e	US	12/16/20 12:08	TRUE	FALSE	2498264	2498264	1	44	212	1108	2986	2498254	2498264	Aythya collaris	Aythya	Aythya collaris (Donovan, 1809)	Aythya collaris	DWC_ARCHIVE	12/16/20 12:08	6/30/20 8:20	FALSE	USA	United States	USA.5_1	California	USA.5.42_1	Santa Barbara	2019-3-4	FALSE
2755577006	OBS718487315	CC0_1_0	Cornell Lab of Ornithology	CLO	EBIRD	EOD - eBird Observation Dataset	HUMAN_OBSERVATION	URN:catalog:CLO:EBIRD:OBS718487315	OBS718487315	obsr309446	20	PRESENT	3/4/19 0:00	2019	3	4	US	California	Santa Barbara	Devereux Slough	34.4136	-119.876	8214667	Anas crecca Linnaeus, 1758	Animalia	Chordata	Aves	Anseriformes	Anatidae	Anas	crecca	SPECIES	Green-winged Teal	ACCEPTED	4fa7b334-ce0d-4e88-aaae-2e0c138d049e	US	12/16/20 12:07	TRUE	FALSE	8214667	8214667	1	44	212	1108	2986	2498056	8214667	Anas crecca	Anas	Anas crecca Linnaeus, 1758	Anas crecca	DWC_ARCHIVE	12/16/20 12:07	6/30/20 8:20	FALSE	USA	United States	USA.5_1	California	USA.5.42_1	Santa Barbara	2019-3-4	FALSE
2749333177	OBS718470571	CC0_1_0	Cornell Lab of Ornithology	CLO	EBIRD	EOD - eBird Observation Dataset	HUMAN_OBSERVATION	URN:catalog:CLO:EBIRD:OBS718470571	OBS718470571	obsr17450	NA	PRESENT	3/4/19 0:00	2019	3	4	US	California	Santa Barbara	Devereux Slough	34.4136	-119.876	8214667	Anas crecca Linnaeus, 1758	Animalia	Chordata	Aves	Anseriformes	Anatidae	Anas	crecca	SPECIES	Green-winged Teal	ACCEPTED	4fa7b334-ce0d-4e88-aaae-2e0c138d049e	US	12/16/20 12:07	TRUE	FALSE	8214667	8214667	1	44	212	1108	2986	2498056	8214667	Anas crecca	Anas	Anas crecca Linnaeus, 1758	Anas crecca	DWC_ARCHIVE	12/16/20 12:07	6/30/20 8:20	FALSE	USA	United States	USA.5_1	California	USA.5.42_1	Santa Barbara	2019-3-4	FALSE
2661666396	OBS719732439	CC0_1_0	Cornell Lab of Ornithology	CLO	EBIRD	EOD - eBird Observation Dataset	HUMAN_OBSERVATION	URN:catalog:CLO:EBIRD:OBS719732439	OBS719732439	obsr135070	7	PRESENT	3/5/19 0:00	2019	3	5	US	California	Santa Barbara	Devereux Slough	34.4136	-119.876	5229155	Pelecanus erythrorhynchos Gmelin, 1789	Animalia	Chordata	Aves	Pelecaniformes	Pelecanidae	Pelecanus	erythrorhynchos	SPECIES	American White Pelican	ACCEPTED	4fa7b334-ce0d-4e88-aaae-2e0c138d049e	US	12/16/20 11:58	TRUE	FALSE	5229155	5229155	1	44	212	7190953	9329	10650925	5229155	Pelecanus erythrorhynchos	Pelecanus	Pelecanus erythrorhynchos Gmelin, 1789	Pelecanus erythrorhynchos	DWC_ARCHIVE	12/16/20 11:58	6/30/20 8:20	FALSE	USA	United States	USA.5_1	California	USA.5.42_1	Santa Barbara	2019-3-5	FALSE
2766907521	OBS719732429	CC0_1_0	Cornell Lab of Ornithology	CLO	EBIRD	EOD - eBird Observation Dataset	HUMAN_OBSERVATION	URN:catalog:CLO:EBIRD:OBS719732429	OBS719732429	obsr135070	20	PRESENT	3/5/19 0:00	2019	3	5	US	California	Santa Barbara	Devereux Slough	34.4136	-119.876	8214667	Anas crecca Linnaeus, 1758	Animalia	Chordata	Aves	Anseriformes	Anatidae	Anas	crecca	SPECIES	Green-winged Teal	ACCEPTED	4fa7b334-ce0d-4e88-aaae-2e0c138d049e	US	12/16/20 12:08	TRUE	FALSE	8214667	8214667	1	44	212	1108	2986	2498056	8214667	Anas crecca	Anas	Anas crecca Linnaeus, 1758	Anas crecca	DWC_ARCHIVE	12/16/20 12:08	6/30/20 8:20	FALSE	USA	United States	USA.5_1	California	USA.5.42_1	Santa Barbara	2019-3-5	FALSE
2743360335	OBS719732408	CC0_1_0	Cornell Lab of Ornithology	CLO	EBIRD	EOD - eBird Observation Dataset	HUMAN_OBSERVATION	URN:catalog:CLO:EBIRD:OBS719732408	OBS719732408	obsr135070	3	PRESENT	3/5/19 0:00	2019	3	5	US	California	Santa Barbara	Devereux Slough	34.4136	-119.876	5231138	Zonotrichia atricapilla (J.F.Gmelin, 1789)	Animalia	Chordata	Aves	Passeriformes	Emberizidae	Zonotrichia	atricapilla	SPECIES	Golden-crowned Sparrow	ACCEPTED	4fa7b334-ce0d-4e88-aaae-2e0c138d049e	US	12/16/20 12:08	TRUE	FALSE	5231138	5231138	1	44	212	729	9608	6173226	5231138	Zonotrichia atricapilla	Zonotrichia	Zonotrichia atricapilla (J.F.Gmelin, 1789)	Zonotrichia atricapilla	DWC_ARCHIVE	12/16/20 12:08	6/30/20 8:20	FALSE	USA	United States	USA.5_1	California	USA.5.42_1	Santa Barbara	2019-3-5	FALSE
2745462444	OBS719732419	CC0_1_0	Cornell Lab of Ornithology	CLO	EBIRD	EOD - eBird Observation Dataset	HUMAN_OBSERVATION	URN:catalog:CLO:EBIRD:OBS719732419	OBS719732419	obsr135070	1	PRESENT	3/5/19 0:00	2019	3	5	US	California	Santa Barbara	Devereux Slough	34.4136	-119.876	2498329	Bucephala albeola (Linnaeus, 1758)	Animalia	Chordata	Aves	Anseriformes	Anatidae	Bucephala	albeola	SPECIES	Bufflehead	ACCEPTED	4fa7b334-ce0d-4e88-aaae-2e0c138d049e	US	12/16/20 12:07	TRUE	FALSE	2498329	2498329	1	44	212	1108	2986	2498324	2498329	Bucephala albeola	Bucephala	Bucephala albeola (Linnaeus, 1758)	Bucephala albeola	DWC_ARCHIVE	12/16/20 12:07	6/30/20 8:20	FALSE	USA	United States	USA.5_1	California	USA.5.42_1	Santa Barbara	2019-3-5	FALSE
2672064280	OBS719732444	CC0_1_0	Cornell Lab of Ornithology	CLO	EBIRD	EOD - eBird Observation Dataset	HUMAN_OBSERVATION	URN:catalog:CLO:EBIRD:OBS719732444	OBS719732444	obsr135070	1	PRESENT	3/5/19 0:00	2019	3	5	US	California	Santa Barbara	Devereux Slough	34.4136	-119.876	2482032	Aechmophorus clarkii (Lawrence, 1858)	Animalia	Chordata	Aves	Podicipediformes	Podicipedidae	Aechmophorus	clarkii	SPECIES	Clark's Grebe	ACCEPTED	4fa7b334-ce0d-4e88-aaae-2e0c138d049e	US	12/16/20 11:58	TRUE	FALSE	2482032	2482032	1	44	212	7191588	9338	2482031	2482032	Aechmophorus clarkii	Aechmophorus	Aechmophorus clarkii (Lawrence, 1858)	Aechmophorus clarkii	DWC_ARCHIVE	12/16/20 11:58	6/30/20 8:20	FALSE	USA	United States	USA.5_1	California	USA.5.42_1	Santa Barbara	2019-3-5	FALSE
2668108853	OBS721145403	CC0_1_0	Cornell Lab of Ornithology	CLO	EBIRD	EOD - eBird Observation Dataset	HUMAN_OBSERVATION	URN:catalog:CLO:EBIRD:OBS721145403	OBS721145403	obsr251355	2	PRESENT	3/6/19 0:00	2019	3	6	US	California	Santa Barbara	Coal Oil Point--Devereux Beach and Sands Beach	34.4071	-119.878	2484597	Regulus calendula (Linnaeus, 1766)	Animalia	Chordata	Aves	Passeriformes	Regulidae	Regulus	calendula	SPECIES	Ruby-crowned Kinglet	ACCEPTED	4fa7b334-ce0d-4e88-aaae-2e0c138d049e	US	12/16/20 11:58	TRUE	FALSE	2484597	2484597	1	44	212	729	5279	2484589	2484597	Regulus calendula	Regulus	Regulus calendula (Linnaeus, 1766)	Regulus calendula	DWC_ARCHIVE	12/16/20 11:58	6/30/20 8:20	FALSE	USA	United States	USA.5_1	California	USA.5.42_1	Santa Barbara	2019-3-6	FALSE
2659057828	OBS721144832	CC0_1_0	Cornell Lab of Ornithology	CLO	EBIRD	EOD - eBird Observation Dataset	HUMAN_OBSERVATION	URN:catalog:CLO:EBIRD:OBS721144832	OBS721144832	obsr251355	4	PRESENT	3/6/19 0:00	2019	3	6	US	California	Santa Barbara	Devereux Slough	34.4136	-119.876	2498257	Aythya affinis (Eyton, 1838)	Animalia	Chordata	Aves	Anseriformes	Anatidae	Aythya	affinis	SPECIES	Lesser Scaup	ACCEPTED	4fa7b334-ce0d-4e88-aaae-2e0c138d049e	US	12/16/20 12:17	TRUE	FALSE	2498257	2498257	1	44	212	1108	2986	2498254	2498257	Aythya affinis	Aythya	Aythya affinis (Eyton, 1838)	Aythya affinis	DWC_ARCHIVE	12/16/20 12:17	6/30/20 8:20	FALSE	USA	United States	USA.5_1	California	USA.5.42_1	Santa Barbara	2019-3-6	FALSE
2761356539	OBS720537886	CC0_1_0	Cornell Lab of Ornithology	CLO	EBIRD	EOD - eBird Observation Dataset	HUMAN_OBSERVATION	URN:catalog:CLO:EBIRD:OBS720537886	OBS720537886	obsr933209	3	PRESENT	3/6/19 0:00	2019	3	6	US	California	Santa Barbara	Coal Oil Point--Devereux Beach and Sands Beach	34.4071	-119.878	2481958	Gavia stellata (Pontoppidan, 1763)	Animalia	Chordata	Aves	Gaviiformes	Gaviidae	Gavia	stellata	SPECIES	Red-throated Loon	ACCEPTED	4fa7b334-ce0d-4e88-aaae-2e0c138d049e	US	12/16/20 12:08	TRUE	FALSE	2481958	2481958	1	44	212	7192754	9312	2481954	2481958	Gavia stellata	Gavia	Gavia stellata (Pontoppidan, 1763)	Gavia stellata	DWC_ARCHIVE	12/16/20 12:08	6/30/20 8:20	FALSE	USA	United States	USA.5_1	California	USA.5.42_1	Santa Barbara	2019-3-6	FALSE
2738176707	OBS720537879	CC0_1_0	Cornell Lab of Ornithology	CLO	EBIRD	EOD - eBird Observation Dataset	HUMAN_OBSERVATION	URN:catalog:CLO:EBIRD:OBS720537879	OBS720537879	obsr933209	1	PRESENT	3/6/19 0:00	2019	3	6	US	California	Santa Barbara	Coal Oil Point--Devereux Beach and Sands Beach	34.4071	-119.878	2481139	Larus argentatus Pontoppidan, 1763	Animalia	Chordata	Aves	Charadriiformes	Laridae	Larus	argentatus	SPECIES	Herring Gull	ACCEPTED	4fa7b334-ce0d-4e88-aaae-2e0c138d049e	US	12/16/20 12:07	TRUE	FALSE	2481139	2481139	1	44	212	7192402	9316	2481126	2481139	Larus argentatus	Larus	Larus argentatus Pontoppidan, 1763	Larus argentatus	DWC_ARCHIVE	12/16/20 12:07	6/30/20 8:20	FALSE	USA	United States	USA.5_1	California	USA.5.42_1	Santa Barbara	2019-3-6	FALSE
2715190584	OBS852631991	CC0_1_0	Cornell Lab of Ornithology	CLO	EBIRD	EOD - eBird Observation Dataset	HUMAN_OBSERVATION	URN:catalog:CLO:EBIRD:OBS852631991	OBS852631991	obsr1479168	1	PRESENT	3/6/19 0:00	2019	3	6	US	California	Santa Barbara	Devereux Slough	34.4136	-119.876	8214667	Anas crecca Linnaeus, 1758	Animalia	Chordata	Aves	Anseriformes	Anatidae	Anas	crecca	SPECIES	Green-winged Teal	ACCEPTED	4fa7b334-ce0d-4e88-aaae-2e0c138d049e	US	12/16/20 12:00	TRUE	FALSE	8214667	8214667	1	44	212	1108	2986	2498056	8214667	Anas crecca	Anas	Anas crecca Linnaeus, 1758	Anas crecca	DWC_ARCHIVE	12/16/20 12:00	6/30/20 8:20	FALSE	USA	United States	USA.5_1	California	USA.5.42_1	Santa Barbara	2019-3-6	FALSE
2724121027	OBS852632011	CC0_1_0	Cornell Lab of Ornithology	CLO	EBIRD	EOD - eBird Observation Dataset	HUMAN_OBSERVATION	URN:catalog:CLO:EBIRD:OBS852632011	OBS852632011	obsr1479168	2	PRESENT	3/6/19 0:00	2019	3	6	US	California	Santa Barbara	Coal Oil Point--Devereux Beach and Sands Beach	34.4071	-119.878	2484597	Regulus calendula (Linnaeus, 1766)	Animalia	Chordata	Aves	Passeriformes	Regulidae	Regulus	calendula	SPECIES	Ruby-crowned Kinglet	ACCEPTED	4fa7b334-ce0d-4e88-aaae-2e0c138d049e	US	12/16/20 12:00	TRUE	FALSE	2484597	2484597	1	44	212	729	5279	2484589	2484597	Regulus calendula	Regulus	Regulus calendula (Linnaeus, 1766)	Regulus calendula	DWC_ARCHIVE	12/16/20 12:00	6/30/20 8:20	FALSE	USA	United States	USA.5_1	California	USA.5.42_1	Santa Barbara	2019-3-6	FALSE
2755553645	OBS720537892	CC0_1_0	Cornell Lab of Ornithology	CLO	EBIRD	EOD - eBird Observation Dataset	HUMAN_OBSERVATION	URN:catalog:CLO:EBIRD:OBS720537892	OBS720537892	obsr933209	5	PRESENT	3/6/19 0:00	2019	3	6	US	California	Santa Barbara	Coal Oil Point--Devereux Beach and Sands Beach	34.4071	-119.878	7982160	Larus canus Linnaeus, 1758	Animalia	Chordata	Aves	Charadriiformes	Laridae	Larus	canus	SPECIES	Mew Gull	ACCEPTED	4fa7b334-ce0d-4e88-aaae-2e0c138d049e	US	12/16/20 12:08	TRUE	FALSE	7982160	7982160	1	44	212	7192402	9316	2481126	7982160	Larus canus	Larus	Larus canus Linnaeus, 1758	Larus canus	DWC_ARCHIVE	12/16/20 12:08	6/30/20 8:20	FALSE	USA	United States	USA.5_1	California	USA.5.42_1	Santa Barbara	2019-3-6	FALSE
2722477697	OBS852631980	CC0_1_0	Cornell Lab of Ornithology	CLO	EBIRD	EOD - eBird Observation Dataset	HUMAN_OBSERVATION	URN:catalog:CLO:EBIRD:OBS852631980	OBS852631980	obsr1479168	4	PRESENT	3/6/19 0:00	2019	3	6	US	California	Santa Barbara	Devereux Slough	34.4136	-119.876	2498257	Aythya affinis (Eyton, 1838)	Animalia	Chordata	Aves	Anseriformes	Anatidae	Aythya	affinis	SPECIES	Lesser Scaup	ACCEPTED	4fa7b334-ce0d-4e88-aaae-2e0c138d049e	US	12/16/20 11:59	TRUE	FALSE	2498257	2498257	1	44	212	1108	2986	2498254	2498257	Aythya affinis	Aythya	Aythya affinis (Eyton, 1838)	Aythya affinis	DWC_ARCHIVE	12/16/20 11:59	6/30/20 8:20	FALSE	USA	United States	USA.5_1	California	USA.5.42_1	Santa Barbara	2019-3-6	FALSE
2742988819	OBS721144843	CC0_1_0	Cornell Lab of Ornithology	CLO	EBIRD	EOD - eBird Observation Dataset	HUMAN_OBSERVATION	URN:catalog:CLO:EBIRD:OBS721144843	OBS721144843	obsr251355	1	PRESENT	3/6/19 0:00	2019	3	6	US	California	Santa Barbara	Devereux Slough	34.4136	-119.876	8214667	Anas crecca Linnaeus, 1758	Animalia	Chordata	Aves	Anseriformes	Anatidae	Anas	crecca	SPECIES	Green-winged Teal	ACCEPTED	4fa7b334-ce0d-4e88-aaae-2e0c138d049e	US	12/16/20 12:07	TRUE	FALSE	8214667	8214667	1	44	212	1108	2986	2498056	8214667	Anas crecca	Anas	Anas crecca Linnaeus, 1758	Anas crecca	DWC_ARCHIVE	12/16/20 12:07	6/30/20 8:20	FALSE	USA	United States	USA.5_1	California	USA.5.42_1	Santa Barbara	2019-3-6	FALSE
2661019698	OBS721540613	CC0_1_0	Cornell Lab of Ornithology	CLO	EBIRD	EOD - eBird Observation Dataset	HUMAN_OBSERVATION	URN:catalog:CLO:EBIRD:OBS721540613	OBS721540613	obsr447864	2	PRESENT	3/7/19 0:00	2019	3	7	US	California	Santa Barbara	Devereux Slough	34.4136	-119.876	8214667	Anas crecca Linnaeus, 1758	Animalia	Chordata	Aves	Anseriformes	Anatidae	Anas	crecca	SPECIES	Green-winged Teal	ACCEPTED	4fa7b334-ce0d-4e88-aaae-2e0c138d049e	US	12/16/20 11:58	TRUE	FALSE	8214667	8214667	1	44	212	1108	2986	2498056	8214667	Anas crecca	Anas	Anas crecca Linnaeus, 1758	Anas crecca	DWC_ARCHIVE	12/16/20 11:58	6/30/20 8:20	FALSE	USA	United States	USA.5_1	California	USA.5.42_1	Santa Barbara	2019-3-7	FALSE
2669184751	OBS721540617	CC0_1_0	Cornell Lab of Ornithology	CLO	EBIRD	EOD - eBird Observation Dataset	HUMAN_OBSERVATION	URN:catalog:CLO:EBIRD:OBS721540617	OBS721540617	obsr447864	1	PRESENT	3/7/19 0:00	2019	3	7	US	California	Santa Barbara	Devereux Slough	34.4136	-119.876	2498257	Aythya affinis (Eyton, 1838)	Animalia	Chordata	Aves	Anseriformes	Anatidae	Aythya	affinis	SPECIES	Lesser Scaup	ACCEPTED	4fa7b334-ce0d-4e88-aaae-2e0c138d049e	US	12/16/20 12:17	TRUE	FALSE	2498257	2498257	1	44	212	1108	2986	2498254	2498257	Aythya affinis	Aythya	Aythya affinis (Eyton, 1838)	Aythya affinis	DWC_ARCHIVE	12/16/20 12:17	6/30/20 8:20	FALSE	USA	United States	USA.5_1	California	USA.5.42_1	Santa Barbara	2019-3-7	FALSE
2659257551	OBS721541246	CC0_1_0	Cornell Lab of Ornithology	CLO	EBIRD	EOD - eBird Observation Dataset	HUMAN_OBSERVATION	URN:catalog:CLO:EBIRD:OBS721541246	OBS721541246	obsr447864	2	PRESENT	3/7/19 0:00	2019	3	7	US	California	Santa Barbara	Dune Pond at COPR	34.4137	-119.882	2482059	Podiceps auritus (Linnaeus, 1758)	Animalia	Chordata	Aves	Podicipediformes	Podicipedidae	Podiceps	auritus	SPECIES	Horned Grebe	ACCEPTED	4fa7b334-ce0d-4e88-aaae-2e0c138d049e	US	12/16/20 12:17	TRUE	FALSE	2482059	2482059	1	44	212	7191588	9338	2482049	2482059	Podiceps auritus	Podiceps	Podiceps auritus (Linnaeus, 1758)	Podiceps auritus	DWC_ARCHIVE	12/16/20 12:17	6/30/20 8:20	FALSE	USA	United States	USA.5_1	California	USA.5.42_1	Santa Barbara	2019-3-7	FALSE
2665357900	OBS732234258	CC0_1_0	Cornell Lab of Ornithology	CLO	EBIRD	EOD - eBird Observation Dataset	HUMAN_OBSERVATION	URN:catalog:CLO:EBIRD:OBS732234258	OBS732234258	obsr420881	32	PRESENT	4/1/19 0:00	2019	4	1	US	California	Santa Barbara	Coal Oil Point--Devereux Beach and Sands Beach	34.4071	-119.878	2481955	Gavia pacifica (Lawrence, 1858)	Animalia	Chordata	Aves	Gaviiformes	Gaviidae	Gavia	pacifica	SPECIES	Pacific Loon	ACCEPTED	4fa7b334-ce0d-4e88-aaae-2e0c138d049e	US	12/16/20 11:58	TRUE	FALSE	2481955	2481955	1	44	212	7192754	9312	2481954	2481955	Gavia pacifica	Gavia	Gavia pacifica (Lawrence, 1858)	Gavia pacifica	DWC_ARCHIVE	12/16/20 11:58	6/30/20 8:20	FALSE	USA	United States	USA.5_1	California	USA.5.42_1	Santa Barbara	2019-4-1	TRUE
2664432550	OBS732234251	CC0_1_0	Cornell Lab of Ornithology	CLO	EBIRD	EOD - eBird Observation Dataset	HUMAN_OBSERVATION	URN:catalog:CLO:EBIRD:OBS732234251	OBS732234251	obsr420881	1	PRESENT	4/1/19 0:00	2019	4	1	US	California	Santa Barbara	Coal Oil Point--Devereux Beach and Sands Beach	34.4071	-119.878	2481958	Gavia stellata (Pontoppidan, 1763)	Animalia	Chordata	Aves	Gaviiformes	Gaviidae	Gavia	stellata	SPECIES	Red-throated Loon	ACCEPTED	4fa7b334-ce0d-4e88-aaae-2e0c138d049e	US	12/16/20 11:59	TRUE	FALSE	2481958	2481958	1	44	212	7192754	9312	2481954	2481958	Gavia stellata	Gavia	Gavia stellata (Pontoppidan, 1763)	Gavia stellata	DWC_ARCHIVE	12/16/20 11:59	6/30/20 8:20	FALSE	USA	United States	USA.5_1	California	USA.5.42_1	Santa Barbara	2019-4-1	TRUE
2777087740	OBS737288792	CC0_1_0	Cornell Lab of Ornithology	CLO	EBIRD	EOD - eBird Observation Dataset	HUMAN_OBSERVATION	URN:catalog:CLO:EBIRD:OBS737288792	OBS737288792	obsr420881	1	PRESENT	4/10/19 0:00	2019	4	10	US	California	Santa Barbara	Devereux Slough	34.4136	-119.876	9740253	Accipiter striatus Vieillot, 1808	Animalia	Chordata	Aves	Accipitriformes	Accipitridae	Accipiter	striatus	SPECIES	Sharp-shinned Hawk	ACCEPTED	4fa7b334-ce0d-4e88-aaae-2e0c138d049e	US	12/16/20 12:08	TRUE	FALSE	9740253	9740253	1	44	212	7191147	2877	9405810	9740253	Accipiter striatus	Accipiter	Accipiter striatus Vieillot, 1808	Accipiter striatus	DWC_ARCHIVE	12/16/20 12:08	6/30/20 8:20	FALSE	USA	United States	USA.5_1	California	USA.5.42_1	Santa Barbara	2019-4-10	TRUE
2675019858	OBS739898602	CC0_1_0	Cornell Lab of Ornithology	CLO	EBIRD	EOD - eBird Observation Dataset	HUMAN_OBSERVATION	URN:catalog:CLO:EBIRD:OBS739898602	OBS739898602	obsr302151	1	PRESENT	4/16/19 0:00	2019	4	16	US	California	Santa Barbara	Devereux Slough	34.4136	-119.876	6065818	Chroicocephalus philadelphia (Ord, 1815)	Animalia	Chordata	Aves	Charadriiformes	Laridae	Chroicocephalus	philadelphia	SPECIES	Bonaparte's Gull	ACCEPTED	4fa7b334-ce0d-4e88-aaae-2e0c138d049e	US	12/16/20 11:59	TRUE	FALSE	6065818	6065818	1	44	212	7192402	9316	4848452	6065818	Chroicocephalus philadelphia	Chroicocephalus	Chroicocephalus philadelphia (Ord, 1815)	Chroicocephalus philadelphia	DWC_ARCHIVE	12/16/20 11:59	6/30/20 8:20	FALSE	USA	United States	USA.5_1	California	USA.5.42_1	Santa Barbara	2019-4-16	TRUE
2667123842	OBS743089054	CC0_1_0	Cornell Lab of Ornithology	CLO	EBIRD	EOD - eBird Observation Dataset	HUMAN_OBSERVATION	URN:catalog:CLO:EBIRD:OBS743089054	OBS743089054	obsr420881	14	PRESENT	4/16/19 0:00	2019	4	16	US	California	Santa Barbara	Devereux Slough	34.4136	-119.876	6065818	Chroicocephalus philadelphia (Ord, 1815)	Animalia	Chordata	Aves	Charadriiformes	Laridae	Chroicocephalus	philadelphia	SPECIES	Bonaparte's Gull	ACCEPTED	4fa7b334-ce0d-4e88-aaae-2e0c138d049e	US	12/16/20 12:17	TRUE	FALSE	6065818	6065818	1	44	212	7192402	9316	4848452	6065818	Chroicocephalus philadelphia	Chroicocephalus	Chroicocephalus philadelphia (Ord, 1815)	Chroicocephalus philadelphia	DWC_ARCHIVE	12/16/20 12:17	6/30/20 8:20	FALSE	USA	United States	USA.5_1	California	USA.5.42_1	Santa Barbara	2019-4-16	TRUE
2749685078	OBS740065845	CC0_1_0	Cornell Lab of Ornithology	CLO	EBIRD	EOD - eBird Observation Dataset	HUMAN_OBSERVATION	URN:catalog:CLO:EBIRD:OBS740065845	OBS740065845	obsr933209	1	PRESENT	4/17/19 0:00	2019	4	17	US	California	Santa Barbara	Coal Oil Point--Devereux Beach and Sands Beach	34.4071	-119.878	2487446	Vireo gilvus (Vieillot, 1808)	Animalia	Chordata	Aves	Passeriformes	Vireonidae	Vireo	gilvus	SPECIES	Warbling Vireo	ACCEPTED	4fa7b334-ce0d-4e88-aaae-2e0c138d049e	US	12/16/20 12:08	TRUE	FALSE	2487446	2487446	1	44	212	729	9358	2487406	2487446	Vireo gilvus	Vireo	Vireo gilvus (Vieillot, 1808)	Vireo gilvus	DWC_ARCHIVE	12/16/20 12:08	6/30/20 8:20	FALSE	USA	United States	USA.5_1	California	USA.5.42_1	Santa Barbara	2019-4-17	FALSE
2736668212	OBS740065823	CC0_1_0	Cornell Lab of Ornithology	CLO	EBIRD	EOD - eBird Observation Dataset	HUMAN_OBSERVATION	URN:catalog:CLO:EBIRD:OBS740065823	OBS740065823	obsr933209	1	PRESENT	4/17/19 0:00	2019	4	17	US	California	Santa Barbara	Coal Oil Point--Devereux Beach and Sands Beach	34.4071	-119.878	2482032	Aechmophorus clarkii (Lawrence, 1858)	Animalia	Chordata	Aves	Podicipediformes	Podicipedidae	Aechmophorus	clarkii	SPECIES	Clark's Grebe	ACCEPTED	4fa7b334-ce0d-4e88-aaae-2e0c138d049e	US	12/16/20 12:07	TRUE	FALSE	2482032	2482032	1	44	212	7191588	9338	2482031	2482032	Aechmophorus clarkii	Aechmophorus	Aechmophorus clarkii (Lawrence, 1858)	Aechmophorus clarkii	DWC_ARCHIVE	12/16/20 12:07	6/30/20 8:20	FALSE	USA	United States	USA.5_1	California	USA.5.42_1	Santa Barbara	2019-4-17	FALSE
2755898290	OBS740065817	CC0_1_0	Cornell Lab of Ornithology	CLO	EBIRD	EOD - eBird Observation Dataset	HUMAN_OBSERVATION	URN:catalog:CLO:EBIRD:OBS740065817	OBS740065817	obsr933209	2	PRESENT	4/17/19 0:00	2019	4	17	US	California	Santa Barbara	Coal Oil Point--Devereux Beach and Sands Beach	34.4071	-119.878	2498246	Melanitta perspicillata (Linnaeus, 1758)	Animalia	Chordata	Aves	Anseriformes	Anatidae	Melanitta	perspicillata	SPECIES	Surf Scoter	ACCEPTED	4fa7b334-ce0d-4e88-aaae-2e0c138d049e	US	12/16/20 12:07	TRUE	FALSE	2498246	2498246	1	44	212	1108	2986	2498237	2498246	Melanitta perspicillata	Melanitta	Melanitta perspicillata (Linnaeus, 1758)	Melanitta perspicillata	DWC_ARCHIVE	12/16/20 12:07	6/30/20 8:20	FALSE	USA	United States	USA.5_1	California	USA.5.42_1	Santa Barbara	2019-4-17	FALSE
2760819153	OBS740065853	CC0_1_0	Cornell Lab of Ornithology	CLO	EBIRD	EOD - eBird Observation Dataset	HUMAN_OBSERVATION	URN:catalog:CLO:EBIRD:OBS740065853	OBS740065853	obsr933209	1	PRESENT	4/17/19 0:00	2019	4	17	US	California	Santa Barbara	Coal Oil Point--Devereux Beach and Sands Beach	34.4071	-119.878	5232446	Branta bernicla (Linnaeus, 1758)	Animalia	Chordata	Aves	Anseriformes	Anatidae	Branta	bernicla	SPECIES	Brant	ACCEPTED	4fa7b334-ce0d-4e88-aaae-2e0c138d049e	US	12/16/20 12:08	TRUE	FALSE	5232446	5232446	1	44	212	1108	2986	2498190	5232446	Branta bernicla	Branta	Branta bernicla (Linnaeus, 1758)	Branta bernicla	DWC_ARCHIVE	12/16/20 12:08	6/30/20 8:20	FALSE	USA	United States	USA.5_1	California	USA.5.42_1	Santa Barbara	2019-4-17	FALSE
2771324177	OBS740065851	CC0_1_0	Cornell Lab of Ornithology	CLO	EBIRD	EOD - eBird Observation Dataset	HUMAN_OBSERVATION	URN:catalog:CLO:EBIRD:OBS740065851	OBS740065851	obsr933209	10	PRESENT	4/17/19 0:00	2019	4	17	US	California	Santa Barbara	Coal Oil Point--Devereux Beach and Sands Beach	34.4071	-119.878	2481962	Gavia immer (Brunnich, 1764)	Animalia	Chordata	Aves	Gaviiformes	Gaviidae	Gavia	immer	SPECIES	Common Loon	ACCEPTED	4fa7b334-ce0d-4e88-aaae-2e0c138d049e	US	12/16/20 12:08	TRUE	FALSE	2481962	2481962	1	44	212	7192754	9312	2481954	2481962	Gavia immer	Gavia	Gavia immer (Brunnich, 1764)	Gavia immer	DWC_ARCHIVE	12/16/20 12:08	6/30/20 8:20	FALSE	USA	United States	USA.5_1	California	USA.5.42_1	Santa Barbara	2019-4-17	FALSE
2749066999	OBS740065833	CC0_1_0	Cornell Lab of Ornithology	CLO	EBIRD	EOD - eBird Observation Dataset	HUMAN_OBSERVATION	URN:catalog:CLO:EBIRD:OBS740065833	OBS740065833	obsr933209	1	PRESENT	4/17/19 0:00	2019	4	17	US	California	Santa Barbara	Coal Oil Point--Devereux Beach and Sands Beach	34.4071	-119.878	5230754	Tachycineta thalassina (Swainson, 1827)	Animalia	Chordata	Aves	Passeriformes	Hirundinidae	Tachycineta	thalassina	SPECIES	Violet-green Swallow	ACCEPTED	4fa7b334-ce0d-4e88-aaae-2e0c138d049e	US	12/16/20 12:08	TRUE	FALSE	5230754	5230754	1	44	212	729	5248	2489178	5230754	Tachycineta thalassina	Tachycineta	Tachycineta thalassina (Swainson, 1827)	Tachycineta thalassina	DWC_ARCHIVE	12/16/20 12:08	6/30/20 8:20	FALSE	USA	United States	USA.5_1	California	USA.5.42_1	Santa Barbara	2019-4-17	FALSE
2754183150	OBS740065855	CC0_1_0	Cornell Lab of Ornithology	CLO	EBIRD	EOD - eBird Observation Dataset	HUMAN_OBSERVATION	URN:catalog:CLO:EBIRD:OBS740065855	OBS740065855	obsr933209	1	PRESENT	4/17/19 0:00	2019	4	17	US	California	Santa Barbara	Coal Oil Point--Devereux Beach and Sands Beach	34.4071	-119.878	2481958	Gavia stellata (Pontoppidan, 1763)	Animalia	Chordata	Aves	Gaviiformes	Gaviidae	Gavia	stellata	SPECIES	Red-throated Loon	ACCEPTED	4fa7b334-ce0d-4e88-aaae-2e0c138d049e	US	12/16/20 12:08	TRUE	FALSE	2481958	2481958	1	44	212	7192754	9312	2481954	2481958	Gavia stellata	Gavia	Gavia stellata (Pontoppidan, 1763)	Gavia stellata	DWC_ARCHIVE	12/16/20 12:08	6/30/20 8:20	FALSE	USA	United States	USA.5_1	California	USA.5.42_1	Santa Barbara	2019-4-17	FALSE
2738492093	OBS740065827	CC0_1_0	Cornell Lab of Ornithology	CLO	EBIRD	EOD - eBird Observation Dataset	HUMAN_OBSERVATION	URN:catalog:CLO:EBIRD:OBS740065827	OBS740065827	obsr933209	4000	PRESENT	4/17/19 0:00	2019	4	17	US	California	Santa Barbara	Coal Oil Point--Devereux Beach and Sands Beach	34.4071	-119.878	2481955	Gavia pacifica (Lawrence, 1858)	Animalia	Chordata	Aves	Gaviiformes	Gaviidae	Gavia	pacifica	SPECIES	Pacific Loon	ACCEPTED	4fa7b334-ce0d-4e88-aaae-2e0c138d049e	US	12/16/20 12:07	TRUE	FALSE	2481955	2481955	1	44	212	7192754	9312	2481954	2481955	Gavia pacifica	Gavia	Gavia pacifica (Lawrence, 1858)	Gavia pacifica	DWC_ARCHIVE	12/16/20 12:07	6/30/20 8:20	FALSE	USA	United States	USA.5_1	California	USA.5.42_1	Santa Barbara	2019-4-17	FALSE
2759327140	OBS794313336	CC0_1_0	Cornell Lab of Ornithology	CLO	EBIRD	EOD - eBird Observation Dataset	HUMAN_OBSERVATION	URN:catalog:CLO:EBIRD:OBS794313336	OBS794313336	obsr689353	3	PRESENT	4/18/19 0:00	2019	4	18	US	California	Santa Barbara	Dune Pond at COPR	34.4137	-119.882	9476062	Quiscalus mexicanus (Gmelin, 1788)	Animalia	Chordata	Aves	Passeriformes	Icteridae	Quiscalus	mexicanus	SPECIES	Great-tailed Grackle	ACCEPTED	4fa7b334-ce0d-4e88-aaae-2e0c138d049e	US	12/16/20 12:08	TRUE	FALSE	9476062	9476062	1	44	212	729	6176	2484132	9476062	Quiscalus mexicanus	Quiscalus	Quiscalus mexicanus (Gmelin, 1788)	Quiscalus mexicanus	DWC_ARCHIVE	12/16/20 12:08	6/30/20 8:20	FALSE	USA	United States	USA.5_1	California	USA.5.42_1	Santa Barbara	2019-4-18	FALSE
2743610822	OBS741480425	CC0_1_0	Cornell Lab of Ornithology	CLO	EBIRD	EOD - eBird Observation Dataset	HUMAN_OBSERVATION	URN:catalog:CLO:EBIRD:OBS741480425	OBS741480425	obsr111092	3	PRESENT	4/18/19 0:00	2019	4	18	US	California	Santa Barbara	Dune Pond at COPR	34.4137	-119.882	9476062	Quiscalus mexicanus (Gmelin, 1788)	Animalia	Chordata	Aves	Passeriformes	Icteridae	Quiscalus	mexicanus	SPECIES	Great-tailed Grackle	ACCEPTED	4fa7b334-ce0d-4e88-aaae-2e0c138d049e	US	12/16/20 12:08	TRUE	FALSE	9476062	9476062	1	44	212	729	6176	2484132	9476062	Quiscalus mexicanus	Quiscalus	Quiscalus mexicanus (Gmelin, 1788)	Quiscalus mexicanus	DWC_ARCHIVE	12/16/20 12:08	6/30/20 8:20	FALSE	USA	United States	USA.5_1	California	USA.5.42_1	Santa Barbara	2019-4-18	TRUE
2688594088	OBS741176647	CC0_1_0	Cornell Lab of Ornithology	CLO	EBIRD	EOD - eBird Observation Dataset	HUMAN_OBSERVATION	URN:catalog:CLO:EBIRD:OBS741176647	OBS741176647	obsr933209	2	PRESENT	4/19/19 0:00	2019	4	19	US	California	Santa Barbara	Devereux Slough	34.4136	-119.876	2491651	Chondestes grammacus (Say, 1822)	Animalia	Chordata	Aves	Passeriformes	Emberizidae	Chondestes	grammacus	SPECIES	Lark Sparrow	ACCEPTED	4fa7b334-ce0d-4e88-aaae-2e0c138d049e	US	12/16/20 11:58	TRUE	FALSE	2491651	2491651	1	44	212	729	9608	2491650	2491651	Chondestes grammacus	Chondestes	Chondestes grammacus (Say, 1822)	Chondestes grammacus	DWC_ARCHIVE	12/16/20 11:58	6/30/20 8:20	FALSE	USA	United States	USA.5_1	California	USA.5.42_1	Santa Barbara	2019-4-19	FALSE
2684521118	OBS741176643	CC0_1_0	Cornell Lab of Ornithology	CLO	EBIRD	EOD - eBird Observation Dataset	HUMAN_OBSERVATION	URN:catalog:CLO:EBIRD:OBS741176643	OBS741176643	obsr933209	1	PRESENT	4/19/19 0:00	2019	4	19	US	California	Santa Barbara	Devereux Slough	34.4136	-119.876	6065818	Chroicocephalus philadelphia (Ord, 1815)	Animalia	Chordata	Aves	Charadriiformes	Laridae	Chroicocephalus	philadelphia	SPECIES	Bonaparte's Gull	ACCEPTED	4fa7b334-ce0d-4e88-aaae-2e0c138d049e	US	12/16/20 11:58	TRUE	FALSE	6065818	6065818	1	44	212	7192402	9316	4848452	6065818	Chroicocephalus philadelphia	Chroicocephalus	Chroicocephalus philadelphia (Ord, 1815)	Chroicocephalus philadelphia	DWC_ARCHIVE	12/16/20 11:58	6/30/20 8:20	FALSE	USA	United States	USA.5_1	California	USA.5.42_1	Santa Barbara	2019-4-19	FALSE
2750829961	OBS732915366	CC0_1_0	Cornell Lab of Ornithology	CLO	EBIRD	EOD - eBird Observation Dataset	HUMAN_OBSERVATION	URN:catalog:CLO:EBIRD:OBS732915366	OBS732915366	obsr100639	1	PRESENT	4/2/19 0:00	2019	4	2	US	California	Santa Barbara	Coal Oil Point--Devereux Beach and Sands Beach	34.4071	-119.878	7964835	Calidris virgata	Animalia	Chordata	Aves	Charadriiformes	Scolopacidae	Calidris	virgata	SPECIES	Surfbird	ACCEPTED	4fa7b334-ce0d-4e88-aaae-2e0c138d049e	US	12/16/20 12:08	TRUE	FALSE	7964835	7964835	1	44	212	7192402	5282	2481739	7964835	Calidris virgata	Calidris	Calidris virgata	Calidris virgata	DWC_ARCHIVE	12/16/20 12:08	6/30/20 8:20	FALSE	USA	United States	USA.5_1	California	USA.5.42_1	Santa Barbara	2019-4-2	FALSE
2771925346	OBS739269071	CC0_1_0	Cornell Lab of Ornithology	CLO	EBIRD	EOD - eBird Observation Dataset	HUMAN_OBSERVATION	URN:catalog:CLO:EBIRD:OBS739269071	OBS739269071	obsr605751	2	PRESENT	4/2/19 0:00	2019	4	2	US	California	Santa Barbara	Coal Oil Point--Devereux Beach and Sands Beach	34.4071	-119.878	2490263	Anthus rubescens (Tunstall, 1771)	Animalia	Chordata	Aves	Passeriformes	Motacillidae	Anthus	rubescens	SPECIES	American Pipit	ACCEPTED	4fa7b334-ce0d-4e88-aaae-2e0c138d049e	US	12/16/20 12:08	TRUE	FALSE	2490263	2490263	1	44	212	729	5257	2490241	2490263	Anthus rubescens	Anthus	Anthus rubescens (Tunstall, 1771)	Anthus rubescens	DWC_ARCHIVE	12/16/20 12:08	6/30/20 8:20	FALSE	USA	United States	USA.5_1	California	USA.5.42_1	Santa Barbara	2019-4-2	FALSE
2751670728	OBS739269059	CC0_1_0	Cornell Lab of Ornithology	CLO	EBIRD	EOD - eBird Observation Dataset	HUMAN_OBSERVATION	URN:catalog:CLO:EBIRD:OBS739269059	OBS739269059	obsr605751	2	PRESENT	4/2/19 0:00	2019	4	2	US	California	Santa Barbara	Coal Oil Point--Devereux Beach and Sands Beach	34.4071	-119.878	2482033	Aechmophorus occidentalis (Lawrence, 1858)	Animalia	Chordata	Aves	Podicipediformes	Podicipedidae	Aechmophorus	occidentalis	SPECIES	Western Grebe	ACCEPTED	4fa7b334-ce0d-4e88-aaae-2e0c138d049e	US	12/16/20 12:07	TRUE	FALSE	2482033	2482033	1	44	212	7191588	9338	2482031	2482033	Aechmophorus occidentalis	Aechmophorus	Aechmophorus occidentalis (Lawrence, 1858)	Aechmophorus occidentalis	DWC_ARCHIVE	12/16/20 12:07	6/30/20 8:20	FALSE	USA	United States	USA.5_1	California	USA.5.42_1	Santa Barbara	2019-4-2	FALSE
2760891552	OBS739269069	CC0_1_0	Cornell Lab of Ornithology	CLO	EBIRD	EOD - eBird Observation Dataset	HUMAN_OBSERVATION	URN:catalog:CLO:EBIRD:OBS739269069	OBS739269069	obsr605751	4	PRESENT	4/2/19 0:00	2019	4	2	US	California	Santa Barbara	Coal Oil Point--Devereux Beach and Sands Beach	34.4071	-119.878	2484597	Regulus calendula (Linnaeus, 1766)	Animalia	Chordata	Aves	Passeriformes	Regulidae	Regulus	calendula	SPECIES	Ruby-crowned Kinglet	ACCEPTED	4fa7b334-ce0d-4e88-aaae-2e0c138d049e	US	12/16/20 12:10	TRUE	FALSE	2484597	2484597	1	44	212	729	5279	2484589	2484597	Regulus calendula	Regulus	Regulus calendula (Linnaeus, 1766)	Regulus calendula	DWC_ARCHIVE	12/16/20 12:10	6/30/20 8:20	FALSE	USA	United States	USA.5_1	California	USA.5.42_1	Santa Barbara	2019-4-2	FALSE
2680798442	OBS739269091	CC0_1_0	Cornell Lab of Ornithology	CLO	EBIRD	EOD - eBird Observation Dataset	HUMAN_OBSERVATION	URN:catalog:CLO:EBIRD:OBS739269091	OBS739269091	obsr605751	3	PRESENT	4/2/19 0:00	2019	4	2	US	California	Santa Barbara	Coal Oil Point--Devereux Beach and Sands Beach	34.4071	-119.878	2498257	Aythya affinis (Eyton, 1838)	Animalia	Chordata	Aves	Anseriformes	Anatidae	Aythya	affinis	SPECIES	Lesser Scaup	ACCEPTED	4fa7b334-ce0d-4e88-aaae-2e0c138d049e	US	12/16/20 12:18	TRUE	FALSE	2498257	2498257	1	44	212	1108	2986	2498254	2498257	Aythya affinis	Aythya	Aythya affinis (Eyton, 1838)	Aythya affinis	DWC_ARCHIVE	12/16/20 12:18	6/30/20 8:20	FALSE	USA	United States	USA.5_1	California	USA.5.42_1	Santa Barbara	2019-4-2	FALSE
2668060431	OBS741865927	CC0_1_0	Cornell Lab of Ornithology	CLO	EBIRD	EOD - eBird Observation Dataset	HUMAN_OBSERVATION	URN:catalog:CLO:EBIRD:OBS741865927	OBS741865927	obsr172576	6	PRESENT	4/20/19 0:00	2019	4	20	US	California	Santa Barbara	Coal Oil Point--Devereux Beach and Sands Beach	34.4071	-119.878	2481962	Gavia immer (Brunnich, 1764)	Animalia	Chordata	Aves	Gaviiformes	Gaviidae	Gavia	immer	SPECIES	Common Loon	ACCEPTED	4fa7b334-ce0d-4e88-aaae-2e0c138d049e	US	12/16/20 12:18	TRUE	FALSE	2481962	2481962	1	44	212	7192754	9312	2481954	2481962	Gavia immer	Gavia	Gavia immer (Brunnich, 1764)	Gavia immer	DWC_ARCHIVE	12/16/20 12:18	6/30/20 8:20	FALSE	USA	United States	USA.5_1	California	USA.5.42_1	Santa Barbara	2019-4-20	FALSE
2745076251	OBS742801067	CC0_1_0	Cornell Lab of Ornithology	CLO	EBIRD	EOD - eBird Observation Dataset	HUMAN_OBSERVATION	URN:catalog:CLO:EBIRD:OBS742801067	OBS742801067	obsr1321639	6	PRESENT	4/21/19 0:00	2019	4	21	US	California	Santa Barbara	Coal Oil Point--Devereux Beach and Sands Beach	34.4071	-119.878	5229247	Sterna forsteri Nuttall, 1834	Animalia	Chordata	Aves	Charadriiformes	Laridae	Sterna	forsteri	SPECIES	Forster's Tern	ACCEPTED	4fa7b334-ce0d-4e88-aaae-2e0c138d049e	US	12/16/20 11:57	TRUE	FALSE	5229247	5229247	1	44	212	7192402	9316	2481227	5229247	Sterna forsteri	Sterna	Sterna forsteri Nuttall, 1834	Sterna forsteri	DWC_ARCHIVE	12/16/20 11:57	6/30/20 8:20	FALSE	USA	United States	USA.5_1	California	USA.5.42_1	Santa Barbara	2019-4-21	FALSE
2671760639	OBS743089475	CC0_1_0	Cornell Lab of Ornithology	CLO	EBIRD	EOD - eBird Observation Dataset	HUMAN_OBSERVATION	URN:catalog:CLO:EBIRD:OBS743089475	OBS743089475	obsr420881	1	PRESENT	4/21/19 0:00	2019	4	21	US	California	Santa Barbara	Devereux Slough	34.4136	-119.876	5229247	Sterna forsteri Nuttall, 1834	Animalia	Chordata	Aves	Charadriiformes	Laridae	Sterna	forsteri	SPECIES	Forster's Tern	ACCEPTED	4fa7b334-ce0d-4e88-aaae-2e0c138d049e	US	12/16/20 12:18	TRUE	FALSE	5229247	5229247	1	44	212	7192402	9316	2481227	5229247	Sterna forsteri	Sterna	Sterna forsteri Nuttall, 1834	Sterna forsteri	DWC_ARCHIVE	12/16/20 12:18	6/30/20 8:20	FALSE	USA	United States	USA.5_1	California	USA.5.42_1	Santa Barbara	2019-4-21	TRUE
2773073726	OBS744151756	CC0_1_0	Cornell Lab of Ornithology	CLO	EBIRD	EOD - eBird Observation Dataset	HUMAN_OBSERVATION	URN:catalog:CLO:EBIRD:OBS744151756	OBS744151756	obsr933209	1	PRESENT	4/24/19 0:00	2019	4	24	US	California	Santa Barbara	Coal Oil Point--Devereux Beach and Sands Beach	34.4071	-119.878	2481958	Gavia stellata (Pontoppidan, 1763)	Animalia	Chordata	Aves	Gaviiformes	Gaviidae	Gavia	stellata	SPECIES	Red-throated Loon	ACCEPTED	4fa7b334-ce0d-4e88-aaae-2e0c138d049e	US	12/16/20 12:08	TRUE	FALSE	2481958	2481958	1	44	212	7192754	9312	2481954	2481958	Gavia stellata	Gavia	Gavia stellata (Pontoppidan, 1763)	Gavia stellata	DWC_ARCHIVE	12/16/20 12:08	6/30/20 8:20	FALSE	USA	United States	USA.5_1	California	USA.5.42_1	Santa Barbara	2019-4-24	FALSE
2755306710	OBS744151771	CC0_1_0	Cornell Lab of Ornithology	CLO	EBIRD	EOD - eBird Observation Dataset	HUMAN_OBSERVATION	URN:catalog:CLO:EBIRD:OBS744151771	OBS744151771	obsr933209	10	PRESENT	4/24/19 0:00	2019	4	24	US	California	Santa Barbara	Coal Oil Point--Devereux Beach and Sands Beach	34.4071	-119.878	2482033	Aechmophorus occidentalis (Lawrence, 1858)	Animalia	Chordata	Aves	Podicipediformes	Podicipedidae	Aechmophorus	occidentalis	SPECIES	Western Grebe	ACCEPTED	4fa7b334-ce0d-4e88-aaae-2e0c138d049e	US	12/16/20 12:08	TRUE	FALSE	2482033	2482033	1	44	212	7191588	9338	2482031	2482033	Aechmophorus occidentalis	Aechmophorus	Aechmophorus occidentalis (Lawrence, 1858)	Aechmophorus occidentalis	DWC_ARCHIVE	12/16/20 12:08	6/30/20 8:20	FALSE	USA	United States	USA.5_1	California	USA.5.42_1	Santa Barbara	2019-4-24	FALSE
2772579593	OBS744151774	CC0_1_0	Cornell Lab of Ornithology	CLO	EBIRD	EOD - eBird Observation Dataset	HUMAN_OBSERVATION	URN:catalog:CLO:EBIRD:OBS744151774	OBS744151774	obsr933209	80	PRESENT	4/24/19 0:00	2019	4	24	US	California	Santa Barbara	Coal Oil Point--Devereux Beach and Sands Beach	34.4071	-119.878	5232446	Branta bernicla (Linnaeus, 1758)	Animalia	Chordata	Aves	Anseriformes	Anatidae	Branta	bernicla	SPECIES	Brant	ACCEPTED	4fa7b334-ce0d-4e88-aaae-2e0c138d049e	US	12/16/20 12:08	TRUE	FALSE	5232446	5232446	1	44	212	1108	2986	2498190	5232446	Branta bernicla	Branta	Branta bernicla (Linnaeus, 1758)	Branta bernicla	DWC_ARCHIVE	12/16/20 12:08	6/30/20 8:20	FALSE	USA	United States	USA.5_1	California	USA.5.42_1	Santa Barbara	2019-4-24	FALSE
2752545775	OBS744151777	CC0_1_0	Cornell Lab of Ornithology	CLO	EBIRD	EOD - eBird Observation Dataset	HUMAN_OBSERVATION	URN:catalog:CLO:EBIRD:OBS744151777	OBS744151777	obsr933209	1	PRESENT	4/24/19 0:00	2019	4	24	US	California	Santa Barbara	Coal Oil Point--Devereux Beach and Sands Beach	34.4071	-119.878	2481962	Gavia immer (Brunnich, 1764)	Animalia	Chordata	Aves	Gaviiformes	Gaviidae	Gavia	immer	SPECIES	Common Loon	ACCEPTED	4fa7b334-ce0d-4e88-aaae-2e0c138d049e	US	12/16/20 12:08	TRUE	FALSE	2481962	2481962	1	44	212	7192754	9312	2481954	2481962	Gavia immer	Gavia	Gavia immer (Brunnich, 1764)	Gavia immer	DWC_ARCHIVE	12/16/20 12:08	6/30/20 8:20	FALSE	USA	United States	USA.5_1	California	USA.5.42_1	Santa Barbara	2019-4-24	FALSE
2749841843	OBS745467327	CC0_1_0	Cornell Lab of Ornithology	CLO	EBIRD	EOD - eBird Observation Dataset	HUMAN_OBSERVATION	URN:catalog:CLO:EBIRD:OBS745467327	OBS745467327	obsr605751	1	PRESENT	4/24/19 0:00	2019	4	24	US	California	Santa Barbara	Coal Oil Point--Devereux Beach and Sands Beach	34.4071	-119.878	2484597	Regulus calendula (Linnaeus, 1766)	Animalia	Chordata	Aves	Passeriformes	Regulidae	Regulus	calendula	SPECIES	Ruby-crowned Kinglet	ACCEPTED	4fa7b334-ce0d-4e88-aaae-2e0c138d049e	US	12/16/20 12:07	TRUE	FALSE	2484597	2484597	1	44	212	729	5279	2484589	2484597	Regulus calendula	Regulus	Regulus calendula (Linnaeus, 1766)	Regulus calendula	DWC_ARCHIVE	12/16/20 12:07	6/30/20 8:20	FALSE	USA	United States	USA.5_1	California	USA.5.42_1	Santa Barbara	2019-4-24	FALSE
2744596836	OBS744151757	CC0_1_0	Cornell Lab of Ornithology	CLO	EBIRD	EOD - eBird Observation Dataset	HUMAN_OBSERVATION	URN:catalog:CLO:EBIRD:OBS744151757	OBS744151757	obsr933209	1	PRESENT	4/24/19 0:00	2019	4	24	US	California	Santa Barbara	Coal Oil Point--Devereux Beach and Sands Beach	34.4071	-119.878	2482032	Aechmophorus clarkii (Lawrence, 1858)	Animalia	Chordata	Aves	Podicipediformes	Podicipedidae	Aechmophorus	clarkii	SPECIES	Clark's Grebe	ACCEPTED	4fa7b334-ce0d-4e88-aaae-2e0c138d049e	US	12/16/20 12:08	TRUE	FALSE	2482032	2482032	1	44	212	7191588	9338	2482031	2482032	Aechmophorus clarkii	Aechmophorus	Aechmophorus clarkii (Lawrence, 1858)	Aechmophorus clarkii	DWC_ARCHIVE	12/16/20 12:08	6/30/20 8:20	FALSE	USA	United States	USA.5_1	California	USA.5.42_1	Santa Barbara	2019-4-24	FALSE
2732185845	OBS744151738	CC0_1_0	Cornell Lab of Ornithology	CLO	EBIRD	EOD - eBird Observation Dataset	HUMAN_OBSERVATION	URN:catalog:CLO:EBIRD:OBS744151738	OBS744151738	obsr933209	5	PRESENT	4/24/19 0:00	2019	4	24	US	California	Santa Barbara	Coal Oil Point--Devereux Beach and Sands Beach	34.4071	-119.878	2481134	Larus delawarensis Ord, 1815	Animalia	Chordata	Aves	Charadriiformes	Laridae	Larus	delawarensis	SPECIES	Ring-billed Gull	ACCEPTED	4fa7b334-ce0d-4e88-aaae-2e0c138d049e	US	12/16/20 12:07	TRUE	FALSE	2481134	2481134	1	44	212	7192402	9316	2481126	2481134	Larus delawarensis	Larus	Larus delawarensis Ord, 1815	Larus delawarensis	DWC_ARCHIVE	12/16/20 12:07	6/30/20 8:20	FALSE	USA	United States	USA.5_1	California	USA.5.42_1	Santa Barbara	2019-4-24	FALSE
2771252663	OBS744151745	CC0_1_0	Cornell Lab of Ornithology	CLO	EBIRD	EOD - eBird Observation Dataset	HUMAN_OBSERVATION	URN:catalog:CLO:EBIRD:OBS744151745	OBS744151745	obsr933209	1	PRESENT	4/24/19 0:00	2019	4	24	US	California	Santa Barbara	Coal Oil Point--Devereux Beach and Sands Beach	34.4071	-119.878	2498246	Melanitta perspicillata (Linnaeus, 1758)	Animalia	Chordata	Aves	Anseriformes	Anatidae	Melanitta	perspicillata	SPECIES	Surf Scoter	ACCEPTED	4fa7b334-ce0d-4e88-aaae-2e0c138d049e	US	12/16/20 12:07	TRUE	FALSE	2498246	2498246	1	44	212	1108	2986	2498237	2498246	Melanitta perspicillata	Melanitta	Melanitta perspicillata (Linnaeus, 1758)	Melanitta perspicillata	DWC_ARCHIVE	12/16/20 12:07	6/30/20 8:20	FALSE	USA	United States	USA.5_1	California	USA.5.42_1	Santa Barbara	2019-4-24	FALSE
2773379814	OBS744151776	CC0_1_0	Cornell Lab of Ornithology	CLO	EBIRD	EOD - eBird Observation Dataset	HUMAN_OBSERVATION	URN:catalog:CLO:EBIRD:OBS744151776	OBS744151776	obsr933209	1000	PRESENT	4/24/19 0:00	2019	4	24	US	California	Santa Barbara	Coal Oil Point--Devereux Beach and Sands Beach	34.4071	-119.878	2481955	Gavia pacifica (Lawrence, 1858)	Animalia	Chordata	Aves	Gaviiformes	Gaviidae	Gavia	pacifica	SPECIES	Pacific Loon	ACCEPTED	4fa7b334-ce0d-4e88-aaae-2e0c138d049e	US	12/16/20 12:08	TRUE	FALSE	2481955	2481955	1	44	212	7192754	9312	2481954	2481955	Gavia pacifica	Gavia	Gavia pacifica (Lawrence, 1858)	Gavia pacifica	DWC_ARCHIVE	12/16/20 12:08	6/30/20 8:20	FALSE	USA	United States	USA.5_1	California	USA.5.42_1	Santa Barbara	2019-4-24	FALSE
2748868806	OBS744151736	CC0_1_0	Cornell Lab of Ornithology	CLO	EBIRD	EOD - eBird Observation Dataset	HUMAN_OBSERVATION	URN:catalog:CLO:EBIRD:OBS744151736	OBS744151736	obsr933209	2	PRESENT	4/24/19 0:00	2019	4	24	US	California	Santa Barbara	Coal Oil Point--Devereux Beach and Sands Beach	34.4071	-119.878	5229247	Sterna forsteri Nuttall, 1834	Animalia	Chordata	Aves	Charadriiformes	Laridae	Sterna	forsteri	SPECIES	Forster's Tern	ACCEPTED	4fa7b334-ce0d-4e88-aaae-2e0c138d049e	US	12/16/20 12:07	TRUE	FALSE	5229247	5229247	1	44	212	7192402	9316	2481227	5229247	Sterna forsteri	Sterna	Sterna forsteri Nuttall, 1834	Sterna forsteri	DWC_ARCHIVE	12/16/20 12:07	6/30/20 8:20	FALSE	USA	United States	USA.5_1	California	USA.5.42_1	Santa Barbara	2019-4-24	FALSE
2689018747	OBS749101815	CC0_1_0	Cornell Lab of Ornithology	CLO	EBIRD	EOD - eBird Observation Dataset	HUMAN_OBSERVATION	URN:catalog:CLO:EBIRD:OBS749101815	OBS749101815	obsr39702	1	PRESENT	4/25/19 0:00	2019	4	25	US	California	Santa Barbara	Devereux Slough	34.4136	-119.876	7341805	Setophaga coronata (Linnaeus, 1766)	Animalia	Chordata	Aves	Passeriformes	Parulidae	Setophaga	coronata	SPECIES	Yellow-rumped Warbler	ACCEPTED	4fa7b334-ce0d-4e88-aaae-2e0c138d049e	US	12/16/20 11:58	TRUE	FALSE	7341805	7341805	1	44	212	729	5263	2489984	7341805	Setophaga coronata	Setophaga	Setophaga coronata (Linnaeus, 1766)	Setophaga coronata	DWC_ARCHIVE	12/16/20 11:58	6/30/20 8:20	FALSE	USA	United States	USA.5_1	California	USA.5.42_1	Santa Barbara	2019-4-25	FALSE
2774667544	OBS745303465	CC0_1_0	Cornell Lab of Ornithology	CLO	EBIRD	EOD - eBird Observation Dataset	HUMAN_OBSERVATION	URN:catalog:CLO:EBIRD:OBS745303465	OBS745303465	obsr34952	3	PRESENT	4/26/19 0:00	2019	4	26	US	California	Santa Barbara	Coal Oil Point--Devereux Beach and Sands Beach	34.4071	-119.878	2482033	Aechmophorus occidentalis (Lawrence, 1858)	Animalia	Chordata	Aves	Podicipediformes	Podicipedidae	Aechmophorus	occidentalis	SPECIES	Western Grebe	ACCEPTED	4fa7b334-ce0d-4e88-aaae-2e0c138d049e	US	12/16/20 12:09	TRUE	FALSE	2482033	2482033	1	44	212	7191588	9338	2482031	2482033	Aechmophorus occidentalis	Aechmophorus	Aechmophorus occidentalis (Lawrence, 1858)	Aechmophorus occidentalis	DWC_ARCHIVE	12/16/20 12:09	6/30/20 8:20	FALSE	USA	United States	USA.5_1	California	USA.5.42_1	Santa Barbara	2019-4-26	FALSE
2754045058	OBS745303448	CC0_1_0	Cornell Lab of Ornithology	CLO	EBIRD	EOD - eBird Observation Dataset	HUMAN_OBSERVATION	URN:catalog:CLO:EBIRD:OBS745303448	OBS745303448	obsr34952	1	PRESENT	4/26/19 0:00	2019	4	26	US	California	Santa Barbara	Coal Oil Point--Devereux Beach and Sands Beach	34.4071	-119.878	2491651	Chondestes grammacus (Say, 1822)	Animalia	Chordata	Aves	Passeriformes	Emberizidae	Chondestes	grammacus	SPECIES	Lark Sparrow	ACCEPTED	4fa7b334-ce0d-4e88-aaae-2e0c138d049e	US	12/16/20 12:08	TRUE	FALSE	2491651	2491651	1	44	212	729	9608	2491650	2491651	Chondestes grammacus	Chondestes	Chondestes grammacus (Say, 1822)	Chondestes grammacus	DWC_ARCHIVE	12/16/20 12:08	6/30/20 8:20	FALSE	USA	United States	USA.5_1	California	USA.5.42_1	Santa Barbara	2019-4-26	FALSE
2766745711	OBS745303431	CC0_1_0	Cornell Lab of Ornithology	CLO	EBIRD	EOD - eBird Observation Dataset	HUMAN_OBSERVATION	URN:catalog:CLO:EBIRD:OBS745303431	OBS745303431	obsr34952	2	PRESENT	4/26/19 0:00	2019	4	26	US	California	Santa Barbara	Coal Oil Point--Devereux Beach and Sands Beach	34.4071	-119.878	2481962	Gavia immer (Brunnich, 1764)	Animalia	Chordata	Aves	Gaviiformes	Gaviidae	Gavia	immer	SPECIES	Common Loon	ACCEPTED	4fa7b334-ce0d-4e88-aaae-2e0c138d049e	US	12/16/20 12:08	TRUE	FALSE	2481962	2481962	1	44	212	7192754	9312	2481954	2481962	Gavia immer	Gavia	Gavia immer (Brunnich, 1764)	Gavia immer	DWC_ARCHIVE	12/16/20 12:08	6/30/20 8:20	FALSE	USA	United States	USA.5_1	California	USA.5.42_1	Santa Barbara	2019-4-26	FALSE
2669270049	OBS745994061	CC0_1_0	Cornell Lab of Ornithology	CLO	EBIRD	EOD - eBird Observation Dataset	HUMAN_OBSERVATION	URN:catalog:CLO:EBIRD:OBS745994061	OBS745994061	obsr51183	1	PRESENT	4/27/19 0:00	2019	4	27	US	California	Santa Barbara	Devereux Slough	34.4136	-119.876	7341770	Setophaga nigrescens (J.K.Townsend, 1837)	Animalia	Chordata	Aves	Passeriformes	Parulidae	Setophaga	nigrescens	SPECIES	Black-throated Gray Warbler	ACCEPTED	4fa7b334-ce0d-4e88-aaae-2e0c138d049e	US	12/16/20 11:58	TRUE	FALSE	7341770	7341770	1	44	212	729	5263	2489984	7341770	Setophaga nigrescens	Setophaga	Setophaga nigrescens (J.K.Townsend, 1837)	Setophaga nigrescens	DWC_ARCHIVE	12/16/20 11:58	6/30/20 8:20	FALSE	USA	United States	USA.5_1	California	USA.5.42_1	Santa Barbara	2019-4-27	TRUE
2732502479	OBS746175291	CC0_1_0	Cornell Lab of Ornithology	CLO	EBIRD	EOD - eBird Observation Dataset	HUMAN_OBSERVATION	URN:catalog:CLO:EBIRD:OBS746175291	OBS746175291	obsr302151	1	PRESENT	4/27/19 0:00	2019	4	27	US	California	Santa Barbara	Coal Oil Point--Devereux Beach and Sands Beach	34.4071	-119.878	2482033	Aechmophorus occidentalis (Lawrence, 1858)	Animalia	Chordata	Aves	Podicipediformes	Podicipedidae	Aechmophorus	occidentalis	SPECIES	Western Grebe	ACCEPTED	4fa7b334-ce0d-4e88-aaae-2e0c138d049e	US	12/16/20 12:06	TRUE	FALSE	2482033	2482033	1	44	212	7191588	9338	2482031	2482033	Aechmophorus occidentalis	Aechmophorus	Aechmophorus occidentalis (Lawrence, 1858)	Aechmophorus occidentalis	DWC_ARCHIVE	12/16/20 12:06	6/30/20 8:20	FALSE	USA	United States	USA.5_1	California	USA.5.42_1	Santa Barbara	2019-4-27	TRUE
2663050728	OBS733288466	CC0_1_0	Cornell Lab of Ornithology	CLO	EBIRD	EOD - eBird Observation Dataset	HUMAN_OBSERVATION	URN:catalog:CLO:EBIRD:OBS733288466	OBS733288466	obsr100639	2	PRESENT	4/3/19 0:00	2019	4	3	US	California	Santa Barbara	Coal Oil Point--Devereux Beach and Sands Beach	34.4071	-119.878	5231132	Zonotrichia leucophrys (J.R.Forster, 1772)	Animalia	Chordata	Aves	Passeriformes	Emberizidae	Zonotrichia	leucophrys	SPECIES	White-crowned Sparrow	ACCEPTED	4fa7b334-ce0d-4e88-aaae-2e0c138d049e	US	12/16/20 11:58	TRUE	FALSE	5231132	5231132	1	44	212	729	9608	6173226	5231132	Zonotrichia leucophrys	Zonotrichia	Zonotrichia leucophrys (J.R.Forster, 1772)	Zonotrichia leucophrys	DWC_ARCHIVE	12/16/20 11:58	6/30/20 8:20	FALSE	USA	United States	USA.5_1	California	USA.5.42_1	Santa Barbara	2019-4-3	FALSE
2673031745	OBS733288463	CC0_1_0	Cornell Lab of Ornithology	CLO	EBIRD	EOD - eBird Observation Dataset	HUMAN_OBSERVATION	URN:catalog:CLO:EBIRD:OBS733288463	OBS733288463	obsr100639	3	PRESENT	4/3/19 0:00	2019	4	3	US	California	Santa Barbara	Coal Oil Point--Devereux Beach and Sands Beach	34.4071	-119.878	5231190	Passer domesticus (Linnaeus, 1758)	Animalia	Chordata	Aves	Passeriformes	Passeridae	Passer	domesticus	SPECIES	House Sparrow	ACCEPTED	4fa7b334-ce0d-4e88-aaae-2e0c138d049e	US	12/16/20 11:58	TRUE	FALSE	5231190	5231190	1	44	212	729	5264	2492321	5231190	Passer domesticus	Passer	Passer domesticus (Linnaeus, 1758)	Passer domesticus	DWC_ARCHIVE	12/16/20 11:58	6/30/20 8:20	FALSE	USA	United States	USA.5_1	California	USA.5.42_1	Santa Barbara	2019-4-3	FALSE
2670058944	OBS748062495	CC0_1_0	Cornell Lab of Ornithology	CLO	EBIRD	EOD - eBird Observation Dataset	HUMAN_OBSERVATION	URN:catalog:CLO:EBIRD:OBS748062495	OBS748062495	obsr933209	1	PRESENT	4/30/19 0:00	2019	4	30	US	California	Santa Barbara	Devereux Slough	34.4136	-119.876	5229754	Contopus sordidulus P.L.Sclater, 1859	Animalia	Chordata	Aves	Passeriformes	Tyrannidae	Contopus	sordidulus	SPECIES	Western Wood-Pewee	ACCEPTED	4fa7b334-ce0d-4e88-aaae-2e0c138d049e	US	12/16/20 11:58	TRUE	FALSE	5229754	5229754	1	44	212	729	5291	2483729	5229754	Contopus sordidulus	Contopus	Contopus sordidulus P.L.Sclater, 1859	Contopus sordidulus	DWC_ARCHIVE	12/16/20 11:58	6/30/20 8:20	FALSE	USA	United States	USA.5_1	California	USA.5.42_1	Santa Barbara	2019-4-30	FALSE
2685395948	OBS748062497	CC0_1_0	Cornell Lab of Ornithology	CLO	EBIRD	EOD - eBird Observation Dataset	HUMAN_OBSERVATION	URN:catalog:CLO:EBIRD:OBS748062497	OBS748062497	obsr933209	2	PRESENT	4/30/19 0:00	2019	4	30	US	California	Santa Barbara	Devereux Slough	34.4136	-119.876	7341606	Cardellina pusilla (A.Wilson, 1811)	Animalia	Chordata	Aves	Passeriformes	Parulidae	Cardellina	pusilla	SPECIES	Wilson's Warbler	ACCEPTED	4fa7b334-ce0d-4e88-aaae-2e0c138d049e	US	12/16/20 11:59	TRUE	FALSE	7341606	7341606	1	44	212	729	5263	2489633	7341606	Cardellina pusilla	Cardellina	Cardellina pusilla (A.Wilson, 1811)	Cardellina pusilla	DWC_ARCHIVE	12/16/20 11:59	6/30/20 8:20	FALSE	USA	United States	USA.5_1	California	USA.5.42_1	Santa Barbara	2019-4-30	FALSE
2674082910	OBS748062481	CC0_1_0	Cornell Lab of Ornithology	CLO	EBIRD	EOD - eBird Observation Dataset	HUMAN_OBSERVATION	URN:catalog:CLO:EBIRD:OBS748062481	OBS748062481	obsr933209	1	PRESENT	4/30/19 0:00	2019	4	30	US	California	Santa Barbara	Devereux Slough	34.4136	-119.876	2487446	Vireo gilvus (Vieillot, 1808)	Animalia	Chordata	Aves	Passeriformes	Vireonidae	Vireo	gilvus	SPECIES	Warbling Vireo	ACCEPTED	4fa7b334-ce0d-4e88-aaae-2e0c138d049e	US	12/16/20 11:59	TRUE	FALSE	2487446	2487446	1	44	212	729	9358	2487406	2487446	Vireo gilvus	Vireo	Vireo gilvus (Vieillot, 1808)	Vireo gilvus	DWC_ARCHIVE	12/16/20 11:59	6/30/20 8:20	FALSE	USA	United States	USA.5_1	California	USA.5.42_1	Santa Barbara	2019-4-30	FALSE
2678660423	OBS734199273	CC0_1_0	Cornell Lab of Ornithology	CLO	EBIRD	EOD - eBird Observation Dataset	HUMAN_OBSERVATION	URN:catalog:CLO:EBIRD:OBS734199273	OBS734199273	obsr628871	1	PRESENT	4/4/19 0:00	2019	4	4	US	California	Santa Barbara	Coal Oil Point--Devereux Beach and Sands Beach	34.4071	-119.878	2498246	Melanitta perspicillata (Linnaeus, 1758)	Animalia	Chordata	Aves	Anseriformes	Anatidae	Melanitta	perspicillata	SPECIES	Surf Scoter	ACCEPTED	4fa7b334-ce0d-4e88-aaae-2e0c138d049e	US	12/16/20 11:59	TRUE	FALSE	2498246	2498246	1	44	212	1108	2986	2498237	2498246	Melanitta perspicillata	Melanitta	Melanitta perspicillata (Linnaeus, 1758)	Melanitta perspicillata	DWC_ARCHIVE	12/16/20 11:59	6/30/20 8:20	FALSE	USA	United States	USA.5_1	California	USA.5.42_1	Santa Barbara	2019-4-4	FALSE
2663101328	OBS734199265	CC0_1_0	Cornell Lab of Ornithology	CLO	EBIRD	EOD - eBird Observation Dataset	HUMAN_OBSERVATION	URN:catalog:CLO:EBIRD:OBS734199265	OBS734199265	obsr628871	2	PRESENT	4/4/19 0:00	2019	4	4	US	California	Santa Barbara	Coal Oil Point--Devereux Beach and Sands Beach	34.4071	-119.878	5231132	Zonotrichia leucophrys (J.R.Forster, 1772)	Animalia	Chordata	Aves	Passeriformes	Emberizidae	Zonotrichia	leucophrys	SPECIES	White-crowned Sparrow	ACCEPTED	4fa7b334-ce0d-4e88-aaae-2e0c138d049e	US	12/16/20 11:59	TRUE	FALSE	5231132	5231132	1	44	212	729	9608	6173226	5231132	Zonotrichia leucophrys	Zonotrichia	Zonotrichia leucophrys (J.R.Forster, 1772)	Zonotrichia leucophrys	DWC_ARCHIVE	12/16/20 11:59	6/30/20 8:20	FALSE	USA	United States	USA.5_1	California	USA.5.42_1	Santa Barbara	2019-4-4	FALSE
2663214984	OBS734589208	CC0_1_0	Cornell Lab of Ornithology	CLO	EBIRD	EOD - eBird Observation Dataset	HUMAN_OBSERVATION	URN:catalog:CLO:EBIRD:OBS734589208	OBS734589208	obsr1205914	7	PRESENT	4/6/19 0:00	2019	4	6	US	California	Santa Barbara	Devereux Slough	34.4136	-119.876	2498329	Bucephala albeola (Linnaeus, 1758)	Animalia	Chordata	Aves	Anseriformes	Anatidae	Bucephala	albeola	SPECIES	Bufflehead	ACCEPTED	4fa7b334-ce0d-4e88-aaae-2e0c138d049e	US	12/16/20 12:00	TRUE	FALSE	2498329	2498329	1	44	212	1108	2986	2498324	2498329	Bucephala albeola	Bucephala	Bucephala albeola (Linnaeus, 1758)	Bucephala albeola	DWC_ARCHIVE	12/16/20 12:00	6/30/20 8:20	FALSE	USA	United States	USA.5_1	California	USA.5.42_1	Santa Barbara	2019-4-6	FALSE
2745077452	OBS735883415	CC0_1_0	Cornell Lab of Ornithology	CLO	EBIRD	EOD - eBird Observation Dataset	HUMAN_OBSERVATION	URN:catalog:CLO:EBIRD:OBS735883415	OBS735883415	obsr997374	1	PRESENT	4/8/19 0:00	2019	4	8	US	California	Santa Barbara	Devereux Slough	34.4136	-119.876	2498139	Spatula cyanoptera (Vieillot, 1816)	Animalia	Chordata	Aves	Anseriformes	Anatidae	Anas	cyanoptera	SPECIES	Cinnamon Teal	SYNONYM	4fa7b334-ce0d-4e88-aaae-2e0c138d049e	US	12/16/20 12:08	TRUE	FALSE	9345027	2498139	1	44	212	1108	2986	2498056	2498139	Anas cyanoptera	Spatula	Anas cyanoptera Vieillot, 1816	Spatula cyanoptera	DWC_ARCHIVE	12/16/20 12:08	6/30/20 8:20	FALSE	USA	United States	USA.5_1	California	USA.5.42_1	Santa Barbara	2019-4-8	FALSE
2746820428	OBS735883413	CC0_1_0	Cornell Lab of Ornithology	CLO	EBIRD	EOD - eBird Observation Dataset	HUMAN_OBSERVATION	URN:catalog:CLO:EBIRD:OBS735883413	OBS735883413	obsr997374	2	PRESENT	4/8/19 0:00	2019	4	8	US	California	Santa Barbara	Devereux Slough	34.4136	-119.876	7341805	Setophaga coronata (Linnaeus, 1766)	Animalia	Chordata	Aves	Passeriformes	Parulidae	Setophaga	coronata	SPECIES	Yellow-rumped Warbler	ACCEPTED	4fa7b334-ce0d-4e88-aaae-2e0c138d049e	US	12/16/20 12:08	TRUE	FALSE	7341805	7341805	1	44	212	729	5263	2489984	7341805	Setophaga coronata	Setophaga	Setophaga coronata (Linnaeus, 1766)	Setophaga coronata	DWC_ARCHIVE	12/16/20 12:08	6/30/20 8:20	FALSE	USA	United States	USA.5_1	California	USA.5.42_1	Santa Barbara	2019-4-8	FALSE
2755647501	OBS748350560	CC0_1_0	Cornell Lab of Ornithology	CLO	EBIRD	EOD - eBird Observation Dataset	HUMAN_OBSERVATION	URN:catalog:CLO:EBIRD:OBS748350560	OBS748350560	obsr933209	1	PRESENT	5/1/19 0:00	2019	5	1	US	California	Santa Barbara	Coal Oil Point--Devereux Beach and Sands Beach	34.4071	-119.878	7341606	Cardellina pusilla (A.Wilson, 1811)	Animalia	Chordata	Aves	Passeriformes	Parulidae	Cardellina	pusilla	SPECIES	Wilson's Warbler	ACCEPTED	4fa7b334-ce0d-4e88-aaae-2e0c138d049e	US	12/16/20 12:08	TRUE	FALSE	7341606	7341606	1	44	212	729	5263	2489633	7341606	Cardellina pusilla	Cardellina	Cardellina pusilla (A.Wilson, 1811)	Cardellina pusilla	DWC_ARCHIVE	12/16/20 12:08	6/30/20 8:20	FALSE	USA	United States	USA.5_1	California	USA.5.42_1	Santa Barbara	2019-5-1	FALSE
2775897231	OBS748350583	CC0_1_0	Cornell Lab of Ornithology	CLO	EBIRD	EOD - eBird Observation Dataset	HUMAN_OBSERVATION	URN:catalog:CLO:EBIRD:OBS748350583	OBS748350583	obsr933209	1000	PRESENT	5/1/19 0:00	2019	5	1	US	California	Santa Barbara	Coal Oil Point--Devereux Beach and Sands Beach	34.4071	-119.878	2481955	Gavia pacifica (Lawrence, 1858)	Animalia	Chordata	Aves	Gaviiformes	Gaviidae	Gavia	pacifica	SPECIES	Pacific Loon	ACCEPTED	4fa7b334-ce0d-4e88-aaae-2e0c138d049e	US	12/16/20 12:09	TRUE	FALSE	2481955	2481955	1	44	212	7192754	9312	2481954	2481955	Gavia pacifica	Gavia	Gavia pacifica (Lawrence, 1858)	Gavia pacifica	DWC_ARCHIVE	12/16/20 12:09	6/30/20 8:20	FALSE	USA	United States	USA.5_1	California	USA.5.42_1	Santa Barbara	2019-5-1	FALSE
2775944220	OBS748350584	CC0_1_0	Cornell Lab of Ornithology	CLO	EBIRD	EOD - eBird Observation Dataset	HUMAN_OBSERVATION	URN:catalog:CLO:EBIRD:OBS748350584	OBS748350584	obsr933209	3	PRESENT	5/1/19 0:00	2019	5	1	US	California	Santa Barbara	Coal Oil Point--Devereux Beach and Sands Beach	34.4071	-119.878	2481962	Gavia immer (Brunnich, 1764)	Animalia	Chordata	Aves	Gaviiformes	Gaviidae	Gavia	immer	SPECIES	Common Loon	ACCEPTED	4fa7b334-ce0d-4e88-aaae-2e0c138d049e	US	12/16/20 11:58	TRUE	FALSE	2481962	2481962	1	44	212	7192754	9312	2481954	2481962	Gavia immer	Gavia	Gavia immer (Brunnich, 1764)	Gavia immer	DWC_ARCHIVE	12/16/20 11:58	6/30/20 8:20	FALSE	USA	United States	USA.5_1	California	USA.5.42_1	Santa Barbara	2019-5-1	FALSE
2673094315	OBS748325531	CC0_1_0	Cornell Lab of Ornithology	CLO	EBIRD	EOD - eBird Observation Dataset	HUMAN_OBSERVATION	URN:catalog:CLO:EBIRD:OBS748325531	OBS748325531	obsr337176	1	PRESENT	5/1/19 0:00	2019	5	1	US	California	Santa Barbara	Devereux Slough	34.4136	-119.876	5229864	Icterus bullockii (Swainson, 1827)	Animalia	Chordata	Aves	Passeriformes	Icteridae	Icterus	bullockii	SPECIES	Bullock's Oriole	ACCEPTED	4fa7b334-ce0d-4e88-aaae-2e0c138d049e	US	12/16/20 11:59	TRUE	FALSE	5229864	5229864	1	44	212	729	6176	2484282	5229864	Icterus bullockii	Icterus	Icterus bullockii (Swainson, 1827)	Icterus bullockii	DWC_ARCHIVE	12/16/20 11:59	6/30/20 8:20	FALSE	USA	United States	USA.5_1	California	USA.5.42_1	Santa Barbara	2019-5-1	FALSE
2775794142	OBS748350580	CC0_1_0	Cornell Lab of Ornithology	CLO	EBIRD	EOD - eBird Observation Dataset	HUMAN_OBSERVATION	URN:catalog:CLO:EBIRD:OBS748350580	OBS748350580	obsr933209	65	PRESENT	5/1/19 0:00	2019	5	1	US	California	Santa Barbara	Coal Oil Point--Devereux Beach and Sands Beach	34.4071	-119.878	5232446	Branta bernicla (Linnaeus, 1758)	Animalia	Chordata	Aves	Anseriformes	Anatidae	Branta	bernicla	SPECIES	Brant	ACCEPTED	4fa7b334-ce0d-4e88-aaae-2e0c138d049e	US	12/16/20 12:08	TRUE	FALSE	5232446	5232446	1	44	212	1108	2986	2498190	5232446	Branta bernicla	Branta	Branta bernicla (Linnaeus, 1758)	Branta bernicla	DWC_ARCHIVE	12/16/20 12:08	6/30/20 8:20	FALSE	USA	United States	USA.5_1	California	USA.5.42_1	Santa Barbara	2019-5-1	FALSE
2673027673	OBS758075525	CC0_1_0	Cornell Lab of Ornithology	CLO	EBIRD	EOD - eBird Observation Dataset	HUMAN_OBSERVATION	URN:catalog:CLO:EBIRD:OBS758075525	OBS758075525	obsr420881	2	PRESENT	5/12/19 0:00	2019	5	12	US	California	Santa Barbara	Devereux Slough	34.4136	-119.876	7341606	Cardellina pusilla (A.Wilson, 1811)	Animalia	Chordata	Aves	Passeriformes	Parulidae	Cardellina	pusilla	SPECIES	Wilson's Warbler	ACCEPTED	4fa7b334-ce0d-4e88-aaae-2e0c138d049e	US	12/16/20 11:59	TRUE	FALSE	7341606	7341606	1	44	212	729	5263	2489633	7341606	Cardellina pusilla	Cardellina	Cardellina pusilla (A.Wilson, 1811)	Cardellina pusilla	DWC_ARCHIVE	12/16/20 11:59	6/30/20 8:20	FALSE	USA	United States	USA.5_1	California	USA.5.42_1	Santa Barbara	2019-5-12	TRUE
2780850287	OBS760190823	CC0_1_0	Cornell Lab of Ornithology	CLO	EBIRD	EOD - eBird Observation Dataset	HUMAN_OBSERVATION	URN:catalog:CLO:EBIRD:OBS760190823	OBS760190823	obsr337176	1	PRESENT	5/16/19 0:00	2019	5	16	US	California	Santa Barbara	Coal Oil Point--Devereux Beach and Sands Beach	34.4071	-119.878	2481196	Larus glaucescens J.F.Naumann, 1840	Animalia	Chordata	Aves	Charadriiformes	Laridae	Larus	glaucescens	SPECIES	Glaucous-winged Gull	ACCEPTED	4fa7b334-ce0d-4e88-aaae-2e0c138d049e	US	12/16/20 12:08	TRUE	FALSE	2481196	2481196	1	44	212	7192402	9316	2481126	2481196	Larus glaucescens	Larus	Larus glaucescens J.F.Naumann, 1840	Larus glaucescens	DWC_ARCHIVE	12/16/20 12:08	6/30/20 8:20	FALSE	USA	United States	USA.5_1	California	USA.5.42_1	Santa Barbara	2019-5-16	FALSE
2754128092	OBS761013321	CC0_1_0	Cornell Lab of Ornithology	CLO	EBIRD	EOD - eBird Observation Dataset	HUMAN_OBSERVATION	URN:catalog:CLO:EBIRD:OBS761013321	OBS761013321	obsr939050	2	PRESENT	5/17/19 0:00	2019	5	17	US	California	Santa Barbara	Devereux Slough	34.4136	-119.876	2481134	Larus delawarensis Ord, 1815	Animalia	Chordata	Aves	Charadriiformes	Laridae	Larus	delawarensis	SPECIES	Ring-billed Gull	ACCEPTED	4fa7b334-ce0d-4e88-aaae-2e0c138d049e	US	12/16/20 12:07	TRUE	FALSE	2481134	2481134	1	44	212	7192402	9316	2481126	2481134	Larus delawarensis	Larus	Larus delawarensis Ord, 1815	Larus delawarensis	DWC_ARCHIVE	12/16/20 12:07	6/30/20 8:20	FALSE	USA	United States	USA.5_1	California	USA.5.42_1	Santa Barbara	2019-5-17	FALSE
2747402147	OBS761070587	CC0_1_0	Cornell Lab of Ornithology	CLO	EBIRD	EOD - eBird Observation Dataset	HUMAN_OBSERVATION	URN:catalog:CLO:EBIRD:OBS761070587	OBS761070587	obsr53608	1	PRESENT	5/17/19 0:00	2019	5	17	US	California	Santa Barbara	Devereux Slough	34.4136	-119.876	5230754	Tachycineta thalassina (Swainson, 1827)	Animalia	Chordata	Aves	Passeriformes	Hirundinidae	Tachycineta	thalassina	SPECIES	Violet-green Swallow	ACCEPTED	4fa7b334-ce0d-4e88-aaae-2e0c138d049e	US	12/16/20 11:58	TRUE	FALSE	5230754	5230754	1	44	212	729	5248	2489178	5230754	Tachycineta thalassina	Tachycineta	Tachycineta thalassina (Swainson, 1827)	Tachycineta thalassina	DWC_ARCHIVE	12/16/20 11:58	6/30/20 8:20	FALSE	USA	United States	USA.5_1	California	USA.5.42_1	Santa Barbara	2019-5-17	FALSE
2765655058	OBS761013333	CC0_1_0	Cornell Lab of Ornithology	CLO	EBIRD	EOD - eBird Observation Dataset	HUMAN_OBSERVATION	URN:catalog:CLO:EBIRD:OBS761013333	OBS761013333	obsr939050	1	PRESENT	5/17/19 0:00	2019	5	17	US	California	Santa Barbara	Devereux Slough	34.4136	-119.876	2498246	Melanitta perspicillata (Linnaeus, 1758)	Animalia	Chordata	Aves	Anseriformes	Anatidae	Melanitta	perspicillata	SPECIES	Surf Scoter	ACCEPTED	4fa7b334-ce0d-4e88-aaae-2e0c138d049e	US	12/16/20 12:08	TRUE	FALSE	2498246	2498246	1	44	212	1108	2986	2498237	2498246	Melanitta perspicillata	Melanitta	Melanitta perspicillata (Linnaeus, 1758)	Melanitta perspicillata	DWC_ARCHIVE	12/16/20 12:08	6/30/20 8:20	FALSE	USA	United States	USA.5_1	California	USA.5.42_1	Santa Barbara	2019-5-17	FALSE
2773755036	OBS761122316	CC0_1_0	Cornell Lab of Ornithology	CLO	EBIRD	EOD - eBird Observation Dataset	HUMAN_OBSERVATION	URN:catalog:CLO:EBIRD:OBS761122316	OBS761122316	obsr309446	1	PRESENT	5/17/19 0:00	2019	5	17	US	California	Santa Barbara	Devereux Slough	34.4136	-119.876	5230754	Tachycineta thalassina (Swainson, 1827)	Animalia	Chordata	Aves	Passeriformes	Hirundinidae	Tachycineta	thalassina	SPECIES	Violet-green Swallow	ACCEPTED	4fa7b334-ce0d-4e88-aaae-2e0c138d049e	US	12/16/20 12:06	TRUE	FALSE	5230754	5230754	1	44	212	729	5248	2489178	5230754	Tachycineta thalassina	Tachycineta	Tachycineta thalassina (Swainson, 1827)	Tachycineta thalassina	DWC_ARCHIVE	12/16/20 12:06	6/30/20 8:20	FALSE	USA	United States	USA.5_1	California	USA.5.42_1	Santa Barbara	2019-5-17	FALSE
2766177653	OBS767741501	CC0_1_0	Cornell Lab of Ornithology	CLO	EBIRD	EOD - eBird Observation Dataset	HUMAN_OBSERVATION	URN:catalog:CLO:EBIRD:OBS767741501	OBS767741501	obsr576127	1	PRESENT	5/28/19 0:00	2019	5	28	US	California	Santa Barbara	Coal Oil Point--Devereux Beach and Sands Beach	34.4071	-119.878	2498343	Cygnus olor (Gmelin, 1789)	Animalia	Chordata	Aves	Anseriformes	Anatidae	Cygnus	olor	SPECIES	Mute Swan	ACCEPTED	4fa7b334-ce0d-4e88-aaae-2e0c138d049e	US	12/16/20 12:07	TRUE	FALSE	2498343	2498343	1	44	212	1108	2986	2498334	2498343	Cygnus olor	Cygnus	Cygnus olor (Gmelin, 1789)	Cygnus olor	DWC_ARCHIVE	12/16/20 12:07	6/30/20 8:20	FALSE	USA	United States	USA.5_1	California	USA.5.42_1	Santa Barbara	2019-5-28	FALSE
2683716965	OBS752352785	CC0_1_0	Cornell Lab of Ornithology	CLO	EBIRD	EOD - eBird Observation Dataset	HUMAN_OBSERVATION	URN:catalog:CLO:EBIRD:OBS752352785	OBS752352785	obsr420881	22	PRESENT	5/3/19 0:00	2019	5	3	US	California	Santa Barbara	Coal Oil Point--Devereux Beach and Sands Beach	34.4071	-119.878	2481955	Gavia pacifica (Lawrence, 1858)	Animalia	Chordata	Aves	Gaviiformes	Gaviidae	Gavia	pacifica	SPECIES	Pacific Loon	ACCEPTED	4fa7b334-ce0d-4e88-aaae-2e0c138d049e	US	12/16/20 11:59	TRUE	FALSE	2481955	2481955	1	44	212	7192754	9312	2481954	2481955	Gavia pacifica	Gavia	Gavia pacifica (Lawrence, 1858)	Gavia pacifica	DWC_ARCHIVE	12/16/20 11:59	6/30/20 8:20	FALSE	USA	United States	USA.5_1	California	USA.5.42_1	Santa Barbara	2019-5-3	TRUE
2762175784	OBS751269062	CC0_1_0	Cornell Lab of Ornithology	CLO	EBIRD	EOD - eBird Observation Dataset	HUMAN_OBSERVATION	URN:catalog:CLO:EBIRD:OBS751269062	OBS751269062	obsr933209	2	PRESENT	5/4/19 0:00	2019	5	4	US	California	Santa Barbara	Devereux Slough	34.4136	-119.876	2476855	Selasphorus rufus (Gmelin, 1788)	Animalia	Chordata	Aves	Apodiformes	Trochilidae	Selasphorus	rufus	SPECIES	Rufous Hummingbird	ACCEPTED	4fa7b334-ce0d-4e88-aaae-2e0c138d049e	US	12/16/20 12:09	TRUE	FALSE	2476855	2476855	1	44	212	1448	5289	2476843	2476855	Selasphorus rufus	Selasphorus	Selasphorus rufus (Gmelin, 1788)	Selasphorus rufus	DWC_ARCHIVE	12/16/20 12:09	6/30/20 8:20	FALSE	USA	United States	USA.5_1	California	USA.5.42_1	Santa Barbara	2019-5-4	FALSE
2766321718	OBS751245980	CC0_1_0	Cornell Lab of Ornithology	CLO	EBIRD	EOD - eBird Observation Dataset	HUMAN_OBSERVATION	URN:catalog:CLO:EBIRD:OBS751245980	OBS751245980	obsr1205914	20	PRESENT	5/4/19 0:00	2019	5	4	US	California	Santa Barbara	Devereux Slough	34.4136	-119.876	2484609	Bombycilla cedrorum Vieillot, 1808	Animalia	Chordata	Aves	Passeriformes	Bombycillidae	Bombycilla	cedrorum	SPECIES	Cedar Waxwing	ACCEPTED	4fa7b334-ce0d-4e88-aaae-2e0c138d049e	US	12/16/20 12:10	TRUE	FALSE	2484609	2484609	1	44	212	729	5215	2484604	2484609	Bombycilla cedrorum	Bombycilla	Bombycilla cedrorum Vieillot, 1808	Bombycilla cedrorum	DWC_ARCHIVE	12/16/20 12:10	6/30/20 8:20	FALSE	USA	United States	USA.5_1	California	USA.5.42_1	Santa Barbara	2019-5-4	FALSE
2671604885	OBS751269074	CC0_1_0	Cornell Lab of Ornithology	CLO	EBIRD	EOD - eBird Observation Dataset	HUMAN_OBSERVATION	URN:catalog:CLO:EBIRD:OBS751269074	OBS751269074	obsr933209	2	PRESENT	5/4/19 0:00	2019	5	4	US	California	Santa Barbara	Devereux Slough	34.4136	-119.876	5229864	Icterus bullockii (Swainson, 1827)	Animalia	Chordata	Aves	Passeriformes	Icteridae	Icterus	bullockii	SPECIES	Bullock's Oriole	ACCEPTED	4fa7b334-ce0d-4e88-aaae-2e0c138d049e	US	12/16/20 11:58	TRUE	FALSE	5229864	5229864	1	44	212	729	6176	2484282	5229864	Icterus bullockii	Icterus	Icterus bullockii (Swainson, 1827)	Icterus bullockii	DWC_ARCHIVE	12/16/20 11:58	6/30/20 8:20	FALSE	USA	United States	USA.5_1	California	USA.5.42_1	Santa Barbara	2019-5-4	FALSE
2764710665	OBS751269066	CC0_1_0	Cornell Lab of Ornithology	CLO	EBIRD	EOD - eBird Observation Dataset	HUMAN_OBSERVATION	URN:catalog:CLO:EBIRD:OBS751269066	OBS751269066	obsr933209	20	PRESENT	5/4/19 0:00	2019	5	4	US	California	Santa Barbara	Devereux Slough	34.4136	-119.876	2484609	Bombycilla cedrorum Vieillot, 1808	Animalia	Chordata	Aves	Passeriformes	Bombycillidae	Bombycilla	cedrorum	SPECIES	Cedar Waxwing	ACCEPTED	4fa7b334-ce0d-4e88-aaae-2e0c138d049e	US	12/16/20 12:09	TRUE	FALSE	2484609	2484609	1	44	212	729	5215	2484604	2484609	Bombycilla cedrorum	Bombycilla	Bombycilla cedrorum Vieillot, 1808	Bombycilla cedrorum	DWC_ARCHIVE	12/16/20 12:09	6/30/20 8:20	FALSE	USA	United States	USA.5_1	California	USA.5.42_1	Santa Barbara	2019-5-4	FALSE
2769166782	OBS751864192	CC0_1_0	Cornell Lab of Ornithology	CLO	EBIRD	EOD - eBird Observation Dataset	HUMAN_OBSERVATION	URN:catalog:CLO:EBIRD:OBS751864192	OBS751864192	obsr842316	3	PRESENT	5/5/19 0:00	2019	5	5	US	California	Santa Barbara	Devereux Slough	34.4136	-119.876	2481134	Larus delawarensis Ord, 1815	Animalia	Chordata	Aves	Charadriiformes	Laridae	Larus	delawarensis	SPECIES	Ring-billed Gull	ACCEPTED	4fa7b334-ce0d-4e88-aaae-2e0c138d049e	US	12/16/20 11:58	TRUE	FALSE	2481134	2481134	1	44	212	7192402	9316	2481126	2481134	Larus delawarensis	Larus	Larus delawarensis Ord, 1815	Larus delawarensis	DWC_ARCHIVE	12/16/20 11:58	6/30/20 8:20	FALSE	USA	United States	USA.5_1	California	USA.5.42_1	Santa Barbara	2019-5-5	FALSE
2673844005	OBS752393929	CC0_1_0	Cornell Lab of Ornithology	CLO	EBIRD	EOD - eBird Observation Dataset	HUMAN_OBSERVATION	URN:catalog:CLO:EBIRD:OBS752393929	OBS752393929	obsr1205914	12	PRESENT	5/5/19 0:00	2019	5	5	US	California	Santa Barbara	Devereux Slough	34.4136	-119.876	2484609	Bombycilla cedrorum Vieillot, 1808	Animalia	Chordata	Aves	Passeriformes	Bombycillidae	Bombycilla	cedrorum	SPECIES	Cedar Waxwing	ACCEPTED	4fa7b334-ce0d-4e88-aaae-2e0c138d049e	US	12/16/20 11:58	TRUE	FALSE	2484609	2484609	1	44	212	729	5215	2484604	2484609	Bombycilla cedrorum	Bombycilla	Bombycilla cedrorum Vieillot, 1808	Bombycilla cedrorum	DWC_ARCHIVE	12/16/20 11:58	6/30/20 8:20	FALSE	USA	United States	USA.5_1	California	USA.5.42_1	Santa Barbara	2019-5-5	FALSE
2737952051	OBS757099665	CC0_1_0	Cornell Lab of Ornithology	CLO	EBIRD	EOD - eBird Observation Dataset	HUMAN_OBSERVATION	URN:catalog:CLO:EBIRD:OBS757099665	OBS757099665	obsr1101344	2	PRESENT	5/5/19 0:00	2019	5	5	US	California	Santa Barbara	Devereux Slough	34.4136	-119.876	2481759	Calidris alpina (Linnaeus, 1758)	Animalia	Chordata	Aves	Charadriiformes	Scolopacidae	Calidris	alpina	SPECIES	Dunlin	ACCEPTED	4fa7b334-ce0d-4e88-aaae-2e0c138d049e	US	12/16/20 12:06	TRUE	FALSE	2481759	2481759	1	44	212	7192402	5282	2481739	2481759	Calidris alpina	Calidris	Calidris alpina (Linnaeus, 1758)	Calidris alpina	DWC_ARCHIVE	12/16/20 12:06	6/30/20 8:20	FALSE	USA	United States	USA.5_1	California	USA.5.42_1	Santa Barbara	2019-5-5	FALSE
2754858150	OBS751866451	CC0_1_0	Cornell Lab of Ornithology	CLO	EBIRD	EOD - eBird Observation Dataset	HUMAN_OBSERVATION	URN:catalog:CLO:EBIRD:OBS751866451	OBS751866451	obsr842316	2	PRESENT	5/5/19 0:00	2019	5	5	US	California	Santa Barbara	Coal Oil Point--Devereux Beach and Sands Beach	34.4071	-119.878	9476062	Quiscalus mexicanus (Gmelin, 1788)	Animalia	Chordata	Aves	Passeriformes	Icteridae	Quiscalus	mexicanus	SPECIES	Great-tailed Grackle	ACCEPTED	4fa7b334-ce0d-4e88-aaae-2e0c138d049e	US	12/16/20 12:08	TRUE	FALSE	9476062	9476062	1	44	212	729	6176	2484132	9476062	Quiscalus mexicanus	Quiscalus	Quiscalus mexicanus (Gmelin, 1788)	Quiscalus mexicanus	DWC_ARCHIVE	12/16/20 12:08	6/30/20 8:20	FALSE	USA	United States	USA.5_1	California	USA.5.42_1	Santa Barbara	2019-5-5	FALSE
2686905260	OBS755230580	CC0_1_0	Cornell Lab of Ornithology	CLO	EBIRD	EOD - eBird Observation Dataset	HUMAN_OBSERVATION	URN:catalog:CLO:EBIRD:OBS755230580	OBS755230580	obsr172576	1	PRESENT	5/7/19 0:00	2019	5	7	US	California	Santa Barbara	Dune Pond at COPR	34.4137	-119.882	2481285	Thalasseus elegans (Gambel, 1849)	Animalia	Chordata	Aves	Charadriiformes	Laridae	Thalasseus	elegans	SPECIES	Elegant Tern	ACCEPTED	4fa7b334-ce0d-4e88-aaae-2e0c138d049e	US	12/16/20 11:58	TRUE	FALSE	2481285	2481285	1	44	212	7192402	9316	9109074	2481285	Thalasseus elegans	Thalasseus	Thalasseus elegans (Gambel, 1849)	Thalasseus elegans	DWC_ARCHIVE	12/16/20 11:58	6/30/20 8:20	FALSE	USA	United States	USA.5_1	California	USA.5.42_1	Santa Barbara	2019-5-7	FALSE
2675950205	OBS755230576	CC0_1_0	Cornell Lab of Ornithology	CLO	EBIRD	EOD - eBird Observation Dataset	HUMAN_OBSERVATION	URN:catalog:CLO:EBIRD:OBS755230576	OBS755230576	obsr172576	1	PRESENT	5/7/19 0:00	2019	5	7	US	California	Santa Barbara	Dune Pond at COPR	34.4137	-119.882	2482065	Podiceps nigricollis C.L.Brehm, 1831	Animalia	Chordata	Aves	Podicipediformes	Podicipedidae	Podiceps	nigricollis	SPECIES	Eared Grebe	ACCEPTED	4fa7b334-ce0d-4e88-aaae-2e0c138d049e	US	12/16/20 11:59	TRUE	FALSE	2482065	2482065	1	44	212	7191588	9338	2482049	2482065	Podiceps nigricollis	Podiceps	Podiceps nigricollis C.L.Brehm, 1831	Podiceps nigricollis	DWC_ARCHIVE	12/16/20 11:59	6/30/20 8:20	FALSE	USA	United States	USA.5_1	California	USA.5.42_1	Santa Barbara	2019-5-7	FALSE
2751903491	OBS755371407	CC0_1_0	Cornell Lab of Ornithology	CLO	EBIRD	EOD - eBird Observation Dataset	HUMAN_OBSERVATION	URN:catalog:CLO:EBIRD:OBS755371407	OBS755371407	obsr57194	25	PRESENT	5/9/19 0:00	2019	5	9	US	California	Santa Barbara	Coal Oil Point--Devereux Beach and Sands Beach	34.4071	-119.878	5232446	Branta bernicla (Linnaeus, 1758)	Animalia	Chordata	Aves	Anseriformes	Anatidae	Branta	bernicla	SPECIES	Brant	ACCEPTED	4fa7b334-ce0d-4e88-aaae-2e0c138d049e	US	12/16/20 11:57	TRUE	FALSE	5232446	5232446	1	44	212	1108	2986	2498190	5232446	Branta bernicla	Branta	Branta bernicla (Linnaeus, 1758)	Branta bernicla	DWC_ARCHIVE	12/16/20 11:57	6/30/20 8:20	FALSE	USA	United States	USA.5_1	California	USA.5.42_1	Santa Barbara	2019-5-9	FALSE
2688653967	OBS769551467	CC0_1_0	Cornell Lab of Ornithology	CLO	EBIRD	EOD - eBird Observation Dataset	HUMAN_OBSERVATION	URN:catalog:CLO:EBIRD:OBS769551467	OBS769551467	obsr221434	1	PRESENT	6/1/19 0:00	2019	6	1	US	California	Santa Barbara	Devereux Slough	34.4136	-119.876	2483600	Myiarchus cinerascens (Lawrence, 1851)	Animalia	Chordata	Aves	Passeriformes	Tyrannidae	Myiarchus	cinerascens	SPECIES	Ash-throated Flycatcher	ACCEPTED	4fa7b334-ce0d-4e88-aaae-2e0c138d049e	US	12/16/20 11:58	TRUE	FALSE	2483600	2483600	1	44	212	729	5291	2483527	2483600	Myiarchus cinerascens	Myiarchus	Myiarchus cinerascens (Lawrence, 1851)	Myiarchus cinerascens	DWC_ARCHIVE	12/16/20 11:58	6/30/20 8:20	FALSE	USA	United States	USA.5_1	California	USA.5.42_1	Santa Barbara	2019-6-1	FALSE
2679340840	OBS769469885	CC0_1_0	Cornell Lab of Ornithology	CLO	EBIRD	EOD - eBird Observation Dataset	HUMAN_OBSERVATION	URN:catalog:CLO:EBIRD:OBS769469885	OBS769469885	obsr21101	1	PRESENT	6/1/19 0:00	2019	6	1	US	California	Santa Barbara	Devereux Slough	34.4136	-119.876	2488484	Piranga ludoviciana (A.Wilson, 1811)	Animalia	Chordata	Aves	Passeriformes	Cardinalidae	Piranga	ludoviciana	SPECIES	Western Tanager	ACCEPTED	4fa7b334-ce0d-4e88-aaae-2e0c138d049e	US	12/16/20 12:00	TRUE	FALSE	2488484	2488484	1	44	212	729	9285	2488483	2488484	Piranga ludoviciana	Piranga	Piranga ludoviciana (A.Wilson, 1811)	Piranga ludoviciana	DWC_ARCHIVE	12/16/20 12:00	6/30/20 8:20	FALSE	USA	United States	USA.5_1	California	USA.5.42_1	Santa Barbara	2019-6-1	FALSE
2683179156	OBS769708070	CC0_1_0	Cornell Lab of Ornithology	CLO	EBIRD	EOD - eBird Observation Dataset	HUMAN_OBSERVATION	URN:catalog:CLO:EBIRD:OBS769708070	OBS769708070	obsr309446	1	PRESENT	6/1/19 0:00	2019	6	1	US	California	Santa Barbara	Devereux Slough	34.4136	-119.876	2498343	Cygnus olor (Gmelin, 1789)	Animalia	Chordata	Aves	Anseriformes	Anatidae	Cygnus	olor	SPECIES	Mute Swan	ACCEPTED	4fa7b334-ce0d-4e88-aaae-2e0c138d049e	US	12/16/20 12:00	TRUE	FALSE	2498343	2498343	1	44	212	1108	2986	2498334	2498343	Cygnus olor	Cygnus	Cygnus olor (Gmelin, 1789)	Cygnus olor	DWC_ARCHIVE	12/16/20 12:00	6/30/20 8:20	FALSE	USA	United States	USA.5_1	California	USA.5.42_1	Santa Barbara	2019-6-1	FALSE
2751723915	OBS769555138	CC0_1_0	Cornell Lab of Ornithology	CLO	EBIRD	EOD - eBird Observation Dataset	HUMAN_OBSERVATION	URN:catalog:CLO:EBIRD:OBS769555138	OBS769555138	obsr243067	1	PRESENT	6/1/19 0:00	2019	6	1	US	California	Santa Barbara	Devereux Slough	34.4136	-119.876	2488484	Piranga ludoviciana (A.Wilson, 1811)	Animalia	Chordata	Aves	Passeriformes	Cardinalidae	Piranga	ludoviciana	SPECIES	Western Tanager	ACCEPTED	4fa7b334-ce0d-4e88-aaae-2e0c138d049e	US	12/16/20 12:09	TRUE	FALSE	2488484	2488484	1	44	212	729	9285	2488483	2488484	Piranga ludoviciana	Piranga	Piranga ludoviciana (A.Wilson, 1811)	Piranga ludoviciana	DWC_ARCHIVE	12/16/20 12:09	6/30/20 8:20	FALSE	USA	United States	USA.5_1	California	USA.5.42_1	Santa Barbara	2019-6-1	FALSE
2703112518	OBS774685791	CC0_1_0	Cornell Lab of Ornithology	CLO	EBIRD	EOD - eBird Observation Dataset	HUMAN_OBSERVATION	URN:catalog:CLO:EBIRD:OBS774685791	OBS774685791	obsr605751	9	PRESENT	6/11/19 0:00	2019	6	11	US	California	Santa Barbara	Coal Oil Point--Devereux Beach and Sands Beach	34.4071	-119.878	5231190	Passer domesticus (Linnaeus, 1758)	Animalia	Chordata	Aves	Passeriformes	Passeridae	Passer	domesticus	SPECIES	House Sparrow	ACCEPTED	4fa7b334-ce0d-4e88-aaae-2e0c138d049e	US	12/16/20 12:17	TRUE	FALSE	5231190	5231190	1	44	212	729	5264	2492321	5231190	Passer domesticus	Passer	Passer domesticus (Linnaeus, 1758)	Passer domesticus	DWC_ARCHIVE	12/16/20 12:17	6/30/20 8:20	FALSE	USA	United States	USA.5_1	California	USA.5.42_1	Santa Barbara	2019-6-11	FALSE
2761615033	OBS774352234	CC0_1_0	Cornell Lab of Ornithology	CLO	EBIRD	EOD - eBird Observation Dataset	HUMAN_OBSERVATION	URN:catalog:CLO:EBIRD:OBS774352234	OBS774352234	obsr337176	1	PRESENT	6/12/19 0:00	2019	6	12	US	California	Santa Barbara	Devereux Slough	34.4136	-119.876	2483600	Myiarchus cinerascens (Lawrence, 1851)	Animalia	Chordata	Aves	Passeriformes	Tyrannidae	Myiarchus	cinerascens	SPECIES	Ash-throated Flycatcher	ACCEPTED	4fa7b334-ce0d-4e88-aaae-2e0c138d049e	US	12/16/20 12:07	TRUE	FALSE	2483600	2483600	1	44	212	729	5291	2483527	2483600	Myiarchus cinerascens	Myiarchus	Myiarchus cinerascens (Lawrence, 1851)	Myiarchus cinerascens	DWC_ARCHIVE	12/16/20 12:07	6/30/20 8:20	FALSE	USA	United States	USA.5_1	California	USA.5.42_1	Santa Barbara	2019-6-12	FALSE
2684642434	OBS770281169	CC0_1_0	Cornell Lab of Ornithology	CLO	EBIRD	EOD - eBird Observation Dataset	HUMAN_OBSERVATION	URN:catalog:CLO:EBIRD:OBS770281169	OBS770281169	obsr654966	1	PRESENT	6/2/19 0:00	2019	6	2	US	California	Santa Barbara	Devereux Slough	34.4136	-119.876	2488484	Piranga ludoviciana (A.Wilson, 1811)	Animalia	Chordata	Aves	Passeriformes	Cardinalidae	Piranga	ludoviciana	SPECIES	Western Tanager	ACCEPTED	4fa7b334-ce0d-4e88-aaae-2e0c138d049e	US	12/16/20 11:59	TRUE	FALSE	2488484	2488484	1	44	212	729	9285	2488483	2488484	Piranga ludoviciana	Piranga	Piranga ludoviciana (A.Wilson, 1811)	Piranga ludoviciana	DWC_ARCHIVE	12/16/20 11:59	6/30/20 8:20	FALSE	USA	United States	USA.5_1	California	USA.5.42_1	Santa Barbara	2019-6-2	FALSE
2680068088	OBS770158937	CC0_1_0	Cornell Lab of Ornithology	CLO	EBIRD	EOD - eBird Observation Dataset	HUMAN_OBSERVATION	URN:catalog:CLO:EBIRD:OBS770158937	OBS770158937	obsr548926	2	PRESENT	6/2/19 0:00	2019	6	2	US	California	Santa Barbara	Devereux Slough	34.4136	-119.876	2482786	Empidonax traillii (Audubon, 1828)	Animalia	Chordata	Aves	Passeriformes	Tyrannidae	Empidonax	traillii	SPECIES	Willow Flycatcher	ACCEPTED	4fa7b334-ce0d-4e88-aaae-2e0c138d049e	US	12/16/20 11:59	TRUE	FALSE	2482786	2482786	1	44	212	729	5291	2482766	2482786	Empidonax traillii	Empidonax	Empidonax traillii (Audubon, 1828)	Empidonax traillii	DWC_ARCHIVE	12/16/20 11:59	6/30/20 8:20	FALSE	USA	United States	USA.5_1	California	USA.5.42_1	Santa Barbara	2019-6-2	TRUE
2740707803	OBS774287171	CC0_1_0	Cornell Lab of Ornithology	CLO	EBIRD	EOD - eBird Observation Dataset	HUMAN_OBSERVATION	URN:catalog:CLO:EBIRD:OBS774287171	OBS774287171	obsr420881	1	PRESENT	6/2/19 0:00	2019	6	2	US	California	Santa Barbara	Devereux Slough	34.4136	-119.876	7341606	Cardellina pusilla (A.Wilson, 1811)	Animalia	Chordata	Aves	Passeriformes	Parulidae	Cardellina	pusilla	SPECIES	Wilson's Warbler	ACCEPTED	4fa7b334-ce0d-4e88-aaae-2e0c138d049e	US	12/16/20 12:07	TRUE	FALSE	7341606	7341606	1	44	212	729	5263	2489633	7341606	Cardellina pusilla	Cardellina	Cardellina pusilla (A.Wilson, 1811)	Cardellina pusilla	DWC_ARCHIVE	12/16/20 12:07	6/30/20 8:20	FALSE	USA	United States	USA.5_1	California	USA.5.42_1	Santa Barbara	2019-6-2	TRUE
2684121131	OBS778193847	CC0_1_0	Cornell Lab of Ornithology	CLO	EBIRD	EOD - eBird Observation Dataset	HUMAN_OBSERVATION	URN:catalog:CLO:EBIRD:OBS778193847	OBS778193847	obsr337176	3	PRESENT	6/23/19 0:00	2019	6	23	US	California	Santa Barbara	Devereux Slough	34.4136	-119.876	5231190	Passer domesticus (Linnaeus, 1758)	Animalia	Chordata	Aves	Passeriformes	Passeridae	Passer	domesticus	SPECIES	House Sparrow	ACCEPTED	4fa7b334-ce0d-4e88-aaae-2e0c138d049e	US	12/16/20 12:17	TRUE	FALSE	5231190	5231190	1	44	212	729	5264	2492321	5231190	Passer domesticus	Passer	Passer domesticus (Linnaeus, 1758)	Passer domesticus	DWC_ARCHIVE	12/16/20 12:17	6/30/20 8:20	FALSE	USA	United States	USA.5_1	California	USA.5.42_1	Santa Barbara	2019-6-23	FALSE
2758827943	OBS779636942	CC0_1_0	Cornell Lab of Ornithology	CLO	EBIRD	EOD - eBird Observation Dataset	HUMAN_OBSERVATION	URN:catalog:CLO:EBIRD:OBS779636942	OBS779636942	obsr7509	1	PRESENT	6/27/19 0:00	2019	6	27	US	California	Santa Barbara	Devereux Slough	34.4136	-119.876	9362842	Junco hyemalis (Linnaeus, 1758)	Animalia	Chordata	Aves	Passeriformes	Emberizidae	Junco	hyemalis	SPECIES	Dark-eyed Junco	ACCEPTED	4fa7b334-ce0d-4e88-aaae-2e0c138d049e	US	12/16/20 12:06	TRUE	FALSE	9362842	9362842	1	44	212	729	9608	2492009	9362842	Junco hyemalis	Junco	Junco hyemalis (Linnaeus, 1758)	Junco hyemalis	DWC_ARCHIVE	12/16/20 12:06	6/30/20 8:20	FALSE	USA	United States	USA.5_1	California	USA.5.42_1	Santa Barbara	2019-6-27	FALSE
2742536853	OBS779651942	CC0_1_0	Cornell Lab of Ornithology	CLO	EBIRD	EOD - eBird Observation Dataset	HUMAN_OBSERVATION	URN:catalog:CLO:EBIRD:OBS779651942	OBS779651942	obsr38892	1	PRESENT	6/27/19 0:00	2019	6	27	US	California	Santa Barbara	Devereux Slough	34.4136	-119.876	9362842	Junco hyemalis (Linnaeus, 1758)	Animalia	Chordata	Aves	Passeriformes	Emberizidae	Junco	hyemalis	SPECIES	Dark-eyed Junco	ACCEPTED	4fa7b334-ce0d-4e88-aaae-2e0c138d049e	US	12/16/20 12:07	TRUE	FALSE	9362842	9362842	1	44	212	729	9608	2492009	9362842	Junco hyemalis	Junco	Junco hyemalis (Linnaeus, 1758)	Junco hyemalis	DWC_ARCHIVE	12/16/20 12:07	6/30/20 8:20	FALSE	USA	United States	USA.5_1	California	USA.5.42_1	Santa Barbara	2019-6-27	FALSE
2686366157	OBS779715721	CC0_1_0	Cornell Lab of Ornithology	CLO	EBIRD	EOD - eBird Observation Dataset	HUMAN_OBSERVATION	URN:catalog:CLO:EBIRD:OBS779715721	OBS779715721	obsr415170	2	PRESENT	6/27/19 0:00	2019	6	27	US	California	Santa Barbara	Devereux Slough	34.4136	-119.876	5959118	Bubo virginianus (Gmelin, 1788)	Animalia	Chordata	Aves	Strigiformes	Strigidae	Bubo	virginianus	SPECIES	Great Horned Owl	ACCEPTED	4fa7b334-ce0d-4e88-aaae-2e0c138d049e	US	12/16/20 12:18	TRUE	FALSE	5959118	5959118	1	44	212	1450	9348	5959091	5959118	Bubo virginianus	Bubo	Bubo virginianus (Gmelin, 1788)	Bubo virginianus	DWC_ARCHIVE	12/16/20 12:18	6/30/20 8:20	FALSE	USA	United States	USA.5_1	California	USA.5.42_1	Santa Barbara	2019-6-27	FALSE
2771007041	OBS779727000	CC0_1_0	Cornell Lab of Ornithology	CLO	EBIRD	EOD - eBird Observation Dataset	HUMAN_OBSERVATION	URN:catalog:CLO:EBIRD:OBS779727000	OBS779727000	obsr1067688	1	PRESENT	6/27/19 0:00	2019	6	27	US	California	Santa Barbara	Devereux Slough	34.4136	-119.876	9362842	Junco hyemalis (Linnaeus, 1758)	Animalia	Chordata	Aves	Passeriformes	Emberizidae	Junco	hyemalis	SPECIES	Dark-eyed Junco	ACCEPTED	4fa7b334-ce0d-4e88-aaae-2e0c138d049e	US	12/16/20 12:09	TRUE	FALSE	9362842	9362842	1	44	212	729	9608	2492009	9362842	Junco hyemalis	Junco	Junco hyemalis (Linnaeus, 1758)	Junco hyemalis	DWC_ARCHIVE	12/16/20 12:09	6/30/20 8:20	FALSE	USA	United States	USA.5_1	California	USA.5.42_1	Santa Barbara	2019-6-27	FALSE
2685478169	OBS780222684	CC0_1_0	Cornell Lab of Ornithology	CLO	EBIRD	EOD - eBird Observation Dataset	HUMAN_OBSERVATION	URN:catalog:CLO:EBIRD:OBS780222684	OBS780222684	obsr576127	1	PRESENT	6/29/19 0:00	2019	6	29	US	California	Santa Barbara	Coal Oil Point--Devereux Beach and Sands Beach	34.4071	-119.878	2482032	Aechmophorus clarkii (Lawrence, 1858)	Animalia	Chordata	Aves	Podicipediformes	Podicipedidae	Aechmophorus	clarkii	SPECIES	Clark's Grebe	ACCEPTED	4fa7b334-ce0d-4e88-aaae-2e0c138d049e	US	12/16/20 11:58	TRUE	FALSE	2482032	2482032	1	44	212	7191588	9338	2482031	2482032	Aechmophorus clarkii	Aechmophorus	Aechmophorus clarkii (Lawrence, 1858)	Aechmophorus clarkii	DWC_ARCHIVE	12/16/20 11:58	6/30/20 8:20	FALSE	USA	United States	USA.5_1	California	USA.5.42_1	Santa Barbara	2019-6-29	FALSE
2769534221	OBS780163792	CC0_1_0	Cornell Lab of Ornithology	CLO	EBIRD	EOD - eBird Observation Dataset	HUMAN_OBSERVATION	URN:catalog:CLO:EBIRD:OBS780163792	OBS780163792	obsr415170	1	PRESENT	6/29/19 0:00	2019	6	29	US	California	Santa Barbara	Devereux Slough	34.4136	-119.876	9510564	Turdus migratorius Linnaeus, 1766	Animalia	Chordata	Aves	Passeriformes	Turdidae	Turdus	migratorius	SPECIES	American Robin	ACCEPTED	4fa7b334-ce0d-4e88-aaae-2e0c138d049e	US	12/16/20 12:08	TRUE	FALSE	9510564	9510564	1	44	212	729	5290	2490714	9510564	Turdus migratorius	Turdus	Turdus migratorius Linnaeus, 1766	Turdus migratorius	DWC_ARCHIVE	12/16/20 12:08	6/30/20 8:20	FALSE	USA	United States	USA.5_1	California	USA.5.42_1	Santa Barbara	2019-6-29	FALSE
